content,rating,type,status,sequence_num,tokenization,text,publishedDate,origin
昆蟲數量眾多，甚至有蜜蜂出沒，吹風機也僅有1台可供使用。,1,1,-1,2172,,昆蟲數量眾多蜜蜂出沒吹風機僅有台可供使用,2023/11/7,0
屢見停電困擾，蚊蟲橫行難耐，廁所距離令人詬病。,1,1,-1,5236,,屢見停電困擾蚊蟲橫行難耐廁所距離令人詬病,2023/6/8,0
造訪後深覺失望，營區主人將所有問題歸咎於遊客，言詞之尖銳令欲言又止，無奈之情溢於言表。,1,1,-1,3782,,造訪深覺失望營區主人歸咎於遊客言詞尖銳令欲言又止無奈之情溢於言表,2023/12/7,0
營主疏於維護廁所，未定期打掃，導致異味難聞，影響生活品質。每天晚上都需尋找有熱水的衛浴設施，且隔壁帳的交談聲難以忍受，無法安心休憩。雖然景觀優美，但營主的管理不力，導致住宿體驗不佳。因此，只能給予一顆星。,1,1,-1,6753,,營主疏於維護廁所未定期打掃導致異味難聞影響生活品質每天晚上需尋找熱水衛浴設施隔壁帳的交談聲難以忍受安心休憩景觀優美營主管理導致住宿體驗不佳只能給予一顆星,2024/4/11,0
一開始就選在炎熱的天氣於該區搭設帳篷，搭好帳後卻被告知不能在該區域搭設，需要移至停車場，且須多付費。整個過程相當掃興，道路品質不佳，導致車底盤受到損壞。,1,1,-1,6073,,選炎熱天氣該區搭設帳篷搭好帳後卻告知區域搭設移至停車場且須付費過程掃興道路品質不佳導致車底盤損壞,2023/7/8,0
造訪露營區租借帳篷和客廳帳，客廳帳已失防水功能，大雨中嚴重漏水，下午四點請求管理員協助，直到晚間七點雨停才接獲回應。工作人員僅擦拭內部，堅稱無破洞，堅持離去。強調客廳帳本應漏水，態度傲慢，漠視顧客反應。過往評論顯示類似問題屢見不鮮，擔心成為慣老闆的受害者。儘管營地美麗，遇到問題時，身心俱疲。,1,1,-1,538,,造訪區租借帳篷客廳帳客廳帳已失防水功能大雨中漏水下午四點請求管理員協助晚間七點雨停接獲回應工作人員擦拭內部堅稱破洞離去客廳帳本應漏水態度傲慢漠視顧客過往評論顯示類似屢見不鮮擔心成為慣老闆受害者營地美麗時身心俱疲,2022/5/6,0
"1.營地的草地非常美麗，令人印象深刻。2.帳棚緊鄰，空間十分擁擠，導致小孩無法自在地奔跑，疑似超收。3.收費1,200元，卻遇到了跳電問題。4.總評：若營地能控制帳數並改善電力系統，才能提供良好的住宿體驗。因此，不考慮再次造訪。",2,1,-1,3214,,營地草地美麗令人印象深刻帳棚緊鄰空間擁擠導致小孩自在奔跑疑似超收收費200元跳電總評營地控制帳數並改善電力系統提供住宿體驗造訪,2021/5/7,0
環境：山景優美，休憩區設,2,1,-1,2181,,環境山景優美休憩區設,2022/5/7,0
營區屢遭指控超收帳篷，導致許多遊客的休憩空間受到嚴重影響，彼此帳帳相連，活動範圍幾近消失。此外，營區內聚集眾多喧嘩的酒客，嚴重影響親子活動的進行，令遊客感到失望。,1,1,-1,6655,,營區屢遭指控超收帳篷導致遊客休憩空間影響帳帳相連活動幾近消失營區聚集眾多喧嘩酒客影響親子活動令遊客感到失望,2021/5/9,0
冰箱僅提供送風功能，反映問題後卻得到反話，令人失望。營主對水質不佳的問題也無解，用水龍頭流出的泥土水感到困擾。,1,1,-1,3587,,冰箱提供送風功能反話令人失望營主對水質不佳無解水龍頭流出泥土水感到困擾,2022/5/7,0
"1) 衛浴設有乾濕分離，令人滿意，但廁所仍有改善空間。

2) 帳篷位置稍嫌接近，無法在草地上舒適活動。

3) 管理未限制寵物入營，導致半夜狗吠擾人，清晨發現草地上滿布狗便。",2,1,-1,3199,,"衛浴設有乾濕分離令人滿意廁所改善空間

帳篷位置稍嫌接近草地上舒適活動

管理未寵物入營導致半夜狗吠擾人清晨發現草地上滿布狗",2021/5/7,0
優點：D區的場地寬敞，樹木提供自然遮陽，不受陽光曝曬，非常舒適。缺點：環境清潔度需改善，水槽髒亂且未整理，廁所內有蜘蛛網，可能久未清潔。營位與廁所門口的洗手槽有大量大蟑螂，令人擔憂衛生狀況。,2,1,-1,1,,優點D區的場地寬敞樹木提供自然遮陽受陽光曝曬舒適缺點環境清潔度需改善水槽髒亂未整理廁所內有蜘蛛網久未清潔營位與廁所門口洗手槽蟑螂令人擔憂衛生狀況,2024/5/6,0
露營區風景優美，區域寬廣，稍高的位置於五月底（5/28）也不悶熱。入住於上方的營位G區，廁所清潔度稍低，洗澡間於晚上9點時卻無熱水，需自行調整後才可使用。用完浴室後，吹風機已無電，洗手台水龍頭則無水可供使用。當日蚊蟲密度極高，導致一人眼睛腫痛需前往急診。負責人最初關心保險事宜，表達感謝，但後續聯繫不積極，使整體體驗不佳。,1,1,-1,2179,,區風景優美區域寬廣稍高位置於五月底28悶熱入住上方營位G區廁所清潔度稍低洗澡間晚上點時熱水需自行調整完浴室吹風機已無電洗手台水龍頭無水可供使用當日蚊蟲密度極高導致一人眼睛腫痛需前往急診負責人最初關心事宜表達感謝後續整體體驗不佳,2023/5/7,0
水活動相當有趣，但營地附近總是飄散著菸味，令人難以忍受。,1,1,-1,1289,,水活動有趣營地飄散著菸味令人難以忍受,2023/6/7,0
元旦心情愉快，抵達營地後，早上10點半，一下車向營主告知已預訂當日住宿，然而營主的態度不佳，臉上掛著臭臉，表示即使已預訂，也要稍晚才到，不解為何提前抵達。營主不斷重複此說法，強調需等到一點才准許前來，感到困惑且受氣，擔心日後三天的住宿期間受到影響。營主，請反思自己的態度和口氣，勿將責任歸咎於他人，您的口氣和態度確有問題。露營經驗豐富的您也不是「老大」，希望營主能尊重其他人，彼此相互尊重。畢竟，誰也不知道營區的規則，希望營主能更友善地對待客人。,1,1,-1,3435,,元旦心情愉快抵達營地早上10點半車向營主告知預訂當日住宿營主態度不佳臉上掛著臉預訂稍晚不解為何提前抵達營主重複說法需一點准許前來感到困惑受氣擔心日後三天住宿期間影響營主請反思態度口氣勿將責任歸咎於口氣態度確有經驗豐富希望營主能尊重其他人相互尊重營區規則希望營主能友善客人,2021/5/7,0
營地僅有中華電信訊號，其他電信業者無訊號，但營地提供Wi-Fi。抵達馬胎227營地的路途彎曲，可能有安全風險，且路面因整修而凹凸不平，易損傷底盤。營地營主家前廣場區空間有限，收5帳且帳帳相連，孩童活動空間不足。環境有蟑螂、多蒼蠅，為目前最多蒼蠅營地。因海拔750M，無小黑蚊。廁所乾淨，附近有小溪可抓蝦。營主養的雞未關籠，凌晨咕咕叫，影響睡眠。個人不建議再造訪。,2,1,-1,6660,,營地僅有中華電信訊號電信業訊號營地提供WiFi抵達馬胎227營地路途彎曲風險路面整修凹凸不平易損傷底盤營地營主家前廣場區空間有限收帳且帳帳相連孩童活動空間環境蟑螂蒼蠅為蒼蠅營地海拔750M小黑蚊廁所乾淨小溪抓蝦營主養雞未關籠凌晨咕咕影響睡眠建議造訪,2021/5/9,0
造訪當日傍晚前往廁所之路缺乏充足照明，建議營區於廁所前方之水溝增設護欄，以避免夜半使用廁所時不慎滑落之風險。此次因安全疑慮，於夜晚完全禁止孩子單獨前往廁所，憂心意外發生。主要問題與先前訪客所述相似，遺憾地，此營地已無再訪之機會。,1,1,-1,4215,,造訪當日傍晚前往廁所路缺乏充足照明建議營區廁所前方水溝增設護欄夜半廁所時不慎滑落風險疑慮夜晚禁止孩子單獨前往廁所憂心意外發生先前訪客所述遺憾營地再訪機會,2022/5/7,0
帳篷間距過近，彼此影響隱私，且洗水槽高度不足，造成不便。B區和C區衛浴共用，人潮眾多時容易產生髒亂，清潔維護待加強。營主未妥善處理音量問題，影響睡眠品質，強烈建議加強管制，以提升整體露營體驗。,1,1,-1,5497,,帳篷間距過近影響隱私洗水槽高度不便B區和C區衛浴共用人潮眾多時髒亂清潔維護營主未妥善處理音量影響睡眠品質強烈建議管制提升整體體驗,2021/5/8,0
洗澡水溫經常性地不穩定，導致無法順利調整至合適的溫度，且營地中完全沒有飲水機可供使用，造成不便。,2,1,-1,6076,,洗澡水溫經常性穩定導致順利調整合適溫度營地中飲水機可供使用不便,2023/5/8,0
整個營區僅有一座冰箱，導致大家無處放置食物，原本準備好的香腸整包竟遺失，管理無方令人失望。一早起床心情不佳，決定不食用露營料理，而改回山下享用美味佳餚，從此不再造訪此營區。,1,1,-1,2778,,營區僅有一座冰箱導致無處放置食物原本香腸整包遺失管理無方令人失望一早起床心情不佳食用料理改回山下享用美味佳餚造訪營區,2022/5/7,0
這個露營區的出入山路令人擔憂，狹窄崎嶇的路面雜草密布，路寬僅容一輛車通行，幾乎無法進行會車。沿途樹枝、竹枝不斷碰撞車身，造成損傷。若遭遇會車，彷彿身在獨木橋的羊群，充滿不確定性。僅建議經驗豐富的會車高手前來造訪。,1,1,-1,2189,,區的出入山路令人擔憂狹窄崎嶇路面雜草密布路寬僅容一輛車通行車沿途樹枝竹枝碰撞車身損傷遭遇車彷彿身在獨木橋羊群充滿不確定性建議經驗豐富會車高手前來造訪,2021/5/7,0
"1.搭設帳篷時，釘子難釘，鎚子卻頻頻損壞。
2.丟棄垃圾需至浴室處的垃圾桶，路途稍遠，不便。
3.廁所除在夜衝後短暫乾淨，之後便維持不佳，缺乏維護，衛生紙用完亦未及時補貨。
4.排水功能不佳，大雨來襲時，雨水湧入帳篷，排水系統無法應付，導致帳篷內積水難消。",2,1,-1,498,,"搭設帳篷時釘子難釘鎚子頻頻損壞
丟棄垃圾需至浴室處垃圾桶路途稍遠不便
廁所夜衝短暫乾淨不佳缺乏維護衛生紙完未補貨
排水功能不佳雨來襲時雨水湧入帳篷排水系統應付導致帳篷積水難消",2023/5/6,0
"露營場地收費過高，達三百元似乎有些不合理，且巡邏人員頻繁出沒，令人感到類似在追捕小偷。這趟第26次露營旅程來到溪遊記，卻浪費了難得的連假四天。營主態度不友善，除了沙坑供小孩玩樂，其他地方也無任何遊樂設施。孩子們首次表示露營無聊，實在令人失望。營主聲稱有數十部車輛進出，但實際上僅有十幾部，因此三天停車費也多付了1,800元。在星光燦爛的夜晚，卻多了許多五顆星評論，令人懷疑真實性。未經當事人同意，擅自將車牌錄影並發至公開網站，已委託家人和律師處理。業者更在留言中嘲諷，表示付不起錢就去住免費的野營？？？",1,1,-1,3833,,場地收費過高達三百元不合理巡邏人員頻繁出沒令人感到類似追捕小偷這趟26次旅程來到溪遊記浪費連假四天營主態度友善沙坑供小孩玩樂地方遊樂設施孩子首次無聊實在令人失望營主聲稱數十部車輛進出實際上僅有十幾部三天停車費多付800元星光燦爛夜晚五顆星評論令人懷疑真實性未經當事人同意擅自車牌錄影發至公開網站委託家人律師業者留言中嘲諷付不起錢住免費野營,2022/5/7,0
植被稀疏營地排水不佳，使土壤鬆軟易受強風影響，導致營釘輕易脫落。未提供棧板，地面泥濘不堪，令人深感失望。幸好，服務人員魅力十足，如赤膊帥哥，頗有加分效果。,1,1,-1,5472,,植被稀疏營地排水不佳土壤鬆軟易受強風影響導致營釘輕易脫落未提供棧板地面泥濘不堪令人深感失望幸好服務人員魅力十足赤膊帥哥有加分效果,2022/5/8,0
鄰近水庫，羅馬公路，夜晚車聲嘈雜，嚴重影響睡眠品質，除B區外，其餘小帳棚區域空間過小，距離過近，營主CD可重新規劃為一區，衛浴廁所數量有限，欲洗澡者需把握時間,2,1,-1,3984,,鄰近水庫羅馬公路夜晚車聲嘈雜影響睡眠品質B區外帳棚區域空間過小距離過近營主CD規劃為一區衛浴廁所數量有限欲洗澡需把握時間,2023/5/8,0
三天兩夜，洗澡水溫總是過低，孩童飽受寒意侵襲。老闆態度惡劣，直接開嗆客人「你哪位？」，似乎不滿生意太好，服務品質卻低落。收取費用時，服務態度亦十分傲慢。改名為「尖石差勁」，以反映其糟糕的印象。,1,1,-1,525,,三天兩夜洗澡水溫過低孩童飽受寒意侵襲老闆態度惡劣開嗆客人哪位生意太好服務品質低落收取費用時服務態度傲慢改名為尖石差勁糟糕印象,2022/5/6,0
廁所未定期清潔，直到晚上變得非常髒亂，垃圾桶已爆滿，且週日（2020/09/20）早上起，連營區水槽也無水可供使用，令住客深感不便。,1,1,-1,2198,,廁所未定期清潔晚上變得髒亂垃圾桶爆滿週日20200920早上營區水槽無水可供使用令住客深感不便,2021/5/7,0
環境整潔須加強，令遊客感受欠佳；帳篷數量過多，影響露營品質。,1,1,-1,6864,,環境整潔須令遊客感受欠佳帳篷數量過多影響品質,2022/5/9,0
"1.廚餘桶標示錯誤，未提供廚餘桶，導致廚餘不知道該丟棄何處。
2.遇到大雨，未辦理退訂，營地淪為泥濘，孩童因踩到泥巴全身髒污，引發家長不滿。
3.沙坑管理過嚴，僅因孩童沙子溢出邊緣，即被員工責駡，營友質疑管理方式。
4.腳踏車放置在危險位置，容易遭籃球碰撞，孩童安全受到威脅。
5.老舊腳踏車提供使用，但無專用車道，與汽車共用，增加危險性。
6.護草墊放置於泳池內，未妥善清洗，影響使用者舒適度。
7.浴室水壓不穩，廁所和浴室集中於同一區域，造成不便。
8.營主態度嚴格，營友須謹慎考慮是否適合體驗。
9.營地管理過於火爆，不適合容易受驚的營友。",2,1,-1,5261,,"廚餘桶標示錯誤未提供廚餘桶導致廚餘丟棄
大雨未辦理退訂營地淪為泥濘孩童踩到泥巴全身髒污引發家長
沙坑管理過嚴僅因孩童沙子溢出邊緣員工責駡營友質疑管理方式
腳踏車放置危險位置遭籃球碰撞孩童威脅
老舊腳踏車提供專用車道汽車共用增加危險性
護草墊放置於泳池未妥善清洗影響使用者舒適度
浴室水壓穩廁所浴室區域不便
營主態度營友須謹慎適合體驗
營地管理火爆適合受驚營友",2022/5/8,0
環境清幽，營主親切，五帳包區兩晚的體驗，僅一間衛浴供洗澡，排隊等候時間較長。即使五帳包區人數較少，也需思考正常人數下，等待時間可能更久。,2,1,-1,6099,,環境清幽營主親切五帳包區兩晚體驗一間衛浴供洗澡排隊等候時間較長五帳包區人數少需思考人數等待時間更久,2022/5/8,0
"1. 12/1-12/2 半夜 1 點多，B 區的露友大聲說話，小孩嘻鬧聲不斷。
2. 帳與帳之間很近，營繩差一步，就要碰一起了。
3. 垃圾桶太少，擺在營位前，建議擺營位後或區入口，才不會一直有人走來走去。
4. 營友的素質很重要，希望大家不要在別帳前走來走去，看看別人的裝備，非常沒禮貌。
5. 請規劃吸煙區，下風處聞到煙味，地上還有煙蒂。不推薦的營地，不會再去了。",1,1,-1,6776,,"1212半夜點多B區的露友大聲說話小孩鬧聲
帳與帳之間很近營繩差一步碰
垃圾桶太少擺在營位前建議擺營位或區入口有人走來走去
營友素質希望帳前走來走去裝備禮貌
請規劃吸煙區下風處聞到煙味地上煙蒂推薦營地",2023/12/9,0
露營區的營位價格雖為800元，稍嫌便宜，訪客停車每車收取300元，且頻繁巡查每幾個小時就來收費一次，令朋友有些困擾，本次露營3天，停車費合計達1800元，著實令人失望，老闆態度惡劣，絲毫缺乏親切感，此次經驗足為教訓，絕不會再訪。,1,1,-1,3835,,區的營位價格雖為800元稍嫌便宜訪客停車每車收取300元頻繁巡查幾個小時收費令朋友困擾本次天停車費合計達1800元著實令人失望老闆態度惡劣絲毫缺乏親切感經驗足為教訓絕不會再訪,2022/5/7,0
熱水供應經常性中斷，令人困擾，不建議前往。,1,1,-1,209,,熱水供應經常性中斷令人困擾建議前往,2019/5/6,0
門票無法折抵消費，餐點價格偏高，麵線搭配一顆蛋竟要價220元，實在讓人驚訝。此外，男女廁所混在一起，且廁所照明不足、隔音效果不佳，使得使用體驗相當不便，不如選擇鄰近的土雞城用餐。,1,1,-1,4309,,門票折抵消費餐點價格偏高麵線搭配一顆蛋竟要價220元實在驚訝男女廁所混在廁所照明隔音效果不佳體驗不便選擇鄰近土雞城用餐,2015/5/7,0
大雨造成大面積積水，草地泥濘難行走，前往廁所的路上照明昏暗，令人不舒適。營地內百帳共聚，環境清潔欠佳，衛生紙嚴重不足，廁所環境臭氣熏天，令人難以忍受。儘管營地常舉辦大型活動，營主卻沒有因經驗成長而改善，雙十連假期間湧入眾多露客，僅有一位阿伯負責打掃。冰箱髒亂不堪，令人失望。此營地環境維護人力不足，不再造訪的意願強烈。,2,1,-1,21,,大雨大面積積水草地泥濘難行走前往廁所路上照明昏暗令人舒適營地內百帳共聚環境清潔欠佳衛生紙嚴重不足廁所環境臭氣熏天令人難以忍受營地舉辦大型活動營主經驗成長改善雙十連假期間湧入眾多露客僅有一位阿伯負責打掃冰箱髒亂不堪令人失望營地環境維護人力不足造訪意願,2023/11/6,0
造訪Google評論後，對營地的現況感到擔憂，但到達現場後，才了解網友的評論都是公正的。廁所缺乏衛生紙，晚上甚至停電，不提供照明和廚餘桶。水槽未清潔，浴室也有積水問題，且熱水供應不規律。生態池散發異味，A區擁擠塞了12帳，角落的荒地也未整理，只好再塞一帳。幸好有團露朋友相伴，否則228連假的出遊樂趣將受到影響。,1,1,-1,1390,,造訪Google評論營地現況感到擔憂到達現場網友評論公正廁所缺乏衛生紙晚上停電提供照明廚餘桶水槽未清潔浴室積水熱水供應規律生態池散發異味區擁擠塞12帳角落荒地未整理只好再塞一帳幸好有團露朋友相伴228連假出遊樂趣影響,2021/5/7,0
於三日兩夜跨年假期，熱水供應經常不足且不穩定，向營主之女反映，惟其回應似未改善，且態度冷淡。公廁雖每日清潔，惟第一天環境卻頗為髒亂，留下不愉快印象。各營地皆爆滿，帳棚擁擠，實為可惜。,1,1,-1,532,,三日兩夜跨年假期熱水供應穩定營主之女回應似未改善態度冷淡公廁每日清潔惟第一天環境為髒亂留下愉快印象營地皆爆滿帳棚擁擠實為可惜,2022/5/6,0
「我花了200元繳交清潔費用，但發現並未獲得相應的服務。有些人只是想在露營區與親友聚聚、聊天、打屁，卻得支付高昂的費用。營主，您收取的費用似乎有些過高。」,1,1,-1,3205,,我花200元繳交清潔費用發現並未服務想區與親友聚聚聊天打屁支付高昂費用營主收取費用過高,2021/5/7,0
草雖茂密，排水卻顯不佳，令雙腳浸滿泥濘。昆蟲飛舞、跳動本屬自然，然蟑螂頻繁在桌下竄出，令人不堪其擾。犬隻飼主應妥善看顧寵物，勿使之對賓客囂張地張口狂吠。倘有幼童受驚嚇，不慎跌倒，責任歸屬恐難釐清。一次性體驗已足供警惕，感謝您的分享。,1,1,-1,1782,,草茂密排水顯不佳令雙腳浸滿泥濘昆蟲飛舞跳動本屬自然蟑螂頻繁桌下竄出令人不堪其擾犬隻飼主應妥善看顧寵物勿賓客囂張張口狂吠幼童受驚嚇不慎跌倒責任歸屬恐難釐清一次性體驗已足供警惕感謝您分享,2023/5/7,0
地點偏遠，導致用餐購物十分不便。建議可販售簡易食物，並多聘僱工作人員協助。此外，管理住宿顧客的素質也非常重要，如降低音量，以維持寧靜環境。最後，考量住宿價格過高，建議調整以吸引更多旅客。,2,1,-1,2400,,地點偏遠導致用餐購物不便建議販售簡易食物並多聘僱工作人員協助管理住宿顧客素質降低音量寧靜環境考量住宿價格過高建議調整吸引旅客,2017/8/29,0
官網宣稱浴廁提供衛生紙與沐浴乳，然於廁所未見衛生紙，沐浴乳亦已不知多久未更新。淋浴水近乎寒冰，於3天2夜露營之旅，全未見清潔浴廁及垃圾桶。偶見數隻蟑螂與蒼蠅。實為可惜之地，其硬體設備尚稱不錯。,2,1,-1,1391,,官網宣稱浴廁提供衛生紙沐浴乳廁所未見衛生紙沐浴乳不知多久未更新淋浴水近乎寒冰天夜之旅全未見清潔浴廁及垃圾桶偶見數隻蟑螂蒼蠅實為可惜之地硬體設備尚稱不錯,2021/5/7,0
營主待人態度不佳，車輛僅短暫發動，竟遭質疑用車需求。洗澡期間，營主於浴室清潔，分配浴室予露友使用時，營主要求洗尚未清潔之第三間，令人困惑。此外，熱水不穩定，水質混濁，導致同行友人皮膚敏感，洗手檯亦十分混濁，影響生活品質。夜深後，仍有露友吵鬧，聯繫營主未獲回應，營主辯稱睡著，引發安全疑慮。高評價之緣由不明，建議欲前往之露友審慎斟酌。,1,1,-1,3335,,營主待人態度不佳車輛短暫發動遭質疑用車需求洗澡期間營主浴室清潔分配浴室予露友時營求洗尚未清潔第三間令人困惑熱水穩定水質混濁導致同行友人皮膚敏感洗手檯混濁影響生活品質夜深仍有露友吵鬧營主未獲回應營主辯稱睡著引發疑慮高評價緣由不明建議欲前往之露友審慎斟酌,2024/3/7,0
洗碗槽和插座數量不足，熱水供應不穩定，常有忽冷忽熱的情況，建議營主實施夜間音量限制，例如十點後降低噪音，以免影響其他營地朋友的休息。此次遇到隔壁帳的朋友深夜仍大聲喧嘩，反應後雖有短暫改善，但後繼無力，令人難以入眠。營主可思考如何提升營地品質，並加強對營地使用者的管理。,1,1,-1,176,,洗碗槽插座數量熱水供應穩定常有忽冷忽熱情況建議營主實施夜間音量十點降低噪音影響營地朋友休息隔壁帳的朋友深夜大聲喧嘩短暫改善後繼無力令人難以入眠營主可思考提升營地品質營地使用者管理,2021/5/6,0
環境整潔，熱水供應僅至晚間10點，鄰近洗手台照明亦至10點，營主夫婦態度較冷淡，缺乏熱情。,2,1,-1,6625,,環境整潔熱水供應僅至晚間10點鄰近洗手台照明10點營主夫婦態度冷淡缺乏熱情,2022/5/9,0
"1.營區清潔度尚可，但草地被帳篷覆蓋後，缺少自然美景。
2.提供PIZZA、石鍋拌飯等餐點，方便免開伙，但僅能在特定時段購買。
3.營地位置擁擠，缺乏空間感，讓人感到擁擠。
4.入園時間早，但需在中午前離場，使遊玩時間受限。
5.每帳價格為1200元，若欲提早入園需另加100元，整體CP值稍嫌不足。以上為後花園區之露營體驗。",2,1,-1,3278,,"營區清潔度尚可草地帳篷覆蓋缺少自然美景
提供PIZZA石鍋拌飯餐點免開伙但僅特定時段購買
營地位置擁擠缺乏空間感感到擁擠
入園時間早需中午前離場遊玩時間受限
每帳價格為1200元欲提早入園需另加100元整體CP值稍嫌為後花園區之體驗",2018/5/7,0
廁所：定期清掃不確實，導致異味飄散，吹風機功能不佳，甚至斷電，浴室熱水供應不穩定，有時無熱水可用，冰箱數量不足以滿足露營客需求，洗手台結構不良，影響生活便利性。,2,1,-1,16,,廁所定期清掃確實導致異味飄散吹風機功能不佳斷電浴室熱水供應穩定熱水可用冰箱數量不足以客需求洗手台結構不良影響生活便利性,2023/12/6,0
帳篷區擁擠不堪，僅提供約四至五帳的活動空間，然而營區卻容留七帳，導致活動感大幅減少。網路上提到的遊樂設施，如沙坑、戲水池和射箭場，實際上已荒廢，令人失望。廁所則維持乾淨，搗麻糬活動則增添一些樂趣。然而，下面營區在露營期間舉辦電音趴，噪音干擾三夜兩日，令露營體驗大打折扣。營主於露營前兩天才告知，令人錯愕，為首次給予營區負面評價，期盼後續改善。,2,1,-1,3599,,帳篷區擁擠不堪提供約四至五帳活動空間營區容留七帳導致活動感大幅減少網路上提到遊樂設施沙坑戲水池射箭場實際上荒廢令人失望廁所乾淨搗麻糬活動增添樂趣營區期間舉辦電音趴噪音干擾三夜兩日令體驗大打折扣營主前兩天告知令人錯愕為首次給予營區負面評價期盼後續改善,2021/5/7,0
雨棚區的石子鋪面過薄，遇雨容易積水，導致場地淹水成災難。以人頭、車輛和帳篷數量計費，計算方式十分精準。,1,1,-1,4188,,雨棚區的石子鋪面過薄遇雨積水導致場地淹水成災難人頭車輛帳篷數量計費計算方式精準,2023/7/7,0
