content,rating,type,status,sequence_num,tokenization,text,publishedDate,origin
蟲子氾濫成災，熱水供應不穩定，營主飼養多隻犬隻，易因吠叫干擾安寧；廁所數量不足，造成排隊困擾。,2,1,-1,1778,,蟲子氾濫成災熱水供應穩定營主飼養多隻犬隻易因吠叫干擾安寧廁所數量排隊困擾,2023/5/7,0
廁所和浴室雖保持整潔，但提供的水源為山泉水，使之稍顯黃濁。營區未設置飲水機，需自備飲用水。此外，螞蟻和蜘蛛網豐富，需注意安全。露營區的小樹間距稍窄，車輛出入較為困難，但夜晚聆聽溪流的聲聲奔流，確使人心生愜意。,2,1,-1,4176,,廁所浴室整潔提供水源為山泉水稍顯黃濁營區未設置飲水機需自備飲用水螞蟻蜘蛛網需注意區的小樹間距稍窄車輛出入為困難夜晚聆聽溪流聲聲奔流確使人心生愜意,2024/4/7,0
營主易受控，營地費偏高，空間略嫌狹窄，大車停放較尷尬。,1,1,-1,6676,,營主易受控營地費偏高空間略嫌狹窄大車停放尷尬,2019/5/9,0
入住馬胎227營區，原期待人生初露能帶來美好回憶，但入住後發現廣場區環境清幽乾淨，讓初露體驗大受鼓舞。晚餐後，孩子隨鄰營家長遊玩，初嘗探險樂趣，卻因雨增添露營樂趣。入夜後，睡眠時間卻遭鄰近營客喧嘩打擾，持續至深夜2-3點，營主未出面制止，影響睡眠品質。隔天一早，受雨天影響及睡眠不足，心情不佳，迫不及待收隊下山。營主才至打招呼，主動提及客喧嘩，表示曾聽到但未制止，以熟客為由，令心情更沮喪。馬胎227雖獲5星評價，但營主好客僅顧熟客，失望之感不減。,2,1,-1,6640,,入住馬胎227營區原期待人生初露帶來美好回憶入住發現廣場區環境清幽乾淨初露體驗大受鼓舞晚餐孩子隨鄰營家長遊玩初嘗探險樂趣因雨增添樂趣入夜後睡眠時間遭鄰近營客喧嘩打擾持續深夜點營主未出面制止影響睡眠品質隔天一早受雨天影響睡眠不足心情不佳迫不及待收隊下山營主才打招呼主動提及客喧嘩聽到未制止熟客為令心情沮喪馬胎227雖獲星評價營主好客僅顧熟客失望之感不減,2021/5/9,0
環境雖保持得不錯，但工作人員的態度需再提升（如10/8萬聖節活動中的扮演鬼滅之刃角色的工作人員），常表現不耐煩的回答方式！當詢問問題時，尚未看到對方的臉就迅速不耐煩地回應，使人懷疑若小孩在，真會忍不住表現不悅的心情。,1,1,-1,22,,環境不錯工作人員態度需再提升10萬聖節活動中扮演鬼滅之刃角色工作人員表現不耐煩回答方式詢問時尚未臉不耐煩回應使人懷疑小孩真忍不住表現不悅心情,2023/11/6,0
當初因網路好評而充滿期待，但下訂後卻充滿失望。1.訂金支付後，聯繫問題未獲得回應，感到氣餒。2.入住後，老闆娘立即收取尾款，未再遇到他們，缺乏親切感。3.兩間衛浴室供六帳以上（十六人）使用，衛生紙是否足夠令人疑慮。4.其他露友可能共用衛浴，增加不確定性。5.洗澡時間需排隊，尿意難忍。6.流理台未提供肥皂或洗碗精，盥洗室亦無沐浴用品。綜合以上，此次露營參與者共11人皆對露營經驗感到失望。,1,1,-1,6137,,當初網路好評充滿期待下訂充滿失望訂金支付未回應感到氣餒入住老闆娘收取尾款未缺乏親切感兩間衛浴室供六帳十六衛生紙足夠令人疑慮露友共用衛浴增加不確定性洗澡時間需排隊尿意難忍流理台未提供肥皂洗碗精盥洗室沐浴用品綜合參與者11皆經驗感到失望,2019/5/8,0
帳棚相鄰太近，連在一起幾乎沒隱私，護草墊還不夠大，廁所雖乾淨，但只有四間衛浴不足夠，淋浴間水壓小且忽冷忽熱，電力供應不穩，燈條僅微亮，營地人員回應為太多帳位導致電力負載過高，並表示延長線及線路問題可能出在A、B區。此外，營地在下雨時排水不良，大雨過後地面積水嚴重，建議穿鞋進出帳篷，並清洗鞋子。,1,1,-1,2194,,帳棚相鄰太近連在一起隱私護草墊廁所乾淨四間衛浴足夠淋浴間水壓小且忽冷忽熱電力供應穩燈條僅微亮營地人員回應為太多帳位導致電力負載過高延長線線路B區營地下雨時排水不良大雨過後地面積水建議穿鞋進出帳篷清洗鞋子,2021/5/7,0
這間露營區的收客速度緩慢，令住客感到失望，因此不建議前往。櫃台於表定退房時間12:00後，於10:30便開始催促，於11:46更提早關閉水電及冰箱，令住客感到不受尊重，留下惡劣印象。,1,1,-1,2173,,這間區的收客速度緩慢令住客感到失望建議前往櫃台表定退房時間12001030催促1146提早關閉水電冰箱令住客感到受尊重留下惡劣印象,2023/5/7,0
營主一家的態度令人失望，不僅自身行為不佳，甚至放任自家狗在營地隨地大小便，造成其他露營者的不便。,2,1,-1,6693,,營主一家態度令人失望行為不佳放任狗營地隨地大小便不便,2023/3/7,0
場地擁擠，帳棚數量過多，限制了活動空間，停車位不足，衛浴設施不潔，淋浴水壓不穩，馬桶阻塞困擾，泳池暫停營業，孩子失望，電壓不穩，跳電問題，大草原好，滑草有風險，帆布破損，成人受傷，景觀前排佳，後排受阻，冷藏冰箱故障，僅剩冷凍櫃，管理不佳，帳數控管失當。,1,1,-1,2224,,場地擁擠帳棚數量過多活動空間停車位衛浴設施不潔淋浴水壓穩馬桶阻塞困擾泳池暫停營業孩子失望電壓穩跳電草原滑草風險帆布破損成人受傷景觀前排佳後排受阻冷藏冰箱故障僅剩冷凍櫃管理不佳帳數控失當,2020/5/7,0
草地營地位於洩水道旁，導致在大雨時有大水溝相伴，營主應考量將營地遷移至水槽附近，以提供更理想的露營環境。,2,1,-1,376,,草地營地位於洩水道旁導致大雨時有大水溝相伴營主應考量營地遷移水槽提供理想環境,2021/5/6,0
營地的岩石地面使營釘難插入，且遇強風易被吹起，導致住宿品質不佳，下次考慮前往其他營地。,1,1,-1,584,,營地岩石地面使營釘難插入遇強風易吹起導致住宿品質不佳下次前往營地,2020/5/6,0
營地鄰近道路方便車停帳邊，但排水設施不佳且未提供護草墊，導致梯田地形的下部營地更受影響。此次遭遇大雨，低漥營地積水嚴重，僅3分鐘就淹入帳棚，形成一片汪洋。露友被迫自救，挖掘溝渠保護帳棚。此次經歷令人傻眼，下雨天不推薦此營地。,1,1,-1,503,,營地鄰近道路車停帳邊排水設施不佳且未提供護草墊導致梯田地形下部營地更受影響遭遇大雨低漥營地積水分鐘淹入帳棚一片汪洋露友被迫自救挖掘溝渠保護帳棚經歷令人傻眼下雨天推薦營地,2023/5/6,0
冬季造訪此營區可能面臨電力不足問題，導致電暖器頻繁跳電，建議攜帶備用電源或可承受低溫的設備。請注意營主的情緒，避免被誤認為怕冷而遭受批評，並慎防營區工作人員使用不雅言語。,1,1,-1,6594,,冬季造訪營區面臨電力導致電暖器頻繁跳電建議攜帶備用電源承受低溫設備請營主情緒誤認為怕冷遭受批評慎防營區工作人員雅言語,2023/5/9,0
草坪優美，衛浴清潔，營主友善，提供自煮飲品。營地照明良好，營主迅速提供協助。然而，狗便的問題令人困擾。第一天踩到狗便，營主承認狗的主人，但第二天在炊事區再次遇到狗便，營主的子女無視陳情。雖然狗在自家便溺無妨，但態度漠不關心令人無法接受。美麗營地卻因狗便留下陰影，期望營主重視此問題，為露營體驗加分。,2,1,-1,1887,,草坪優美衛浴清潔營主友善提供自煮飲品營地照明營主提供協助狗令人困擾第一天踩到狗營主承認狗主人第二天炊事區狗營主子女無視陳情狗便溺無妨態度漠不關心令人接受美麗營地因狗留下陰影期望營主重視為體驗加分,2023/5/19,0
菠蘿蜜區域的熱水供應突然中斷，令人感到失望，且共用衛浴設施僅有2間，分別為蹲式廁所和衛浴間，造成不便。此外，營區禁止車輛進入，營主則使用牛車運送設備，增加了一些不便。,2,1,-1,6079,,菠蘿蜜區域熱水供應中斷令人感到失望共用衛浴設施僅有間為蹲式廁所衛浴間不便營區禁止車輛營主則牛車運送設備增加不便,2023/5/8,0
昔日這裡是我們一群朋友每年相聚的美好營地，隨著生意日益興盛，主人卻漸漸忘記最初的熱誠。在重要的連假期間，基本的設施檢查卻未進行，導致我們經歷了20多年來第一次的無熱水淋浴。當初熱忱的服務吸引了我們一再到訪，但如今卻只希望盡快收取費用，甚至在客人面前確認是否已收到。倘若缺乏信心，建議儘早關門，以免受騙。我們並非無理取鬧，只是感嘆一個曾經溫馨的露營區的消逝。無論是否理會我們，我們已找到其他值得光臨的住宿地點。沒有心的地方，實在不值得我們花錢。,2,1,-1,1892,,昔日一群朋友相聚美好營地生意興盛主人漸漸忘記最初熱誠連假期間設施檢查未導致經歷20年來第一次熱水淋浴當初熱忱服務吸引一再到訪希望盡快收取費用客人面前確認收到缺乏信心建議關門受騙無理取鬧感嘆溫馨區的消逝理會找到值得光臨住宿地點心地方實在值得花錢,2022/11/22,0
有小黑蚊，但適合不怕小黑蚊的露營者（自然界提供參考）。營區包區與隔壁區帳篷緊密相連，帳尾連帳尾，沒有網路。美美的設施已殘破不堪，適合拍照。其他部分懶得拍了，沒有鋼琴和教堂，因有露客不好意思近拍。與網路美照相比，相差甚遠。營區劃分區域安排不恰當，過於密集。露營及訪客費用請自行參考，兩帳包區2200，夜衝600，提供大家參考。本人僅此一次露營。,1,1,-1,4219,,小黑蚊適合小黑蚊自然界提供參考營區包區隔壁區帳篷緊密相連帳尾連帳尾網路美美設施殘破不堪適合拍照懶得拍鋼琴教堂因有露客不好意思拍網路美照相比相差甚遠營區劃分區域安排恰當密集訪客費用請自行參考兩帳包區2200夜衝600提供參考僅此一次,2021/5/7,0
員工態度不友善，僅在收取費用時較為積極。營區網路訊號極為不佳，設施老舊且破損。蚊蟲眾多，困擾不已，營位空間有限。洗手檯及衛浴設備皆無照明，且常因堵塞無法使用。營地雜草叢生，環境雜亂，營地指示不清，難以找到正確位置。因上述種種原因，不排除不再造訪。,1,1,-1,4218,,員工態度友善僅在收取費用時較為營區網路訊號極為不佳設施老舊破損蚊蟲眾多困擾營位空間有限洗手檯衛浴設備皆照明且常因堵塞營地雜草叢生環境雜亂營地指示不清難以找到正確位置種種原因排除造訪,2021/5/7,0
距新店碧潭僅約10分鐘車程，為方便輕鬆露營之選，鄰近地區可購外食，屬城市露營型營地。雖無吵雜車聲，但原為婚宴拍攝地點，設計非露營用，如帳前無洗手台，垃圾桶於廁所使用，僅有一處廁所，約30帳共用，衛浴爭搶。偏遠區域需繞路才能使用，費用雖稍高，但入夜有螢火蟲，衛浴需早點使用、無大整理且老舊。其他營地費用較便宜，營主會巡視整理。,2,1,-1,4216,,新店碧潭僅約10分鐘車程為輕鬆之選鄰近地區可購外食屬城市型營地吵雜車聲原為婚宴拍攝地點設計非如帳前洗手台垃圾桶廁所僅有一處廁所約30帳共用衛浴爭搶偏遠區域需繞路費用稍高入夜螢火蟲衛浴需早點無大整理老舊營地費用便宜營主會巡視整理,2021/5/7,0
房間雖不太乾淨，但春節期間的價格還算合理。,2,1,-1,114,,房間雖不太乾淨春節期間價格算,2022/5/6,0
營區位處山中鞍部，易受季節風影響，內部風勢強勁，令營地成為「怪風之區」。營主應對地形了解更全面，提供適切協助。多次造訪，於11月連續遭遇斷營柱事件，導致半夜被迫撤離。,2,1,-1,765,,營區位處山中鞍部易受季節風影響內部風勢強勁令營地成為怪風之區營主應對地形提供適切協助造訪11月連續遭遇斷營柱事件導致半夜被迫撤離,2017/11/21,0
草區草地過長，蚊蟲成群，令人難以忍受。首次在露營過程中遇到如此多的蒼蠅，從上午八點就被其騷擾，全天使用五張紙驅除仍無效。直到傍晚六時，蒼蠅數量才稍見減少。雖則衛浴空間寬敞，戲水池亦佳，但蒼蠅數量實在太驚人。,2,1,-1,2803,,草區草地過長蚊蟲成群令人難以忍受首次過程中蒼蠅上午八點騷擾全天五張紙驅除無效傍晚六時蒼蠅數量稍減少衛浴空間寬敞戲水池亦佳蒼蠅數量實在太驚人,2021/5/7,0
環境雖佳，但小黑蚊數量多，且野狗於深夜翻找垃圾桶，干擾睡眠品質，令人感到困擾。,2,1,-1,5521,,環境雖佳小黑蚊數量野狗深夜翻找垃圾桶干擾睡眠品質令人感到困擾,2020/5/8,0
訊號不佳令人困擾，且遇到一些自以為會唱歌的神經病，大聲喧嘩難耐耳朵，後悔前來此營地，後悔一輩子。,1,1,-1,2186,,訊號不佳令人困擾自以為唱歌神經病大聲喧嘩難耐耳朵後悔前來營地後悔一輩子,2022/5/7,0
營區的草皮維護確實需要改善，雨天露營經常積水影響露營品質，絕非天氣因素所致，肇因於排水設施未完善，嚴重影響露營氣氛，令營友深感掃興。然營主待人和善，廁所維持整潔，視野開闊等優點仍值得嘉許。,2,1,-1,5436,,營區草皮維護確實改善雨天積水影響品質天氣因素所致肇因排水設施未完善影響氣氛令營友深感掃興然營主待人和善廁所整潔視野開闊優點值得嘉許,2023/11/8,0
全營區大人加小孩多達200多人，洗澡時間非常有限，需在晚上12點前完成，否則可能會遭到中止供水；飲水機僅有一台，使用大桶裝水的民眾被批評，管理單位應反思是否有不足的設備；沙坑遊戲區傍晚就關閉，限制孩童遊玩時間，其目的不明，但前方營區則有更多活動空間。,1,1,-1,5278,,全營區大人加小孩多達200多人洗澡時間有限需在晚上12點前中止供水飲水機僅有一台桶裝水民眾批評管理單位應反思設備沙坑遊戲區傍晚關閉孩童遊玩時間目的不明前方營區則有活動空間,2021/5/8,0
廁所未定期清潔，雜草長成小樹，冰箱發霉未整理，溪畔水池宛如生態池，整體環境令人失望。,1,1,-1,5463,,廁所未定期清潔雜草長成小樹冰箱發霉未整理溪畔水池宛如生態池整體環境令人失望,2023/5/8,0
營地環境整潔，但工作人員的服務態度令人失望。營地帳位價格約新台幣650，抵達時發現冰箱已無空間，於結帳時提出建議，工作人員卻表示無法分區，反建議早到以獲得較佳位置。此外，全營地皆無提供垃圾桶，工作人員表示人手不足，詢問解決方法。,1,1,-1,548,,營地環境整潔工作人員服務態度令人失望營地帳位價格約新台幣650抵達時發現冰箱空間結帳時提出建議工作人員分區反建議早到較佳位置全營皆提供垃圾桶工作人員人手不足詢問解決方法,2022/5/6,0
未提供妥善的熱水供應，即使在寒冷的夜晚，依然無法獲得合適的解決方案，令遊客深感失望，故強烈不建議前來此營地。,1,1,-1,4704,,未提供妥善熱水供應寒冷夜晚依然合適解決方案令遊客深感失望建議前來營地,2021/5/7,0
一個令人失望的營地，炎熱的夏季造訪會讓您後悔，午後的暴雨將使不良排水系統曝光，泥濘難行的路面破壞了露營的舒適氣氛，迫切需要改善。,1,1,-1,375,,令人失望營地炎熱夏季造訪後悔午後暴雨將使不良排水系統曝光泥濘難行路面破壞舒適氣氛迫切需要改善,2021/5/6,0
"在海拔1,000m以上的高山營地，遇到了令人失望的露營體驗。路況狹窄、會車不易，加上收費昂貴，令人感到失望。抵達營區後，沒有專人帶位，露客們需自行在狹窄的營地內尋覓位置。半夜電箱突然爆了，導致跳電，當時室外溫度僅8度，令人膽戰心驚。中華遠傳訊號薄弱，營區提供的Wi-Fi也無法使用，露客們無法聯繫外界。洗碗槽時常無水或水不足，彷彿在推動無水洗碗的環保理念。小朋友洗澡時，還遇到水壓不穩定的問題。馬桶水槽損壞，需自行舀水沖便，彷彿回到早期農村生活。廁所髒臭，臭味撲鼻，令人作嘔。營區缺乏宵夜靜聲管制，非常適合夜貓子狂歡。營地管理不佳，超出了營區硬體設備的負載量，令露客們留下了非常不愉快的回憶。",1,1,-1,6822,,海拔000m高山營地令人失望體驗路況狹窄車不易收費昂貴令人感到失望抵達營區專人帶位露客們需自行狹窄營地尋覓位置半夜電箱爆導致跳電室外溫度度令人膽戰心驚中華遠傳訊號薄弱營區提供WiFi露客們外界洗碗槽時常無水或水彷彿推動無水洗碗環保理念小朋友洗澡時水壓穩定馬桶水槽損壞需自行舀水沖彷彿回到早期農村生活廁所髒臭味撲鼻令人作嘔營區缺乏宵夜靜聲管制非常適合夜貓子狂歡營地管理不佳超出營區硬體設備負載量令露客們留下愉快回憶,2023/5/9,0
廁所未保持清潔、虎頭蜂未妥善處理、蚊蟲眾多、游泳池已乾枯未更新資訊，早上10:30收帳時仍受催促，導致整體露營體驗極度不佳。,1,1,-1,5458,,廁所未保持清潔虎頭蜂未妥善處理蚊蟲眾多游泳池乾枯未更新資訊早上1030收帳時受催促導致整體體驗不佳,2023/5/8,0
露過最糟糕的營區，剛抵達就發現洗手槽積滿前一批人留下的殘渣，環境相當髒亂。TOP區的草地也未整理，草長到影響生活品質。營主在電話中表示有獨立冰箱，但到現場才知道只有在營本部，且距離相當遠。營區有許多會飛的小蟑螂，大隻的也有，令人相當困擾。廁所兩天未清，也無提供衛生紙，僅在收錢時才看到營主。朋友因露營新手，直接向營區租借帳篷、睡袋，結果打開竟是全濕，反應後雖換給新品，但整個露營體驗非常糟糕。,1,1,-1,1393,,露過糟糕營區抵達發現洗手槽積滿前一批留下殘渣環境髒亂TOP區的草地未整理草長影響生活品質營主電話中獨立冰箱現場在營本部距離遠營區會飛蟑螂大隻令人困擾廁所兩天未清提供衛生紙僅在收錢時才營主朋友新手營區租借帳篷睡袋打開竟是全濕雖換給新品體驗糟糕,2021/5/7,0
抵達目的地前，蜿蜒的山路使車無法順利上行，造成旅途中的不便與困擾。,1,1,-1,624,,抵達目的地前蜿蜒山路使車順利上行旅途中不便困擾,2019/5/6,0
臨時被調換營地位置，但1.草地上佈滿雜草，2.人多時淋浴間無熱水供應，3.四周環境昏暗，半夜上廁所不便，4.經常遇到跳電狀況。,1,1,-1,4048,,臨時調換營地位置草地上佈滿雜草人多時淋浴間熱水供應四周環境昏暗半夜廁所不便跳電狀況,2021/5/8,0
位子空間不足，令人感到擁擠。深夜經常有野狗到訪，甚至偷走食物。垃圾桶未提供獨立使用，須與鄰近帳棚共用，增加了不便性。,1,1,-1,6756,,位子空間令人感到擁擠深夜野狗到訪偷走食物垃圾桶未提供獨立須與鄰近帳棚共用增加不便性,2024/4/9,0
明明知道螞蟻繁殖期量多，卻不告知，導致露營體驗大幅降低，令人感到失望。,1,1,-1,373,,明明螞蟻繁殖期量告知導致體驗大幅降低令人感到失望,2021/5/6,0
Ｇ露營區的廁所清潔度有待加強，冰箱出現嚴重發霉情況，令人失望。可能尚未完善規劃，但收費開放營運顯有疑慮。,1,1,-1,2211,,Ｇ區的廁所清潔度有待冰箱發霉情況令人失望尚未完善規劃收費開放營運顯有疑慮,2020/5/7,0
誠信是重要的，在F區精心安排營地，卻因其他客人被迫更改至C區。對於第一次到訪的露營客，可能不熟悉營地的營地位置，不清楚已離開原先預訂的區域。營地劃分的區域意義不明，似乎事先與營地管理員溝通就可以了。,2,1,-1,2362,,誠信F區精心安排營地客人被迫更改C區第一次到訪客熟悉營地營地位置離開原先預訂區域營地劃分區域意義不明事先營地管理員溝通,2018/5/7,0
"優點：雲海的美景令人讚嘆，夜晚星空和夕陽也相當美麗，草地平坦好走。

缺點：營區帳篷營位過多，導致活動空間受限，孩童需在車道上遊戲。廁所和浴室數量不足，且未清楚標示，使用上不便。水壓太小，水溫不穩定，導致洗澡品質不佳。停車位規劃凌亂，行動電話訊號較弱，僅中華電信較穩定，使使用WIFI 類似沒有訊號。",2,1,-1,6966,,"優點雲海美景令人讚嘆夜晚星空夕陽美麗草地平坦走

缺點營區帳篷營位過多導致活動空間受限孩童需在車道遊戲廁所浴室數量未標示不便水壓太小水溫穩定導致洗澡品質不佳停車位規劃凌亂電話訊號較弱中華電信穩定WIFI類似訊號",2020/5/9,0
帳棚數量眾多，導致公廁環境不堪入目，即使連續兩天清洗，廁所依舊髒亂。即便早洗晚洗，熱水供應始終不穩定，故強烈不推薦。,2,1,-1,106,,帳棚數量眾多導致公廁環境不堪入目連續兩天清洗廁所依舊髒亂早洗晚洗熱水供應始終穩定推薦,2022/5/6,0
鄰近水源地的營地可能造成環境影響，需注意露營行為對自然生態的影響，以維護當地生態平衡。,1,1,-1,3631,,鄰近水源地營地環境影響需注意行為自然生態影響維護生態平衡,2020/5/7,0
我們是在4/30-5/2於三天兩夜首次參加學校的戶外活動，在充滿小石子的草地上搭建了登山野營帳篷。營釘難以固定，需要使用鐵槌，但營地工作人員起初表示沒有，後由一名男性員工提供。我們詢問如何在石子草地上釘營釘，但工作人員的態度不友善。第二天，我們前往爬山，回到營地後想洗熱水澡，但水溫突然變為冰水，僅13度的低溫，我首度體驗了冷水澡。最後，忘記雨傘在營地入口處的長凳上，打電話詢問，一名男性員工回應營地什麼都沒有，感覺他們不希望造成麻煩。因此，這並非一次愉快的露營經驗。,1,1,-1,517,,30三天兩夜首次參加學校戶外活動充滿小石子草地上搭建登山野營帳篷營釘難以固定鐵槌營地工作人員一名男性員工提供詢問石子草地上釘營釘工作人員態度友善第二天前往爬山回到營地想洗熱水澡水溫變為冰水13度低溫首度體驗冷水澡忘記雨傘營地入口處長凳打電話詢問一名男性員工回應營地感覺希望麻煩愉快經驗,2023/5/6,0
所有露客皆享受寧靜氛圍，惟獨週日早晨，營主友人來訪，自清晨6時半起於前方交談，持續至近8點，令賓客難以入眠；然營主於生意經營方面的注意事項，有助於提升整體住宿體驗。,1,1,-1,6328,,露客皆享受寧靜氛圍惟獨週日早晨營主友人來訪清晨時半起前方交談持續至近點令賓客難以入眠然營主生意經營注意事項有助於提升整體住宿體驗,2023/5/9,0
滿滿的螞蟻四處飛舞，令住宿期間感到非常不舒適，連住兩晚宛如進入螞蟻的世界，令人深感驚恐。,2,1,-1,6907,,滿滿的螞蟻四處飛舞令住宿期間感到舒適連住兩晚宛如螞蟻世界令人深感驚恐,2022/5/9,0
營主態度惡劣，甚至揚言要驅趕客人下山，令露營者備感不快。,1,1,-1,530,,營主態度惡劣揚言驅趕客人下山令備感不快,2022/5/6,0
抵達後發現保留的位置遭更動，令人失望，但工作人員事後致歉並退還費用，浴室蓮蓬頭卻意外破裂，造成水亂噴濺，所幸小孩在遊樂設施上玩得十分開心。,1,1,-1,593,,抵達發現保留位置遭更動令人失望工作人員事後致歉退還費用浴室蓮蓬頭意外破裂水亂噴濺小孩遊樂設施玩開心,2020/5/6,0
造訪該營區時，請注意上山路況極為險惡，且具有高度危險性。建議營主應制定明確的上山及下山時間，以避免發生危險事故。由於道路狹窄且路況不佳，無法進行安全會車，導致露營裝備和孩童增添了風險。因此，強烈建議審慎考慮安全因素，並三思而後行。,2,1,-1,2291,,造訪營區時請上山路況極為險惡高度危險性建議營主應制定上山下山時間發生危險事故道路狹窄路況不佳車導致裝備孩童增添風險強烈建議審慎考慮因素三思而後行,2021/5/2,0
露營區的環境和衛浴設施都相當乾淨舒適，但工作人員除了營主外，其他女性同仁的態度令人失望。其態度極差，非常不友善，絲毫沒有溫暖。經常聽到其他露營客提出疑問，卻有位女性工作人員的回答非常不友善，彷彿在說教。因為這樣的經驗，決定不再造訪。,1,1,-1,6617,,區的環境衛浴設施乾淨舒適工作人員營主外女性同仁態度令人失望態度極差友善絲毫溫暖聽到客提出疑問有位女性工作人員回答友善彷彿說教因為經驗造訪,2022/5/9,0
