content,rating,type,status,sequence_num,tokenization,text,publishedDate,origin
曾經是溫馨的休閒天堂，但野心膨脹導致遺忘了最初吸引人的魅力。入場費雖為100，卻逐漸疏遠了與旅客間的距離。,2,1,-1,1773,,溫馨休閒天堂野心膨脹導致遺忘最初吸引魅力入場費雖為100疏遠旅客間距離,2023/5/7,0
第一次造訪這個露營區，預訂了A和B兩區，三天兩夜的行程，首先要注意的是營地路面不好，底盤較低的車輛需謹慎行駛。營地的營位規劃稍嫌不足，需將車停放在外部，再搬運裝備至營位，導致搭設營帳較為費力。營地訊號不佳，提供的Wi-Fi也無法使用，可能是區域問題。衛浴設備數量過少，且設有時間限制，以6間衛浴計算，150人共用，每人平均使用時間30分鐘，總計12.5小時，衛浴使用時間稍感緊繃。ABC三區共用一個廁所，14個營位共用一廁所，壓力頗大。營地規定晚上10點關閉洗手台和電燈，導致無法在黑暗中洗碗，十分不便。最後，不會考慮再訪這個營地。,1,1,-1,2776,,第一次造訪區預訂B兩區三天兩夜行程營地路面不好底盤低車輛需謹慎行駛營地營位規劃稍嫌需將車停放在外部搬運裝備至營位導致搭設營帳為費力營地訊號不佳提供WiFi區域衛浴設備數量過少設有時間間衛浴計算150共用每人平均時間30分鐘總計12.5小時衛浴時間稍感緊繃ABC三區共用廁所14營位共用廁所壓力營地晚上10點關閉洗手台電燈導致黑暗中洗碗不便再訪營地,2022/5/7,0
在美麗的營區露營，本應享受愉快的時光，然而營主的態度和營地問題卻使我深感失望。營地潮濕積水，營釘歪斜，垃圾桶不足，皆造成不便。晚上貓咪破壞垃圾，清晨清理，營主卻似怪我，心情更加不悅。收營地時，營主不耐煩，似乎忽視已付的費用。真心不建議前來此營地，雖美景，但營主的不友善和營地缺陷，使露營體驗淪為苦差事。唯一給予一顆星，至少景色美麗。幸而有錄影存證，證明我們遵守不亂丟垃圾的戶外道德。,1,1,-1,492,,美麗營區本應享受愉快時光營主態度營地深感失望營地潮濕積水營釘歪斜垃圾桶皆不便晚上貓咪破壞垃圾清晨清理營主似怪心情不悅收營地時營主不耐煩忽視已付費用真心建議前來營地美景營主友善營地缺陷體驗淪為苦差事唯一給予一顆星至少景色美麗幸而錄影存證證明遵守亂丟垃圾戶外道德,2023/5/6,0
水壓、水溫與電壓經常波動，導致洗澡與煮水不方便。附近的沙坑太小，限制孩子的遊玩樂趣。隔壁果園不時傳來聲響，影響全家人休息品質，令人十分失望。,1,1,-1,2837,,水壓水溫電壓波動導致洗澡煮水沙坑太小孩子遊玩樂趣隔壁果園傳來聲響影響全家人休息品質令人失望,2019/5/7,0
未如預期的美麗，與照片差距過大。洗手台數量不足，插座位置過遠，草地遇雨變泥濘，排水系統效能不彰。,2,1,-1,4643,,未如預期美麗照片差距過大洗手台數量插座位置過遠草地遇雨變泥濘排水系統效能不彰,2016/12/1,0
營區的地面為全石頭地，使釘子無法插入，造成不便。夜晚更因熱水供應不足，洗澡時常感到水溫驟降，令人感到寒意。,1,1,-1,597,,營區地面為全石頭釘子插入不便夜晚熱水供應洗澡時常感到水溫驟降令人感到寒意,2020/5/6,0
營主具有精算師背景，卻未妥善處理雨棚漏水問題，甚至在低窪地區導致淹水情況，令人更加擔憂。,1,1,-1,4189,,營主精算師背景未妥善處理雨棚漏水低窪地區導致淹水情況令人擔憂,2023/7/7,0
營區環境相當令人失望，主理人態度惡劣，大量的虎頭蜂造成擔憂，直徑約2-3公分，令人心生畏懼。營區未妥善處理，將責任歸咎於訪客，聲稱是訪客惹事。虎頭蜂於夜晚出沒，實屬正常？20至30隻虎頭蜂頻頻出沒，令人擔憂。若叮咬孩童，能否承擔責任？考慮前往的朋友，請三思！,1,1,-1,3844,,營區環境令人失望主理態度惡劣虎頭蜂擔憂直徑約公分令人心生畏懼營區未妥善處理責任歸咎於訪客聲稱訪客惹事虎頭蜂夜晚出沒實屬2030隻虎頭蜂頻頻出沒令人擔憂叮咬孩童承擔責任前往朋友請三思,2022/5/7,0
「3年來造訪最令人失望的露營區：1.淋浴間於洗澡期間斷電，熱水供應不足，小孩浸泡於泡沫中近一小時仍無熱水。2.至少6帳共用同一迴路，電壓不穩，3W10顆LED燈無法點亮，打氣機故障，需手動充氣。3.營地髒亂，生態池未整理，充斥小黑蚊，防蚊措施無效，每人至少需20包防蚊貼。4.在衛浴與帳篷區域驚見飛來大蟑螂。5.草地未定期修剪，超過腳踝高度，石階佈滿青苔，多人滑倒。6.收費不合理，4人以上每人需付250元，幼兒園以下孩童也收費，且與網頁描述不符。7.照片展示的教堂等景點多已老舊，服務人員態度不友善，如有不實，願負法律責任。」,1,1,-1,4204,,年來造訪令人失望區淋浴間洗澡期間斷電熱水供應小孩浸泡泡沫中近小時熱水至少帳共用迴路電壓穩3W10顆LED燈點亮氣機故障需手動充氣營地髒亂生態池未整理充斥小黑蚊防蚊措施無效每人至少需20包防蚊貼衛浴帳篷區域驚飛來蟑螂草地未定期修剪超過腳踝高度石階佈滿青苔多人滑倒收費不合理每人需付250元幼兒園孩童收費網頁描述不符照片展示教堂景點老舊服務人員態度友善如有不實願負法律責任,2023/5/7,0
我昨天剛從騰雲露營區返回，實在迫不及待要分享我的評論，因為感受實在太差了。浴室雖大，但最後一間完全沒有熱水，飲水機的灰塵超厚，彷彿希望人喝下滿滿的灰塵。冰箱太小，沒有妥善規劃，導致大家都亂放，而馬桶水箱沒有蓋子，讓人感覺非常不衛生。在草地上，蜈蚣真的很多，令人感到困擾。營區的環境動線十分怪異，並沒有提供安全的活動空間給小孩。每個營位間隔過於接近，宛如在夜市擺攤。晚上很晚了，隔壁包區的露營客非常吵，營主卻沒有上前處理。帶狗的露友也無法妥善管理，經常跑到我們的帳位，造成小孩與寵物間的衝突。本來看到評論後，我決定要前往特一區，期待百萬夜景，但結果只看到營位前方有大樹擋住我的美景。因此，我強烈不推薦騰雲露營區。,1,1,-1,6786,,昨天剛從騰雲區返回實在迫不及待分享評論因為感受實在太差浴室雖大一間熱水飲水機灰塵超厚彷彿希望喝滿滿的灰塵冰箱太小妥善規劃導致亂放馬桶水箱蓋子感覺衛生草地上蜈蚣真的令人感到困擾營區環境動線怪異提供活動空間小孩營位間隔接近宛如夜市擺攤晚上很晚隔壁包區客吵營主上前帶狗露友妥善管理跑帳位小孩寵物間衝突本來評論前往特一區期待百萬夜景營位前方大樹擋住美景推薦騰雲區,2023/11/9,0
"在B區露營，猶如於停車場般擁擠，停車位規劃不足，導致帳位與停車位融合在一起，空間十分有限。園區告示牌要求停在外圈，但A區露營客卻獲准將車輛停在附近，導致景觀變成滿目車輛，與網路照片及規劃有明顯落差。支付1,000元的費用，令人有受騙之感。希望營主能提供清楚資訊，避免造成困擾。對於消極的服務態度，深感失望。",1,1,-1,6870,,B區猶如停車場般擁擠停車位規劃導致帳位與停車位融合空間有限園區告示牌停外圈區客獲准將車輛停導致景觀滿目車輛網路照片規劃落差支付000元費用令人受騙之感希望營主能提供資訊困擾消極服務態度深感失望,2022/5/9,0
我們在第十一區的露營體驗，環境雖優美，營主人也十分親切，但野生動物太活躍，蚊蟲、小蟑螂、蚱蜢等到處跑。草地雖翠綠，但草長過於茂密，導致這些小生物叢生。廁所洗手台照明稍嫌不足，建議多裝設一盞燈。清晨施工聲響、昆蟲、鳥叫、狗吠等雜音，使睡眠品質受影響，建議攜帶耳塞。電壓不穩，吹頭髮時燈有閃爍感，需使用延長線。整體評分兩顆星，主因為環境優美、營主人親切，但蟲害過多。,2,1,-1,1781,,第十一區的體驗環境優美營主人親切野生動物太活躍蚊蟲蟑螂蚱蜢到處跑草地翠綠草長茂密導致生物叢生廁所洗手台照明稍嫌建議裝設一盞燈清晨施工聲響昆蟲鳥叫狗吠雜音睡眠品質受影響建議攜帶耳塞電壓穩吹頭髮時燈閃爍感需延長線整體評分兩顆星主因為環境優美營主人親切蟲害過多,2023/5/7,0
不建議入住客房，因隔音不佳導致睡眠困擾；露營區廁所位於戶外，吹風機不足，且使用者眾多，清潔度不佳，令體驗相當不便。,1,1,-1,6758,,建議入住客房隔音不佳導致睡眠困擾區廁所位於戶外吹風機使用者眾多清潔度不佳令體驗不便,2024/4/9,0
首先，針對晚上11點後的音量問題，營主未妥善處理，令住客難以入眠，建議營主應更加重視並約束賓客音量。然而，營區位置優越，下山採買便利，僅約15分鐘即可抵達全家便利商店。此外，營區場地寬廣且草皮保養良好，景觀優美，更擁有餐廳設施，為上層之亮點。,2,1,-1,1746,,晚上11點後的音量營主未妥善處理令住客難以入眠建議營主應重視約束賓客音量營區位置優越下山採買便利僅約15分鐘即可抵達全家便利商店營區場地寬廣草皮保養景觀優美擁有餐廳設施為上層亮點,2024/4/16,0
場地尺寸有限，道路狹窄，導致通行不便。洗手台環境凌亂，雜草叢生。可見營主未積極整理。夜晚有包區遊客喧嘩，至深夜仍未停歇，影響睡眠品質。原訂活動，如射箭、搗麻薯、竹筒飯，皆取消。在惡劣環境和缺乏娛樂下，無法吸引再訪。,1,1,-1,3595,,場地尺寸有限道路狹窄導致通行不便洗手台環境凌亂雜草叢生營主未整理夜晚包區遊客喧嘩深夜未停歇影響睡眠品質原訂活動射箭搗麻薯竹筒飯皆取消惡劣環境缺乏娛樂吸引再訪,2022/5/7,0
營主人和善，時常提醒大家有新鮮青草茶享用，草地翠綠且星空璀璨，提供美好夜晚。然則，三天內出現大量會飛的小蟑螂，令人不悅，懼怕蟲蛙的同行者無法完全放鬆。此外，食物與器具需謹慎管理，以防止蟑螂侵擾。各營地間距離較近，聲響相互影響，故需留意避免打擾他人。下方營地時有飄散令人不適的廁所氣味，雖不常且不持久，未向營主反映。交通便利，開車輕鬆無負擔，冰箱容量充足，大部分露友需求皆能滿足。惟對懼怕蟑螂者及重視隱私者，宜審慎考慮。,2,1,-1,1821,,營主人和善時常提醒新鮮青草茶享用草地翠綠星空璀璨提供美好夜晚三天會飛蟑螂令人不悅懼怕蟲蛙同行者放鬆食物器具需謹慎管理蟑螂侵擾營地間距離較近聲響相互影響故需留意打擾下方營地時有飄散令人不適廁所氣味雖不常且持久未向營主交通便利開車輕鬆負擔冰箱容量充足大部分露友需求皆惟對懼怕蟑螂重視隱私宜審慎考慮,2021/5/7,0
"寧靜處中充滿熱鬧氛圍，鄰近羅馬公路，夜晚常聽見重機或超跑聲浪。營地限制踩踏草皮，然而高空與美景未符合期待。每帳收費1,200元，評價稍高，但附近螢火蟲的自然美景值得嘉許。",2,1,-1,5534,,寧靜處中充滿熱鬧氛圍鄰近羅馬公路夜晚聽見重機超跑聲浪營地踩踏草皮高空美景未符合期待每帳收費200元評價稍高螢火蟲自然美景值得嘉許,2019/5/8,0
廁所及浴室數量不足，導致多個營區僅提供四間浴室、四間廁所共用，洗澡時間常需耐心等候，且熱水供應不穩定，溫度忽高忽低，而營主的態度則令人失望。,1,1,-1,529,,廁所浴室數量導致多個營區提供四間浴室四間廁所共用洗澡時間常需耐心等候熱水供應穩定溫度忽高忽低營主態度令人失望,2022/5/6,0
照片十分美麗，只要親臨現場即可親身感受。營區的景觀照片拍得十分動人，但設施方面，遠觀和眺望似乎較為適宜。,2,1,-1,4357,,照片美麗親臨現場即可感受營區景觀照片拍動人設施遠觀眺望為適宜,2021/4/26,0
營區是否確實宣導晚間22:00後降低音量？然而，仍出現團體於凌晨2點仍彈奏吉他並喧嘩，完全無視其他露營者的休息需求。管理措施何在？,1,1,-1,45,,營區確實宣導晚間2200降低音量團體凌晨點仍彈奏吉他並喧嘩無視休息需求管理措施何在,2023/5/6,0
露營本應帶來愉快的回憶，但由於營區停車位不足，導致我的愛車後照鏡受損，此外，水槽水管還脫落，令我不禁希望不再造訪這個營地。,1,1,-1,5454,,本應帶來愉快回憶營區停車位導致愛車照鏡受損水槽水管脫落令不禁希望造訪營地,2023/5/8,0
女用更衣室僅有五間，廁所則稍遠；提供熱水服務至凌晨十二點，然而同行友人於晚上十一點多前往已使用冷水。由於為柴燒熱水器，水溫難以保持穩定，甚至轉到最冷位置仍可能過燙。女生吹風機僅有一台，且營地區域設置略嫌狹小，帳篷間距離過於接近。此外，雖未明文規定，但工作人員卻提醒打麻將可能影響兒童觀感，要求帳篷圍布拉。飲水機僅有一台，時有缺水問題，因此強烈不推薦此營地。,1,1,-1,5243,,女更衣室僅有五間廁所稍遠提供熱水服務凌晨十二點同行友人晚上十一點多前往冷水為柴燒熱水器水溫難以保持穩定轉到冷位置過燙女生吹風機僅有一台營地區域設置略嫌狹小帳篷間距離接近雖未明文規定工作人員提醒打麻將影響兒童觀感帳篷圍布拉飲水機僅有一台時有缺水推薦營地,2023/5/8,0
衛浴未提供衛生紙、戲水池環境也不清潔。營區面積有限，無護草墊防護，且常見小蟑螂出沒。,1,1,-1,1397,,衛浴未提供衛生紙戲水池環境清潔營區面積有限無護草墊防護常見蟑螂出沒,2021/5/7,0
草長高未整理，導致割傷及吸引多蚊子、螞蟻和小黑蚊，是園區的常態。然而，遇到大雨時，最低漥的營地會淹水，泥巴水與垃圾淹沒帳篷，令人感到困擾。排水設施不明，土地吸收雨水，排水管堵塞，需等待人員處理。飲水機故障，未事先告知，需至雜貨店購買，有被剝削之感。冰箱距離營地較遠，地面不平整，護草墊破損。雖工作人員年青友善，廁所清潔，但草塞廁所問題存在。整體而言，營地品質不佳，收費1200/天，難以認同其價值。,1,1,-1,5439,,草長高未整理導致割傷吸引蚊子螞蟻小黑蚊園區常態大雨時最低漥營地淹水泥巴水垃圾淹沒帳篷令人感到困擾排水設施不明土地吸收雨水排水管堵塞需等待人員飲水機故障未事先告知需至雜貨店購買剝削之感冰箱距離營地較遠地面平整護草墊破損工作人員年青友善廁所清潔草塞廁所整體而言營地品質不佳收費1200天難以認同價值,2023/7/8,0
營主未妥善處理吵鬧客人，自中午狂歡至凌晨四點，嚴重干擾其他露營者安寧。即使接獲投訴，電話也未接聽。凌晨十二點後，仍未出面制止。營區規定禁用卡拉OK，卻未執行，導致警方前來勸導。因營主的疏忽，導致不愉快的露營經驗，不推薦此營地。,1,1,-1,5476,,營主未妥善處理吵鬧客人中午狂歡凌晨四點干擾安寧接獲投訴電話未接聽凌晨十二點未出面制止營區禁用卡拉OK未執行導致警方前來勸導因營主疏忽導致愉快經驗推薦營地,2022/5/8,0
硬體設備卓越，衛浴設施乾淨明亮。然營區內有三隻大狗狗，營主不明，於晚餐至深夜在帳蓬四周徘徊，影響日常行動，甚且於入睡時仍在附近嬉鬧，影響睡眠品質。雖非對犬隻反感，惟於用餐時影響甚大，需兼顧煮食防止犬隻偷吃。除此之外，體驗皆良好，實為值得推薦之處。,2,1,-1,5520,,硬體設備卓越衛浴設施乾淨明亮營區內有三隻狗狗營主不明晚餐深夜帳蓬四周徘徊影響日常入睡時嬉鬧影響睡眠品質雖非犬隻反感惟用餐時影響甚大需兼顧煮食犬隻偷吃體驗皆實為值得推薦處,2020/5/8,0
抵達營地準備冷藏食材時，老闆表示冰箱剛開，但已放置近一小時，溫度仍高達27度，甚至比家中冷氣還熱，導致冰塊迅速融化。晚上朋友們進浴室發現無熱水，經維修後雖恢復供熱，但僅維持初洗的兩分鐘，隨後全段冷水，令人不得不忍受寒冷完成洗澡。雖然營地風景優美，但設備明顯需要改善。,1,1,-1,6849,,抵達營地冷藏食材時老闆冰箱剛開放置近一小時溫度高達27度家中冷氣還熱導致冰塊融化晚上朋友進浴室發現熱水維修恢復供熱但僅初洗兩分鐘全段冷水令人忍受寒冷洗澡營地風景優美設備改善,2023/5/9,0
到處充斥著卡拉OK歌曲，音量調得巨大震耳欲聾，卻未見管理人員的介入，美好的景觀景致因此蒙塵，令人深表失望。,2,1,-1,6882,,充斥著卡拉OK歌曲音量調震耳欲聾未管理人員介入美好景觀景致蒙塵令人深表失望,2022/5/9,0
在營地三號區，您會發現營主非常熱情且親和力十足，但遇到了過多的會飛害蟲，如蟑螂、蛾、大螞蟻、蒼蠅和蚊子等。營區廁所氣味過重，且衛浴間稍嫌不足，照明較不明亮，而蟲類亦較為多見。營地較小，帳篷相距較近。對於懼怕飛蟲的朋友，建議審慎考慮預訂。然對不懼怕蟲類的人而言，此處仍是個不錯的選擇。因個人害怕飛蟲，此次露營充滿警戒，未得放鬆，故評為一顆星。,1,1,-1,1822,,營地三號區發現營主熱情親和力十足過多飛害蟲蟑螂蛾螞蟻蒼蠅蚊子營區廁所氣味過重衛浴間稍嫌照明明亮蟲類為營地帳篷相距較近懼怕飛蟲朋友建議審慎考慮預訂然對懼怕蟲類不錯選擇害怕飛蟲充滿警戒未得放鬆故評為一顆星,2021/5/7,0
營地排水不佳，地面不平整，草坡未妥善護草，導致積水問題，而營主的反應態度則被描述為消極。,1,1,-1,507,,營地排水不佳地面平整草坡未妥善護草導致積水營主態度描述為消極,2023/5/6,0
屋外傾盆大雨，廁所微雨相伴，營地排水系統欠佳，導致積水漫延。,1,1,-1,1396,,屋外傾盆大雨廁所微雨相伴營地排水系統欠佳導致積水漫延,2021/5/7,0
環境清幽，但小黑蚊成群，大雨無法延期，帳棚數量過多。,2,1,-1,4295,,環境清幽小黑蚊成群大雨延期帳棚數量過多,2018/5/7,0
抵達營地的路途狹窄，難以會車，令人心驚；水溫不穩，洗到一半突然變冷，導致一邊洗澡一邊發抖，感到十分不舒服。,1,1,-1,2829,,抵達營地路途狹窄難以車令人心驚水溫穩洗一半變冷導致洗澡發抖感到舒服,2019/5/7,0
經過多通電話聯繫仍未獲回應，在營區等候近半小時，熱水供暖不穩定，導致洗澡間忽冷忽熱。然而，這唯一的星等是因其他地區的設施尚可而獲得，但整體體驗仍有改善空間。,1,1,-1,6802,,通電話未獲回應營區等候半小時熱水供暖穩定導致洗澡間忽冷忽熱唯一星等地區設施尚可整體體驗改善空間,2023/5/9,0
在露營區的這段週末，硬體和景觀方面都相當良好，但營地的清潔問題令人失望。經常在帳棚區的草地上看到狗大便，使住宿期間的舒適性大打折扣。入住當天，2位同伴在帳篷附近不慎踩到糞便，導致當晚用餐失去食慾。隔天，同伴又看到遛狗的小妹妹，提醒她清理狗便，但沒多久又發現新便，只得通知營主。最後，收帳時，小妹妹又帶著多隻狗來到附近，其中一隻大黑狗便在地上，且一次就三坨。雖然露營時需要與自然共存，但營主應該要更重視旅客的住宿環境，確保其整潔。,1,1,-1,1757,,區的這段週末硬體景觀營地清潔令人失望帳棚區的草地上狗大便住宿期間舒適性大打折扣入住當天位同伴帳篷不慎踩到糞便導致當晚用餐食慾隔天同伴遛狗小妹妹提醒清理狗沒多久發現新只得通知營主收帳時小妹妹著多隻狗來到一隻黑狗地上坨時自然共存營主重視旅客住宿環境確保整潔,2023/6/7,0
請廣大露營愛好者注意，此營地入園每位遊客需支付100元，且低消額外達180元。在眾多餐廳中，此案例實屬罕見，其目的顯為賺取高額利潤。故在預訂前，請謹慎考慮此營地是否符合您的需求。,1,1,-1,4310,,請愛好者營地入園每位遊客需支付100元低消額外達180元眾多餐廳中案例實屬罕見目的顯為賺取高額利潤預訂前請謹慎營地符合需求,2015/5/7,0
營主放任自家寵物大聲吠叫，夜晚難以入眠。雖允許攜帶寵物，但每隻須支付300元清潔費用，令人難以接受。高山地區寒冷，浴室水龍頭卻忽冷忽熱，險些導致感冒。廁所及浴室環境略顯髒亂，盼營主積極改善。,2,1,-1,1906,,營主放任寵物大聲吠叫夜晚難以入眠攜帶寵物隻須支付300元清潔費用令人難以接受高山地區寒冷浴室水龍頭忽冷忽熱險些導致感冒廁所浴室環境略顯髒亂盼營主改善,2022/4/18,0
景色優美，老闆熱心，但營區環境清潔急需改善，特別是水槽和冰箱。此次入住貨櫃露營屋，一進門地板相當潮濕，詢問打掃阿姨後得知已噴灑酒精消毒水，但似乎過濕了。打掃阿姨的行為令人感到困惑，因浴室洗澡時多次遭停水，一次甚至長達2-3分鐘，在寒冷的天氣中，被停水感到相當傻眼，導致小孩大人都飽受驚嚇。,2,1,-1,5482,,景色優美老闆熱心營區環境清潔急需改善特別水槽冰箱入住貨櫃屋進門地板潮濕詢問打掃阿姨得知噴灑酒精消毒水過濕打掃阿姨行為令人感到困惑浴室洗澡時多次遭停水長達分鐘寒冷天氣中停水感到傻眼導致小孩大人飽受驚嚇,2022/5/8,0
沙坑遊戲區吸引了小朋友的目光，提供了充足的熱水和水量，使大家玩得愉快。老闆可考慮增設沙圍，以減少沙子吹入帳棚。此次住在C區後側，遇到一條死水溝，使得環境較不舒適。此外，小黑蚊數量多，露友需做好防蚊措施。希望露友共同維護營區整潔，妥善處理仙女棒廢棄物，避免危害其他露營者。老闆也應注意後續整理工作，確保安全。整體而言，露營體驗尚可，但需改善部分細節。,2,1,-1,1585,,沙坑遊戲區吸引小朋友目光提供充足熱水水量玩得愉快老闆增設沙圍減少沙子吹入帳棚住C區後側一條死水溝環境舒適小黑蚊數量露友需做好防蚊措施希望露友維護營區整潔妥善處理仙女棒廢棄物危害老闆應後續整理工作確保安全整體而言體驗尚可需改善細節,2019/5/7,0
車聲噪音嚴重影響睡眠，凌晨5點即遭驚醒無法入眠，衛浴設施不足需排隊等候，但營地主人親切有魅力。,2,1,-1,3979,,車聲噪音影響睡眠凌晨點即遭驚醒入眠衛浴設施需排隊等候營地主人親切魅力,2023/9/8,0
在60露的特殊營地中體驗到令人詫異的環境，雨棚設於營主家門口，導致隱私感不足，營主家人頻繁進出影響生活品質。雖已支付營位費用，卻因此需保留通道給營主，導致搭帳空間受限，令露營體驗大打折扣。,1,1,-1,417,,60露營地中體驗令人詫異環境雨棚設於營主家門口導致隱私感營主家人頻繁進出影響生活品質支付營位費用需保留通道給營主導致搭帳空間受限令體驗大打折扣,2024/4/3,0
帳棚過多，彼此距離過近，導致晚上因鄰居吵鬧無法獲得充分休息。環境清潔度及營主態度則獲得好評，但考量到住宿品質，可能不會再考慮造訪。,1,1,-1,5471,,帳棚過多距離過近導致晚上鄰居吵鬧休息環境清潔度及營主態度獲得好評考量住宿品質造訪,2022/5/8,0
場地雖寬闊，但F區確實令人失望。加壓機設置於附近，導致該區環境吵雜，影響睡眠品質。規劃者似乎未充分考慮露營客需求，令人遺憾。,1,1,-1,50,,場地寬闊F區確實令人失望加壓機設置於導致該區環境吵雜影響睡眠品質規劃者未充分考慮客需求令人遺憾,2023/5/6,0
疑似違法於露營區設置捕獸夾，請注意寵物安全！建議攜帶寵物前往露營的民眾應提高警覺，以保障心愛寵物免於危險。,1,1,-1,467,,疑似違法區設置捕獸夾請寵物建議攜帶寵物前往民眾應提高警覺保障心愛寵物免於危險,2024/2/6,0
茄苳D區的排水功能明顯不足，豪雨時積水氾濫，令露友不得不緊急撤帳，事後更發現其他露友也相繼撤離。營地為混合草皮與石頭地面，底層較大的石頭增加釘營困難度，遇雨情況下建議審慎評估。,1,1,-1,506,,茄苳D區的排水功能豪雨時積水氾濫令露友緊急撤帳事後發現露友相繼撤離營地為混合草皮石頭地面底層較大石頭增加釘營困難度遇雨情況建議審慎評估,2023/5/6,0
