content,rating,type,publishedDate,tokenization,sequence_num,status,origin
很近很方便很舒適的營區。設備很齊全，很適合小孩來，浴側不用等太久，老闆很貼心，晚上還帶大家去看螢火蟲,5,1,2018/05/10,,1895,1,1
營主很用心在弄更多的基礎建設，沙坑跟水池大大滿足小朋友，可惜我們這區的小黑蚊有點多,5,1,2018/05/08,,1896,1,1
老闆很用心在弄更多的基礎建設，沙坑跟水池大大滿足小朋友，我們這區的小黑蚊有點多,5,1,2018/05/08,,1897,1,1
很棒的營區。真的是很棒的營區，女兒不小心跌，老闆娘還特地去買新的擦傷藥膏跟紗布棉花棒，真是很甘心，小孩子玩樂設施也超齊全，溜滑梯，沙坑，盪鞦韆含戲水池都有，唯一的缺點是小黑蚊真的是很多，要去記得備齊防蚊器具！,5,1,2018/05/07,,1898,1,1
溫馨舒服乾淨的營地。建議洗手台能放置椅凳，方便孩子自行洗手運用，謝謝！,4,1,2018/05/06,,1899,1,1
營區到北埔老街、綠世界農場只要5分鐘，機能方便。營主很熱心、熱情，推薦給大家。。小黑蚊是我們家這次去唯一苦惱的，大家前往要記得帶蚊香、防蚊液。但營主不想用殺蟲劑，怕會影響環境與螢火蟲的生態。試看看多種些防蚊的花草是否可減少問題。很棒的營區、很棒的營主、很棒的體驗，謝謝。,5,1,2018/05/02,,1900,1,1
希望浴廁可以增加，喜歡整體環境，給第一露的我們有好的回憶，謝謝營主！！,5,1,2018/04/30,,1901,1,1
遊樂設施豐富，小朋友很開心！,5,1,2018/04/28,,1902,1,1
很棒會再來的營區。營區設施小朋友設施多，小孩玩的很開心，衛浴設備很新很乾淨，還有帶我們去看螢火蟲，很舒服的營區，會再來哦～,5,1,2018/04/22,,1903,1,1
"營位夠大,交通便利。建議B區洗手台增設夜間照明",5,1,2018/04/21,,1904,1,1
營主太感心了⋯拉了全營區的人去秘境賞螢,5,1,2018/04/21,,1905,1,1
第一次露營就遇到狂風暴雨，沒能好好體驗營區，但撇除氣候，營區條件都算不錯喔!,5,1,2018/04/16,,1906,1,1
"孩子們的遊戲天堂。1.營位超大,交通方便2.浴廁間數還OK,但洗澡時間需排隊,乾淨度OK但可再加強巡邏維持整濟3.營內的遊戲設施是孩子們的天堂4.很適合親子露營新手",5,1,2018/04/12,,1907,1,1
"服務品質OK,晚上洗菜不方便,水槽部分應增設照明",4,1,2018/04/10,,1908,1,1
非常熱心的好老闆， 第一次露的新手，遇到刮風下雨老闆幫我們做了防風防雨措施， 真的很謝謝老闆,5,1,2018/04/08,,1909,1,1
很棒的環境，很貼心的營主，排水好營区的,5,1,2018/04/07,,1910,1,1
營地很乾淨而且不會帳帳相連，小朋友活動空間很足夠 。營主人很好很和善，下次有機會會再次光臨。,5,1,2018/04/05,,1911,1,1
山景適合大人放空，沙池，球池，秋千適合小孩子遊戲。臨近老街方便外食~,5,1,2018/03/26,,1912,1,1
遊戲區很好玩。遊戲區很多設施，小水池冬天會變球池，小孩超愛的,5,1,2018/03/24,,1913,1,1
很值得推薦的親子營區。衛浴簡單乾淨營主為人客氣營位空間足夠遊戲區小人高興,5,1,2018/03/22,,1914,1,1
在叉路口處路標要設清楚一些會更好,3,1,2018/03/20,,1915,0,1
很好的營地，孩子玩的開心,5,1,2018/03/05,,1916,1,1
遊戲區很多，有沙坑，溜滑梯，還有球池真的很棒~,5,1,2018/02/25,,1917,1,1
路況好開，營主客氣，浴廁間數足夠，備有兒童遛滑梯。,4,1,2018/02/19,,1918,1,1
超棒！值得一去再去。下次找朋友來包區,5,1,2018/01/28,,1919,1,1
營位大，不會帳帳相連，有沙坑、球池、溜滑梯等等多項兒童設施，是一個小孩開心、大人放鬆的營地,4,1,2018/01/27,,1920,1,1
給了VIP位子，真的太感謝了,5,1,2018/01/27,,1921,1,1
很適合小朋友的營區。要說缺點的話就是沒雨棚，遇到下雨會不方便，小朋友玩的很盡興下次會在去,5,1,2018/01/21,,1922,1,1
感謝營主的款待，營區很乾淨，設施完備，每個露友各有自己的位子，中間還種了一排桂花，好香！,5,1,2018/01/21,,1923,1,1
小而美且親子友善的營區~。很適合小孩跑跳的營區，孩子們玩上一整天也不嫌累！營主很是熱情，有大型公用冰箱+五星級衛浴~環境舒適又乾淨，值得再訪！！,5,1,2018/01/21,,1924,1,1
營位不擁擠，衛浴乾淨沒臭味，親子設施多， 很適合有小孩的露營區！。洗手台有燈會更好！,5,1,2018/01/20,,1925,1,1
環境很好，當天露營風超大，營主半夜加強固定露友帳篷,4,1,2018/01/04,,1926,1,1
很棒 小孩玩得很開心....,5,1,2018/01/02,,1927,1,1
"老闆很用心，也很親切。謝謝老闆精心準備的跨年活動，小孩大人都玩很大，我們在A2-A6營位也很大,不擁擠，很讚的營區",5,1,2018/01/02,,1928,1,1
有機會還會再來。交通方便，離北埔老街也很近，衛浴乾淨，有冰箱可以冷凍冷藏食物，營主很親切熱情，聖誕節前夕還有安排活動，大人小朋友都玩的很開心,5,1,2017/12/29,,1929,1,1
營區小而美..有棚的沙坑、溜滑梯、球池下雨天都不怕。營區設施齊全、飲水機、冰箱、泡茶桌椅、衛浴設備乾淨舒適、營區主人一家都很熱情、親子同樂、好友團露的好營區,5,1,2017/12/18,,1930,1,1
營主熱情又熱心。我的初露獻給星院～搭帳遇到風大，營主主動來幫忙，太感動～晚上還辦聖誕節活動～熱水供應很充足，冷冷天洗熱水澡很舒服，小孩的遊樂設施很不錯耶～剛好遇到東北季風 風很大，營主還出來巡視，很大心～希望下次來是個無風無雨的好天氣～,5,1,2017/12/16,,1931,1,1
離家近，路好走，孩子玩樂的設施不少，廁所的燈用感應的還蠻不錯的。營主服務也很好喔！,5,1,2017/11/25,,1932,1,1
有沙坑、球池、鞦韆、溜滑梯，小孩玩瘋了!  浴廁又乾淨!!  超讚的～～～,5,1,2017/11/05,,1933,1,1
設施完善，老闆親切，值得再去的親子營區。新營區，裡面設施都是新的。非常試合親子遊!!帶家人來，家人都很開心。就是營位付近有些許螞蟻窩。,5,1,2017/10/31,,1934,1,1
設施完善，衛浴乾凈，值得再去的親子營區,5,1,2017/10/29,,1935,1,1
營區乾淨，風景優美.....老闆超親切友善的唷,5,1,2017/10/29,,1936,1,1
營地很乾淨，營主親切，值得推薦,5,1,2017/10/28,,1937,1,1
"超棒的營區! 超好的營主! 有機會一定會再去!。環境舒適, 浴廁乾淨, 出發前一週詢問天氣等事項也都能得到迅速的回應!昨晚小孩有點發燒, 營主馬上去幫忙買了退熱貼 退燒藥 並借我耳溫槍, 就感心",5,1,2017/10/22,,1938,1,1
交通便利，遊樂設施小朋友很愛!。營區的公共照明，建議9點以後就能關閉，尤其是景觀區那兩盞燈，光害特別嚴重，用手擋燈光，這樣看滿天星一點都不浪漫，除了這點，基本上這個營區其他部分我都很喜歡，已經收入口袋名單!,5,1,2017/10/22,,1939,1,1
很棒的營區，維持的很乾淨，親切的服務。真的很適合親子遊!!,5,1,2017/10/12,,1940,1,1
服務很好~ 報到前一日，還來電貼心提醒氣候狀況!!,5,1,2017/10/11,,1941,1,1
好適合小孩放電的地方，廁所也超乾淨的,5,1,2017/10/07,,1942,1,1
不要刻意區隔每個營位會更好,5,1,2017/09/29,,1943,1,1
浴室廁所分離，每帳應有適當距離。。整體而言還不錯，但是希望浴室廁所分離(營區有些是浴廁分離，有些是合在一起)，每一帳的空間約有6*9公尺這麼大，但是其實這包含停車位，建議每一帳應該至少間隔2公尺，避免太過擁擠，希望營區能禁菸。編輯,5,1,2017/09/25,,1944,1,1
浴室廁所分離，每帳應有適當距離。。整體而言還不錯，但是希望浴室廁所分離(營區有些是浴廁分離，有些是合在一起)，每一帳的空間約有6*9公尺這麼大，但是其實這包含停車位，建議每一帳應該至少間隔2公尺，避免太過擁擠，希望營區能禁菸。,5,1,2017/09/25,,1945,1,1
很棒的營區，很用心的營主。浴廁過少，洗澡時很不方便。,5,1,2017/09/23,,1946,1,1
還不錯新營地 交通蠻方便 營主蠻親切,5,1,2017/09/16,,1947,1,1
～2024/4/3-4/5三天兩夜跟朋友的露營～️帳篷：Coleman TOUGH SCREEN 2-ROOM HOUSE MDX入住營位數：A區草皮區->1帳位整體體驗很棒很喜歡營主也很和善～整個營區都很舒適，熱水穩定水壓也很強而且還有營主熬的薑茶但唯一美中不足的地方是4號晚上一場大暴雨，我們的營位有積水結果造成了內帳整個濕透雖然不是營主的問題，但希望各位露友之後有要在A區搭帳的話可能要稍微看一下地勢～,5,1,2024/05/03,,1948,1,1
很喜歡這裡我家小狗子也很喜歡但是廁所中間那件沒熱水 但沒標示差點冷鼠飲水機只有營本部有 有點不方便 …,5,1,2024/04/23,,1949,1,1
先說最大的缺點，晚上11點後，營主完全不管制音量，絕對是吵到睡不著。強烈建議營主可以有所行動，讓露營品質更好、吸引更多優質露友。除此之外，露營區地點不錯，離下山採購點的距離也不遠，大約15分鐘就有一間全家。場地很大、草皮養護得非常好，景觀也算美，最上層還有餐廳。 …,2,1,2024/04/16,,1950,-1,1
五星大滿分營區！放入二訪名單！山路全程兩線道，山下補給也方便！洗手間熱水、水壓都相當足夠～景觀餐廳餐點價格合理，美味風景無限極美，營地範圍廣，唯一要注意的是各區如果收滿帳的話，可能會有點太擠唯一缺點是草地1、3號距離實在太近，彼此連講話聲音都會聽到在意的人請避開5號9號10號A區草地、B區棧板都不錯！下次來會帶朋友一起～,5,1,2024/03/07,,1951,1,1
這次第一次獨露、選擇2號草地1帳包區、營區滿大的、每區都是獨立的區域、路況好雙線道適合新手、營區上方有餐廳、不想煮可以來這吃。唯一不滿意的是營主晚上11點過都不管的,4,1,2024/02/07,,1952,1,1
這次露營我們選擇星期五夜衝，說明事項中是六點才能入場，冬季的六點天色全黑，搭帳上有些不便。我們訂的是A區一帳，但因為營地要維護草皮所以車輛不能開進去，我們是車頂帳又一定得直接在營位開帳，營主立刻帶我們去別區解決了這個問題。我們這區的衛浴很棒，浴室跟廁所分開，浴室跟廁所很乾淨，熱水很熱洗起來很舒服。星期六寒流來襲，營主還煮了薑湯請大家喝。我的瓦斯快用完，營主還記得我的詢問買來了瓦斯罐。我放冰箱的食材被他人錯拿，營地妹妹幫我問了好幾個營位找到了我的食材，服務上真的一級棒！營區門口出去往右走約莫半小時有個小市集，各類蔬菜跟客家食材很好買。關刀山步道也在這可以走走。美中不足的是星期五晚上有二大團體喧囂到至少凌晨兩點，半夜還放超大聲的動滋音樂。後來詢問得知星期五晚上沒有宵禁，星期六則是10點後宵禁，所以要星期五夜衝的要有心理準備！,4,1,2024/01/07,,1953,1,1
地點好，但路邊的比較吵。,4,1,2023/12/07,,1954,1,1
營區很讚營主超熱情餐廳好吃到爆 …,5,1,2023/12/07,,1955,1,1
可以帶小孩來這邊露營️,5,1,2023/11/07,,1956,1,1
營區擁擠，隔壁區超級吵營區內路狹窄，車子底盤刮傷了,3,1,2023/11/07,,1957,0,1
營主很熱情，風景超好，很舒服,5,1,2023/10/07,,1958,1,1
營主好客熱情，草地很蓬鬆，由於營主不灑殺蟲劑，營地的生態很豐富！E區的浴廁，燈有不足，水壓偏低，需用水桶接水洗澡！,5,1,2023/07/07,,1959,1,1
"營地很漂亮 草地顧得很好 廁所也很乾淨 因為燈條臨時壞掉 營主還借了我們燈串 人非常nice 唯一最大且不能接受的點就是 ""狗大便""搭天募的時候 踩到營地旁的狗大便 因為不知道是誰的狗就算了 但從此覺得大便味無處不在 隔天早餐時兩個小妹妹帶了四隻大狗散步 剛好在我正前方大便 我請她們要記得回來清 回答好以後就走了 再也沒回來清 電話告知營主後我們就幫忙先清了 免得有哪個可憐的傢伙不小心踩到 結果撤帳時 狗狗又跑來 這次是直接在棧板旁炊事空間上拉了一大坨 兩個小妹妹就在旁邊 完全沒有要清理的意思 對此 非常失望 場地再好 營主再好 真的抵不過露營兩天被大便味繚繞的噁心感 望營主能重視這個問題(那四隻大狗是營主的狗狗)",1,1,2023/06/07,,1960,-1,1
這個週末在該區露營，硬體設施跟景觀都沒有問題。惟帳棚區草地附近常見狗大便。入住第一天2名同伴就在帳篷旁的草地踩到大便，讓當晚的晚餐進食不是很舒適。隔天早晨同伴撞見遛狗小妹妹，告知要清好狗便，但仍沒處理，只好通知營主，結果收帳時小妹妹又帶了幾條狗來我們帳篷附近，其中一隻大黑狗跑到我們帳篷旁的草地大便，還一次大三坨，小妹妹仍舊視若無睹的走了。雖然說露營要與自然共存，狗狗大便也是無可厚非，但營主是否該至少維持旅客住宿的環境清潔?,1,1,2023/06/07,,1961,-1,1
很棒的露營區，可以洗澡，水龍頭也很近，插座也很足，場地乾淨風景優美,5,1,2023/05/07,,1964,1,1
大年初二四人房沒有漲價2500元……超值有電視電暖爐乾濕分離衛浴設備寵物友善非常美好的住宿回憶營主親切對房客問題回應迅速附近薑麻園農場吃喝玩樂方便推薦一下會二訪,5,1,2023/05/07,,1965,1,1
給5顆星++的營主～這裡的營主波棒的，一路都笑臉迎人。剛到營地跟營主說哇～電源好遠唷！（離150公尺遠）營主一聽，我馬上想辦法，然後就拿來了延長線￼和燈條，當下好感度++。￼傍晚洗菜，下著微微細雨，然後營主巡邏，我又牢騷，啊，怎麼辦一隻手要洗菜，一隻手要撐傘～練功夫耶！營主一聽，我馬上想辦法，然後搭了遮雨帆布。晚上洗碗，我說完蛋了，暗摸摸的看不到碗盤洗得乾淨、洗不乾淨，咋辦？營主一聽，等我一下。然後5分鐘過後，然後洗手台很完美的多了燈條，最後形成我家阿萍說的我很難搞的美麗畫面。不得不說這裡的營主有求必應的，一一解決問題，實在是太感動了，難怪評價超級高，連我都想給5顆星++了。我家阿萍說我很難搞、很囉說，但這不是營地的基本需求嗎？感謝～營主為我們創造美麗的回憶。,5,1,2023/05/07,,1966,1,1
第一次露營～來到了景庭一入園會有狗狗聲音熱情迎接（怕狗的可能會小緊張園區到處都是桂花香！超愛的我們租的是D區離廁所冰箱都很近但廁所環境衛生比較偏老舊 不能接受的可以選其他位子整體下來還是蠻舒服的 老闆也很熱情還有泡薑茶～,5,1,2023/05/07,,1968,1,1
第一次來訪，園區很大營地也分很多區域，運用山坡地勢錯開各區營位真的很不錯，且每個營位空間都很大，不會太壅擠。原本想要選單獨一個營位的1號或2號草地，結果都被訂走了，只好選了A區大草皮，沒想到草皮空間很大，視野也很棒，也算是選對了；若再有機會來訪，會想再訂訂看1.2號小營位，體驗小小包區的可愛感。,5,1,2023/05/07,,1969,1,1
第二次來景庭營區，老闆非常熱心！有問題都會立刻處理，感謝老闆228連假願意趕工把營地整理好收留我們，晚上還特別下山去買設備趕工安裝好給我們，真的很讚！！下次還會再來露營～環境乾淨，場地很大，熱水穩定，另外希望浴室的照明設備可以改善，有點太暗了,5,1,2023/05/07,,1970,1,1
228連假訂到F區，這次是夜衝路上剛好會遇到廣勝老街，是週五會有的小夜市剛好吃晚餐後上山，到營區的路好開沒有遇到起霧，但到營區遇到起霧，整體營區算舒適沒有貓狗出沒也沒有蚊蟲，可能剛好遇到寒流最冷的2天，哈！還有重要的衛浴空間乾淨是乾濕分開的一區都有設置，營區很貼心有很多區塊有小包區的安排，只是大多都是細長形的空間有好有壞，露友可在自行評估選訂，還有營主團隊人都很好，夜衝還可以接到凌晨！問後才知道他們主在哪裡。但營區沒有特別管制晚上的宵禁，所以也建議還是帶一下耳塞才好入睡。,4,1,2023/05/07,,1971,1,1
環境優美 營主很用心維護 天氣很冷還貼心煮薑茶請大家喝 ，228連假還能找到那麼棒的營地真是幸運,5,1,2023/05/07,,1972,1,1
冬天露營竟是爽，蟲偏少！,5,1,2023/05/07,,1973,1,1
規劃太多帳了 好像隔間的分租套房 帳搭滿的話都沒有活動空間了 浴廁還挺乾淨的 但數量上以比例來說也有點少間,3,1,2023/05/07,,1974,0,1
初四來這邊老闆人nice環境很美,5,1,2023/05/07,,1975,1,1
營主人超好～^ ^走過路過總是都笑臉迎人還有提供薑茶在冷冷的天喝上一杯超暖身營區位置的風景也不賴 …,5,1,2023/05/07,,1976,1,1
營主很有禮貌，服務態度很好，草皮去有狗大便，要留意,5,1,2023/05/07,,1977,1,1
夜晚星星超級多，營區很乾淨很美，營主爸爸還會煮很多薑茶給露友喝營區有四隻很壯的狗狗，超級帥氣！！！米漿最帥！！！！！唯一小小缺點是廁所有點不足，不過很乾淨,5,1,2023/05/07,,1978,1,1
優點:1.離三義市區近 車程15-20分缺點:1.營區在山路旁，早上半夜有人跑山真的很擾人2.整個營區約5-6層區域，30-40帳空間只有入口營本部有冰    箱，有比要省成這樣嗎嗎?夏天拿個東西真的會很不爽3.某幾層的營位太短或太窄，搭了帳又要山景前放客廳天幕根本不可能，甚至後面也沒位置可以通行，建議營主不要為了賺錢排得太擠4.營主還有種橘子，1-5沒人來露營怎麼不修剪樹枝，偏偏要在六日修剪，發動機油煙味跟噪音真的不堪其擾,1,1,2023/05/07,,1980,-1,1
"曾經是親切舒適的休閒場所…但隨著野心越來越大，忘了當初讓人喜歡的因子......入場收100,不是很多，但卻逐漸疏遠與旅客的距離了......",2,1,2023/05/07,,1981,-1,1
位在130縣道旁，引擎層在所難免園內生態豐富冰箱就一台商用四門跟家用小雙門營區內還有飲水機跟販賣部,4,1,2023/05/07,,1982,1,1
此營區很好到，路都很大條，沒有會車困擾這次去的是9號草地~ 到9號草地有兩個轉彎處，第二個轉彎處需要彎大一點才不會卡到旁邊。浴廁很乾淨~ 營本部離9號草地有點遠 要走一段路才可以拿東西去冰，不過還好有帶冰桶，所以沒有造成困擾。9號草地很適合跟朋友一群人來，比較有隱密性，也不用怕吵到其他露友。雖然沒有甚麼大景可以看，但是跟朋友聚在舒服的營地還是很開心><,4,1,2023/05/07,,1983,1,1
風景優美，營主熱情，小孩玩到捨不得離開，離開前要跟狗狗們拍照,5,1,2023/05/07,,1984,1,1
環境優美 空氣品質很好 每次去都能好好放鬆心情 平時的疲勞感都沒了！,5,1,2023/05/07,,1985,1,1
蟲子超多，水忽冷忽熱，營主有很多狗會一直吠，廁所偏少需要排隊,2,1,2023/05/07,,1986,-1,1
離市區近 優質草地唯獨排水可能需要加強,4,1,2023/05/07,,1988,1,1
營地很ＯＫ，但５帳共用２處電箱及洗菜枱，不夠用。另廁所浴室ＯＫ，但屋頂為透光罩，夏天在裡面，很像＜烤箱＞太熱了。廁所前洗手枱只有１個小小的，不好用又不足夠。,3,1,2023/05/07,,1989,0,1
我們這次露營是訂第九區，環境很美，營主也整理的很乾淨，營主一家笑臉迎人，人超好的，但是生態太豐富蟲太多，有看藍鵲也有被他的尾巴掃到，很多會飛的小蟑螂、蚱蜢，草地很美但草太高了，導致很多蟲，建議廁所的洗手台可以多安裝一盞燈，早上有一些施工聲、很大聲的蟲聲、鳥聲、狗叫聲，比較淺眠的人要記得戴耳塞喔~電壓的部分吹頭髮會閃燈沒有很穩的感覺，腹地蠻大的要記得帶長一點的延長線，以上純個人體驗，怕蟲的人比較不建議。兩顆星給環境太美、營主人很好,2,1,2023/05/07,,1990,-1,1
草雖厚但排水不良，滿腳泥濘！戶外本就昆蟲飛跳，但一直有蟑螂出沒上桌下竄的，這個太超過！養狗就顧好，對著客人呲牙咧嘴的亂吼亂叫，若小孩嚇到逃跑跌倒，要算誰的？這種體驗一次就夠，謝謝.,1,1,2023/05/07,,1991,-1,1
營地花草有維護很不錯我們租到的是「沒有」木棧板的營地因為是下超級大雨，營地整個大泥濘整個帳棚區都在泥水中⋯24小時內腳沒有一下是乾的⋯然後更崩潰的是滿滿的小蟑螂（還是會飛的）內帳外帳都是蟑螂附著在棚上帳篷也因為泥水全毀了⋯環境植物優美給場主*2顆星因為我們也沒有像上述評論有什麼服務之類的就門開放收完費放我們進來場地泥濘—2顆星滿滿的小蟑螂-2顆星場地租借費用-0.5顆星（如果這種環境跟天氣酌收700～800可以，1000並沒有那種CP值）總而言之若是下雨天非常不推薦來如果是沒有租到木棧板區會有很多蟑螂也不推薦綜合指數1.5顆星（以上純為個人體驗，與商家無關）,2,1,2023/05/07,,1992,-1,1
營地整理維持得很好，草皮區平整漂亮，浴廁整潔，營主和善。晚上會有狗來翻垃圾桶和食物，記得要收好。雖然階梯式分區但其實距離都很近，連續兩晚都有別區的人聊天播音樂到半夜兩點，可以清楚聽到說話內容，睡覺需要耳塞。,4,1,2023/05/07,,1993,1,1
整體體驗很好，營主也很好,5,1,2022/05/07,,1994,1,1
不推薦，老闆不是很友善，有寵物的人，真的要考慮，打電話問是否可帶寵物，沒說，到了現場直接收300元，浴室廁所有點髒亂，浴室水龍頭忽冷忽熱，在浴室洗澡還可以聞到廁所味，真的很不ok,1,1,2022/05/07,,1995,-1,1
營地各區腹地都不大，所幸平常日只有一車才不會感到擁擠，唯一的夕陽風景的方向多會被樹木遮擋到，最上層營位剛好緊臨馬路會有點吵，環境整理算蠻乾淨的！比較不好的感受是，入住時講好車泊無折扣，同樣依露營原價收費，ok！但隔天拔營前卻又來告知露營車不能用電，插電需要另外加價！？！？  付一樣費用，露營可用電，車泊就不能用電？？？看來營主對車宿車泊較不友善，車泊車宿的同好若有需入園住宿的請自行斟酌三思……,3,1,2022/05/07,,1996,0,1
蚊子超級無敵多！另外營區提供的冰箱異味重冷度也不夠，保冷磚放一個晚上了還無法結冰。,2,1,2022/05/07,,1997,-1,1
可以小包區，私人空間隱密營區無噴殺蟲劑，蚊蟲會比較多,5,1,2022/05/07,,1998,1,1
風光明媚的露營區，適合微醺耶,5,1,2022/05/07,,1999,1,1
場地空間很大，廁所也很乾淨！還有可愛的小三花 …,4,1,2022/05/07,,2000,1,1
整個營區環境不錯，這次訂到棧板區，規劃很不錯每個營位棧板都是各自獨立的，不會互相干擾，營主是當地客家人，熱情親切還免費提供橄欖茶讓客人飲用，唯一美中不足的是洗菜台是共用（約2-3帳）及洗澡熱水忽冷忽熱需要用桶子裝，其他的都很好價錢也合理。,4,1,2022/05/07,,2001,1,1
營主人很好，運氣很好遇到了雲瀑,4,1,2022/05/07,,2002,1,1
場地乾淨漂亮，營主熱情，有冷藏冷凍飲水機，交通方便,5,1,2022/05/07,,2003,1,1
整體環境不錯  沒有甚麼值得挑剔的  應有盡有唯一不能接受是 2021/11/20(六) 露營時  有一區超過 10 點後還在放音樂喧嘩打電話給老闆  老闆也只說了有反應請他們小聲喧嘩持續到 23:30  造成睡眠困擾若不是這點  整體評價是可以給四個星~,2,1,2022/05/07,,2004,-1,1
我請朋友載我來跟家人露營，雖然朋友是訪客，但不到一小時，一人還是要收100元，我沒有被收100，因為我是要一起露營的人，那如果是一起露營的就不用嗎？那早知道就說要一起露營的就好，不是說不能收，而是100真的有點偏多，建議可以用時間收費，入場一小時內免收，入場超過一小時收50、超過兩小時以上100，一人收100為限…..而不是司機載我們來了進去喝一杯茶也要收100…,3,1,2022/05/07,,2005,0,1
這次露營場地是G1棧板區，營地寬敞漂亮，,5,1,2022/05/07,,2006,1,1
營主太熱情！會帶著狗來「關心大家」順便讓狗大便，（可能是來關心人數與帳篷數）,1,1,2022/05/07,,2008,-1,1
老闆人很好 自然生態很豐富 有簡約式自助商店 場地也很豐富 但有些區域樹蔭比較少 如果怕曬的建議準備天幕 可攜帶防蚊液,5,1,2022/05/07,,2009,1,1
環境還不錯，走上去遼望台約30分可看360°風景。營地探班每人100元，最上面靠路邊的營地是磚地不好下釘。,3,1,2022/05/07,,2010,0,1
好山好水好老闆完善規劃路線跟帳位天然好空氣真舒服這個好營地，很值得在跟好友或單飛喔！ …,5,1,2021/05/07,,2011,1,1
很舒服的營地，營主很熱心煮好喝的橄欖薑湯，廁所也維持很乾淨，小孩也有場地可以跑！推薦看得出來營主很用心的維持這個營地！常常看見他騎著機車的身影穿梭在各個區域,5,1,2021/05/07,,2012,1,1
