content,rating,type,publishedDate,tokenization,sequence_num,status,origin
不錯。除了路有點難開其他的都不錯衛浴環境都很乾淨下次會在去,5,1,2018/02/20,,5676,1,1
視野超佳，環境用心整理，值得再來。,4,1,2018/02/19,,5677,1,1
這是我們最滿意最喜歡的景觀露營區，有雲海，有櫻花，營位又超大ヾ(*´∀｀*)ﾉ,5,1,2018/02/19,,5678,1,1
到營區的路況真的蠻差的，讓人坐的心驚驚，如能改善會更好。營主如能駐點在營區比較好預到事情才能找到人商量。,4,1,2018/02/19,,5679,1,1
景色優美。美中不足的就是前往營地的道路狹隘但就是因為這樣才能看到美景冬天很值得來看雲海，很美。,5,1,2018/02/14,,5680,1,1
感受得到營主的用心經營，乾淨的廁所隨時備有廁紙。壯闊翻騰的雲海，讓我們為之驚嘆，簡直就是仙境啊!,5,1,2018/01/28,,5681,1,1
營主熱情，服務又好。環境好，草地寬敞。還會想再去露的營地。。快到營地的指標希望可以再清楚一些，因為路小，第一次去會以為走錯了呢。,5,1,2018/01/23,,5682,1,1
營主親善，環境優美，路況欠佳。產業道路希望能再整修,5,1,2018/01/15,,5683,1,1
浴廁很乾淨，風景好，將近180度無電線（桿）純山景。,5,1,2018/01/15,,5684,1,1
營主人很好，年輕又帥，營位夠大，風景超讚,5,1,2018/01/15,,5685,1,1
老闆人非常Nice，營位空間相當足夠，風景超讚。,5,1,2018/01/15,,5686,1,1
營主人很好，廁所常清潔的乾淨。上山的路有點可怕，希望能將顛簸的路面修好,5,1,2018/01/15,,5687,1,1
衛浴很大廁所很乾淨。很不錯的營地週邊也能走晃環境清憂營主也親切,4,1,2018/01/02,,5688,1,1
覺得公共設施很乾淨，希望營地能有棧板。,5,1,2018/01/02,,5689,1,1
超棒營區，雲海滿山谷，衛浴乾淨，營主很熱情,5,1,2017/12/31,,5690,1,1
營主用心管理營地，空間也很舒適，值得推薦大家來感受。,5,1,2017/12/25,,5691,1,1
沿路有些路段路比較差(底盤低的要注意)，視野很好，廁所很乾淨都有在清潔及補給,5,1,2017/12/25,,5692,1,1
營主客氣 場地寬敞 讓人放鬆的好地方,5,1,2017/12/24,,5693,1,1
不錯。希望有Wifi功能,4,1,2017/12/24,,5694,1,1
不錯的營區  可惜這次的霧太重了 沒看到好的風景,5,1,2017/12/18,,5695,1,1
"白天有雲海,晚上有夜景。反應隔壁區23:00還在大聲喧嘩營主有處理,態度很好,感覺有誠意",4,1,2017/12/15,,5696,1,1
"竹林很美,雲海更美。如果有飲水機的話,會更方便",4,1,2017/12/15,,5697,1,1
"山路不好走,但是雲海很美。浴室偏小,幫小孩洗澡比較壅擠",4,1,2017/12/15,,5698,1,1
風景優美，有草地給小孩奔跑玩遊戲,4,1,2017/12/13,,5699,1,1
當踏上營區的那刻，煩悶，塵霾，一切的一切，在這一刻煙消雲散,5,1,2017/12/05,,5700,1,1
路稍差，標示也還可以，但在到達的那一刻，抱怨已昇華，值得，值得，太值得,5,1,2017/12/05,,5701,1,1
很舒服的營區！有機會會再去,4,1,2017/11/29,,5702,1,1
位置很大  不會很小  風景超讚  比烏嘎彥好  建議可以增加沙坑或戲水池或其他遊樂設施,5,1,2017/11/26,,5703,1,1
風景好，視野棒，夜景優美，衛浴乾淨，烏嘎彥竹林步道是闔家出遊的好地方。,4,1,2017/11/26,,5704,1,1
很清幽的地方。建議收費時順便對所有營友提醒，晚上十點之後就要降低說話音量，以不干擾到鄰居睡覺為原則。我們可以選擇好營地，更希望遇到好鄰居。,5,1,2017/11/20,,5705,1,1
營地很寬闊，活動空間大，浴廁五星級,4,1,2017/11/19,,5706,1,1
營區和廁所都很乾淨，老闆很親切～,4,1,2017/11/12,,5707,1,1
風景優美，營主服務態度極佳。產業道路盼能改進,5,1,2017/11/06,,5708,1,1
喜歡安靜與美景的人，很適合藍天嶺露營,5,1,2017/11/06,,5709,1,1
景觀單純的美草地浴廁舒適。喜歡一區面前單純山景黃昏夕陽及夜景的寧靜，分小區適合單獨及小型團露，每區有獨立乾淨廁所，浴室大水壓穩定熱水大而熱，草地舒適而大，真的是一次享受滿分的露營。可眺望鷂婆山，附近還有竹林步道喔！加分。,4,1,2017/11/05,,5710,1,1
風景美，草皮優， 空間給的很大方,5,1,2017/11/05,,5711,1,1
感謝營主熱心助人。同露露友臨時身體不舒服四肢無力，臉色發白還上吐下瀉，半夜親切的營主還開車送急診，診完送回營區。真的十分感謝！,4,1,2017/11/05,,5712,1,1
雨天須注意營地前的陡坡,5,1,2017/11/03,,5713,1,1
風景優美，營主態度極佳,5,1,2017/11/01,,5714,1,1
"營主服務好。廁所浴室乾淨但數量少集中需要排隊等,建議增加場地大不超收優進來的路太小難夜衝要想辦法改善",3,1,2017/10/23,,5715,0,1
環境優美的地方。建議道路指示牌要再增加,5,1,2017/10/22,,5716,1,1
營區很乾淨舒適衛浴設備很乾淨很棒,4,1,2017/10/22,,5717,1,1
營主親切，衛浴清潔，營位寬敞。,4,1,2017/10/22,,5718,1,1
三不五時就尋廁所，非常乾淨！,5,1,2017/10/22,,5719,1,1
營區乾淨、帳位規劃大、營主服務佳,5,1,2017/10/13,,5720,1,1
環境清幽，設備充裕，希望廢水不要直接排到草地上影響到大地,4,1,2017/10/08,,5721,1,1
小區包場很棒，草皮很漂亮，視野遼闊，會再去。,5,1,2017/10/05,,5722,1,1
"營區景觀佳視野好,衛浴也都很乾淨,建議屋簷再加大一些,不然下雨時洗完澡出來又立馬被雨淋辣,謝謝^^",4,1,2017/09/26,,5723,1,1
風景很美、洗手台很多很方便、盥洗間很乾淨。藍天嶺的指示牌太少了，隔很長一段距離才有一個，甚至看不到藍天嶺，只看到烏嘎彥或鑽石林，會讓人走錯路或不知道該向左向右，那天晚上開車就是越走越偏僻，路越來越窄，希望可以在路上的電線桿上多貼一些藍天嶺的標示，會比較好找。,4,1,2017/09/26,,5724,1,1
營區真的好棒，廁所衛浴設備都很乾淨，對有帶小小孩的我們，真的很方便，感謝！,5,1,2017/09/26,,5725,1,1
很乾淨的營區且沒有超收的問題，最重要的是沒有小黑蚊跟蚊子，風景也好美跟營主反應問題也馬上得到解決超讚。孔雀區的缺點就是要去別區跟人家搶浴室，但視野很不錯,5,1,2017/09/24,,5726,1,1
第一次的草皮露營，感覺良好，是個好營地，營長也很熱心。,4,1,2017/09/24,,5727,1,1
空氣好，鄰居電音派對，少了夜裡寧靜,5,1,2017/09/09,,5728,1,1
營區的景不錯，營主也很熱心，衛浴也很乾淨，建議衛浴外面的雨遮要再凸出來一些，因為下雨時會被噴到雨呦！,5,1,2017/09/04,,5729,1,1
草皮很讚，風景很優，營位很大,5,1,2017/08/28,,5730,1,1
夏天避暑的好營地，天氣涼爽,5,1,2017/08/27,,5731,1,1
衛浴廁所設備超整潔，草地空間寬闊，只是低底盤車輛要小心慢開,5,1,2017/08/27,,5732,1,1
草皮很優，皆可赤腳享受大自然，讚。,5,1,2017/08/20,,5733,1,1
很舒服的地方，風景超美，浴廁超乾淨,5,1,2017/08/13,,5734,1,1
很放鬆，設備新穎，夏天的避暑好選責.。洗手台旁如能增設個置放平台更佳.,4,1,2017/08/09,,5735,1,1
草地漂亮風景優美竹林步道讚避暑的好營區,5,1,2017/08/08,,5736,1,1
除了路況差了點，其他都還不錯。,4,1,2017/08/07,,5737,1,1
空氣好，風景美，會車難。改善前往道路,5,1,2017/08/07,,5738,1,1
老闆用心是個很棒的營區。,5,1,2017/08/07,,5739,1,1
草地維護的很好 孩子有遊戲空間 浴室 廁所乾淨。浴室少了點,5,1,2017/08/07,,5740,1,1
道路難走 風景優美。道路有點難走，指標也不是非常清楚，但風景優美，晚上有很多星星，營地也算大，另外還有提供吹風機,5,1,2017/07/27,,5741,1,1
勢必再訪！。到營區的路算好走（按照路標尋找）。衛浴設備很不錯，唯獨洗澡得走一段上坡（山豬區）。風景不錯運氣好看到夕陽與彩虹。這營區推薦 ！,5,1,2017/07/27,,5742,1,1
景色優美。這個營區景色非常漂亮~衛浴跟廁所都非常乾淨! 層層分區有獨立空間跟廁所! 適合2帳或3帳搭帳的露友前往。不過唯獨一個很大的缺點就是道路非常小條，會車非常不方便，有的地面還未整好甚至是泥濘道路，覺得有點遺憾了。,5,1,2017/07/24,,5743,1,1
很棒的營區，一層一層的分區超讚的^^。很好的初露體驗，傍晚還看到夕陽，相當超值的一晚，建議可購入大台一點的冰箱，好方便營友使用，謝謝^^,5,1,2017/07/23,,5744,1,1
廁所可再增加。因為是夏天，到了傍晚有很多蚊子，但夕陽很美，草皮也保養得不錯，離洗手台近，很方便。快到達時的路小了點,5,1,2017/07/23,,5745,1,1
非常乾淨、整期、客氣的營主，會再度光臨及推薦的好營地,5,1,2017/07/23,,5746,1,1
很滿意的營地 道路是個小小缺點,5,1,2017/07/17,,5747,1,1
視野遼闊，風景優美。產業道路狹窄陡峭，路面顛簸極具危險，建議道路能再整修。,4,1,2017/07/16,,5748,1,1
環境優美！。★衛浴間略少！★冷凍冷藏設備，是否應設立集中在，各區較方便寄放食材的地點？謝謝…,5,1,2017/07/16,,5749,1,1
景色優美，服務好，設備好。1.交通不便，路寬只有一台車。2.路線標示不明，太少。,4,1,2017/07/16,,5750,1,1
夏日避暑好營地。來的路上有點驚險，但到了之後覺得冒險的的路程都值得了，下午三點就慢慢飄霧，晚上滿天的星斗，很舒緩的環境！,4,1,2017/07/15,,5751,1,1
來的道路有點糟糕 希望能改善 不過景觀跟設施都很讚! 值得推薦,5,1,2017/07/15,,5752,1,1
風景好，營主親切，草地寬敞，不錯的營地,5,1,2017/07/04,,5753,1,1
值得推薦的露營場地。老闆親切，設施完備，景觀佳（夜有星空、日有雲海）唯山羊區女廁過小。下次必再來！！,4,1,2017/07/02,,5754,1,1
草地養的很好，蟲很少，非常適合夏天上來避暑~。浴室建議增設掛勾,5,1,2017/06/28,,5755,1,1
值得再訪的營區。我露山羌區，薦議每帳的營位需做區隔。才能都享有好的視野。謝謝。,5,1,2017/06/26,,5756,1,1
服務很不錯，場地用心整理。,4,1,2017/06/26,,5757,1,1
這裡風景美環境優，衛浴乾淨，營主人很nice又帥喔~,5,1,2017/06/26,,5758,1,1
"非常棒的營地, 乾淨舒適, 非常涼爽",5,1,2017/06/26,,5759,1,1
超讚的營區！下次還要再來～。產業道路如果能再整理好一點會更好！,5,1,2017/06/13,,5760,1,1
營主態度非常讚，值得再去一次的營區喔！,5,1,2017/06/11,,5761,1,1
謝謝泰雅族，希望您們族人永續經營，讓我們向您們學習，疼惜這片美麗山林。這就是五顆星，其他不重要！,5,1,2017/05/31,,5762,1,1
風景超美，老闆人很好。,4,1,2017/05/23,,5763,1,1
風景美，每帳空間都很大，還提供冰東西服務，讚！,5,1,2017/05/21,,5764,1,1
洗手台的水直接流下斜坡，在下面覺得怪怪的⋯,5,1,2017/05/21,,5765,1,1
導引到園區的指示貼紙要再多增加一些，不然很容易找不到！,5,1,2017/05/08,,5766,1,1
快到達目的地時的指標要再清楚，這樣才不會走錯路,5,1,2017/05/06,,5767,1,1
你們的親切態度一定會吸引更多的人來遊玩的。上山時有些許路段指示不是很清楚，但營主親切的態度和乾淨的衛浴環境還有嗎美麗的風景，讓人有下次想再帶孩子們來這裡的想法，加油營主們,5,1,2017/05/06,,5768,1,1
風景美，草坪與設施都不錯，加上營主很熱心，有時間會再去。,5,1,2017/05/01,,5769,1,1
路標不明．去難找．回．迷路了．繞了一大圈。路標不明．去難找．回．迷路了．繞了一大圈,5,1,2017/05/01,,5770,1,1
路小會車不易，有管控通知上山會更好。樹立牌子導覽簡介會更好,5,1,2017/05/01,,5771,1,1
除了交通較不便以外，環境整理得不錯，也有很好的服務～下次有機會會再來～～,5,1,2017/04/30,,5772,1,1
雲海、竹林.....風景美如畫!,4,1,2017/04/23,,5773,1,1
"很棒的草皮,營主很NICE,每一區的區格能有效幫忙我們這種大嗓門的",4,1,2017/04/17,,5774,1,1
營區不錯！但要進營區的道路實在不ok。還有進步了的空間！但年輕營主蠻熱心的不錯,4,1,2017/04/16,,5775,1,1
營區指示標誌延路應多設立，開車到一半不知如何進入營區,5,1,2017/04/11,,5776,1,1
設備服務好，會讓我想再去，可惜上山的路難走了點！底盤低的要小心,5,1,2017/04/10,,5777,1,1
景觀很棒，搭帳的空間很足夠，小朋友活動空間很充足，會想再造訪的營區。,5,1,2017/04/06,,5778,1,1
夕陽超讚風景優美。可惜路況差一點,5,1,2017/04/03,,5779,1,1
從細節可以看見營主的用心。看夕陽與夜景的好地方風好大喔！營主很細心,5,1,2017/04/02,,5780,1,1
會想再去的營區，就是棒！而且營主很親切，是帥哥唷！,5,1,2017/03/25,,5781,1,1
營主很用心維護，超讚的營區，風景無敵。感受到整個營地顧的很用心，不時的會看見營主巡場(垃圾浴廁等設施)查看狀態，隨時詢問也可以得到立即的回覆，非常熱心，大推藍天嶺營主，服務很棒!草地很平整，浴廁非常乾淨，還可聞到木頭清香，真的是個很棒的營區，無敵雲海美景與營位的熱心讓我們印象深刻，期待下次再訪喔~,5,1,2017/03/20,,5782,1,1
環境很舒服，景色優美！。洗手漕水龍頭建議可以加管子，不然水龍頭位置太短，不方便沖洗。,5,1,2017/03/18,,5783,1,1
風景優美，環境乾淨。。延路產業道路，兩旁竹林，希望業者能稍做整理，愛車哭哭了,5,1,2017/03/01,,5784,1,1
廁所跟衛浴很乾淨有在維護又很多間，很不錯！(浴室內有一個盥洗置物架還有一個雙層有門的置物櫃！有提供公共吹風機一台使用，浴室熱水提供時間為18:00-00:00，水壓蠻夠的熱水也很熱)這裡還有提供公共冰箱給大家冰食材！營位很大，每個營位有一個流理臺和一個垃圾桶可以使用，流理臺上有插座可接延長線，如果需要記得帶長一點大約3-4米的線才夠。圖片的區域是C、D區的露營區，車子可以直接停在營位前面蠻方便的！蠻適合帶小孩來的一個露營區，看到蠻多組家庭，但因為地點偏平地海拔不高所以是沒什麼風景，但營區周邊有田散散步還不錯，很像鄉下阿嬤家附近的感覺。搭帳時，營主有要求需要在帳棚下都墊一塊護草墊，但墊子蠻硬的所以建議帶睡墊，不然晚上睡覺地板會硬到讓你難入睡。-2024-04-06-當日天氣大約25-26度C，氣溫舒適，在這個營區能感受到微微風不會太熱。,5,1,2024/04/10,,5785,1,1
方便抵達的露營區！營位分配很大，草地維護很好也有提供護草墊浴廁很大很乾淨都有人打掃,5,1,2024/04/08,,5786,1,1
營主一直盯著看限制非常多然後態度口氣也很差是出來露營放鬆不是來受氣的非常不推,1,1,2024/03/08,,5787,-1,1
無敵差評千萬不要來受氣營主非常沒有耐心小孩玩球營主車子就停旁邊球打到車子就被營主罵了一個老太太還走來帳篷罵大人一樣講話態度真的非常差口氣無敵差露營想放鬆晚上又換年輕的來罵垃圾亂丟明明還沒整理好而已要這麼兇嗎真的這麼不歡迎開什麼營區真的讓人很不爽到極點是完全不歡迎寵物老太太營主自己嘴巴說出來的營主說：「我就最討厭寵物」,1,1,2024/03/08,,5788,-1,1
服務態度超差，口氣是很像跟人吵架一樣,1,1,2024/03/08,,5789,-1,1
設備齊全，營位工整，但冬天有時風大滿冷的,5,1,2024/03/08,,5790,1,1
第一次到沒有蚊蟲跟蜘蛛網以及發霉門板的露營區，整個很令人驚艷！草皮整理的好乾淨空間又大！真的無敵推薦！,5,1,2024/02/08,,5791,1,1
營主很有耐心，大草坪適合親子同遊，有小籃球場，腳踏車，營位給很大，整體很好，舒服 …,5,1,2024/01/08,,5793,1,1
營主位置給超大～A區草皮超舒服！適合小孩奔跑玩耍還有腳踏車提供小孩騎乘！真的很讚浴室廁所超乾淨超推,5,1,2024/01/08,,5794,1,1
前往營地的路非常好開，有提供親子設施 (溜滑梯、腳踏車、籃球、沙坑、泳池等)、冰箱、飲水機，草皮活動空間也很大，整體來說，是一個很舒服的營地，營主人也滿Nice的。可是1.洗澡有限時間 (晚上12:30前)，白天沒熱水。2.裝備只能在草地旁邊的柏油路下，可是柏油路大概只有不到3米寬，下裝備會有壓力，因為下裝備的時候，勢必會擋到後面的車。3.適合腳踏車騎行的空間就只有柏油路，可是柏油路很窄。4.撤帳時間比較硬，很多營地在收假當天會有比較大的彈性時間。5.海拔低，可以看到星星，最大光害是門口那盞路燈，如果可以手動開關就好了。6.A區3帳之後距離護草墊放置區雖然不遠，但會很累。整體來說，還是會在營地的口袋名單中，但下裝備不能在草地下，真的是個硬傷，希望營主可以思考一下解決的方式。,3,1,2023/12/08,,5795,0,1
"場地寬廣舒服, 衛浴乾淨",5,1,2023/12/08,,5796,1,1
A區的車不能停草皮上，上下裝備讓人感覺很緊張，我移車移了四五次。BC區的路比較大，車可以停路邊，會比較好,4,1,2023/12/08,,5797,1,1
營位給的蠻大的很友善的營地,5,1,2023/12/08,,5798,1,1
這次參加的是團露活動，營區整個環境很乾淨草坪也很舒服，廁所很乾淨有提供衛生紙，但是一開始說天氣溫度許可就會開放泳池，結果要去的前一天變成早晚溫差大所以不開放了，但是其實星期六真的超級無敵熱⋯所以沒有使用到這項設施，不過沒關係，因為營主應該也是為了露友的健康著想隔天才知道營區12:30就要全部撤帳離開，也許營區本來就有這樣規定，但是當下還是很傻眼，露營本來就是放鬆的活動，之前的經驗都是14:00前離開，我想以後絕對不會再去，畢竟營區很多⋯加上營區提供的腳踏車都非常破舊，能騎車的地方也很窄小，小孩們一直出現撞車受傷️超危險營位滿帳可以到50幾帳，但是全部共用一個衛浴，熱水只供應到晚上12:00，所以媽媽帶小孩用的女生衛浴常常都是大排長龍等洗澡，白天是完全沒有熱水的唷如果是習慣前一天就開始收拾裝備或輕裝備露友就很適合這個營區，如果是習慣在營區吃點簡單午餐才離開的露友或早上10點才開始收拾要稍微讓帳篷曬太陽去露水的露友真的要好好考慮囉！,2,1,2023/11/08,,5799,-1,1
狂跳電，小黑蚊超多，廁所很遠,1,1,2023/06/08,,5800,-1,1
是一個對露營新手來說很友善的露營區！設備蠻多的（大冰箱、飲水機、戲水池、籃球場..）不太需要擔心設施的問題，但也因為冰箱裡的食材蠻多的，所以造成溫度不夠低的狀況（？，我們有三袋冰塊冰一整天還是水水的。比較需要準備的是大量的防蚊液，最好是防小黑蚊的防蚊液，畢竟露營是接近大自然的活動，不能避免遇到許多的昆蟲們～這次跟朋友們待了兩天一夜，我們都對此感到非常滿意！是一個讓人放鬆的好地方(  ˶ˊᵕˋ),5,1,2023/06/08,,5801,1,1
超大草坪，廁所乾淨，營主用心經營，一大早就在除草,5,1,2023/06/08,,5802,1,1
很大的營區，營區中心在中間，分左右兩區，空間很大，還有籃球區，沙坑，溜滑梯，水池，還有準備了大小朋友都可以騎的腳踏車，廁所浴室也都很乾淨，白天蒼蠅有些多，晚上要稍微注意有沒有營區的狗，會來找東西吃，不過整體營區很棒唷 …,5,1,2023/06/08,,5803,1,1
親子露營區首選大草皮適合讓小孩放電衛浴廁所也算乾淨小黑蚊很多需要注意防蚊,5,1,2023/05/08,,5804,1,1
草皮寬廣，衛浴清潔，有沙地與水池，現場還有自行車可借用(要挑一下)，冰箱也很夠用，孩子們也玩得很開心。,5,1,2023/05/08,,5805,1,1
規劃的動線很棒。這次是參加鹿營團團露，大家有默契把車輛停到外面，原本停車的中央走道，變成孩子的遊戲奔跑區。整個營區更加分了！超棒營主很用心，隨時隨地都有人打掃巡視，洗澡水也是用鍋爐柴火燒的，很舒服。沙坑、遊戲區、腳踏車、很多遊戲器材可以自由取用，很大器。,5,1,2023/05/08,,5806,1,1
女生淋浴間只有5間  廁所很遠  熱水寫供應到12點 結果同行友人11點多去已經洗了冷水  洗澡時因為是柴燒所以水溫無法穩定   連轉到最冷的地方都還有可能超燙  女生吹風機只有一台  營地區域設置空間偏小  帳篷跟帳篷之間超近==   規定上沒有寫不能打麻將 卻跑來告知打麻將會影響小孩不佳觀感  要我們把帳篷圍布拉上 飲水機只有一台 時不時水就不夠用  完全不推,1,1,2023/05/08,,5807,-1,1
適合遛小孩，但收的帳數太多,4,1,2023/05/08,,5808,1,1
適合小孩放電的營區，五星級衛浴，唯一的缺點---有小黑蚊和蒼蠅，不然就很完美了!,4,1,2023/05/08,,5809,1,1
空間舒適的營地，小孩可以完全放風，不擔心危險，廁所等也維護良好，可再訪也有小朋友遊樂設施及沙坑，夏天還可以玩水,5,1,2023/05/08,,5810,1,1
2022/11-第74露-米迦  團露，剛到時飄毛雨，後來搭帳時下中雨，也是第一次體驗到在雨中搭帳的感覺，真是有點狼狽。不過人在江湖飄，哪能不挨刀，所以在雨中搭帳，也是露營必修的課程之一。場地大，草皮厚，但若有雨草皮會積水泥濘。海拔雖不高，但這次露起來，感覺還算涼爽舒適，風也不小，客廳帳有拉風繩。營區有場地讓小朋友騎腳踏車、打球、玩沙、打羽毛球，也算是不錯,4,1,2023/05/08,,5812,1,1
草皮 3.5星 可能因為生意好，來不及重長設施 5星 營主很用心在維護，腳踏車籃球小孩玩整天衛浴 5星 有用心維護整理整體來說適合新手，建議氣溫低於28度再來露營，不然會熱死…小黑蚊有，但目前可能因為季節的關係沒有非常嚴重,4,1,2023/05/08,,5813,1,1
我們這次是訂在D區13帳， 營區空間非常的寬闊，整個營區的規劃讓我們貼心感受，還有小孩的遊樂設施玩沙區更提供腳踏車給小孩大人騎，然後車停在營區道路兩旁，離帳篷真的很近很方便而且蚊蟲非常的少.營區有冰箱冷凍和冷藏也有供應飲水機.廁所浴室整理的非常乾淨. 隨時在整理巡視～營主柴燒熱水燒到12點，整個真的就甘心欸.下次有機會ㄧ定會再去的營區,5,1,2023/05/08,,5814,1,1
很漂亮的場地，只是螞蟻有點多～收帳時要注意,4,1,2023/05/08,,5815,1,1
老闆娘很親切，工作人員都很好,5,1,2023/05/08,,5816,1,1
這裡場地很棒，公用浴室很乾淨，小孩還有沙坑水池的可以玩，洗澡的熱水還是老闆親自柴燒，真的很讚！！另外，非常謝謝老闆跟闆娘，在跟闆娘取租的營帳時，闆娘知道我們整團露營經驗值趨近於0之後，直接手把手教我們搭帳！！幸好我們學完後就順利的分工搭完剩下的3頂帳，隔天收帳時，老闆跟闆娘又一起來教我們如何有效率的收帳跟復原場地。光是這一part，我們這趟行程就物超所值了，真的非常感謝你們,5,1,2023/05/08,,5817,1,1
優點：冰箱和冷凍都足夠，有草皮足夠空間孩子打棒球，還有籃球場運動，腳踏車、玩沙區跟戲水區及飲水機，稱讚營主一家人勤勞打掃，收垃圾及分類，雖然廁所、浴室間數少但每隔時間巡視清理環境，還有撤帳開車營主指導車，注意孩子安全，廁所門上櫃子，感受用心經營。待改善硬體：女廁浴室的冷水流太小，小到像筷子細長，是要放水桶多久時間？水溫不穩過燙，只有5間淋浴間，反應營主回應是太多人用水？！洗澡很痛苦買加壓馬達。最後要選對季節來，今天來風大，沒遇到小黑蚊幸運，小黑蚊太輕，怕風吹。,3,1,2023/05/08,,5818,0,1
小孩玩得很開心 廁所優 場地大 雖說像颱風來襲但還是推,5,1,2023/05/08,,5819,1,1
漂亮的草皮，乾淨的廁所、衛浴，還有冷藏、冷凍、飲水機都非常方便。,5,1,2023/05/08,,5820,1,1
路況佳，藍球場，沙坑，浴廁都不錯，下次還會再來。,5,1,2022/05/08,,5821,1,1
草坪漂亮，帳位空間很大，浴廁乾淨且空間大,5,1,2022/05/08,,5822,1,1
衛浴沒幾間要排隊，冰箱只有一台（爆櫃），注意小黑蚊,2,1,2022/05/08,,5823,-1,1
優點：營區海拔不高、開車路況好到達，兒童設施非常豐富，草皮適合小孩玩樂。缺點：非常非常多的小黑蚊，已經噴了防蚊液還是被叮滿腳，從中午到傍晚都有，傍晚還有超大隻的斑蚊，被叮到會痛的那種，非常恐怖。下次可能挑冬天來比較適合。,3,1,2022/05/08,,5824,0,1
