content,rating,type,publishedDate,tokenization,sequence_num,status,origin
視野遼闊，層層的山巒美景還有營主夫婦用心維護的環境在這邊渡過美好的露營時光有機會一定會再來！,5,1,2021/05/07,,3842,1,1
視野開闊，清幽放鬆的好處所，大人小孩都被收服了，意猶未盡，謝謝營主夫婦的用心經營。,5,1,2021/05/07,,3844,1,1
空氣好，視野佳，營主人好。。,5,1,2021/05/07,,3845,1,1
小巧的營地，孩子在山的面前戲水，很開心！搭在 B 區，早上有樹蔭，不會被曬醒，早上收帳時也比較不會這麼曬；營地也提供了冷凍、冷藏設備，還有飲水機，還有一支十元的營地冰棒。營地的生態也很豐富，白天不少蜻蜓、蝴蝶，晚上好多螽斯、蟾蜍跳來跳去。,4,1,2021/05/07,,3846,1,1
環境好，廁所跟浴室非常乾淨，老闆很用心的維持環境整潔。但來此地記得照老闆的指示，否則google的導航是錯誤的路線，會走到很小的道路。,5,1,2021/05/07,,3847,1,1
很棒的營地，小兒美，麻雀雖小五臟俱全，有冰箱也有冷凍庫，而且飲水機的水很甘甜，浴室非常大，掛鉤完全夠用。營主夫妻很親切，還送我們超嫩的竹筍，營地確實規劃得很好！！這個季節的夜晚還有螢火蟲，數量非常多，好像滿地的星斗，看得眼花繚亂了～白天就是悠哉地欣賞視野遼闊的山景，非常棒！ …,5,1,2020/05/07,,3848,1,1
乾淨、簡單、方便、享受露營生活好地方,5,1,2020/05/07,,3849,1,1
上去的路線一定要遵照營主的指示！有非常美麗的景觀，夕陽也一覽無遺，衛浴設備都保持的乾乾淨淨，冰箱飲水機一應俱全，還有烤肉爐可以借，有草皮空間給孩子們遊玩，非常值得再來的營區，而且...好便宜。唯一缺點是剛好遇到風有點大。營主非常熱情！推薦,5,1,2020/05/07,,3850,1,1
風景優美，環景乾淨整潔！,5,1,2020/05/07,,3851,1,1
這營區乾淨 都是小區 營主非常好客 廁所大間乾淨 下次會在來喔  …,5,1,2020/05/07,,3852,1,1
場地雖然不大，環境景觀不錯，適合放空，可分區包區，好處是不會太吵雜。廁所乾淨，浴室也乾淨又大間。最後一段路不太好走。真的要先導航至霞雲派出所再依指標上山。,5,1,2020/05/07,,3853,1,1
風景很美，營區很整潔，浴室很大間，熱水充足還有小農場免費摘取小白菜與地瓜葉,4,1,2020/05/07,,3856,1,1
好地方 再來 再來 ！！,5,1,2020/05/07,,3858,1,1
第一次露營就給了沒搞頭，營主熱情！營地乾淨，環境漂亮果然有看頭啊！可是這下好了！第一次體驗就這麼好，之後怎麼辦哈哈，有機會還會想再來～,5,1,2020/05/07,,3859,1,1
風景優，營地乾淨，衛浴乾淨，很用心的營主每組洗手台放置洗潔精，營主夫妻很熱心，值得推薦的營區.,5,1,2020/05/07,,3861,1,1
風景好、視野遼闊，有乾淨跟有遮陽的戲水池，營地空間很大很舒服，碎石營地但有提供護草墊，夕陽很漂亮，晚上星空也超美~~~另外老闆夫婦人超級好，很加分！小缺點是樹還不夠高大到可以遮陽，上山的路較抖，然後浴室少了置物架~~,5,1,2020/05/07,,3862,1,1
去路為產業道路，若用地址導航會迷路！建議導航直接設定到“霞雲派出所”，經過此處再往前開一點就可以看到營區相關指示牌，請依指示牌走，不要導航！！每一區適合2-3帳為一區團露，階梯式分區，帳數不多，但寬敞舒適，讓每一區都有各自獨立放鬆的空間，不會互相干擾。層層山巒，適合想從都市叢林暫時跳脫的人們！碎石地，地平整，有提供黑墊子墊底！浴廁乾淨不擁擠，但浴室目前僅有一排掛衣架，攜帶進去的洗髮沐浴乳這些東西只能放地上，希望能再有個層架方便放置！垃圾桶目前只提供一個，如果能多一個區隔一般跟可回收應該會更好！營區從白天9：00到太陽下山前，陽光都超級熱情，還有風偶爾有點大，建議營釘營繩要多準備些！以上......是個即使我第一次去，還是能感受到營主用心打造的小天地，讚！,5,1,2020/05/07,,3863,1,1
"營主夫婦和善,營地寬敞整齊潔靜,水廁設備新穎乾淨.",4,1,2020/05/07,,3864,1,1
"很棒的營區,只是不好訂位",5,1,2024/04/26,,3865,1,1
絕對會回訪的營區！。謝謝老闆娘，我是昨天一人一貓車宿入住B區的露友，非常感謝營主夫婦打造這麼乾淨舒適的營區！也希望老闆身體早日康復、多休息！我是第二露的超級新手，也是自己一個人的第一露，雖然上山的路有嚇到我，最後這段真的比較陡，但走過一次其實就大概知道是這樣的路，很感謝下山有A區露友帶著一起走，心情輕鬆不少。營區的冰箱、冷凍櫃、廁所、浴室、吹風機、營位旁的流理台、插座、照明燈、垃圾桶、護草墊，每一樣都乾淨整潔很好用，碎石區地面超級乾淨，就是大自然的蟲類蟾蜍而已，我也很放心帶著我的貓一起在這裡露營。（我的貓是每天都會出門的有訓練過，所以沒練習過的請先找貓行為訓練師學習，不要貿然直接外出）,5,1,2024/04/04,,3866,1,1
營主很用心經營，風景很美，浴廁也超乾淨的,5,1,2024/03/23,,3867,1,1
第2次造訪，朋友車壞在營區，營主太太超熱心協助處理。因為最後上山的一段路很狹窄，所以交通很不忍心的沒給5顆星，但是露客還是絡繹不絕，所以根本不用擔心,5,1,2024/03/22,,3868,1,1
感受的到用心照顧的營區。整體氛圍很舒服放鬆，浴廁乾淨，最後一段路上下山不好會車，已訂好4月再訪,5,1,2024/03/14,,3869,1,1
最乾淨的廁所 ! 蚊蟲蒼蠅相對少，非常用心的經營者。是我喜歡的碎石營地 !坐式馬桶間地板非常乾淨，捨不得弄髒，索性脫鞋子體驗感受像家中般的舒適；營區旁邊可走到東眼山林道，一路陡上，走40分鐘以上。非營區問題：會聽到鄰近達XX營區客人大聲嬉鬧聊天，卡拉OK傳上來的聲音，即使如此，我還是想回訪 ! ,5,1,2024/02/19,,3870,1,1
很棒的環境～。這是第二次造訪，感覺一樣很舒服很美的景色，夜晚也是滿天星星！白天營主還帶小朋友體驗拔蘿蔔，實在有趣！自己拔自己吃，超級甜～一定會在造訪！,5,1,2024/01/19,,3871,1,1
老闆娘場地維護的很棒，有一定的堅持，,5,1,2023/11/03,,3872,1,1
路顛波。快到時，路很陡 不好開,3,1,2023/10/23,,3873,0,1
路很危險。快到營區大概5分鐘左右時，那段路超難開,3,1,2023/10/23,,3874,0,1
"浴廁很乾淨,自產的高麗菜真好吃",5,1,2023/10/23,,3875,1,1
風景佳、老闆老闆娘熱心！非常值得推薦新手露營的營區！。從台北開到營區，台灣的第一露感覺非常的現代化XD 非常新手有好的區營，園區內的浴廁乾淨，單帳包區的營位空間非常大，還都貼心的付了插座。環境清幽，日落跟日出的景色也十分值得一訪！交通的部分上山較陡，可能下雨天上山會較危險~有機會一定要再來多住幾天，兩天一夜實在太少了！,5,1,2023/10/19,,3876,1,1
感受的到用心照顧的營區。整體氛圍很舒服放鬆，浴廁乾淨，最後一段路上下山不好會車，期待下次再訪,5,1,2023/10/16,,3877,1,1
營區很棒，值得二訪 !,5,1,2023/09/23,,3878,1,1
很愜意的營區，有假的時候還會來。初次在打雷聲中搭完帳，在磅礡大雨中渡過三四個小時後，排水良好的碎石營地讓我愛上了這種營地，晚上帳外有幾隻蛙類生物跳來跳去，請注意過往的腳步。浴室和廁所很乾淨，熱水很熱，水量很強，地上的蚱蜢或是蜈蚣要稍微注意就好，冰箱和飲水機也都一應俱全。謝謝營主的熱情招呼，我們在適當的時機還會再訪。,5,1,2023/07/25,,3879,1,1
很乾淨的營區。。每次入住的營區我都會很在意廁所跟浴室的乾淨，這營區讓我很滿意，乾淨程度沒話說。在這兒的生態很多元，雖然很多昆蟲(在大自然的環境下露營就是如此啊)，但至少沒有陪我一起上廁所就放心了！整體的營區環境很滿意^^,5,1,2023/07/18,,3880,1,1
入營當天有一間廁所不通，營區乾淨。B區在樹下，早上可睡較晚，景觀最好的營位都要包區,4,1,2023/07/10,,3881,1,1
"每區空間大又乾淨風景優美，浴廁也都很乾淨。還收到營主夫妻的驚喜""大""禮，下次必再訪。",5,1,2023/06/21,,3882,1,1
第2次入住，一樣是很好的體驗,5,1,2023/06/16,,3883,1,1
營地得排水系統真的超強，遇上了強降雨，一點也不積水。,5,1,2023/06/12,,3884,1,1
風景好但低海拔蟲多還遇到蛇。風景好，但低海拔蟲多半夜還遇到蛇尤其營區晚上10點之後就熄燈，露友如要來一定要打好燈再去廁所設備很齊全，冷凍庫跟冷藏櫃分開置放，如果露友多不用怕沒地方冰,5,1,2023/05/23,,3885,1,1
"環境優美乾淨整齊,營主熱心好客,山景雲海極美,會讓人流連忘返.只是產業道路髮夾彎頗斜,要注意",5,1,2023/04/27,,3886,1,1
二訪了，喜歡像山谷的開闊景色,5,1,2023/04/25,,3887,1,1
是個被用心經營的營區  景觀優美   值得一去再去的營區,5,1,2023/04/09,,3888,1,1
設備好景觀好。設備好景觀好，但草地的隔草墊其實對某些裝備還是麻煩，建議草地養護好之後，墊子就可以移走了PS.老闆娘講話滿．．．真的是老闆娘口吻,5,1,2023/03/31,,3889,1,1
露營區營主夫妻用心經營，對環境維持非常講究，給每位露友擁有很棒環境。。希望每區洗手台上面有可以有個小燈,5,1,2023/03/02,,3890,1,1
衛浴乾淨，營主人很nice。營主人很好，有自己的原則，這其實沒什麼不好，某方面來說是保護露友的權益，但也會讓不解的露友認為她一板一眼。浴廁打掃的很勤勞，還備有衛生紙，24小時熱水供應。營本部還設置飲水機供露友們使用，挺方便的。唯獨美中不足的是營位不大，搭完帳後，前庭空間不大，活動空間因此受限了。但整體感覺是很美好的。,5,1,2023/03/02,,3891,1,1
已造訪多次，是值得推薦的優質營區,5,1,2023/02/15,,3892,1,1
很棒的營區.乾淨，風景很美，老闆娘很棒，會再回露的一個營區,5,1,2023/01/13,,3893,1,1
營主很熱情健談，雲海&滿天星星&沒有蚊蟲。,5,1,2023/01/02,,3894,1,1
營主夫妻超級好。營主夫妻非常熱心，如果不是營主夫妻的協助，我騎的摩托車可能沒辦法成功到達營區。營區風景很漂亮，而且營地碎石非常乾淨，幾乎沒有沙塵，浴室水壓水溫都非常穩定。極度推薦的優良露營區！,5,1,2022/11/26,,3895,1,1
非常適合小包區的營地。是我喜歡的碎石營地，很適合三五好友小包區，空間有區隔開來不會互相影響，而且沒有蚊蟲。一定要照著網頁說明的路開上來，也可以找YT有影片，沿路都有指標。,5,1,2022/09/20,,3896,1,1
"風景美, 老闆親切, 衛浴很大且超乾淨",5,1,2022/09/15,,3897,1,1
營主夫婦對環境的保育真的很用心。有很豐富的自然生態，但上山的路徑較為陡峭且狹小，夜間沒有路燈，要小心。風景很棒，而且還有清涼的戲水池，真的可以再次造訪~,5,1,2022/09/12,,3898,1,1
四訪了！每來一次就更喜歡這裡！,5,1,2022/09/06,,3899,1,1
隔了半年，選擇7月的夏天第二次造訪，環境很棒，營主維持得很用心，兒童戲水池非常刷洗與換水，使用安心。,5,1,2022/07/25,,3900,1,1
場地很寬廣，帳與帳之間不會覺得有壓迫感，我們選擇小包區的D場地，全家人都很舒適，對這個營地印象深刻。,5,1,2022/07/25,,3901,1,1
營主熱心，衛浴非常乾淨，過年時去的當天算是滿帳，而廁所與衛浴間幾乎像沒人使用過的一直保持乾淨,5,1,2022/07/25,,3902,1,1
很乾淨風景非常漂亮老闆維持的很好,5,1,2022/07/18,,3903,1,1
櫻花樹種的很漂亮，景觀很優，碎石排水也很有效。靠近營區路面較斜，夜衝要小心路況,5,1,2022/07/01,,3904,1,1
營區景超級棒，居高臨下面向滿滿翠綠的山！,5,1,2022/06/27,,3905,1,1
很天然的營區，衛浴設備乾淨又舒服，看的出來管理很用心，老闆娘熱情親切，這次體驗很好,5,1,2022/06/07,,3906,1,1
超棒的營區，環境乾淨風景優美，營主很親切，讓我們的首露完美落幕,5,1,2022/05/22,,3907,1,1
"超棒的!!!第一次露營,老闆娘相當熱情!!上營區的路相當刺激",5,1,2022/05/14,,3908,1,1
營區乾凈整潔、環境美好、悠閑自在放鬆心情的好地方^^,5,1,2022/04/05,,3909,1,1
"小而美營區,維護用心,營主人很好",5,1,2022/04/01,,3910,1,1
"管理需要加強。半夜12點都聽得旁邊大聲聊天講話也有人在洗澡吹頭髮,這樣A區的人都無法休息吧.",5,1,2022/03/14,,3911,1,1
路線標示清楚，乾淨寬敞,5,1,2022/03/12,,3912,1,1
地方舒服舒適，營主親切。,5,1,2022/03/08,,3913,1,1
令人驚嘆的營地，享有壯麗的景色。一個美麗的露營地，老闆非常有愛心和熱情。 景色令人驚嘆，所有設施都維護得很好。 老闆很努力地保持一切清潔，還帶我們去種蘿蔔。 這已經是我們第二次訪問了，我們肯定想再來一次！,5,1,2022/01/23,,3914,1,1
小而美，精緻，空氣清新風景佳，加上營主人很nice! 非常棒的營地!,5,1,2022/01/05,,3915,1,1
營主親切、用心維護的好營地,5,1,2021/12/20,,3916,1,1
小巧漂亮的營區~很熱情的營主.有收到贈送的高麗菜&菜頭.營區販賣的黃金泡菜很好吃呦~,4,1,2021/12/13,,3917,1,1
一萬個讚！。感謝營主們讓我們渡過了兩日滿滿開心的回憶，實在是太棒的環境與設施。,5,1,2021/11/27,,3918,1,1
少帳包區 值得再次光臨,5,1,2021/11/17,,3919,1,1
"營區環境整齊乾淨漂亮,值得推薦~",5,1,2021/11/10,,3920,1,1
環境很乾淨，營主很親切。上山的路好可怕，但一看到美景都值得了!,5,1,2021/10/28,,3921,1,1
老闆你們人好好！～。很喜歡的營區，一直不太喜歡擁擠的營區，老闆們的規劃讓人擁有非常棒的露營體驗～希望。。。已後還是好訂位！哈哈哈～,5,1,2021/10/28,,3922,1,1
這次二帳包區，天氣很好，看到超美的夕陽，設備很齊全，營主還送我們高麗菜。,5,1,2021/09/26,,3923,1,1
舒服放鬆，生態豐富的營地，營主很棒、好客。,5,1,2021/09/26,,3924,1,1
用心經營 小而美 親子營區 下次還想再來,5,1,2021/09/23,,3925,1,1
心目中第一名的營區。看似《沒搞頭》，其實大《有看頭 》營地雖然不大但是小而美又舒適，俗話說麻雀雖小五臟俱全就是在形容這營地。雖然他們才經營營區不久、但事事親力親為、自己設計自己規劃。最重要的是願意聽露客們的意見。我和家人都很喜歡這裡,5,1,2021/09/11,,3926,1,1
浴廁超乾淨，值得推薦的優質營區,5,1,2021/08/23,,3927,1,1
浴廁超乾淨，值得推薦的優質營區,5,1,2021/08/23,,3928,1,1
浴廁超乾淨，值得推薦的優質營區,5,1,2021/08/23,,3929,1,1
老闆娘人超好。營區漂亮，真的讚讚,5,1,2021/07/06,,3930,1,1
二訪營區還是很開心渡過了假期，約定好下回再三訪。這次二訪，剛好女兒可同行，期間還參加了闆娘舉行的動手做竹筒飯，果然自己做的就是好吃！好山好水好竹筒飯^_^,5,1,2021/05/22,,3931,1,1
路程比較遠但標示清楚，風景超棒，沒有蚊子但蒼蠅有點多，會再去,5,1,2021/05/07,,3932,1,1
小而美營地。環境整潔，沒有蚊子，日落很美，竹筒飯好吃，洗澡熱水穩，冬天有時會有強風要注意，整體推薦！！,4,1,2021/04/25,,3933,1,1
景觀很美，浴室很乾淨，非常推薦!,5,1,2021/04/21,,3934,1,1
值得來的好地方~。當天遇到西北風(跟颱風沒差多少)，營主會來提醒先把客廳帳收起來，避免被吹下山，環境也整理的乾淨，感謝。,5,1,2021/04/20,,3935,1,1
值得一來再來的好地方！,5,1,2021/04/19,,3936,1,1
首露!!。首露決定獻給沒搞頭露營區~整體來說感覺很好，平日很清閒，整個營區很乾淨，走路不用三分鐘就可以看螢火蟲，我們雞蛋帶不夠，營區老闆很好還送我們五顆雞蛋，讓我們可以吃豐盛早餐~~~以後有機會還是會想再去~~,5,1,2021/04/14,,3937,1,1
二訪的營區，是一個乾淨整潔的小營區，營主親切熱心，戲水池剛整理好，貼新的磁磚迎接夏天,5,1,2021/04/01,,3938,1,1
環境好，老闆娘熱心，適合放鬆的好地方,5,1,2021/02/27,,3939,1,1
營區清幽，廁所乾淨，老闆娘熱心協助，適合小家庭單露的營地。,5,1,2021/02/02,,3940,1,1
很有溫度的小而美營地。因應路況不易走，營主在霞雲派出所開始，每10公尺就有指示牌，照著走不用擔心迷路，進場後的親切接待、景色視野及乾淨整潔到不行的衛浴，營區的用心隨處可見，當然不可錯過的是營主手工黃金泡菜（自種的有機蔬菜製作），好吃又涮口，季節限量露友必買呀！,5,1,2020/12/28,,3941,1,1
小而美的營區，景色沒話說,5,1,2020/12/02,,3942,1,1
小巧的營地，孩子在山的面前戲水，很開心。搭在 B 區，早上有樹蔭，不會被曬醒，早上收帳時也比較不會這麼曬；營地也提供了冷凍、冷藏設備，還有飲水機，還有一支十元的營地冰棒。營地的生態也很豐富，白天不少蜻蜓、蝴蝶，晚上好多螽斯、蟾蜍跳來跳去。,5,1,2020/11/27,,3943,1,1
營區乾淨，蚊蟲不多，景色舒服，碎石排水性好，營主親切,5,1,2020/11/19,,3944,1,1
"很有愛的營主夫妻。1.導航一定要先到派出所再依照指示上山,後段山路陡,要多加注意安全2.環境維護的非常好,老闆娘會巡視整理,請露友也要多加愛惜,分類要做好,垃圾不落地3.有手作DIY課程,也有戲水池(夏季適合)4.是比較新的營區,廁所,浴室 很乾淨,水壓水溫非常穩定5.山景無敵美麗,只要沒有下雨,星星非常漂亮6.雖然海拔沒有太高,但是很多很棒的朋友(生物)蝴蝶.蚱蜢.等務必要愛護牠們唷(沒蚊子)7.少帳包區 很適合這裡 大團可以包全場 以上是10/9入住體驗 推薦給大家唷",5,1,2020/10/15,,3945,1,1
二度回訪 景色 環境 服務 設備依然值得光臨~。這次參加了竹筒飯DIY活動 真的是狠棒的體驗 竹筒飯也超好吃 ~,5,1,2020/10/12,,3946,1,1
廁所乾淨也很大，非常舒適！,5,1,2020/10/02,,3947,1,1
環境很棒，也沒有小黑蚊，很適合一直來！,5,1,2020/10/02,,3948,1,1
"風景很棒, 老闆娘熱心會與客人閒話家常。1. 從霞雲往上到營區這段路小, 會車不易, 加上有陡彎坡, 要小心行駛2. 衛浴大, 戲水池冰涼3. 車帳分離, 活動空間還不錯4. 海拔七百公尺, 夏天夜晚涼爽, 未來會想再訪",4,1,2020/09/21,,3949,1,1
很棒的露營區，下次還要找時間來,5,1,2020/08/12,,3950,1,1
風景很好，老闆娘人也很好。好山好水好風情熱情的老闆娘以熱情態度又不會緊迫方式讓露營人感到窩心值得推薦造訪！,5,1,2020/08/02,,3951,1,1
無可挑剔的好營區。小而巧小而美 值得再訪的營區，營主夫婦人超級親切熱心 浴廁好大好乾淨  冰箱也非常乾淨整齊 處處可見用心 唯一就是上山的路比較小不好走 如果有夜衝的朋友 一定要遵照指標小心開避免危險~,5,1,2020/06/18,,3952,1,1
很棒且值得再去的營區。如果有小便斗會更好,5,1,2020/06/13,,3953,1,1
老闆手作的黃金泡菜超好吃~~~,5,1,2020/06/09,,3954,1,1
麻雀雖小，五臟俱全的營區。。夜衝上山要開慢一點，到了霞雲派出所後跟著指標走就到囉!!有時候是雲霧繚繞的景致，有時候又可一覽群山。剛好遇到母親節比較少人，幸運的包區了! 還有沙坑跟水池，適合親子露營。營主也很親切!!,5,1,2020/05/13,,3955,1,1
老闆娘很親切，營地也很乾淨。營地後方的菜田還可以看到螢火蟲。很棒的體驗~,5,1,2020/05/04,,3956,1,1
此露營區處處可以看到營主的用心，值得推薦。,5,1,2020/05/03,,3957,1,1
遠眺山嵐視野非常美麗眼前雲海一幕一幕播放 隱居山中好去處 老闆娘自製黃金高麗菜.黑糖薑片好吃,5,1,2020/04/04,,3958,1,1
非常棒又讓人放鬆好營區,5,1,2020/03/31,,3959,1,1
營主好熱情，會巡視我們是否有需要幫助的，還讓我們去拔菜來吃，看天氣熱還放水讓小孩玩水,5,1,2020/03/30,,3960,1,1
超棒的營地。我們星期五晚上夜衝前接到一通營主打來關心的電話~說目前山區霧氣很重~有確定要夜衝嗎?請開車小心雖然之前爬文有看到人家說路不好走~但沒想到真的真的不好走不過後來我聽到人說他照GPS走~那個路真的太刺激了真的要聽營主說的要到霞雲派出所照著指標走那晚營主一直出來關心我們搭帳的狀況~一整天也幾乎看到他在忙進忙出的有其他帳的人來的時後他又開始準備一些東西~廁所也很乾淨~不管什麼時後去都是乾乾淨淨的,5,1,2020/03/16,,3961,1,1
非常非常非常棒的營地♡♡♡。我們是住B區的小情侶，非常喜歡這裡環境~很舒服、很乾淨還有營主親自種的菜可以吃!!! 又大又好吃!!!風景更是無可挑剔肯定會再去!! 適合放鬆、放空、放下鳥事的好地方   ,5,1,2020/01/14,,3962,1,1
很美的營地。老闆和老闆娘人很好，營地很美紮營空間充足，廁所很乾淨浴室很大幫小朋友洗澡時也不會弄濕衣物，環境自然很適合帶小朋友跑跑跳跳.,5,1,2019/12/10,,3963,1,1
一定還會再來。非常推推桃園復興的 ‘沒搞頭露營區’老闆跟闆娘超級親切而且露營區是新的 非常乾淨全部都是老闆自己靠雙手整理出來的而且非常便宜,5,1,2019/10/16,,3964,1,1
整潔乾淨小而美風景好有人情味的好營區。有點不習慣的開過兩公里的產業道路，抵達營區，看到那被山環抱的景色，和整潔的營地，感覺這一小段路是值得的，很幸運的晚上也是大晴天，滿天的星斗和斜掛的月亮，涼涼的微風吹來，享受愜意的休閒時光。小孩在水池和玩沙區也玩的很開心。最令人感動的是，我們的超大沙灘球晚上不見了，早上發現被風吹到在距離營地往下20公尺處，我沒有跟營主提這件事，因為掉在看起來蠻危險的地方。可能前一天營主有聽到我們的談話，早上竟然幫我們把球找回來，驚喜之餘也為營主捏把冷汗，嚇得我差點忘記說謝謝。唯一遇到的問題是洗澡時冷熱水不管怎麼調整，過幾十秒後都會變成最燙，之後我試著把瓦斯熱水器調到最小火的位置，溫度就剛剛好，所以也不算是缺點。,5,1,2019/08/04,,3965,1,1
水庫風光景觀（雖然現在水位比較低）晚上時螢火蟲就在帳篷附近飛舞，小朋友很開心營區內蚊子較多，需注意防蚊 …,4,1,2024/04/23,,3966,1,1
瞭望石門水庫源頭景色（往下走不用5分鐘可以親臨拍照）營主介紹唷，浴廁乾淨、熱水穩定、草皮翠綠，營主親切（女兒說男營主帥唷）認真經營….推,5,1,2024/02/07,,3967,1,1
景色和草地都超級讚的營區要注意的是傍晚會有蚊子大軍 白天某時段有蒼蠅 要記得帶蚊香浴廁都很乾淨 要注意供熱水時間,5,1,2024/01/07,,3968,1,1
很棒的“露營”體驗。我們住在一個豪華小屋裡，它更像是飯店房間而不是露營。然而，走出去，大自然就在等著您，包括所有常見的露營設施。我們中的一些人選擇使用供電帳篷營地搭建帳篷。一個維護良好、乾淨、美麗的露營地。適合鐵桿露營者或只想嘗試的人。,5,1,2024/01/07,,3969,1,1
噪音很多的營地~鄰居的狗叫聲~羊叫聲~凌晨4點的公雞叫~,3,1,2023/12/07,,3970,0,1
風景優美，基礎設施普通，路開的太小了，斜坡陡，開的心驚膽跳，真的不愧祕境二字。,4,1,2023/11/07,,3971,1,1
傍晚蚊子很多，營區下方有3～4隻狗狗，長時間一直吠叫還有應該是鄰居家的小孩，也是從傍晚開始嬉戲吵鬧至晚上10點多還不休息真的很擾人營區廁所設施老舊，有洗澡間無法鎖門的，還有廁所沖水設備損壞的除了景色，這營區真的不推,2,1,2023/11/07,,3972,-1,1
風景絕美，日落時的美景讓人驚嘆。營區主人熱情好客，超好的旅遊經驗！,5,1,2023/08/07,,3973,1,1
2022.10去的園區內很舒服，包區的話空間算是相當大也有自己的一個獨立廁所可以直接看到水庫，真的很美很舒適  視野相當好浴室是在最下面獨立一區，間數算是夠大家都不同時間去沒甚麼等到也滿乾淨的，熱水也相當穩定，一家三口一起洗沒有問題空間有足夠離路沒有很遠，所以晚上睡覺一定還是會有車聲大概就是跑車跟重機那類的，也會有野狗叫聲要自己斟酌另外園區內的道路真的是，有點陡進到我們這一區的那個入口不夠平所以幾乎每一台車都刮到了底盤建議開到最下面那區迴轉再往上開會比較合適,4,1,2023/06/07,,3977,1,1
