content,rating,type,status,tokenization,publishedDate,origin
在露營區浴室緊緊湊在一起，人都要排隊擠進去，還要搶著用前面剩下的溫水，結果還是隻有十秒的熱水，接著就只能忍受冰冷的水準備快速沖洗，這種情況實在讓人無法忍受。,3,1,0,,2023/05/01,0
浴室太少，排隊排了很久，結果只洗到10秒的溫水，接著就只能忍受冰冷的水龍頭。在寒溪露營真是讓人感到心寒。,3,1,0,,2023/05/01,0
寒溪露營的浴室數量明顯不足，排隊等候的時間很長，終於洗到時只有前10秒是溫水，之後就只能忍受冷水澡，讓人非常不舒服。,3,1,0,,2023/05/01,0
在這裡住了5天4夜，過年期間洗澡時水溫忽冷忽熱，水壓也不穩定。建議洗澡前先備好一桶水，以免洗澡時遇到水溫忽熱忽冷的情況，相當不舒適。,1,1,-1,,2023/03/01,0
在這裡過年待了5天4夜，洗澡時水溫時冷時熱，水壓一直不穩定。建議洗澡前先裝滿一桶水，以免洗澡時忽燙忽冷。,1,1,-1,,2023/03/01,0
在這家住宿的五天四夜裡，洗澡時遇到了水溫忽熱忽冷的問題，水壓也一直不穩定。建議未來入住的旅客可以事先準備一個桶子裝水，以免在洗澡時遇到突然變熱或冷的情況。這樣才能確保洗澡的過程不會讓人感到不適。,1,1,-1,,2023/03/01,0
在這裡住了5天4夜，洗澡時水溫時冷時熱，水壓也很不穩定。建議洗澡前先準備一桶水，以防突然被燙到或者被冷水淋頭。,1,1,-1,,2023/03/01,0
在這裡住了五天四夜，過年期間洗澡時水溫時冷時熱，水壓一直不穩定。建議洗澡前最好事先準備一桶水，這樣才能避免一下子被熱到快要燒傷又突然冷到發抖的情況發生。,1,1,-1,,2023/03/01,0
水溫時冷時熱，水壓不穩定，洗澡的時候真的感覺好冷。,1,1,-1,,2023/03/01,0
這水溫變化忒大，時冷時熱，還水壓不穩，洗個澡都感覺冷到骨子裡。,1,1,-1,,2023/03/01,0
沐浴時，水溫時冷時熱，且水壓不穩，感覺真的很冷。,1,1,-1,,2023/03/01,0
這頓飯菜色豐盛，有甜有酸有辣，味道真的很豐富。,1,1,-1,,2023/03/01,0
沐浴時水溫時冷時熱，水壓不穩，真的很難受啊....,1,1,-1,,2023/03/01,0
我在露營四天裡有兩天都只有冷水可以洗澡，我向營地主人反映，但他卻厚臉皮地表示這不是他的問題。此外，我們的帳篷旁停了一輛車，他卻強迫我們把車停到遠處的停車場。,1,1,-1,,2023/03/01,0
露營四天，竟有兩天只能忍受冷水淋浴，向營主反映後，卻被厚臉皮地推說問題不在他身上。此外，我們的帳篷旁並無妨礙其他帳篷的情況下，他卻硬要求我們將車停放在遠處的停車場，實在令人氣憤。,1,1,-1,,2023/03/01,0
露營四天，有兩天沒熱水可洗澡，向營地負責人反映後，卻毫不負責任地說這不是他的問題。另外，我們的帳篷旁邊沒有其他帳篷，只是停了一輛車而已，竟然還要求我們把車停到遠處的停車場，實在是過分。,1,1,-1,,2023/03/01,0
露營四天，竟然有兩天需要忍受冷水沐浴，跟營地負責人反應後卻被推卸責任，甚至堅持說不是他的問題。此外，即使我們的帳篷旁邊沒有其他帳篷，也被要求將車停放在遠處的停車場，實在是令人生氣。,1,1,-1,,2023/03/01,0
露營四天，竟有兩天冷水不熱，向營主反映竟被推諉說不是他的錯。更何況，我們的帳篷旁還放了輛車，卻被強迫開到遠處的停車場停車。這種服務態度實在令人無法接受。,1,1,-1,,2023/03/01,0
熱水問題時而冷時而熱，只有兩間穩定供應熱水的公共浴室，如果沒滿房間就必須排隊等洗澡，即便滿房間也要久等。建議夏天造訪，因為即使沒有熱水，用冷水也還算可以接受。停車位置離公共浴室很遙遠，而且提供的停車場好像是公共地方，停車行為可能違法。可見管理方對此沒有足夠的注意，或許因為沒有人舉報才敢這樣做。,1,1,-1,,2023/03/01,0
溫泉飯店的熱水問題真是讓人困擾，時而忽冷忽熱，要不就是完全冷掉。只有兩間穩定提供熱水，導致洗澡時要排長長的隊伍。就算房間滿了也得等待。建議大家可以考慮夏天來，反正冷水洗也沒問題。另外，停車位有限，而且似乎使用了公有地當作停車場，這樣應該是違法的。也許是因為沒有人舉報，所以才敢這樣做吧。,1,1,-1,,2023/03/01,0
溫泉度假村的熱水問題十分不穩定，時而冷時而熱，只有兩間能提供穩定熱水。若人數未滿，就必須排隊等洗澡；即使滿房也可能遇到同樣情形。建議大家夏天前來，因為即便沒熱水洗冷水也算可以。此外，停車場離溫泉度假村相當遠，而且提供的停車位似乎屬於公共停車場，違法停車，但猜測可能不會被檢舉才敢這樣做。,1,1,-1,,2023/03/01,0
熱水時忽冷忽熱，或者完全冷掉，只有兩間浴室穩定，不滿房就要排隊洗澡，即使滿房也要等，建議夏天來比較好，因為洗冷水也可以，停車位要停很遠，而且停車場似乎是公有地，可能是非法使用，應該是沒人會檢舉才敢這樣做。,1,1,-1,,2023/03/01,0
熱水問題不穩定，要排隊等洗澡，只有兩間穩定的熱水供應。停車地點需要停很遠，而且停車地點好像是公有地，可能是違法的。建議夏天來比較好，因為洗冷水也是可以的。這樣說，可能是因為不會有人舉報才可以這樣使用停車地點。,1,1,-1,,2023/03/01,0
過年期間露營五天四夜，一到營區就聞到濃濃的煙味，原來是營主在抽煙，煙味竟然飄進營區裡。浴室有兩區共六間，但熱水有限時間，晚上時水溫忽冷忽熱，真是讓人受不了，要麼燙傷了，要麼冷得發抖，尤其是另一區的水溫幾乎就是冰水，只要同區浴室有其他人一起使用，立刻就會變得冷得讓人寒到不行，真的非常令人崩潰...,1,1,-1,,2023/03/01,0
過年期間露營五天四夜，一抵達營區就聞到濃濃的煙味，第二天清晨仍然不能擺脫煙霧瀰漫，原來是營主總是在營區內抽煙，導致整個空氣都充滿了煙味。浴室共有兩個區域，總共六間浴室，但熱水時間有限，而晚間熱水時而冷時而熱，令人困擾不已，另外一個區域的熱水則總是保持在溫熱的程度，但如果有其他人同時使用浴室，熱水會瞬間變為冰水，特別在寒流時期更是冷得讓人難以忍受，實在令人感到非常崩潰！,1,1,-1,,2023/03/01,0
過年期間露營五天四夜，一到營區就聞到煙味，隔天一早依然瀰漫著濃濃的煙味，才發現原來是營主在抽煙，煙味竟然飄到了營區裡。浴室共有兩區，總共六間，但熱水卻有限定時間，晚上時熱水時冷水，讓人又燙又冷，非常不舒服。另一區的水溫一直都是溫的，幾乎接近冰水的程度，只要同區浴室有其他人一起使用，水馬上就會變冷，寒流期間更是如此，實在令人崩潰…,1,1,-1,,2023/03/01,0
過年的時候去露營五天四夜，一到營區就聞到濃濃的煙味，原來是營主一直在抽煙，煙味竟然都飄進了營區。浴室共有兩區六間，但熱水卻有限定時間，晚上竟然時熱時冷，真是讓人受不了，一直怕燙到或是凍死。另外一區的水一直都是溫的，只要跟別人一起用浴室，馬上就變成冷水，寒流期間更是冰水，真的很令人崩潰。,1,1,-1,,2023/03/01,0
過年期間到營區露營，卻被營主抽煙的習慣給影響到，整個營區都飄散著濃濃的煙味讓人討厭。不僅如此，浴室的熱水時間限制，晚上更是熱水時冷時熱，根本無法舒適地洗澡。其中一區更讓人氣憤，水溫總是保持在溫溫的狀態，甚至是快要變成冷水了！一旦有其他人一起使用浴室，立刻就變成冷水，尤其在寒流襲來的時候，簡直就像是在洗冰水啊！這種情況實在讓人不可思議，真的很令人崩潰…,1,1,-1,,2023/03/01,0
"1. 水壓不穩，浴室熱水溫度忽冷忽熱，調整困難，不適合小孩洗澡。
2. 衛浴設施只有兩間，如人潮眾多可能不夠用，且不是五星級標榜的高階裝置（馬桶和淋浴間放置在一起，使用不太舒適）。
3. 優點是附近有適合散步的寒溪吊橋，距離羅東市區約20-25分鐘車程。",3,1,0,,2022/03/01,0
"1.浴室水壓不穩，位置在雨棚區旁邊的第一間，熱水有時忽冷忽熱，溫度調整困難，不太適合小孩洗澡。

2.廁所只有兩個區域，如果人滿可能不夠用，衛浴設施並非露營地所標榜的五星級水準（馬桶與淋浴在同一間，使用起來不是很方便）。

優點在於附近有寒溪吊橋可以參觀，距離羅東市區約20-25分鐘車程。",3,1,0,,2022/03/01,0
"1. 水壓不穩定，尤其是雨棚區旁的第一間衛浴，熱水時冷時熱，溫度難以調整，對於小孩洗澡不是很方便。
2. 廁所區域少，只有兩個區域，若人潮眾多可能會不夠用，且衛浴設施並非如露營區所標榜的五星級級，特別是馬桶與淋浴在一起使用起來不太舒適。
3. 優點是附近有寒溪吊橋可供遊玩，離羅東市區約20-25分鐘車程，交通方便。",3,1,0,,2022/03/01,0
"1. 沐浴時水壓不穩定，尤其是在雨棚區旁第一間衛浴，熱水時常變化忽冷忽熱，難以準確調整溫度，對小孩洗澡並不方便。
2. 淋浴間只有兩區，如果客滿可能不夠用，且衛浴設施沒有如露營樂所宣稱的五星級水準（例如馬桶與淋浴間合併，使用起來不太舒適）。不過值得一提的是，附近有寒溪吊橋可供遊玩，距離羅東市區約20-25分鐘。",3,1,0,,2022/03/01,0
"1. 水壓不穩定，尤其是在雨棚區旁邊第一間衛浴，熱水時冷時熱，難以調整溫度，對於小孩洗澡來說不太方便。
2. 廁所只有兩個區域，當人潮較多時可能不夠用，而且衛浴設施並非露營區所宣稱的五星級水準（尤其馬桶和淋浴在一起，使用起來並不太舒適）。
優點是附近有寒溪吊橋可供遊玩，距離羅東市區約20-25分鐘車程。",3,1,0,,2022/03/01,0
在這露營雨棚區，首先熱水的問題讓人有些困擾，時冷時熱，燙到凍到都有可能。而營區內有沙坑、小小的溜滑梯以及三個盪鞦韆可供使用。另外，廁所外的衛生紙會在第一天和最後一天老闆都不再補充，需要自備。附近經常有雞叫聲，在凌晨時分可能造成打擾。偶爾會有跳電情況發生，需留意。停車需停在指定區域，並且插座供應有限，一個營位僅有一個插座，使用延長線時要小心避免跳電。最後，垃圾袋需要自備並負責清理。總結來說，這營區曾是商業化較重的地方，老闆經營目的也是為了賺錢，對於問題反應時常以付費解決為主。,3,1,0,,2022/03/01,0
這個露營地的熱水狀況真的很奇怪，時冷時熱，讓人又燙又凍。設施方面有沙坑、小溜滑梯和盪鞦韆，但廁所外的衛生紙不會及時補充。附近常有雞叫聲，而且會有跳電的情況，需要提前做好應對措施。停車需在停車場，插座不夠用，加長線也怕跳電。另外要自己攜帶垃圾袋。整體而言，這個營區之前較商業化，老闆的態度也是付錢即可解決問題。,3,1,0,,2022/03/01,0
在這露營雨棚區，熱水給水時常忽冷忽熱，要小心燙到或冷到。設施包括沙坑、微小的溜滑梯和三個盪鞦韆。衛生紙在廁所外面第一天到最後一天都不會補充。附近常有雞啼聲在清晨2:30和4:00聽得到。中間還跳過一次電，車子也只能停在停車場，插座供應有些不足。垃圾袋則需要自備。此營區以商業化著稱，老闆解決問題的辦法就是付錢。,3,1,0,,2022/03/01,0
這個露營地在跨年當天選擇在雨棚區露營，但是遇到了一些問題。熱水供應時常讓人受不了，忽冷忽熱，溫度不穩定。設施包括沙坑、小溜滑梯和三個盪鞦韆。然而，廁所外的衛生紙每天老闆都不會再補充，有點困擾。附近總是會聽到早上2:30和4:00的雞叫聲，有點吵。還有一次停電事件，讓整個露營經驗略顯不便。車輛需停在指定的停車場內，插座也有點不足，使用延長線時要小心避免跳電。此外，需要自備垃圾袋。總結來說，這個露營地在商業化方面比較重，老闆經營的宗旨基本是以賺錢為主，提出問題後的解答就是付費就能解決。,3,1,0,,2022/03/01,0
"在此露營雨棚區跨年，需要注意以下事項：1. 熱水不穩定，時而熱時而冷；2. 設施有沙坑、小溜滑梯和盪鞦韆；3. 衛生紙不會在第一天和最後一天補充；4. 附近會有雞叫聲，可能在清晨2:30或4:00響起；5. 有可能會有停電情況；6. 停車需停在指定停車場；7. 插座較不足，一個營位只提供一個插座；8. 需要自備垃圾袋。

個人感想是，這個露營區曾經商業化較重，老闆的主要目的可能是賺錢。對於問題反映回覆的方式比較簡單，通常答案就是付錢解決。",3,1,0,,2022/03/01,0
"風景空氣都很棒，只是3月份是否馬陸的盛產期，真的很大隻跟平地的種類不同，有空可以去體驗看看。

景色和空氣都很宜人，但在3月份是否是馬陸的盛產期呢？它們在此時的體型確實比平地的種類大很多，有機會的話，不妨去親身體驗一下。",3,1,0,,2022/03/01,0
這地方風景真的太美了，空氣清新，只是在3月份是否正值馬陸盛產期呢？真的是大隻的，和我們平常見到的種類很不一樣呢，有機會的話一定要去體驗看看。,3,1,0,,2022/03/01,0
風景和空氣都很好，只是不確定3月份是否是馬陸盛產期，它們的體型比平地上的更大，種類也不同，有機會的話可以去親眼體驗一下。,3,1,0,,2022/03/01,0
這裡的景色和空氣都相當優美，但3月份是否是馬陸盛產期呢？它們的大小與常見的品種截然不同，真的很值得親自前往體驗一番。 期待您的光臨！,3,1,0,,2022/03/01,0
這個季節的風景真的很美，空氣清新，但據說3月是馬陸盛產期，比一般的馬陸要大隻很多，如果有機會一定要去體驗看看。,3,1,0,,2022/03/01,0
感覺還有進步的空間，遊戲內容對於小孩來說稍嫌不足，讓人感到可惜。,3,1,0,,2020/03/01,0
覺得還有進步的空間，遊樂設施太少了，讓人有點遺憾。,3,1,0,,2020/03/01,0
覺得還有進步的空間，遊戲種類太單一了，有些可惜。,3,1,0,,2020/03/01,0
玩具種類太單一，感覺還有改善的空間，小孩子缺少更多元的遊戲選擇。,3,1,0,,2020/03/01,0
感覺還有提升空間，兒童玩具選擇有限，有些可惜。,3,1,0,,2020/03/01,0
該露營地不遵守規範，禁止卡拉OK並且管理不善，即使我們通知了營主也沒有得到積極處理。這明顯顯示此地管理不當。如果你想要一個品質好的露營地，這裡絕對不是推薦的選擇。,1,1,-1,,2023/12/01,0
這個露營地嚴格禁止卡拉ok，並且管理單位對此消極處理，顯示管理不善。推薦尋找其他具有品質的露營地，這個地方不值得推薦。,1,1,-1,,2023/12/01,0
管理不善，卡拉OK按規定禁止卻放任不管，營地主人反應冷淡，顯示不負責任的態度，若想找一個品質好的露營地，建議避開這裡。,1,1,-1,,2023/12/01,0
規定不允許卡拉OK，並且管理層反應不力，明顯管理不善。若想找到質量好的露營地，建議不要選擇這個地方。,1,1,-1,,2023/12/01,0
規範禁止卡拉OK，營主通知後並未果斷處理，顯示管理不善。若要尋找優質的露營地，不建議選擇此地。,1,1,-1,,2023/12/01,0
明明就明文規定禁止唱卡拉OK，但卻被某區營地放任晚上超過音量的噪音。其他人紀律守則遵守，卻被忽視，這樣其他人有什麼理由要遵守規則呢？,1,1,-1,,2023/12/01,0
該營地放任晚上唱卡拉OK的噪音，明明公告已經禁止，卻仍然被容忍。其他人為何要遵守規則？,1,1,-1,,2023/12/01,0
明明已經公告禁止唱卡拉OK，但某區營地卻讓人晚上唱超級走音的噪音，為什麼其他人還要遵守規則？,1,1,-1,,2023/12/01,0
明明在公告中明確禁止唱卡拉OK，卻容許某區營地在晚上唱出超級走音的噪音。其他人為什麼還要遵守規定？這不公平。,1,1,-1,,2023/12/01,0
雖然已經明確公告禁止唱卡拉OK，但卻讓某區營地在晚上隨意唱超級走音的噪音，這樣其他人為什麼還要遵守規則呢？,1,1,-1,,2023/12/01,0
經過仔細檢視其他遊客的評價後，對這個景點抱有高度期待，甚至事先向老闆確認了是否飄飄河都有開放。然而，讓我感到失望的是，只有A區有飄飄河開放，其他區域卻都沒有開放，這讓我感到有些失望。雖然沒有太多特別的地方，但我倒是發現他們的水廁都有安裝防蟲紗網，感覺還算貼心。,3,1,0,,2023/10/01,0
經過朋友推薦，我非常期待來這裡玩，但結果是有點失望。只有A區有飄飄河，其他區都沒有啟用，讓我感到有點失望。除此之外，沒有太特別的地方。不過，值得一提的是，他們的水廁裡有防蟲紗網，這點倒是挺貼心的。,3,1,0,,2023/10/01,0
看了大家的評論後，對這個地方抱有很高的期待，我也特地向老闆確認是否所有區域都開放了飄飄河，但結果只有A區有開放，其他區域根本沒有，讓我感到非常失望。除此之外，整體而言沒有特別的地方，水廁裡有防蟲紗網倒是蠻貼心的。,3,1,0,,2023/10/01,0
看了其他人的評論，對這個遊樂場有很高的期待，特地向老闆確認了飄飄河是否都有開放，但結果只有A區有，其他區根本沒有開放，感到非常失望。遊樂場沒有什麼特別的地方，唯一讓人感到貼心的是水廁裡有防蟲紗網。,3,1,0,,2023/10/01,0
我也有看到其他人對這個地方很期待，但實際去了以後發現只有A區有飄飄河開放，其他區根本沒有，感到相當失望。除此之外，沒有什麼特別的地方，只有一個小細節是水廁有防蟲的紗網，這個點倒是挺貼心的。,3,1,0,,2023/10/01,0
這個景點午後下起大雨後，整個場地都變得泥濘不堪，似乎砂石鋪得不夠多。不過，其他區域石頭鋪得比較多的地方倒是乾爽許多，設施整體還算不錯。特別適合有小孩的家庭，因為可以在這裡盡情玩水放電。水質清澈幽靜，似乎是山上直接流出來的。然而，這個季節可能會有水管裡的蝌蚪跑出來。到了晚上，景點周圍滿是各式各樣的昆蟲和蛾類，讓人有種獨特的體驗感。,3,1,0,,2023/06/01,0
午後一場大雨後，場地泥濘不堪，砂石鋪設明顯不足，造成步道泥濘難行。其他區域因石頭鋪設較多，狀況較為乾爽，設施整體表現尚可。特別是設有小水池供孩童戲水，水質清澈宛如山泉流出，但水道中偶有幼蟾蜍跳躍。夜晚時分，處處可見各種昆蟲和蛾類飛舞。,3,1,0,,2023/06/01,0
這個公園在下雨天的時候，場地都變得泥濘，砂石鋪得不夠多，導致地面很容易變得泥濘，不過其他區域石頭鋪得較多的地方倒是乾爽許多。另外，這裡的設施相當不錯，特別適合有小孩的家庭來玩水放電，因為水質很清澈，看得出是山上直接流出來的。不過要注意的是，這個季節水管中有蝌蚪會跑出來，晚上則會有許多昆蟲和各式各樣的蛾類出沒。,3,1,0,,2023/06/01,0
這個景點在午後經常下大雨，地面變得泥濘，缺乏足夠的砂石鋪設。其他區域鋪了更多的石頭，所以相對乾爽一些。儘管如此，其他設施還算不錯，特別適合帶小孩來玩水放電。水源來自山上流出，這個季節水管中還會有蝌蚪跑來跑去。晚上則有許多昆蟲和各種蛾類活動。,3,1,0,,2023/06/01,0
下午一場大雨，導致場地泥濘，顯示出砂石鋪設不足的問題。雖然其他區域石頭鋪得比較多，沒有受到太大影響，保持乾爽。其他設施表現不錯，特別適合帶小孩來玩水放電。水質清澈，應該是山上直接流下來的。在這個季節，水管周邊會有很多蝌蚪出現。夜晚則會聚集大量昆蟲和各種蛾類。,3,1,0,,2023/06/01,0
營主的朋友和營主一樣都非常友善和客氣，但最後一天在收拾的過程中，營地的員工並不盡如人意。他們將我們的洗碗精和菜瓜布誤放到垃圾桶裡，起初還否認，直到我們找營主後才去撿回給我們。他們收拾東西的速度也有點令人匆忙，讓我們感到壓力重重。另外，在露營營區附近的水域和廁所附近，經常能聞到濃厚的二手菸味，尤其提醒帶小孩來玩水的家庭需特別留意。另外，有營主的朋友帶著狗來露營，但卻讓狗亂拉大便而不加清理，同時也讓其他露營者忍受他們高聲播放音樂和喧鬧聲音，一直到半夜12點仍未停止。,1,1,-1,,2023/06/01,0
這個露營地的營主人為人十分好客，但最後一天收營的過程中卻遇到了一些小問題。營主的員工處理收東西的過程中，將我們的洗碗精和菜瓜布誤放進了垃圾桶，起初還推辭說沒有拿，直到我們向營主反映，員工才去垃圾桶找回給我們。他們在忙碌中收取物品時，有時候會忽略一些東西，不該認為不要就丟掉。此外，我們還遺失了一條延長線，詢問員工也不承認有收走，幸好找到營主朋友的幫忙才找回。值得注意的是，露營期間在水源附近或營本部附近都可能聞到濃烈的菸味，家長們帶小孩去玩水時要注意。另外，營主的朋友帶狗去露營，但狗主人卻讓狗亂拉大便而不清理，同時還要忍受他們吵雜的噪音，希望能夠提升一下管理與秩序。,1,1,-1,,2023/06/01,0
在同一區露營時，營主人非常友善，服務周到。不過最後一天在收拾物品時，遇到營地員工將我們的洗碗精和菜瓜布誤放進垃圾桶的情況。起初詢問時員工極力否認，直到我們找營主幫忙，才將洗碗精找回。另外一次我們的延長線差點就這麼不見，問員工卻得到否認的答案，最後才在共用空間找到。另外，在玩水區域附近總是充滿濃烈的二手菸味，建議家長們小心讓小孩遊玩。還有營主的朋友帶著狗在營地，可是狗主人卻讓狗亂拉屎，也不清理。此外，他們的吵鬧音樂和尖笑聲也持續到深夜12點。,1,1,-1,,2023/06/01,0
和營主的朋友一起露營在同一區域，營主人很好很客氣，但是最後一天在整理收拾的時候，營主的員工卻把我們的洗碗精和菜瓜布誤放到垃圾桶裡。起初問員工時，他們還死不承認有拿走，直到我們向營主求助後才找到。有時候可能因為工作忙碌而導致東西收遺漏，但員工應該更加小心。我們甚至在離開場地之前依舊找不到一條延長線，直到在共用空間找到才鬆了一口氣。希望在這類情況下，營地能更加仔細處理遺失物品的問題。此外，玩水區域附近總是飄散著濃濃的二手菸味，家長們帶著孩子遊玩時應該特別注意。另外，有帶狗去露營的人士，應該要負起責任，不應該讓毛小孩亂大便在別人的營區而不清理，這樣的行為真的缺乏尊重。同時，還必須忍受他們播放的難聽音樂和吵雜尖銳的笑聲，嚴重幹擾到其他露營者的休息，希望管理單位能有所規範。,1,1,-1,,2023/06/01,0
露營主人的態度真的很好，很客氣，但最後一天在收拾東西的過程中，營主的員工不夠誠實。他們把我們的洗碗精和菜瓜布丟進垃圾桶，一開始還矢口否認，直到我們找營主後才去找回來。在收東西的時候也有些不夠及時，導致我們差點找不到東西。另外，玩水區域附近總是飄散著濃濃的二手菸味，對於要帶小孩去玩水的家長來說需格外注意。還有在露營中讓寵物亂便並且不清理的行為，實在是讓人受不了。希望露營主人能夠注意這些問題並加以改進。,1,1,-1,,2023/06/01,0
這個地方環境很好，但是不停聞到有人在這裡吸菸，味道實在很難忍受！,1,1,-1,,2023/06/01,0
這個地方的水真的很美，可是周圍總是飄著煙味，令人非常噁心！,1,1,-1,,2023/06/01,0
這裡的風景美不勝收，讓人心情舒暢，但是週遭總是飄散著抽菸的味道，實在令人困擾！,1,1,-1,,2023/06/01,0
在這個美麗的環境裡，卻總是聞到周圍有人吸菸，讓人覺得很難過，因為煙味實在太過濃烈了！,1,1,-1,,2023/06/01,0
這裡的環境很棒，但總是聞到周圍有人吸菸，味道非常難聞！,1,1,-1,,2023/06/01,0
