content,rating,type,status,tokenization,publishedDate,origin
這個高海拔營區的山景很美，環境清幽，但可惜蒼蠅蚊蟲很多，讓人有點困擾。水槽的設計很不方便，必須一直彎腰操作，真的很辛苦。而且臺哥大訊號斷斷續續，讓人感到困擾。更糟糕的是，清晨6:45就開始除草，而且持續兩天，讓人無法好好放鬆，感到相當困擾。,2,1,-1,,2023/09/29,0
這個高海拔營區景色很美，環境清幽，但是蚊蟲太多了，讓人很困擾。水槽位置太低，需要彎腰非常費勁，而且手機訊號也很差，臺哥大的訊號斷斷續續。最讓人無法接受的是清晨6:45就開始除草，持續兩天，讓原本想放鬆的旅程完全被打亂。開了一長段山路到達，原想要放鬆，結果打擾持續，真的讓人無奈。,2,1,-1,,2023/09/29,0
這個高山露營區景觀優美，環境清幽，但卻受到大量蒼蠅和蚊蟲的幹擾。水槽位置很不方便，需要長時間彎腰取水，讓人感到相當辛苦。此外，臺哥大訊號斷斷續續，讓溝通變得困難。更令人無奈的是清晨6點45分就開始除草，連續兩天，讓想要好好放鬆的遊客無法好好休息，實在令人哭笑不得。,2,1,-1,,2023/09/29,0
這個營區真的名不符其實，白天蒼蠅成群結隊，晚上蚊子聚集不散，而且遇到大豪雨時帳篷竟然積水嚴重！向營主反映竟然只叫我們自己挖水線排水，完全沒有提供任何協助。營區裡的燒烤吃到飽更只是隨便弄弄，沒有任何質感可言。垃圾桶稀少，連廚餘桶都沒有，絕對不會考慮再次造訪。,1,1,-1,,2023/06/29,0
這個營地真的名不副實。白天蒼蠅肆虐，晚上蚊子成群，而且遇到大雨後帳篷竟然積水嚴重！營主的態度也很差，只叫我們自己去挖水線排水，完全沒有提供幫助。營區設施也相當簡陋，沒有足夠的垃圾桶和廚餘桶，烤肉吃到飽更是隨便弄弄，完全沒有質感。這次的體驗讓人完全不想再去第二次。,1,1,-1,,2023/06/29,0
這個營區真的太失望了！白天蒼蠅飛來飛去，晚上蚊子又多又煩人。當我們6/10去時，竟然碰上大雨，帳篷全都積水，營主只叫我們自己排水，一點維護都沒有。烤肉吃到飽更是草率，完全沒有品質可言。垃圾桶稀少，連廚餘桶都沒有幫忙處理，絕對不會再考慮第二次光顧這個地方。,1,1,-1,,2023/06/29,0
這次露營經驗真的讓人大失所望，白天蒼蠅成群，晚上蚊子又多，到了下大雨還在帳篷積水，營主的態度更是讓人氣憤，要我們自己動手排水。營區裡垃圾桶稀少，連廚餘桶都沒有，烤肉吃到飽更是草率隨便。整體環境濕濕答答，絕對是個避之唯恐不及的地方，絕對不會考慮再次造訪。,1,1,-1,,2023/06/29,0
這個露營地名符其實，但實際經驗卻太過離譜。白天蒼蠅盤旋不止，晚上又被蚊子叮咬，還遇到大豪雨讓帳篷積水。營主對此只是叫我們自行挖排水溝，完全沒有提供幫助。營區設施簡陋，燒烤吃到飽也沒有品質保證，只是隨便搞搞。更糟糕的是，垃圾桶稀少，連廚餘桶都沒有。總結來說，這次的露營體驗令人失望，絕對不會考慮第二次前往。,1,1,-1,,2023/06/29,0
這個露營區的廁所味道實在太臭了！我在很多露營區都待過，但沒有一個比這個更臭的。甚至比公園的廁所還要臭！而且上一個人離開時垃圾桶已經滿了，但營主還沒有派人來清理（我們傍晚5點才到）。我打電話給營主，他說等等會派人來收拾，但結果到我們第二天要離開時還是沒有人來清理。這讓我覺得營主經營營區的態度不夠用心。雖然營區的景色很漂亮，但是路程遙遠且非常難開。如果是第一次露營的話，建議還是找其他營區，會有更好的設施、更快到達，同時還能欣賞美麗的景色。,2,1,-1,,2023/02/28,0
這個露營區的廁所超級臭，我去過很多地方，廁所也從來沒這麼臭過，比公園廁所還要臭！我們抵達時，看到垃圾桶已經滿了，打電話給營主，他說會派人來收，但我們隔天要離開時，垃圾桶還是沒有被清空。感覺營主對經營營區沒有下足心思。景色雖美，但路途遙遠且難開，對於第一次露營的人來說，還是建議找其他營區，會有更好更方便的選擇。,2,1,-1,,2023/02/28,0
廁所超臭，我去過很多露營區的廁所都沒這麼臭，比公園廁所還臭。上一個人走了之後，垃圾桶都滿了，營主還沒來收（我們傍晚5點才到）。打電話跟營主講，他回應等等派人來收，結果到我們隔天要走了都還沒人來收，感覺不到用心在經營營區。景雖好看，但路超遠超難開。第一次露營的話，還是找其他營區吧，會有更好更快到的地方，景色也很漂亮。,2,1,-1,,2023/02/28,0
廁所臭到讓人無法忍受，比其他露營區的廁所還要臭。即使有垃圾桶滿了，營主也沒有及時清理。儘管我們在傍晚5點抵達並打電話給營主，但到隔天我們離開前，垃圾桶依然未清理。營主經營營區時似乎缺乏用心，儘管景色優美，但卻難以到達。對於第一次露營的人來說，或許應該考慮尋找其他更好的露營區，既開車較快抵達，景色也更宜人。,2,1,-1,,2023/02/28,0
這個露營區的廁所簡直是超級臭，比我去過的任何一個露營區都還要臭，甚至比公園的廁所還要臭！而且上一個使用者走後，垃圾桶都是滿的，營主居然還沒有人來清理（我們傍晚五點才到）。我打電話給營主，他只是說等一下，派人來收，結果到我們第二天要離開時，還是沒有人來清理。感覺營主根本沒用心在經營這個營區。雖然景色很美，但是路程卻非常遙遠且難以開車。如果是第一次露營的話，還是建議找其他營區吧，肯定會有更好、更快抵達的選擇，同時景色也同樣精彩。,2,1,-1,,2023/02/28,0
訂位時詢問是否提供公司報帳的收據，對方表示有提供並要求提供統編與抬頭，但到了當天卻推託著不給，最後聲稱會快遞寄送，卻一直沒有收到。之後詢問也不獲回應，非常不負責任。此外，座位前方擋住了美麗的山景，擺放著一個大橘色水桶，讓人無奈。洗手槽也難以使用，三天下來洗碗盤讓每個人都快斷腰。,1,1,-1,,2023/02/28,0
這家餐廳在訂位時承諾提供公司報帳的收據，要求提供統編和抬頭，但最後卻一再推託並未如約提供。此外，餐廳的位置安排也不佳，一個大水桶擋住了美麗的山景，讓人無法欣賞。而且，水槽裝置不易使用，洗碗成為一大困擾。整體來說，服務不負責任，令人失望。,1,1,-1,,2023/02/28,0
該家餐廳在我們訂位前表示可以提供公司報帳的收據，要了統編和抬頭等資料後卻一再推託，最後甚至沒有寄出。無論詢問幾次都不得到回應，讓人感到非常不負責任。另外，餐廳的營位前擺放了一個巨大的橘色水桶，擋住了原本美麗的山景，令人無言。洗碗盤時使用的水槽也非常不方便，讓我們每個人腰痛不已。,1,1,-1,,2023/02/28,0
這家餐廳在我訂位前承諾可以提供公司報帳的收據，要求了統編和抬頭資料，但當我詢問索取時，卻開始推託並最終說會快遞寄給我，卻遲遲未收到，後續詢問也一直不得回覆，讓人覺得非常不負責任。此外，營位前擋著一個超大橘色水桶，擋住原本美麗的山景，讓人無言。另外，水槽也難以使用，整個三天下來每個人為了洗碗盤都感到腰都快斷了。,1,1,-1,,2023/02/28,0
訂位時詢問是否可以提供公司報帳的收據，對方保證可以，要求提供統編和抬頭資訊。然而當天要求索取收據時卻推託不給，最後還承諾快遞寄送卻未如約寄送，後續詢問也都被忽略，非常不負責任。此外，座位前擋著巨大的橘色水桶，擋住本應美麗的山景，讓人無言。水槽設計也不方便使用，洗碗盤的過程讓人腰部很不舒服。,1,1,-1,,2023/02/28,0
這條山路實在是太難開了，有90彎80拐，大約在下午兩點左右上去一段山路時，霧氣濃厚到完全看不到前方。只能依靠地上的白線前進，相當恐怖。露營地上有很多蟲，而且洗澡得等到晚上六點以後才有熱水。廁所算是乾淨，但仍然有原始的感覺。已經支付過費用，離開前還被再次要求繳款，好像管理混亂，搞不清楚哪些已經付費。,3,1,0,,2023/02/28,0
這條山路真的太難開了，有90彎80拐，而且兩點左右上去的時候霧氣很濃，根本看不到路，只能跟著地上的白線行駛，十分恐怖。露營地裡面蚊蟲特別多，洗澡要等到晚上六點以後才有熱水，而且只有冷水的話就只能硬著頭皮淋浴。廁所還算乾淨，但是設施還是比較原始，使用起來不是很方便。已經支付過費用，但離開前還有人來再次收費，好像搞混了哪些已經繳納過了。,3,1,0,,2023/02/28,0
這條山路實在太難開了，共有90彎80拐，而且兩點左右上去的某段路段霧氣濃厚到看不到前方，只能靠著地上的白線前進，實在太可怕了。露營地裡有許多蟲子，而洗澡只能等到晚上六點之後才有熱水，廁所也相對乾淨但較為原始。此外，我們已經支付了費用，但離開時還有人來收費，似乎搞不清楚哪些地方已經付費了。,3,1,0,,2023/02/28,0
山路實在太難開了，有90彎80拐，而且某段路段霧氣太濃，完全看不到前方，只能跟著地上的白線前進，相當恐怖。露營地上，蟲子真的很多，洗澡只能等到晚上六點後才有熱水可以用，而廁所雖然算乾淨，但也有些原始的感覺。更另人在意的是，明明已經付過錢，卻在離開前再次被收費，好像管理上有些混亂，不清楚哪些已經給過錢了。,3,1,0,,2023/02/28,0
那條山路真的超級難開，有90彎80拐，而且某一段山路的霧氣非常濃密，幾乎看不到前方，只能依靠地上的白線前進，情況相當危險。露營地裡有很多蟲子，洗澡得等到晚上六點以後才會有熱水，營地的廁所算是乾淨但偏向原始。更為糟糕的是，已經支付過費用，離開前還有人來收費，顯然搞不清楚哪些早已支付了。,3,1,0,,2023/02/28,0
整個營區從頭到尾都沒看到任何人，一進來就像是完全沒有營業的樣子，蟲和跳蚤簡直是爆炸性的存在，現在還在瘋狂搔癢。,2,1,-1,,2023/02/28,0
整個營區從進門開始就沒看到一個人，完全沒營業的感覺，而且蟲和跳蚤多到讓人瘋狂，現在還一直癢得不得了。,2,1,-1,,2023/02/28,0
整個營區從頭到尾都沒有見到任何人，進去的時候就感覺像是沒在營業一樣，周圍到處都是蟲和跳蚤，讓我每晚都被叮咬。身體還一直癢，實在太讓人困擾了。,2,1,-1,,2023/02/28,0
從頭到尾都沒看到工作人員，進入營區時感覺就像是沒在營業一樣，蟲和跳蚤的確太多了，到現在身體還在癢。,2,1,-1,,2023/02/28,0
整個營區從頭到尾都沒看到一個人，一進去就覺得像是沒有營業的樣子，蟲和跳蚤多到讓人毛骨悚然，我都還未停止癢呢。,2,1,-1,,2023/02/28,0
尋求高品質露營體驗的露友應該避免這個地方。在凌晨三點時，營區內有其他露友大聲喧嘩，高分貝的笑聲和尖叫不斷，甚至有人高歌彈吉他，已經持續了將近四個小時。儘管我們和營區管理反映了這個情況，但沒有任何改善。當我們試圖勸阻他們時，反而遭到惡言相向。此營區缺乏音量管制政策。此外，前往此營區的路程非常艱險，不要完全依賴Google導航，因為它可能會引導你進入危險的私人土地。,1,1,-1,,2022/02/28,0
尋求高品質露營體驗的朋友應避免這個地方。在凌晨3:00時分，露營區內其他露友喧鬧不安，大聲尖叫嬉笑，漠視他人的存在，甚至還有人彈吉他高歌，已經持續近四個小時，反應給營區管理者後仍未見改善，試圖勸阻卻遭遇惡言相向，營區明顯缺乏音量管制政策。此外，前往露營區的路程相當崎嶇困難，建議不要完全依賴Google導航，以免誤入危險的私人土地。,1,1,-1,,2022/02/28,0
尋求高質素露營體驗的露友應該避免這個地方。在凌晨三點的時候，營區裡其他露友大聲吵鬧，尖叫嘲笑聲不斷，漠視他人彈奏吉他並高聲歌唱，已經持續了近四個小時，即使向營地管理者反應情況也沒有改善。當自己試圖善意提醒時卻遭到言語攻擊，這個營區缺乏噪音控制政策。另外，到達營區的路途崎嶇且艱難，不要完全依賴Google地圖導航，可能會誤入危險的私人土地。,1,1,-1,,2022/02/28,0
適合喜歡狂歡的露友，非常不推薦給那些尋求高品質露營體驗的人。在凌晨3:00，營區傳來其他露友們大聲喧嘩、高分貝的嬉笑尖叫聲，甚至有人不顧他人彈吉他高歌，已經持續了將近四個小時。儘管向營主反應，卻依然沒有得到改善，自行勸阻還引來惡言相向。此外，營區並沒有音量管制政策。至於前往營區的路程，非常崎嶇難行，不要完全依賴Google導航指引，因為它可能會將您引導至危險的私人土地。,1,1,-1,,2022/02/28,0
這個露營營區讓人非常失望，想要享受高品質露營體驗的露友最好不要來。在凌晨3:00時，其他露友在營區大聲喧嘩，嘻笑尖叫，甚至不尊重他人還拿著吉他大聲唱歌，整整持續了將近四個小時。即便向營主反應了問題，卻依然得不到改善，營區完全沒有音量管制政策。此外，前往營區的路程非常崎嶇難行，不要依賴Google導航，可能會誤導你到危險的私人土地上。希望營區能夠改善管理，提供更好的露營環境。,1,1,-1,,2022/02/28,0
露營那幾天非常不舒服，營地人潮擁擠，沒有計畫收費上限，讓整個環境感到混亂。洗完碗盤使用水泥構築的水槽，設計不良讓髒水濺到衣服上。而廁所更是令人作嘔，三天兩夜沒有清潔過，導致髒汙累積到難以忍受的程度，女廁唯一的馬桶漏水，讓地面變成一條黑線，根本想都不敢想要使用。這樣狀況下，即便是有無限量的烤肉大餐，也無法好好享受，整個體驗都變得相當糟糕。,2,1,-1,,2022/02/28,0
這次露營的烤肉大餐真的很美味，可惜其他方面實在令人失望。營地人潮擁擠，收帳沒有明確上限規定，讓整個氣氛感到混亂不便；洗碗槽周圍的水泥設計不良，搖搖欲墜的洗碗臺給人不安的感覺，洗碗時水還會濺到身上；廁所更是讓人感到不舒服，三天兩夜沒有清潔一次，堆積的垃圾和髒汙讓人難以忍受，最可怕的是女廁所唯一的馬桶地面流出汙水...這些惡劣的衛生狀況讓我害怕大吃大喝，因為根本不敢輕易上廁所，烤肉大餐美味也無法好好享用。希望管理單位能夠改善這些問題，讓露營環境更加舒適衛生。,2,1,-1,,2022/02/28,0
營地的設施不盡完善，例如收帳上限沒有規劃好，造成擁擠的情況。洗槽水泥設計不良，容易弄髒衣服。廁所髒汙不堪，女廁的馬桶地面更是讓人無法忍受。這些問題讓人無法盡情享用烤肉大餐，也讓整個露營體驗變得不如預期。,2,1,-1,,2022/02/28,0
露營地的環境很差，不僅沒有規劃好收帳上限，讓人感到擁擠不舒適；廚房的水槽用水泥搭建，設計不良，洗碗時髒水會濺到衣服上；廁所更是糟糕，三天兩夜都沒有清潔過，髒汙滿地，女廁馬桶漏水，整個廁所充滿惡臭，讓人不敢來第二次。這樣的環境讓人不敢大吃大喝，以免髒汙流到食物上，即使是烤肉大餐也無法盡情享用。,2,1,-1,,2022/02/28,0
營地的環境擁擠，沒有管理好收帳上限，讓人感到困擾。洗碗槽用水泥搭建，設計不良，容易讓髒水濺到衣服上。廁所已經三天兩夜沒有清洗過，髒汙堆積，女廁唯一的馬桶地面更是因為漏水而變得非常骯髒。在這樣的環境下，不敢大吃大喝是因為害怕上廁所，即使有烤肉大餐吃到飽也難以盡情享用。這些問題讓我毫不猶豫地決定不再光顧這個地方。,2,1,-1,,2022/02/28,0
這次露營經驗真的很糟糕。抵達營區後，營主安排我們在某個位置搭設帳篷，但突然要求我們換位置，理由是還有另一組客人要搭設七個帳篷，空間才夠。我們感到非常生氣的地方在於營主超收營位，造成空間不夠，而且已經安排好的情況下臨時要求我們換位，我們當然不同意這樣的要求。後來發現七組客人並不在意這樣的安排，於是我們決定不再計較，保持開心的心情繼續享受露營。然而，晚上聽到營主專程找來那七組客人說「不好意思，因為那組客人不讓位，所以只有這樣的空間」，這真的讓我氣憤不已。從頭到尾都是營主方面沒有搞清楚營位數量，甚至超收費用，卻把責任推給我們不讓位。更糟糕的是，營主的一席話讓那七組客人對我們產生不滿，甚至公然計劃吵鬧以抗議。這種處理方式讓我非常失望，為什麼只有七組客人才被重視？未來絕對不會再造訪這個地方。值得一提的是，老闆娘倒是非常友善親切。,1,1,-1,,2022/02/28,0
這次露營經驗真是糟糕透頂！我們到達營區後，營主先安排了一個位置給我們搭帳篷，結果等我們搭好後，營主突然要求我們換到另一個位置，“因為還有一組客人要搭7帳，空間不夠了”。我們非常生氣的原因是，營主明明收了超額的費用，導致空間不足，而且我們已經安排好了位置，卻被臨時叫去換。我們拒絕了這個要求，後來發現那組客人也無所謂，於是我們原本都沒問題了並繼續保持開心心情。然而到了晚上，聽到營主專程去和那組客人說“不好意思，那組客人不願意讓位，所以只能這樣了”，這訊息真是讓我們感到為難。從頭到尾都是營主這方搞錯了營位情況，卻把責任推到我們身上，這讓我們感到很委屈。更讓人氣憤的是，因為營主和那組客人說了什麼，讓他們對我們產生不滿，並暗中計劃要吵我們一整晚。這種不公平的對待讓我們覺得非常失望，只有那一組客人才受到特別的照顧嗎？才是真正的客人嗎？總之，這樣的經驗讓我們決定再也不會來這個地方了，真是太糟糕了！不過撇開這些負面經驗不談，老闆娘倒是非常友善親切！,1,1,-1,,2022/02/28,0
"這次露營真的是經歷了一場糟糕的旅程。到了營區後，營主安排我們在某個位置搭起帳篷，但等我們快完成時，營主突然要求我們換位置，聲稱是因為有另外一組客人要搭建7帳，空間才夠。我們感到非常氣憤，一來是營主超收營位導致空間不夠，二來是我們已經安排好的情況下臨時叫我們換位，我們並沒有同意這樣的要求。更讓人生氣的是，後來那組客人也並不在乎這樣的安排，最後只是讓我們感覺好像是我們在影響了空間分配一樣。

到了晚上，我們聽到營主特地下來向那7組客人道歉，並說是因為我們不願意讓位，所以讓他們的空間變小。這讓我們非常不滿，因為從頭到尾都是營主沒有好好安排營位，甚至超收，卻把責任推給了我們。更糟糕的是，因為營主的一席之言，讓那組客人對我們產生了不滿，甚至公然表示要吵到隔天，讓我們感到非常氣憤。難道只有那7組客人才值得被接待？才是真正的客人嗎？這樣的體驗讓我下次絕對不會再來這個地方。

雖然整體經驗很糟糕，但要提一提的是，老闆娘非常好也很親切。",1,1,-1,,2022/02/28,0
這次露營經驗真的令人沮喪。當我們剛抵達營地時，營主安排了一個位置給我們搭建帳篷，但突然之間要我們換位，原因竟是營位超收。更令人生氣的是，後來那7組客人並不介意我們留在原本的位置。營主應該先搞清楚營位數量，而不是一錯再錯。晚上聽到營主對那7組客人大言不慚，讓他們誤以為是我們不讓位，引起了不必要的誤會和不滿。這種處理方式實在讓人氣憤，並讓我們對這個地方失去了信心。唯一的好處就是老闆娘很親切。,1,1,-1,,2022/02/28,0
這次旅程真的很糟糕，我們到達營區後本來安排好位置搭好帳篷，卻突然被要求換位。營主超收營位，最後還怪我們不讓位給其他客人，讓我感到非常氣憤。更糟糕的是，營主還在背後說我們的壞話，讓其他客人對我們產生不滿。這種待遇讓我決定以後再也不會來這個地方了！但幸好老闆娘還算是很好很親切。,1,1,-1,,2022/02/28,0
如果可以的話我會給零分。這個地方真的很差勁。然而，通往露營地的道路維護得相當不錯，但這個地方沒有其他讓我驚艷的地方。他們對待顧客的態度非常糟糕。我們預訂了一個有10個帳篷的區域，但最後我們被擠在一個狹小的空間裡，與其他14個帳篷面對面，讓空間變得非常狹窄！當其他露營者也到達時，他們也面臨同樣的問題：哪裡可以搭建帳篷？因為每個帳篷之間幾乎沒有距離。最糟糕的是，當我們試著聯絡業主時，他們根本聯絡不到！而且他們也沒有每天清空垃圾桶，讓這裡成為蒼蠅聚集的天堂。,1,1,-1,,2022/02/28,0
這個地方的管理很糟糕，我會給零分評級。道路通往營地的維護不錯，但其他方面都讓人印象深刻。客人的組織非常混亂，我們原本的10個帳篷空間，最終變成了14個帳篷擠在一個小區域，非常擁擠！每個帳篷幾乎是面對面的擺放，其他新露營者也遇到同樣的問題，無法找到搭建帳篷的地方。而且業主幾乎無法聯絡上，每天也不清理垃圾箱，吸引了許多蒼蠅。這裡的經營真的有待改善。,1,1,-1,,2022/02/28,0
這個地方真的很不推薦。經營管理得很亂，沒有令人印象深刻的地方。唯一值得一提的是通往營地的道路保養得很好。但是整個露營場地的規劃非常混亂，我們原本應該有10個帳篷的區域，最後卻擠進了另外14個帳篷，空間非常狹窄。幾乎每一個帳篷都是貼在一起，新來的露營者也會陷入同樣的困境，沒有足夠空間搭建帳篷。更糟糕的是，業主根本聯絡不上，每天也不清理垃圾桶，吸引了許多蒼蠅。這裡真的是個糟糕的體驗。,1,1,-1,,2022/02/28,0
這個營地實在是糟糕透頂，如果有其他選擇的話，我絕對不會再來這裡。雖然通往營地的道路維護得不錯，但其他方面幾乎毫無亮點。他們的客戶服務實在太差勁了。我本來預訂了一個有10個帳篷的區域，最後卻被擠進了一個只能容納14個帳篷的空間，讓空間變得相當擁擠！每個帳篷都幾乎是面對面擺放，新來的露營者也因此面臨同樣的問題，找不到足夠的空間搭建帳篷。最糟糕的是，業主幾乎永遠打不通電話，無法解決問題。而且他們也不定時清理垃圾箱，讓蒼蠅成群結隊。總之，這是一個讓人極度失望的露營地。,1,1,-1,,2022/02/28,0
這個地方真的讓人印象深刻，但不是因為好的原因。除了通往營地的道路維護得很好之外，其他一切都很失望。他們的服務管理非常差，我們被安排在一個只能容納10個帳篷的區域，最後卻要和其他14個帳篷擠在一起，狹小得讓人窒息！每個帳篷都面對面，讓新露營者幾乎無法找到放置帳篷的位置。而且要聯絡業主也是一件不可能的任務！垃圾桶也沒有定時清理，吸引了許多蒼蠅。總的來說，選擇這個地方實在是個大錯誤。,1,1,-1,,2022/02/28,0
哇～～連假真的是開心出門，來到這個名字取得相當貼切的太離譜營區。營主真的是厲害，自己超收營位，明明標榜只收10個帳篷，但原本已經有6個帳篷在營位，他還接受了一組有7個帳篷和2個客廳帳篷已經搭好的大組。當我們拒絕搬位後，晚上他又特地來跟那組大組說營主：因為他們不讓位，所以只能這樣做，真是不好意思。營主真是厲害，把超收變成因為我們不讓位的好人，全都讓給他當餒^^,1,1,-1,,2022/02/28,0
唉呀，太離譜營區真是名副其實啊！營主竟然自作主張超收營位，明明標榜只收10帳，卻硬是接了一組7帳2客廳帳的帳篷，還硬要我們搬位。我們當然拒絕了，結果晚上竟然跑來向那組「大組的」解釋說我們不讓位位置只能這樣。營主這伎倆真是高明，竟然把超收變成了因為我們不讓位的好理由，真是好厲害啊！讓人感受到好人都當餒的感覺。,1,1,-1,,2022/02/28,0
