content,rating,type,status,tokenization,publishedDate,origin
新營區的場地較小，建議包場較佳。熱水很不賴，但蓮蓬頭角度不太好。草皮很不錯，尤其包場靠近廁所位置很方便。不過我們訂得比較邊邊，沒有享受到草地的好處。場地規劃還在進行中，我們的位置還在工程中，草皮還在長，且缺乏明顯的垃圾桶，必須自行處理廢物。洗手檯位置偏遠，也沒有廚餘桶，只能找別的區域處理，而裡面卻滿是垃圾！電源供應也有點特別，需要每四小時按一次充電柱，幸好我們去的不是夏天，不然恐怕會受不了熱。我們碰巧遇到隔壁民宿開趴，整晚都聽得到歌聲，不太安寧，甚至清晨還有重機飆車聲，早晨還有狗叫雞啼聲，相當特別的體驗。老闆待人熱情且客氣，會教如何炒咖啡豆，也分享附近景點，並推薦觀賞星空的好地點。,3,1,0,,2023/03/08,0
新營區，強烈建議包場，因為場地不太大。熱水非常好，但是蓮蓬頭的角度有些微妙。我們沒有包場，位置比較靠邊，可惜沒有享受到靠近廁所草皮好的位置。設施規劃還不夠完善，草皮還在長，沒有明顯的垃圾桶，要自己搬空籃子，洗手檯和廚餘桶也都不夠。電源使用也蠻特別的，要四小時按一次充電柱，幸好不是夏天，不然會很熱。隔壁有民宿開趴，山谷裡充滿歌聲，歡唱到凌晨，甚至出現重機車飆車，早上還有狗吠雞叫，蠻獨特的經驗。老闆很熱情客氣，教我們炒咖啡豆，分享附近景點和星空。,3,1,0,,2023/03/08,0
這個新營區非常值得包場，因為場地不大。熱水設施很棒，但蓮蓬頭的角度有點微妙。我們包場的位置靠近廁所，草皮的品質非常好。不過很可惜我們沒有好好享受到草皮，因為我們訂的位置比較邊邊。整個區域的規劃還不夠成熟，顯然還在持續改善當中。我們的包場位置比較靠邊，草皮還在長，缺乏明顯的垃圾桶，需要自己到遠處搬空籃子。洗手檯的位置也很邊邊，而且沒有垃圾桶，只好使用其他區域的設施，發現裡面都是垃圾。電源的設定也很特別，每四小時才能按一次充電柱，如果是夏天應該會很煩人。我們碰巧遇到隔壁民宿在開趴，整個山谷都是歌聲，歡唱一直到凌晨，接著又出現了重機車在山谷飆車，早上還有狗吠雞叫，是一個非常特別的經驗。老闆非常熱情且客氣，會教我們炒咖啡豆，也分享了附近的景點，還有美麗的星空。絕對會推薦這個地方給其他人。,3,1,0,,2023/03/08,0
新營區是一個非常建議包場的地方，因為場地並不大。雖然熱水很棒，但蓮蓬頭的角度稍微有些微妙。靠近廁所的包場位置草皮很不錯，但可惜我們沒有機會享受到，因為我們訂的位置比較邊緣。目前規劃還不夠成熟，看得出來仍在建設中，我們的位置偏邊緣，草皮還在長，也沒有明顯的垃圾桶，需要自己去搬空籃子，洗手檯位置也有些邊緣，沒有廚餘桶，只好去其他區使用，結果裡面都是垃圾！電源的設計也很特別，需要每四小時按一次去充電柱，還好我們去的不是夏天，否則應該會很熱。我們碰巧遇到隔壁民宿開趴，整個山谷都充滿歌聲，歡唱一直持續到深夜，接著又有人開始在山谷飆車，清晨又傳來狗吠雞鳴，是一個相當特別的體驗。老闆待人熱情且客氣，他不僅會教我們如何炒咖啡豆，還會分享附近的景點，還有美麗的星空。,3,1,0,,2023/03/08,0
新營區，強烈建議包場比較好，場地不算很大。熱水裝置很棒，但蓮蓬頭的角度有點微妙。包場靠近廁所的位置草皮質感不錯，可惜我們訂的位置比較邊緣，沒有享受到。規劃還在進行中，我們的位置草皮還在長，缺乏明顯的垃圾桶，需要自己去搬空籃子，使用洗手檯也很偏邊，沒有廚餘桶，得到其他區域去使用，發現裡面都是垃圾。電源的使用也蠻特別的，需要四小時按一次充電柱，還好不是夏天，不然會很熱。碰巧隔壁民宿開趴，整個山谷都是歡唱聲，持續到深夜，接著出現重機車飆車，早上則是狗吠雞鳴，是相當特別的體驗。老闆非常熱情且客氣，會教導烘焙咖啡豆，分享附近景點以及觀賞星空。,3,1,0,,2023/03/08,0
員工可能在放假期間沒有打掃廁所。當營位已滿，廁所清潔頻率應增加，尤其是在對外開放花園收費的情況下。228連假期間直到結束前，廁所都沒有人打掃，而且打掃表仍停留在2/26...,3,1,0,,2022/03/02,0
228連假期間，負責掃廁所的員工可能也在休假。當所有營位都已被預定滿員時，廁所清潔的頻率就應該增加，尤其當還有遊客需要購買花園門票進入。直到228連假結束，廁所依然沒有人來清潔，而掃廁所的計畫表仍停留在2月26日。,3,1,0,,2022/03/02,0
連假期間掃廁所的員工可能也會休假。當露營地全部設位都已滿，廁所清潔頻率應該增加，尤其是還有收取花園門票的情況下。然而，在228連假期間直到撤營時，廁所仍無人打掃，甚至連打掃紀錄表都還停留在2/26這天。,3,1,0,,2022/03/02,0
這個連假期間，廁所打掃員工可能也享受假期去了。當營位滿員的時候，廁所清潔的頻率就應增加，尤其還有對外開放花園收費。然而，在228連假期間，直到結束開門前這間廁所都沒有人打掃，甚至打掃記錄都停留在2月26日...,3,1,0,,2022/03/02,0
在連續假期時，負責清潔廁所的員工也有可能會放假。當露營區的營位都被訂滿時，廁所清潔的頻率就需要增加，尤其如果還有對外開放花園門票的話。然而，進入228連假後，直到結束露營區撤銷期間，廁所都沒有人來清潔，連清潔表都停在2/26那一天。,3,1,0,,2022/03/02,0
我們在假日支付1500元營地費用，希望能夠享受到穩定的電力供應以及有效的危機處理能力。然而，遇到電力不穩、甚至完全斷電的情況，無法使用甚至是連LED燈條都無法運作，而且這個問題持續了兩天都未得到修復。對於這樣一個價格為1500元的營地，我們期待它擁有足夠可靠的電力系統和危機處理能力。,3,1,0,,2021/01/03,0
對於一個假日營地收取1500元的帳篷費用，我們期望他們具有可靠的電力系統和危機處理能力。我們在那裡露營了三天兩夜，並沒有使用高功率的電器，但電力卻非常不穩定(甚至無法使用連LED燈條)，而且整個兩天都沒有修復。對於一個收費高達1500元的假日營地，我們實在期待他們應有更為可靠的電力系統和危機處理能力。,3,1,0,,2021/01/03,0
對於花費1500元一晚的假日營地，我們期待有穩定且可靠的電力系統，同時也期望他們具備應對危機的能力。不過，在我們露營的三天兩夜中，即使我們沒有使用高功率電器，卻發現營地的電力非常不穩定，甚至出現長時間供應中斷的情況，連一般的LED燈條都無法使用。更糟糕的是，這個問題持續了兩天，卻並未得到修復。對於一個收費如此昂貴的營地來說，這樣的電力系統表現實在令人失望，他們應該要提供更可靠的服務才是。,3,1,0,,2021/01/03,0
對於假期一帳1500元的營地，應該提供穩定的電力系統和優秀的危機處理能力。當露營三天兩夜，即使沒有使用高功率電器，卻遇到電力不穩甚至完全斷電的情況，且營地方維修久拖不解，這樣的狀況實在無法讓人滿意。對於付出1500元的費用，我們應該得到更好的服務和設施保障，期待營地能提供更可靠的電力供應和更有效的危機應變措施。,3,1,0,,2021/01/03,0
在假日一帳1500元的營地，我們期待有可靠的電力系統與危機處理能力。然而，在露營的三天兩夜中，我們並未使用高功率電器，但卻遇到電力不穩的情況，甚至連使用LED燈條都難以實現。最讓人失望的是，營地在兩天的時間內都未修復電力問題。對於付出1500元的營地費用，我們希望可以享受到穩定的電力供應，以及營地應對突發情況的能力。,3,1,0,,2021/01/03,0
這個地方真的太差了，服務態度很差，連個問問題的視窗都沒有，設施完全不到標準，只知道收費，其他事情都不管了，晚上十點還沒有路燈可以指引去廁所的路。,2,1,-1,,2020/08/18,0
這家服務真的很糟糕，完全沒有效率，裝置也一塌糊塗，只關心收費，其他一概不管，晚上十點之後甚至沒有路燈，連上廁所都不方便。,2,1,-1,,2020/08/18,0
這個地方太糟糕了！服務超級差，根本不理會人，連基本設施都沒有，只知道向客人收費就完事了。晚上十點以後，連廁所都找不到，路燈都沒亮。簡直無法忍受！,2,1,-1,,2020/08/18,0
這個地方簡直爛透了！服務不好，沒有人理你，裝置還不到標準，只知道收錢，其他事情都不管。再晚到了十點，連廁所的路燈都沒有開。,2,1,-1,,2020/08/18,0
這裡真的很糟糕，服務不好，一點也不貼心，裝置老舊沒有任何更新，只知道向客人收費，其他的事情全都不管，晚上十點以後，連廁所都找不到路燈照明。,2,1,-1,,2020/08/18,0
露營地點滑草很棒，小朋友玩得很開心。營主非常熱情，甚至派人巡邏維護衛浴設施，還親切地招待我們吃香蕉。但線上上訂位時沒仔細看到注意事項，才知道需包場需另外聯絡營主。跨年期間有許多營友一起度過，半夜在滑草區樂聲不斷，為跨年增添了不少氣氛。絕對是一個超棒的跨年露營體驗！,3,1,0,,2024/01/03,0
線上訂位僅提供部份營位預訂，如需包場，請直接聯絡營主。我們在那裡享受到了滑草的樂趣，小朋友玩得很開心。營主非常熱情，衛浴也很乾淨，甚至還有人定期巡邏清潔。我們還被邀請吃香蕉！當時沒有留意到網站的提示，因此在跨年夜遇到了很多其他露營者一起慶祝跨年，半夜時甚至有人在滑草區營地附近歡聚歡呼，為跨年增添了不少熱鬧的氛圍。非常棒的體驗！,3,1,0,,2024/01/03,0
線上訂位要注意，只有部份營位可以預訂，若需包場，請聯絡營主。孩子們在這裡玩得非常開心，尤其是滑草區讓他們著迷。營主服務熱情，甚至有人巡視衛浴區、清理垃圾，甚至還招待我們吃香蕉。我們原本沒注意到網頁上的注意事項，結果在此跨年露營時碰巧與其他營友相聚，半夜還有人在滑草區扎營並歡呼跨年，為夜晚增添了更多歡樂氛圍。超級棒的體驗！,3,1,0,,2024/01/03,0
營地提供的滑草設施非常棒，小孩們玩得非常開心，營主也非常熱情。衛浴和垃圾清理都有專人負責，甚至還提供香蕉給我們。但如果要包場，需要直接聯絡營主，這是我們在訂位時沒有留意到的地方。我們意外地和很多其他露營者一起度過了跨年，半夜甚至還有營友在滑草區紮營嚎叫，為跨年增添了不少氣氛。整體來說，是一次非常棒的體驗！,3,1,0,,2024/01/03,0
很喜歡這裡的滑草設施，小朋友玩得非常開心！營主待人熱情周到，甚至有專人清潔衛浴及垃圾，還貼心的招待我們吃香蕉。我們原本打算跨年露營，卻沒留意到網站訂位時提到【請注意!!】僅提供部份營位預訂，若要包場需另外聯絡營主。結果跨年當天遇到許多其他營友也一起來露營，甚至有半夜在滑草區紮營的營友們歡樂的歌唱聲，為跨年氣氛增添不少趣味。很棒的體驗！,3,1,0,,2024/01/03,0
希望老闆能更用心管理客房環境。1.希望廁所衛浴能定期清潔並保持乾淨。2.老闆可能忘了提供吹風機，需要補充。3.照片看起來比現場更好，老闆拍攝技巧很棒。4.房間有濕氣和黴味問題，可能需要考慮使用除濕機。5.營地周圍有雞舍，提供豐富的生態環境。,2,1,-1,,2019/10/13,0
希望老闆能更加用心管理。1. 洗手間衛浴應該要常常清潔。2. 忘了提供吹風機，希望有提供。3. 照片和現場有較大的落差，老闆攝影技術很厲害。4. 房間有濕氣和黴味，可能需要開啟除濕機。5. 營區下方有雞舍，生態豐富。,2,1,-1,,2019/10/13,0
"1. 希望老闆可以更用心管理，特別是廁所衛浴部分，希望能夠勤於打掃，保持清潔。
2. 老闆可能不太注意到了，忘了在房間放置吹風機，希望能夠補充這一項設施。
3. 照片和實際現場的情況有些落差，看來老闆的攝影技術相當了得。
4. 房間內有明顯的黴味，可能老闆也忘記了開除濕機，希望可以改善這種情況。
5. 營區下方有雞舍，這裡的生態相當豐富，讓人感到有趣。",2,1,-1,,2019/10/13,0
"1. 希望老闆能更用心管理，特別是廁所衛浴，希望能定期打掃保持清潔。
2. 忘記放吹風機真是一大遺憾，希望老闆可以補充這項必需裝置。
3. 老闆的攝影技術相當厲害，但照片和現場的落差頗大，希望能更貼近實際情況。
4. 房間內黴味嚴重，或許老闆忘記開除濕機，希望可以改善空氣品質。
5. 營區下方有雞舍，帶來豐富的生態環境，希望能夠善加利用這項資源。",2,1,-1,,2019/10/13,0
"1. 希望老闆能更勤於管理廁所衛浴的清潔。
2. 忘了在房間裡放吹風機，希望能夠補上。
3. 老闆在拍照的時候表現很強大，可惜與實際現場有些落差。
4. 房間裡有濕氣和黴味，或許是忘了開除濕機。
5. 營區附近有雞舍，生態環境相當豐富。",2,1,-1,,2019/10/13,0
希望管理單位可以解決小黑蚊的困擾，這裡的蚊蟲實在太多了，叮咬的情形讓人無法忍受。,2,1,-1,,2019/07/05,0
希望營地管理單位能夠有效地解決小黑蚊問題，因為數量實在太多了，被叮得無法忍受。希望他們能夠採取措施，讓我們可以安心享受大自然的美好。,2,1,-1,,2019/07/05,0
希望管理員可以解決小黑蚊的問題，太多了，讓人無法忍受叮咬。,2,1,-1,,2019/07/05,0
希望管理者能夠改善小黑蚊的困擾。這裡小黑蚊太多了，咬得受不了！希望可以加強防蚊措施，讓我們住客能夠更舒適地居住在這裡。感謝！,2,1,-1,,2019/07/05,0
希望營區能加強對小黑蚊的防治，因為實在是太多了，叮咬得讓人受不了。希望管理單位可以解決這個問題，讓大家能夠更好地享受露營的樂趣。,2,1,-1,,2019/07/05,0
小黑蚊太多了，叮得我受不了。小黑蚊太多了，叮得我受不了。,2,1,-1,,2019/07/05,0
這裡有太多的小黑蚊，讓人受不了。這裡有太多的小黑蚊，讓人受不了。,2,1,-1,,2019/07/05,0
那麼多的小黑蚊，真是叮得我受不了。那麼多的小黑蚊，真是叮得我受不了。,2,1,-1,,2019/07/05,0
這裡面小黑蚊實在太多，叮咬得讓人受不了。這裡面小黑蚊實在太多，叮咬得讓人受不了。,2,1,-1,,2019/07/05,0
蚊子多到我已經無法忍受了。這些小黑蚊實在太多了，叮得我受不了。,2,1,-1,,2019/07/05,0
營地主人很友善，但一些小細節還需要改善。靠近鯉魚潭的位置很好，如果再加強一些細節，將有更高的競爭力！#浴室和廁所的數量不夠，常常需要等候。#洗手池的汙水沒有被妥善處理，直接排放，容易產生異味和髒汙。#有太多小黑蚊和蒼蠅。,3,1,0,,2019/03/03,0
營地主人很親切，但還有一些小細節需要改進。位於鯉魚潭附近，地理位置優越，只要再加強一些小細節，就能成為極具競爭力的選擇！#浴室和廁所不夠，經常需要等待使用！#洗手臺的汙水沒有專門管道處理，直接排放，容易產生異味和髒汙。#存在較多小黑蚊和蒼蠅。,3,1,0,,2019/03/03,0
營地主人非常親切，但還有一些小細節需要改善。地點靠近鯉魚潭，優點很多，如果再加強提升一些小細節，就會更具競爭力！#浴室和廁所設施不足，常常需要排隊等候使用！#洗手檯汙水沒有妥善處理，直接排放，容易造成異味和髒汙。#營區有較多小黑蚊和蒼蠅出沒。,3,1,0,,2019/03/03,0
經營者親切，但注意細節的部分還有進步的空間。這家住宿靠近鯉魚潭，地理位置優越，若再加強一些小細節，將會更具競爭力。#浴室和廁所的數量不足，常常需要排隊等候使用。#洗手檯排出的汙水沒有管道處理，直接排放，容易產生異味和髒汙。#小黑蚊和蒼蠅數量過多。,3,1,0,,2019/03/03,0
經營者態度友善，然仍有些細節需要改善。位於鯉魚潭附近，地理位置優越，若再加強些細節，將更具競爭力！#浴室與廁所不足，常需等候！#洗手檯排水沒有管道處理，直接排放，容易產生異味與髒汙。#小黑蚊與蒼蠅數量過多。,3,1,0,,2019/03/03,0
"加強蒙古包的清潔度，會使其更具吸引力。 

提升蒙古包的環境衛生水準，將為顧客帶來更好的用餐體驗。 

改善蒙古包的整潔程度，將使食客感到更加舒適和放心。",3,1,0,,2018/09/29,0
蒙古包的清潔程度需要進一步提升以獲得更好的效果。,3,1,0,,2018/09/29,0
蒙古包的衛生條件若再加強改善，將會更加理想。,3,1,0,,2018/09/29,0
蒙古包的衛生情況應該再改進，這樣會更加理想。,3,1,0,,2018/09/29,0
"蒙古包的清潔度仍有改善空間。 

蒙古包內部的整潔度有待提升。 

希望蒙古包的清潔程度可以更加完善。",3,1,0,,2018/09/29,0
老闆待人親切，只是在衛浴裝置方面還有改進的空間。這次家族露營人數眾多，老闆非常慷慨地讓我們使用旁邊的鐵皮營地，除了洗澡時水溫不太穩定外，整體體驗還算不錯。,3,1,0,,2018/05/28,0
老闆人很好，只是衛浴裝置有加強的空間。這次家族露營因人數眾多，老闆很阿沙力的把旁邊有鐵皮的營地也給我們使用，洗澡時水會冷熱不一，但其他方面還算不錯。,3,1,0,,2018/05/28,0
老闆非常親切友善，只是衛浴裝置需要改善。這次我們家族露營人數眾多，老闆很慷慨地讓我們使用旁邊有鐵皮的營地，除了洗澡時水溫不太穩定外，其他方面整體表現都還算不錯。,3,1,0,,2018/05/28,0
這間露營地的老闆真的很好，只是希望能夠加強衛浴裝置的部分。這次我們家族去露營，因為人數眾多，老闆非常慷慨地讓我們使用旁邊有鐵皮的營地。除了洗澡時水溫不太穩定之外，整體來說還算滿意。,3,1,0,,2018/05/28,0
老闆人非常好，但衛浴裝置需要加強。這次我們家族去露營，由於人數眾多，老闆非常慷慨地讓我們使用旁邊有鐵皮的營地。除了洗澡時水溫乎冷乎熱外，其他方面大致上都還不錯。,3,1,0,,2018/05/28,0
營地周圍的環境需要改善，有太多蒼蠅和小黑蚊。,2,1,-1,,2018/05/21,0
營區的衛生狀況有待提升，蒼蠅和小黑蚊較為猖狂，影響了營區的環境品質。,2,1,-1,,2018/05/21,0
營區環境需要改善，有太多的蒼蠅和小黑蚊。,2,1,-1,,2018/05/21,0
營區整體環境需要改善，蚊蠅和小黑蚊數量過多。,2,1,-1,,2018/05/21,0
營區的環境需要改進，蒼蠅和小黑蚊實在太多了。,2,1,-1,,2018/05/21,0
"1. 開門營業要賺錢，基本設施是必須的。老闆應該要想想為什麼設施如此不完善？就算只是為了做一次性生意，也應該注重口碑的建立。

2. 該露營區地勢陡峭，並不適合建立露營區。夜間視線不佳，路標不明顯，路線狹窄且沒有路燈，會車十分危險。環境骯髒亂，營地不平整且多懸崖，不適合帶小朋友前往。

3. 設施簡陋，沒有遊戲區。夜間營區燈光不足，給人恐怖的感覺，需要自備燈具。預定的營位可能跟實際提供的不同，且沒有正面評價。

4. 總體而言，不建議前往此露營區，如果有計劃前往的露友，要三思而行。",1,1,-1,,2023/01/12,0
這家露營區設施太差，基本裝置都不齊全，開門營業目的難道不是要賺錢嗎？老闆怎麼想的呢？就算只是做一次性客人，也不能忽略名聲的重要性啊。路況環境真的很糟糕，山坡地建議不要開發成露營區，晚上路標不清楚，路又小又黑暗，沒有路燈容易造成交通危險。環境髒亂、營地不平整，懸崖多讓人擔心，帶小朋友要格外小心。設施簡陋，沒有遊戲區，晚上很暗有些恐怖，必須多帶燈具才行。而且營位可能跟預定的不同，沒有星評只有負評，想要去此區露營的朋友們一定要三思啊！,1,1,-1,,2023/01/12,0
這家露營區設施太差了，開門營業就是為了賺錢，基本設施都不完善。老闆到底在想什麼呢？就算是一次性客人，也應該要保持好名聲啊！路況環境真的很糟糕，山坡地不適合建露營區，建議不要去夜衝，路標不清，路又小又黑暗，沒有路燈，會車很危險。環境髒亂，營地不平整，懸崖多，帶小朋友要特別小心。裝置簡陋，沒有遊戲區，晚上營區很暗有點恐怖，要多帶燈具。營位可能跟你預定的不同，沒有星評只有負評，要去這家露營區露營的朋友要三思啊！,1,1,-1,,2023/01/12,0
"1. 這個露營區的路況環境真的太糟糕了，山坡地上建立露營區的設想真的不適合，不推薦夜晚前往，因為路標不清不易找到，而且道路又狹窄又黑暗，沒有路燈更是容易出車禍。

2. 環境骯髒亂、營地地勢不平整，還有許多懸崖，帶小朋友前往必須非常小心。而且設施相當簡陋，沒有遊戲區，晚上更是一片漆黑，讓人有點恐懼，必須攜帶大量照明裝置。

3. 預定的營位和實際安排的並不相同，而且營地只有負面評價，沒有正面評價，建議前往露營的朋友一定要三思。",1,1,-1,,2023/01/12,0
這家露營區基本設施不完善，要開展營業必須改善設施才能賺錢。老闆的想法讓人無法理解，即使只是一次性客人也需留好名聲。路況環境很糟糕，沒有清晰的路標，道路狹窄又黑暗，沒有路燈很容易造成危險。環境骯髒亂，營地不平整，還有懸崖，帶著小朋友一定要小心。裝置簡陋，沒有遊戲區，晚上營區暗暗的有些恐怖，一定要多帶燈具。另外，營位可能會跟預定時不同，而且只有負評沒有星評，建議想去這家露營區的朋友三思。,1,1,-1,,2023/01/12,0
老闆人很好，但深夜一二點還有人在那裡高歌，也沒管理一下吵得都沒法睡覺感覺很糟糕，很想報警處理了。可以多加設飲水機。,3,1,0,,2022/03/26,0
老闆雖然人很好，但半夜一兩點還有人在那邊高歌，沒有管理讓人很難睡覺感到很困擾，幾乎想報警處理了。或許可以考慮增加一些飲水機，讓大家在工作之餘能夠有更好的休息空間。,3,1,0,,2022/03/26,0
老闆人很好，但是半夜一兩點仍然有人在那邊喧嚷高歌，完全沒有負責監管的樣子。這樣弄得大家都無法入眠，實在讓人感到非常不爽，幾乎想報警處理了。建議可以多設定一些飲水機，這樣也能提供更便利的服務。,3,1,0,,2022/03/26,0
老闆雖然為人友善，但是半夜一兩點仍然有人在那邊大聲唱歌，沒有管理控制，影響大家的睡眠品質，讓人感覺很不舒服，甚至想要報警處理。希望可以增設飲水機，讓大家在工作時能夠有更好的環境品質。,3,1,0,,2022/03/26,0
老闆人很好，但深夜時分還有人在哪裡大聲歌唱，沒有管理這種情況讓人無法入睡，感覺很糟糕，很想報警處理。或許增加一臺飲水機會有幫助。,3,1,0,,2022/03/26,0
環境清新，可是在阿里山公路沿途的標示不夠明顯，容易錯過路口而迷路。包區的場地整體還不錯，但浴廁的燈光可以再亮一些。,3,1,0,,2023/07/20,0
"- 空氣清新，但是沿著阿里山公路開車時，路標不夠清楚，容易錯過轉彎，造成迷路的情況。
- 包區的場地還算可以，但是浴廁的燈光可以再亮一點，讓使用者更舒適。",3,1,0,,2023/07/20,0
空氣清新宜人，不過阿里山公路的路標設定不夠密集，容易錯過轉彎口而迷失方向。包區的場地整體還算不錯，但浴廁的照明可以再明亮一些。,3,1,0,,2023/07/20,0
山上空氣清新，但是沿著阿里山公路行駛時標示不夠明顯，容易錯過道路並迷失方向。包括區域內的設施還算可以，只是希望浴廁的照明可以再亮一點。,3,1,0,,2023/07/20,0
空氣清新，但沿途阿里山公路的路標不夠清楚，容易錯過並迷路。包區的場地算可以，不過浴廁的燈光需再亮一些。,3,1,0,,2023/07/20,0
