content,rating,type,status,tokenization,publishedDate,origin
第一次到露營區露營，心情很期待，天氣很好，晚上睡覺也不會冷。不過有幾個缺點：1.吃東西時蜜蜂和蠅紛紛來，海拔較低或許蚊蟲特別多；2.營帳之間的間距太近，很吵，睡覺的時候很難安靜。適合露營區的地方是因為有小孩，整理乾淨有沐浴裝置，但假日時感覺不太放鬆。潔淨的沐浴間和營主的貼心提醒防小偷。,3,1,0,,2023/03/08,0
我對第一次去露營區露營的心情是很期待的，白天的氣候很不錯，晚上睡覺也不會太冷。但是有一些缺點：1.在吃東西的時候，我第一次看到蜜蜂和蒼蠅沒有太大差別，它們很喜歡來吃我們的食物！可能是因為海拔較低吧，蚊蟲特別多。2.營帳之間的距離太近，當我們拿東西時，由於我們車子的設計是開車門就會亮起車燈，擔心打擾到其他人，而且營帳之間的距離真的太近了，晚上很吵，我們準備睡覺時其他帳篷也沒有太剋制，後來營地老闆娘來勸導才比較安靜，但因為營帳之間距離太近，半夜有三個以上的營帳像是交響樂一般[打呼聲此起彼落]，早上起來感覺格外疲累，或許我不太適應露營區的環境吧！選擇露營區是因為我有小孩，那裡整理乾淨又有沐浴裝置，再加上假日人潮真的沒有放鬆的感覺⋯⋯「沐浴廁所方面」非常乾淨、「營主有貼心提醒」最近有小偷出沒要小心儲存貴重物品！,3,1,0,,2023/03/08,0
這次到露營區去露營，心情非常期待，天氣也算不錯，晚上睡覺也沒有感覺到很冷。但是有幾個缺點讓我有些不滿：首先，吃東西的時候發現蜜蜂和蒼蠅看起來沒什麼區別，而且非常喜歡吃人的食物！也許是因為海拔較低，蚊蟲特別多。其次，營帳之間的間距太近，我們拿東西的時候因為車燈會亮，前面的帳篷可能擔心眼睛受到影響，導致距離太近，而且太吵了，準備睡覺時其他帳篷也不太安靜，後來是因為老闆娘來勸導讓情況有所好轉。由於帳篷間距太近，半夜有三個以上的帳篷像是交響樂般的吵雜。早上起床特別累，或許我並不適合露營區的環境。我選擇露營區是因為帶著小孩，整潔又有沐浴設施，再加上是假日，卻無法真正放鬆感受......在沐浴和廁所方面倒是很乾淨，而營主也很貼心地提醒我們近期有小偷出現，要小心保管貴重物品！,3,1,0,,2023/03/08,0
第一次去露營區，很期待享受大自然的氣息，晚上睡覺也沒有太冷，整體氛圍算是不錯。然而，我發現一些缺點：1.在進食時，蜜蜂和蒼蠅竟然無異，都很喜歡來搶食物！可能是因為海拔較低，蚊蟲特別多。2.營位之間距離太近，當我們拿東西出車時，車燈亮起可能會打擾到周圍的帳篷，且夜間可能因帳篷太近而影響到休息。有時半夜三更以上，像是交響樂團一樣的打呼聲此起彼落，讓我早上起床特別累。或許我不太適應這樣的環境，但因為有小孩所以選擇露營區，設施整潔且有沐浴裝置，假日在這裡卻沒有真正放鬆的感覺。整體來說，「沐浴廁所方面」很乾淨，而營帳主人也非常貼心，提醒我們要注意貴重物品，因為最近有小偷潛入的事件發生了！,3,1,0,,2023/03/08,0
2022年2月第49次露營，這個精靈精靈首露營地讓人感覺像是在一個大公園裡露營。那天搭帳的位置是在一片一塊塊水泥方塊組成的土地上，讓人覺得有些不知所措。,3,1,0,,2023/03/08,0
2022年第二週，露營環境給人一種大城市公園的感覺，在露營地上搭帳時，發現地面是水泥方塊，讓人感到有點驚訝。,3,1,0,,2023/03/08,0
2022年2月的第49露營地，初次露營的感覺就像置身大型公園，選擇的營位是一塊塊水泥方塊，這點讓人有些困惑。,3,1,0,,2023/03/08,0
2022年2月的第49露營地-精靈精靈首露，給人的感覺就像是在一個大公園裡露營。當天搭帳的營位，土地是一片片的水泥方塊，令人有點措手不及。,3,1,0,,2023/03/08,0
2022/2-第49露-精靈精靈首露，這個露營地給人的感覺像是在一個大公園裡露營。當天搭帳時，發現營位是由一塊塊水泥方塊組成，讓人有點措手不及。,3,1,0,,2023/03/08,0
這露營區設施簡單，沒有太多花巧。,3,1,0,,2023/03/08,0
露營區設施簡單，但足夠滿足基本需求。,3,1,0,,2023/03/08,0
簡單的露營區設施…,3,1,0,,2023/03/08,0
營區設施簡單實用，環境清幽舒適。,3,1,0,,2023/03/08,0
露營區非常簡單，沒有太多的設施。,3,1,0,,2023/03/08,0
環境很好，但C區螞蟻太多了，影響了整體的舒適度。晚上聚會的人聲音很大，一直持續到凌晨2點，影響其他房客的休息，真的很沒公德心。聽說營主不在場也不會幹預。營位安排不能挑選，但問能否安排到另一區，對方竟回答有其他房客已經訂了同一區，環境雖然整潔，但服務態度有待改善。,3,1,0,,2023/03/08,0
該營地環境整潔，值得五星評分，但C區螞蟻太多，令人困擾。晚上聚會喧囂，一直到凌晨2點，即使有人提醒也無動於衷，缺乏公德心。據說營地管理者不在場也不會幹預。營位安排不能自由選擇，詢問是否能調換位置時，卻被告知有其他人訂了同一區域。雖然環境衛生良好，但無法改變其他方面的問題。,3,1,0,,2023/03/08,0
"環境非常好，但C區螞蟻超多，而且一群人喝酒聊天到半夜2點講了幾次都沒效真沒公德心，聽說營主不在這也不會管；營位安排不能挑選但是問說可以選另一邊嗎？竟然回答說有人訂是同一區，環境衛生是真的很乾淨。 

空間很不錯，但C區有很多螞蟻問題，晚上聲音很吵，喝酒到半夜2點，營主好像不會管，營位不能挑選，問詢是否能換另一邊，回答說已有人訂同一區，營地衛生非常好。 

環境很美，但C區有太多螞蟻，晚上一群人一直喝酒聊天到半夜2點都沒靜下來，營主好像沒在場管理；營位無法挑選，詢問是否能換到另一邊，卻被告知已經有人訂了同一區，雖然環境衛生維持得很好。",3,1,0,,2023/03/08,0
這個營地環境整體來說算得上是5顆星，但是C區的螞蟻實在是太多了。晚上有一群人喝酒聊天一直到凌晨2點，多次請他們安靜都沒有用，真的是缺乏公德心。據說營地的管理者不在並且也不會直接管制。另外，雖然營位是不能挑選的，但我問能否換到另一邊的位子時，竟然被告知已經有人預定了同一區，這點實在讓人感到失望。環境雖然很乾淨，但仍然受到上述問題的幹擾。,3,1,0,,2023/03/08,0
環境非常好，但C區螞蟻太多了，而且晚上喝酒聊天的人一直不斷，擾人到深夜2點，很沒公德心。聽說營主不在場也不管。另外，營位安排不能選擇，但詢問是否可以換到另一邊時，被告知有人已經訂了同區，感覺不太貼心。整體環境倒是非常乾淨衛生。,3,1,0,,2023/03/08,0
昨晚去露營地，發現環境很乾淨，樹木茂盛美麗，距離老街也相當近。不過，露營區的營位偏小，浴室的水量有點小，而且電壓不穩定，使用吹風機就會造成營位跳電。即使是在12月時還有小黑蚊出沒，而且公共區域就是個公園廣場，外人可以直接進來。另外，A11-13營位的硬鋪面下釘相當難處理，而且禮拜天早上9點還會有人除草，讓人感到不太方便。管理者的態度就不多做評論了。以上這些缺點或許有些早就被其他人提出過了，但改善起來並不容易。大家難得一聚露營，希望不要因此而壞了心情。,1,1,-1,,2022/03/08,0
2021/12/3夜爬營地優點是環境乾淨，樹木壯觀美麗，距離老街很近。然而缺點是營位偏小，浴室的水壓小，電壓不穩（使用吹風機可能會造成營位跳電），十二月仍有小黑蚊（寒流天氣下），公共區域相當開放，外人可以直接進入。另外，A11-13營位的硬地面釘子難以處理，禮拜天早上九點就會開始除草。管理人員的態度我就不評論了，總的來說不是很好。這些缺點有的早已被其他人評論過，但改善起來並不容易。大家難得一聚露營，希望不要因此而影響心情。,1,1,-1,,2022/03/08,0
露營地的優點是環境乾淨、樹木茂盛美麗，且距離老街很近。然而，營位偏小，浴室水壓不夠，電壓不穩（在浴室使用吹風機時營位會跳電），還有小黑蚊（即使是在寒流來襲的12月），而且公共區域就是公園廣場，外人可以直接進入。另外，A11-A13的營位硬鋪面下釘很難處理，而且禮拜天早上9點就開始除草。至於管理者的態度，我不打算評論。儘管有些這些缺點已經有其他人提過，但改善起來並不容易。大家很難得有機會一起露營，希望不要因此而破壞了大家的心情。,1,1,-1,,2022/03/08,0
該露營地的優點在於環境乾淨，擁有美麗又大的樹木，且距離老街很近。然而，缺點也不少：營位較小，浴室水壓小，電壓不穩定（使用吹風機可能會跳電），還有小黑蚊，即使在寒流的12月依然存在。此外，公共區域即是公園廣場，外人可以直接進入。在A11-13營位硬鋪面下釘難，且禮拜天早上9點會有除草的工作，管理者的態度也讓人不太滿意。希望露營地能改善以上問題，畢竟大家很難得一聚露營，不希望因為這些問題而破壞心情。,1,1,-1,,2022/03/08,0
夜晚的露營地點環境十分優美，空氣清新，樹木蔥翠，離老街也相當方便。然而，營位稍嫌狹小，浴室水流不足，電壓不穩定（使用吹風機時營位跳電），12月仍有小黑蚊出沒，且公共區域進出不限制，管理者維護態度有待提高。另外，A11-13營位地面有釘子，禮拜天早上9點除草可能影響休息品質。希望露營地方能改進上述問題，讓大家能享受美好的露營時光，保持愉快的心情。,1,1,-1,,2022/03/08,0
因為晚上下班時間遇到塞車，延遲到達營區，卻被告知已經不允許入營，讓人非常失望。建議大家不要選擇這個營區，這麼多次露營經驗中從來沒遇到過這樣的糟糕營區！簡直爛透了！,1,1,-1,,2022/03/08,0
因為車潮延遲到達露營地，竟然拒絕我們入營，建議大家不要前往這個營區，這麼多次露營從未遭遇過如此惡劣的待遇！太糟糕了！太差勁了！…,1,1,-1,,2022/03/08,0
因為遇到下班時塞車，導致我們晚到營區，卻遭到拒絕入營，建議大家最好不要前往這個營區，這是我露營這麼多次從未遇到的糟糕經驗！簡直爛透了！絕對不推薦！,1,1,-1,,2022/03/08,0
因為塞車的關係延遲了到達營區的時間，卻被拒絕入營，對於這個營區的服務及態度非常失望。建議大家不要去這個營區，這麼多次露營從來沒有遇到過這樣的糟糕經驗！ 極差！非常糟糕！…,1,1,-1,,2022/03/08,0
在下班時間遇到塞車，導致晚到營區，卻不允許我們入內，此營區建議避免前往，露過這麼多次營地都沒遇到這種情況！！簡直糟糕透頂！絕對不推薦！…,1,1,-1,,2022/03/08,0
營區的環境規劃很完善，但是卻遇到了許多令人無法理解的狀況。首先，坐式廁所散發出非常濃厚的煙味，讓使用者無法忍受，尤其是對孩子而言更是不好。其次，在凌晨2點，一群年輕人在浴室大聲嬉鬧，完全不顧他人居住的安寧。再者，有陌生小孩到營區搶玩具，甚至還動手打人，看到人離開還大哭不止，這種情況實在讓人感到無奈。另外，營區的熱水供應時間只有晚上6點到早上6點，下午孩子玩了一身汗只能沖冷水，這真的很不方便。因此，我認為營主應該加強管控煙味與環境品質，可以提醒露營者不要在廁所抽菸，並且注意凌晨的音量。希望可以改善這些問題，以免破壞這美好的自然環境，讓更多人能享受露營的樂趣。,1,1,-1,,2022/03/08,0
營區的環境規劃雖然很棒，但是我們卻碰到了很多讓人無法理解的狀況。第一個問題是坐式廁所裡面充滿濃濃的煙味（5/14傍晚使用），孩子急著上廁所只好強忍著讓她吸入二手菸味，而且還要一邊使用廁所一邊開啟門換氣，完全無法忍受的煙味讓人難以呼吸。第二個問題是凌晨2點一群年輕人在浴室大聲嬉鬧，完全不理會已經很晚了（5/15/02:00）。第三個問題是有陌生小孩跑來我們營區搶玩具，不肯放手還動手打人，我們不得不帶著玩具走開，小孩卻哭得傷心至鼻子流血，卻沒有家人來幫他，還需要我們大喊找父母。最後一個問題是熱水供應時間只有晚上六點到早上六點，下午孩子玩了一身汗只能用冷水沖洗。我覺得露營區的品質真的很差，需要營主來做管控，尤其是在煙味和環境品質的維護上。希望能提醒露營的人不要在廁所抽菸，也要注意時間和音量，以免破壞這美好的自然環境。這次來這裡是被美好的環境吸引，卻被這些糟糕的經驗打退堂鼓。,1,1,-1,,2022/03/08,0
"1. 營區的環境雖然規劃得很好，但我們卻碰到了一些讓人難以理解的情況。例如，坐式廁所裡竟然飄著濃濃的煙味，讓我帶著急著上廁所的孩子只能硬著頭皮忍受二手菸味。即使開啟門換氣，還是無法完全避免呼吸困難的煙味。

2. 凌晨2點，一群年輕人在浴室大聲嬉鬧聊天，完全不考慮已經是半夜的事實。

3. 陌生小孩來到我們營區搶玩具，更可惡的是不給就動手打人。當我們帶著玩具離開時，他竟然不顧自己的身體哭泣到鼻子流血，身旁也沒有家人照顧。我們只好大聲呼喊找他的父母。

4. 熱水供應時間只有晚上6點到早上6點，下午孩子玩得一身汗，卻只能用冷水沖洗身體。這讓人感到相當不便。

總而言之，露營的品質令人大失所望，特別是在煙味和環境品質的維護方面，需要營主更嚴格的監管。希望能提醒露營者不要在廁所抽菸，以及注意夜間音量，以免破壞這美麗的自然環境。這次雖然因為環境吸引而前來，卻因為這些不愉快的經驗而深感失望。",1,1,-1,,2022/03/08,0
"1. 營區的設施雖然很不錯，但卻有一些讓人無法理解的問題。例如，我們在使用坐式廁所時，竟然聞到非常濃烈的菸味（5/14傍晚使用），讓孩子也受到了二手菸味的影響，讓人無法忍受。而且即使在使用廁所的同時，還得不停開門讓空氣流通，以排除菸味。

2. 在凌晨2點，卻有一群年輕人在營區大聲嬉鬧，甚至在浴室裡大聲聊天，完全不考慮已經是深夜，讓人感到困擾（5/15/02:00）。

3. 有陌生小孩跑到我們營區搶玩具，甚至還動手打人，讓人感到非常不安。當我們拒絕給他玩具時，他還哭著喊要家人，鼻子甚至流血，卻沒有家長前來照料（日期未知）。

4. 營區的熱水供應時間僅在晚上6點到早上6點，下午孩子玩了一身汗卻只能沖冷水，讓人感到不便（日期未知）。

因此，我認為營區的品質有待提升，尤其是對環境的維護和管控。希望營主能夠加強對營區內的秩序管理，並提醒露營者不在廁所抽菸，以及注意深夜的音量，以確保每位露友都能在美麗的自然環境中享受愉快的露營時光。",1,1,-1,,2022/03/08,0
營區的設施很完善，但卻遇到了一些令人不解的情況⋯1.在使用坐式廁所時，竟然有濃烈的煙味（5/14傍晚使用），讓孩子不得不吸入二手菸味⋯即使開啟門換氣，依然無法忍受的煙味讓人難以呼吸⋯2.在凌晨2點，一群年輕人大聲嬉鬧，浴室裡也有人大聲聊天，完全不考慮已經是半夜2點了（5/15/02:00）3.有陌生小孩跑來我們的營區搶玩具，不給還動手打人，即使我們帶著玩具離開，他仍大哭不止，甚至鼻子流血卻沒有家人來管教⋯還要我們呼喊尋找父母⋯4.營區的熱水只能在晚上六點到早上六點供應，孩子下午玩完汗流滿面只好用冷水淋浴⋯因此，我認為露營品質真的很差勁，煙味和環境管理需要得到主辦單位的注意和控制⋯如果能提醒露營的人不要在廁所抽菸並注意時間和音量，這將會更好⋯切勿破壞這美好的自然環境⋯雖然這次被美好的環境吸引，卻也因為這可怕的經驗稍稍退卻。,1,1,-1,,2022/03/08,0
景色很美！但A區11-12-13洗手檯共用一個實在太不方便了，竟然三位共用一個延長三插頭，洗完手要下坡收拾物品要上坡......建議不要選擇這三個位置。其他地方看起來都還不錯！,3,1,0,,2022/03/08,0
這裡的風景很美，但區域a的11-12-13號房洗手檯共用一個讓人覺得非常不便利，插座也太少了，三位客人要共用一個延長三插座，又要下坡收拾裝備，又要上坡取裝備，實在是很麻煩。建議不要訂這幾間房間，但其他房間看起來都挺不錯的。,3,1,0,,2022/03/08,0
風景美麗！但A區11-12-13洗手檯共用一個，實在太不方便了。插座只有一個延長插座，要下坡才能使用，取下裝備時更要爬坡。建議不要選擇這三個位置，其他都還不錯！,3,1,0,,2022/03/08,0
"風景不錯！但a區11-12-13洗手檯共用一個太不便插頭竟然三位共用一個延長三插頭下裝備要下坡，收裝備要上坡……不建議訂到這三位……剩下的看來都不錯！

其他地方很棒，但a區11-12-13的洗手檯共用一個插頭真的不方便，竟然三位要共用一個延長插座，拿行李要下坡，收拾行李要上坡……不建議選擇這個房間……其餘地方看起來都還不錯！",3,1,0,,2022/03/08,0
風景美麗！但a區11-12-13洗手間共用一個洗手檯實在太不方便了，竟然還要三人共用一個延長三插頭，下山時收拾行李要走下坡，上山時卻要走上坡……不建議選擇這三間房間……其他剩下的房間看起來還不錯！,3,1,0,,2022/03/08,0
晚間十點之後，營地沒有任何管理措施來處理超級吵雜的情況，即使我向營地主人反映，也沒有得到有效的解決。這是我第一次遇到這麼糟糕不關心營客需求的營地，一旦交了錢入場，他們好像就不再在乎營地的管理了。,1,1,-1,,2022/03/08,0
晚上十點過後，營地沒有管制超級吵的情況，我向營主反應也沒有得到處理。這是我第一次遇到一個完全不管營客的營地，感覺只要繳了錢，營地就不會再理會其他事情。,1,1,-1,,2022/03/08,0
晚上十點過後，營地沒有有效管制超大聲的噪音，且營主對此問題並未有任何處理。這是我第一次遇到管理不善的營地，付了錢入場後感覺營地對於營客的舒適度並不在乎。,1,1,-1,,2022/03/08,0
晚上十點以後沒有管理且超級吵，反映給主人也沒有得到處理，這是我第一次遇到營地對營客這麼糟糕，營地似乎只在乎收了錢讓人進來，對營地的事情不負責任。,1,1,-1,,2022/03/08,0
晚間過了十點後，營地沒有管制噪音超大聲的情況，營主也沒有解決問題。這是我第一次遇到這麼糟糕的營地，感覺收了錢就不再關心營客的需求了。,1,1,-1,,2022/03/08,0
這裡的景色真的很美，環境也非常乾淨整潔。距離老街很近，可以先搭帳篷再去老街逛逛。不過這裡有一點小黑蚊，建議要多帶一些蚊香來驅蟲，可以點上四五支蚊香先打發一下蚊子。,3,1,0,,2021/03/08,0
這個地方的風景美不勝收，環境也十分清潔，而且距離老街很近，可以先在這裡搭帳篷，再去老街逛逛。唯一需要注意的是這裡有一些小黑蚊，建議來的人帶多一點蚊香，搭帳篷時點燃四五根蚊香，就能夠防範蚊蟲。,3,1,0,,2021/03/08,0
這裡的風景真的很美，而且環境也保持得很乾淨。距離老街不遠，可以先在這裡搭帳篷，然後再去老街逛逛。不過這裡可能會有一點小黑蚊，建議來的人可以多準備一些蚊香來驅蟲。在搭帳篷前，可以點上四五個蚊香，可以讓營地環境更舒適。,3,1,0,,2021/03/08,0
這裡的風景真的很美，環境整潔衛生也很好。距離老街很近，可以先在這裡搭帳篷，再去老街逛逛。唯一的小缺點是這裡有一點小黑蚊，建議前來的人準備多一點蚊香來驅蟲。在搭帳篷時可以多點四五支蚊香，讓夜晚更加安穩。,3,1,0,,2021/03/08,0
這裡的風景很優美，環境也相當乾淨，而且距離老街很近，可以先在這裡搭帳篷，再去老街逛逛。唯一的小缺點是這裡有一些小黑蚊，建議來的人帶多一點蚊香，搭完帳篷之後點上四五個蚊香。,3,1,0,,2021/03/08,0
"優點：營區位子寬敞，環境整潔，水壓穩定，可以在樹蔭下聆聽大自然的聲音，距離南莊老街不遠，方便購物，老闆娘服務親切。

缺點：老闆兒子態度惡劣，環境有些蟲蟲，夏天稍嫌悶熱，熱水供應時間有限，衛浴設施較少，雨後水泥地易滑，老闆娘經營不力。",3,1,0,,2021/03/08,0
"優點：這裡的位置很寬敞，營地整潔，還有穩定充足的水壓和水溫。在樹下聆聽著自然的聲音，非常放鬆愜意。距離南莊老街不遠，方便外出購物。老闆娘非常親切客氣。

缺點：老闆的兒子收錢時態度惡劣，連招呼都不理會，讓人感覺很不舒服。蟲鳴和鳥叫聲有點大聲，低海拔地區有許多小型昆蟲和蜘蛛。夏天可能會有點熱，只有樹下比較涼爽。熱水供應時間有限，白天則無熱水可使用。衛浴設施較少，且場地容易積水。在雨天時地面容易打滑，老闆孃的態度也讓人感到無奈。",3,1,0,,2021/03/08,0
"優點：營區的位置非常寬敞，整個環境也相當乾淨整潔，提供充足且穩定的水壓和水溫，坐在樹下聆聽著蟲鳴鳥叫聲真是一種享受。距離南莊老街不到十分鐘車程，非常方便前往購買食物，老闆娘也非常親切友善。

缺點：收錢的老闆兒子態度不佳，沒有任何招呼的禮貌，讓人感覺很不舒服。夜晚蟲鳴鳥叫聲稍嫌過大，且低海拔地區可能會有一些小昆蟲如黑蚊、蚊子、蒼蠅和蜘蛛。夏季天氣有點熱，只能選擇坐在樹下降低溫度，熱水供應時間也有限，只到早晨六點。衛浴設施較少，且入口處的水泥地容易積水且青苔滿佈，下雨天會很滑，老闆娘管理不當，對於雷雨天氣沒有提供更多幫助。",3,1,0,,2021/03/08,0
"優點：營區提供的空間很充足，整個營區環境乾淨整潔，水壓和水溫都很穩定，令人感到舒適。在樹下聆聽著蟲鳴和鳥叫的聲音，真是讓人放鬆愜意。距離南莊老街不到十分鐘車程，方便購物，讓生活便利迅速。此外，老闆娘非常親切友善。

缺點：老闆的兒子在收取費用時態度極其惡劣，完全沒有禮貌，似乎對客人心存怨恨。夜晚蟲鳴和鳥叫聲有些大，影響睡眠品質。由於低海拔地區的特性，會有很多小黑蚊、蚊子、蒼蠅和蜘蛛，需要注意防護。夏天氣溫較高，建議選擇樹蔭下的地點。熱水僅供應晚上六點到隔天早上六點，白天無法使用熱水。衛浴設施較少，且入口處有些許積水，需注意安全。老闆娘在管理營區時顯得不太積極，因此在雷雨天氣下，需要自行照顧自己的安全。",3,1,0,,2021/03/08,0
"優點：營區提供的空間很足夠，整個營區保持相當乾淨，水壓和水溫都穩定充足，坐在樹下聆聽蟲鳴鳥叫的聲音非常愜意，離南莊老街不到十分鐘車程，方便外出購食，老闆娘非常親切客氣。

缺點：老闆的兒子收錢時態度極差，連招呼都不打，給人一種欠你的感覺，營區內蚊蟲、蒼蠅和蜘蛛很多，蟲鳴鳥叫聲有點大聲，夏天稍嫌熱，需要在樹下才能稍微降溫，熱水供應時間有限，只限於晚上六點至早上六點，白天沒有熱水可用，衛浴裝置太少而且不夠乾淨，小車道上因為水泥地容易積水，老闆娘不太注意營區環境整潔，當遇到天氣不佳時，只能自求多福。",3,1,0,,2021/03/08,0
"優點：樹林環境下搭帳很舒適，距離南莊老街大約只有五分鐘車程，非常方便。營位空間還算夠大。
缺點：有些營位的排水不佳，洗手檯遠離帳篷且設施較少。營地管理人員只在帶位時收錢，之後就消失不見，缺乏負責任的態度。即使深夜兩三點有人喧嘩，也找不到管理人員處理問題。雷露友吵架情況讓人感到困擾（第二次營地體驗）。",2,1,-1,,2021/03/08,0
"優點：樹林下搭帳感覺很舒適，離南莊老街只有五分鐘車程，非常方便，營位空間也相當足夠。

缺點：部分營位的排水情況不佳，洗手檯距離帳篷有點遠且設施較少；營地管理人員只在帶位時收錢後就消失了，缺乏負責任的態度，就算半夜兩三點有人喧嘩也找不到管理人員，任由騷擾行為持續下去（第二次經驗）。",2,1,-1,,2021/03/08,0
