content,rating,status,type,label,sequence_num,publishedDate
平地離市區近進去的路有點小廁所衛浴是流動式,3,0,1,1,6204,2020/05/07
真的是第一次遇到這麼囉嗦的營主，營位給的不夠大，直到我們額外付了錢搭天幕使用，營主拿了錢之後就笑笑ok了，結果搭好了又有意見，提出如果有人來可能要拆掉？明明無法搭下三帳的區塊，要我們搭三個帳，一點都不合理，不給客人方便，今天有多少位客人自己不知道？露過那麼多次沒遇到這麽囉嗦的營主，事後帶朋友經過還笑笑打招呼問我們ok嗎？給自己做面子好像對客人都很好…..。還跟自己的朋友在營位唱卡拉ok，還好我們一開始就換到離營本部遠一點了…不然應該還有噪音的困擾。環境很好，營地算乾淨，但營主做生意的方式，不會想再去！營位也沒有1200的等級,1,-1,1,0,5191,2023/05/07
建議至少增設一種的遊戲設施，活動空間太小建議評估減帳。,3,0,1,1,6935,2018/01/02
營地的地質，太硬了，打營釘彎了好幾根，冷熱水很不穩定，小還被熱水燙到哭。,4,1,1,2,4605,2021/08/19
營主超nice。1. 營區夜晚有九降風，可主動建議帳棚搭建抗風方向2. 超硬碎石地，釘壞三根大黑釘。還好營主主動提供鍛造螺旋釘,5,1,1,2,3709,2018/01/03
營地小巧，適合一群人包區來玩，廁所乾淨營主也很熱心借我們燈條。不過第二天晚上七點半就被營主告知不可以笑太大聲？才七點半我覺得有點太誇張，詢問隔壁帳篷的旅客他們並不覺得有被打擾，不知道為何營主覺得我們吵？整個心情都被破壞了,3,0,1,1,3891,2023/05/07
夏天小黑蚊真的太多，空間小。夏天真的不建議前往唷小黑蚊很凶小孩被叮了將近200個包+客廳帳被大螞蟻攻陷，收帳麻煩了很久也無法完全清除，車上也有，回家趕緊買煙薰藥來除蟻倉庫車上都用上，還有露友受不了提前離開。想去建議十月份以後到六月以前。營區小空間小、衛浴是不錯、有室內閱讀室、小沙坑、桌遊區，周邊沒景點或步道，待營區實在也無聊。就近的蕙蓀林場門票不便宜。以上希望對各位有幫助。,3,0,1,1,2792,2019/08/05
第一露推薦。第一露選擇在此地，營區很乾淨，可以畫畫，營主人也很親切,5,1,1,2,5504,2023/04/27
這次搭在B區營位幾乎都在樹下所以毛毛蟲很多建議穿長袖長褲比較不會被毛毛蟲攻擊冰箱跟衛浴都在入口處若是滿帳稍稍覺得不足小朋友遊戲區也是在車道邊若有車子經過要留意自家小孩安全可惜到訪時天氣不夠熱不然遊戲區應該小孩會玩瘋,5,1,1,2,5132,2023/06/06
很讚的營地，推薦大家。滑草場很好玩，但是表面塑膠墊有破損現象致使水泥外露，造成許多玩家都有受傷現象。浴室廁所寬敞明亮，但是數量明顯不足，尤其沒有男生獨立小便斗，造成搶廁所更明顯。還有通風有些不足，味道散去不易。,5,1,1,2,3853,2018/04/15
營地內道路陡峭，非四輪傳動車輛要有點勇氣。每區佔地範圍不大，容易包區。護坡樹林有清幽感，又有雨棚。感謝營主招待咖啡還會再訪 …,4,1,1,2,305,2023/06/07
2019跨年來這露營 有煙火  營主人超好 ，這風景滿漂亮 ，重要一點是廁所乾淨哦,4,1,1,2,6770,2019/05/07
蚊子很多，浴廁馬桶被螞蟻給佔據，煮個東西自己還沒吃飽雙腳就先餵飽蚊子，是個適合體驗大自然環境的好地方，因為連訊號都沒有，直接沒有服務！,1,-1,1,0,615,2022/05/06
這個營區老闆有設置卡拉ok，有超大音響一群人在這裡唱的轟天雷大聲，喜歡唱歌的可以來，怕吵的就不推了.,3,0,1,1,2230,2023/05/08
限制非常多，但是給的非常少！沒有停車位，水槽壞到叫我跟人共用，電插座壞掉一邊限制一堆，該給設備沒提供真的非常爛！,1,-1,1,0,773,2023/05/08
"奎柔山路上最棒的露營點了...推薦適合以下的人來:*喜歡洗澡、上廁所的人.算乾淨、同時可訓練耐心...*露營超過10次的老手(10次以下新手完全不建議喔)*喜歡蒼蠅蚊子等小昆蟲的人(小朋友最喜歡了)*想訓練成為蛙人的人.有很棒的天堂路及黃色水池等場地*喜歡熱鬧的人,有悅耳的歡唱聲及喇叭陪你入眠*很想踢足球的人(想玩其它活動的人一定要問過在場所有其他露營的人喔)*想訓練自己脾氣的人綜合以上這麼多,還不快來嗎???趕快聯絡超有個性的營主吧!!!",2,-1,1,0,1639,2023/05/07
很久以前去過的營地，現在應該規劃得更好了；在山上，有很棒的視野，天候好時，可眺望太平洋。,4,1,1,2,230,2023/05/07
新手車宿、露營的好選擇，可以叫foodpanda,5,1,1,2,6243,2023/05/07
超雷營區，肥滋滋蟑螂，小黑蚊天下，超爛服務。3年來露過最雷露營區:1.洗澡洗到一半沒熱水，小孩全身泡沫等了將近1小時，水壓偏小且不穩2.粗估最少6帳用同一個迴路，電壓非常不穩，連3W10顆LED15米串燈不亮，打氣機罷工，只能手動打氣，改用LED燈條3.環境髒亂，生態池看起來無人管理，超多小黑蚊，點了蚊香擦了防蚊液，每人最少20包起4.在浴室與帳篷區看到2隻在飛的超大蟑螂.蟑螂.蟑螂....5.草地沒有定時修剪，超過腳踝高度，石階佈滿青苔，十幾個大人，4位大人不小心滑倒，最後大家都寧可繞路6.收費不合理，大多數營區超過4人每人需收費100幼兒園以下小孩不收費，此營區一人250且幼兒園以下也收費7.拍照景點多數老舊與照片不符,1,-1,1,0,53,2022/06/08
親切的老闆娘，有交朋友的感覺，讓人又想來露營。洗手間清潔乾淨。,5,1,1,2,177,2024/03/07
美景舒服，萬里無雲，營主人好，是露營的不二選擇！,5,1,1,2,1021,2023/05/08
營主夫妻待人很親切，營地環境也很乾淨，離市區採買真的方便，真心推薦。。我連續去了2次，除了沒有遊樂設施跟自營的商品外，真的很適合喜歡安靜又純粹放鬆的營友來這裡露營，即使是(露營小白)也絕對沒問題。,5,1,1,2,912,2023/07/03
超級美的營區，喜歡低開發、大草皮的自然營地的話，你會喜歡，營主也維護得很好很用心，唯一就是夜路有點難開，冰箱有點遠，不過一點也不影響體驗,5,1,1,2,6450,2022/05/07
營區上面有很大遍的農地可規畫親子採果還是採菜等活動,4,1,1,2,5226,2019/01/01
交通方便，浴廁乾淨，草坪非常漂亮，適合小孩放電，營區內直接就可溪釣，值得來露的營區,5,1,1,2,5110,2024/01/06
2021/05/15舒服的營地，浴廁乾淨適合來放空度假，還有螢火蟲。,5,1,1,2,1143,2022/05/06
這次訂A區平日$800.夜衝$400.假日$10003天2夜$1400———————————優點環境乾淨廁所清潔熱水超熱附近有瀑布可以走走營主夫婦親切.缺點蓬距太近離開要等隔壁拔營沒有休閒運動場地沒有特設路燈（可自動開關）上廁所需要自拿小燈照路—————————————-需自備沐浴乳洗髮精衛生紙營區供電800W以下用電設備需要留意建議包區會比較適合,4,1,1,2,2856,2022/05/07
在平台上訂兩營位也訂了帳篷、桌子、椅子、睡袋，結果到現場說顧營地的人說營主沒通知，沒有裝備，扯一堆言論不甘顧營地的人事情，打給營主也沒有接，這種處理態度真的很消極,1,-1,1,0,294,2023/09/07
營地旁邊有小溪可以玩，但是搭帳篷的地方，舖的地面要小心，跌倒很容易破皮，因為他鋪的是有用玻璃回收做的磚,3,0,1,1,5411,2019/05/08
營區腹地廣大，能步行到九九莊園玩，附近補給物資非常方便，但營區衛浴不足，男女廁所數量也是少到不行，浴室排水不良，洗澡會嚴重積水，非常的噁心，門口掛親子衛浴，裡面空間一個大人站著就很擠了，是要怎麼幫小孩洗澡？！深夜兩點還有露客在大聲喧嘩，打電話聯絡營主也無回應，隔天早上罵客人垃圾亂丟，自己垃圾桶沒墊垃圾袋也要怪客人嗎？,2,-1,1,0,1519,2020/05/06
如果天氣好，可以考慮上山看風景還不錯!但是硬設備真的不行，搭帳區，空間設計不良，二帳的位子，要搭正常600*300，是很貼不好搭，衛浴更是....設計二間，但一間用了熱水，另一間就是不穩定的熱水，且使用間數也不足!再來就是遇到天氣不好時(雨天)，千萬放棄別上山了，第一次遇到棧板區，居然會排水不良，且嚴重積水，如果你是車露那OK，如果你要搭睡帳，保證全濕，讓你的帳有得晒，以上!不會再去第二次了~~~,3,0,1,1,2353,2022/05/08
營主夫婦親切 浴廁乾淨 賞螢、老鷹飛翔 美好的經驗,5,1,1,2,512,2018/04/08
提早到，營主還是讓我們提前進入搭帳，,3,0,1,1,5618,2018/07/30
老闆態度超差浴室沒熱水,1,-1,1,0,1695,2022/05/06
雨棚A區！週五夜衝！每帳空間給得很夠！廁所也是坐式馬桶！幾個小可惜的地方！因為燒鍋爐！僅有些時段供熱水！露友要早點沐浴，週五夜衝！遇到下層露友不斷提醒太大聲影響他們！但⋯⋯距離其實很遠！沒有唱歌，就是宵夜吃喝！整個興致都⋯⋯ …,3,0,1,1,1273,2024/04/15
草地蠻大的，兒童遊戲設施很多（玩沙區、溜滑梯、戲水池⋯等等）！衛浴設備也很乾淨！！重點離谷關溫泉很近 …,5,1,1,2,1402,2019/05/07
沒電話，沒網址怎麼下訂啊,2,-1,1,0,1874,2021/05/07
場地很大，有樹林有草地，營位附有護草墊可以墊高帳篷，衛浴乾淨寬敞，旁邊就是小溪，螢火蟲季不用特意去尋營區就有螢火蟲優雅飛舞。,5,1,1,2,4812,2024/04/30
營主相當熱心也容易和年輕人打成ㄧ片，衛浴乾淨感覺的出來時常清潔，讓人覺得到這裡露營實在很舒適,5,1,1,2,4948,2021/05/09
老闆娘很細心的經營這裡，雖然小小的，但是蠻漂亮的，推薦給大家，如果水蜜桃季的時候記得訂購水果哦！,5,1,1,2,5808,2017/05/07
地處不高，環境清幽，老闆和善,3,0,1,1,1869,2022/05/06
【請注意!!】線上訂位僅提供部份營位預訂，如需包場，請洽營主。。滑草很棒~小孩們玩得超開心~營主也很熱情，衛浴垃圾都有派人巡還請我們吃香蕉~但 我們定位時沒注意到網頁上有這句【請注意!!】線上訂位僅提供部份營位預訂，如需包場，請洽營主。所以 這是跨年露營多了很多很多營主收的營友跟我們一起跨年喔~半夜還有在滑草區紮營的營友們嚎叫~ 增添不少跨年的氣氛~~超棒~~,3,0,1,1,4202,2024/01/03
有釣魚可以娛樂是優點，浴廁普通偶有尿味，清潔次數需加強！晚上沒人管，吵鬧聲到凌晨，能不能安靜睡覺，要賭人品了！,2,-1,1,0,3312,2023/05/06
福興小農庄是個值得露營的好地方，好客的營主夫妻，推薦給愛露營的朋友們到此一遊。,5,1,1,2,481,2022/05/07
"景觀美麗,老闆服務很好!。山路較小,指標較少,D區鄰近碎石走道,晚上休息時,客人走動容易有噪音",4,1,1,2,4783,2017/06/14
很舒服的營地，營主很熱心煮好喝的橄欖薑湯，廁所也維持很乾淨，小孩也有場地可以跑！推薦看得出來營主很用心的維持這個營地！常常看見他騎著機車的身影穿梭在各個區域,5,1,1,2,661,2021/05/07
很讚的營地，看百萬夜景很簡單（別去排要看夜景但要排很久的營地了），一定要去，意外一帳包全區爽！。很讚的營地，看百萬夜景很簡單（別去排要看夜景但要排很久的營地了，這家就有），一定要去，意外一帳包全區爽！,5,1,1,2,2618,2018/01/28
營主很親切。浴室蓮蓬頭出水忽冷忽熱。,3,0,1,1,2153,2019/02/13
天氣涼爽 營主用心管理離谷關溫泉近 口袋名單之一,5,1,1,2,2450,2022/05/07
這露營區的老闆很棒....早上有兒童DIY免費教學 竹弓 竹製存錢筒 到下午還有生態及部落歷史導覽 解說都很詳細。到晚上還有老闆招待自養的鹽烤高山台灣鯛超好吃～,5,1,1,2,950,2019/05/08
"很棒的營區,營主熱情人很nice,經營用心,設備齊全(冷凍、冷藏、RO濾水),尤其是乾淨寬敞的浴廁讓人上廁所沒壓力(每間廁所都有酒精跟擴香),最推的是營位給的很大方,活動空間充足,推推推~",5,1,1,2,4317,2024/03/07
前往營地的山路很可怕 要白天時開比較安全 營地廚房及盥洗設備齊全 可以很舒服的親近大自然,5,1,1,2,310,2019/05/08
寬廣舒服的營區，很多樹蔭可遮陽。有溪和登山步道做休閒，離南庄老街不遠方便採買。白天小黑蚊有點多要注意防蚊。,4,1,1,2,5809,2019/05/06
各區間距太近，營位太密，擁擠，晚上鄰居聊到1.2點很吵。,2,-1,1,0,4428,2018/05/08
營主熱情，服務又好。環境好，草地寬敞。還會想再去露的營地。。快到營地的指標希望可以再清楚一些，因為路小，第一次去會以為走錯了呢。,5,1,1,2,641,2018/01/23
到營地的路有一段很窄很陡 要小心開營主大哥人很nice會附黑色板子 可以放在帳篷下廁所非常乾淨 有附吹風機區和區之間距離不遠 所以聲音可能會互相干擾建議去可以包區會玩得比較盡興下面區的若有人抽菸 會飄到上面區不過 上面區比較靠近冰箱可以衡量一下當晚沒看到星星有小小可惜,4,1,1,2,4564,2022/05/09
營地距離浴室、廁所真的有點遠，如果有帶長輩真的需三思，白天兩區共用2間廁所、浴室，晚上11點過後，一間浴室廁所就會上鎖不提供使用，僅剩一間浴室跟一間廁所可以用，如果同時夜間要上廁所就要排隊了，然後衛生紙沒有了也沒有補，但是不得不說，廁所不定時都打掃的很乾淨，另外營區蚊子多就算了，這應該是我票選心目中螞蟻最多的營區，真的超級無敵多，現在想到都還是會害怕。,2,-1,1,0,3421,2023/10/07
"營主很貼心,衛浴很乾淨! 參加撈蝦活動,很有趣~",5,1,1,2,3923,2018/03/08
場地跟衛浴都很讚！只是雨棚跟帳篷size比較剛好，風雨大的時候帳篷還是會濕，還好隔天是晴天，一樣乾燥撤收。第一次被收超過四人的人頭費，訂位規則有寫，所以沒有問題。只是第一次遇到會因為多一位家人而被收費的，可能是我露營經營比較不足，才會覺得驚訝！,5,1,1,2,4416,2023/06/07
1.可以釣魚，溪邊可以抓溪蝦2.營區有提供WIFI不過訊號很弱，連不上3.營區不大滿帳時，洗澡得多花些時間4.早上天還沒亮就有車神再跑山,4,1,1,2,5692,2023/05/06
老闆細心、健談、熱情。草地柔軟生態豐富値得一遊再遊,5,1,1,2,5036,2018/05/07
感覺是以前很用心經營但是現在已荒廢的營地...可能剛好大家補班補課，所以我們包山..營區沒有大門..蠻沒安全感的會突然有過路客直接把車開進來遊大觀園及用廁所營主也只有收錢的時候出現...浴室水有幾間會忽冷忽熱,3,0,1,1,6076,2021/05/07
導航到小烏來天空步道後就沿著路標走就是了不要直接用導航導到這個位置，會帶不到這回是露的是小森林區（平日1600、假日1800）帳篷、充氣床墊、遮陽棚、桌椅都會用好還有一區自己的廚房區有附日光燈照明，不過還是可以自己帶照明比較充足環境優美，可以看到星星跟夜景,5,1,1,2,2837,2021/05/07
有問題反應，營主都很熱心處理及服務。非常喜歡，大推,5,1,1,2,1593,2018/08/18
靠近門口，螞蟻超多，蟲蟲危機，小黑蚊多親子遊樂廣告不實，說好的溜滑梯勒,1,-1,1,0,768,2024/04/24
"露營應超過50幾次，從來沒有遇過這種營區+營主，這是我第一次給踩雷評論缺點：1,插座不足（延長線要經過車道），水槽不足，廁所跟浴室不足+空間很小2.營位沒規劃，長寬由老闆目測，說是6公尺x6公尺，但側邊種樹的地方都算3.最重要的是搭帳蓬時，老闆一直在旁邊監督，只要東西放在旁邊或他覺得你超過了界線，就會在旁邊碎念，一整個露營的心情都沒了，如果不是要先付全額露營費，我早認賠另外再找其他露營區了給兩顆星，包含廁所算乾淨，草皮保養&風景還不錯...不過我不會再來第二次了！！！！",2,-1,1,0,1180,2023/11/07
營主夫婦人很好親切，營地小巧乾淨，樹種的很多很舒服，地點很好下面就是超商機能性十足，開車路好走平坦，下次還會再訪的營區 …,5,1,1,2,3942,2023/05/07
空氣品質真的不錯～環境真好～但只是差了一點～不是每一區域都有廁所～如果改善一下會更好～,5,1,1,2,6039,2023/05/06
營地的草都沒整理，蒼蠅超級無敵多，沙坑也不能玩。,3,0,1,1,1337,2021/05/07
處處可發現小細節的營區。1.營區有種置身公園的感覺，而環境更是乾淨，記得昨晚在不起眼的垃圾桶丟了一個小垃圾，隔天一早已經被清空。2.沙坑、溜滑梯都有遮雨棚，沙子也是乾淨狀態。3.車子可以停放在營位旁。4.此次是團露，大家為了方便，走路約莫5分鐘路程，就有可以吃合菜的店家。,5,1,1,2,94,2023/01/17
草雖厚但排水不良，滿腳泥濘！戶外本就昆蟲飛跳，但一直有蟑螂出沒上桌下竄的，這個太超過！養狗就顧好，對著客人呲牙咧嘴的亂吼亂叫，若小孩嚇到逃跑跌倒，要算誰的？這種體驗一次就夠，謝謝.,1,-1,1,0,748,2023/05/07
"已經2訪的營區,營位規劃很大,熱水穩定,值得持續再訪的營區",5,1,1,2,732,2022/05/09
乾淨的營區，感受得到業者維護上的用心！意外包場，非常開心。熱水超熱、洗手間很乾淨、有冰箱、有水、有遊戲沙坑、還有防止日曬的帆布簾。環境安靜到可以聽到隔壁營區的吵鬧聲，是個很不錯的露營經驗,5,1,1,2,796,2020/05/08
優點1.廁所、浴室很乾淨，也很通風缺點1.營區太小2.營地草皮和碎石密度不夠，導致雨後泥巴很多3.一區只有一個洗手台 要跟其它帳共用 很不方便,1,-1,1,0,5371,2023/05/08
離市區不遠補給方便，有冰箱食物保存方便，晚上有夜景。建議搭帳位置增加草皮密度，穩定熱水水壓。,5,1,1,2,4291,2018/05/18
乾淨、舒適，可看夜景的營區。入住兩天一夜，營區整理的非常乾淨，尤其是浴廁完全沒有異味，垃圾桶裡的衛生紙也很少超過一半，感覺一直有在打掃。營區裡也有種植一些花卉、咖啡樹，還有生態池，景色優美。入住期間沒有看到蒼蠅或小黑蚊，是個會再想去的營區。,5,1,1,2,6506,2022/05/07
營區小小的，但是很乾淨，沒有什麼光害很棒！B區都是一帳包區，A區棧板看出去的景色很美,5,1,1,2,6642,2022/05/07
覺得沒有用心經營。廁所都沒打掃,2,-1,1,0,3604,2020/05/07
真的不錯，小朋友看到水就玩瘋了！只是剛好碰到下雨！下次還會去的,5,1,1,2,579,2018/06/18
園區跟浴廁都乾淨到讓人驚奇，本來想露雨棚，沒訂到，只好改一般位子，想不到意外的寬敞舒適，地上雖然是碎石，但是營主鋪了地布，所以帳底乾乾淨淨，營區的氛圍非常輕鬆，就像回到阿公家的自在！不過營區訊號不良只有中華電信有收訊，大家都把手機放下反而多了更多時間玩耍聊天呢！,5,1,1,2,2302,2023/05/07
營主超熱心，五星級的夜景，廁所超超乾淨，我看到營主ㄧ天打掃許多次，一定再造訪的營地！,5,1,1,2,3463,2021/01/03
未善加維護管理。營區浴廁老舊，未定時清理，夜間洗澡到後面都是泥水，也無法聯繫到營地主處理。,2,-1,1,0,104,2018/05/29
天氣熱時可以往高海拔露營區前去，這次搭雨棚區，天氣很棒，營區管理很好！,5,1,1,2,1582,2023/07/08
D區女生只有一間蹲式廁所與一間淋浴間，覺得不足，媽媽們帶小孩洗澡，就要等很久，真心覺得還是要設計座式廁所或裝設安全扶手，對老年人或不習慣蹲廁的人比較方便。DE區共用一個冷凍庫，希望也能有冷藏優點~有大雨棚方便大家遮風避雨,3,0,1,1,4501,2019/05/07
海拔夠高，環境乾淨！老闆娘人很好！營區稍小,4,1,1,2,4342,2019/05/09
腹地廣大，草地很美，營主友善，適合前往露營。佳興檸檬冰就在附近,5,1,1,2,1817,2023/05/08
自然生態很豐富，但營地小又滿帳，衛浴間少，遊戲區也小。,4,1,1,2,3777,2018/05/07
"營主熱心時常來關心狀況 比較可惜的是沒有摘到他們自家種的草莓…應該要留些給自己露友品嘗一番草地很舒適 希望可以維護越來越棒 衛浴很乾淨 熱水不只充足而且穩定 是個少帳包場的不錯選擇.唯有兩個建議之處 ~衛浴內要增設的小配件及上下樓梯的安全顧慮,希望不久後可以看到其他露友照片是已經改善.加油加油.",5,1,1,2,4232,2021/05/08
很安靜的地方，喜歡清靜的人，可以考慮的地方,5,1,1,2,735,2019/11/18
真的很遙遠的露營區，到達里佳資訊站再過1.5公里就到這個露營區，營地很大，廁所有兩間男生的，三間女生的，營主很親切，我們當天中午訂了風味餐很好吃，還有愛玉配上熬煮的鳳梨醬很對味很消暑，可惜大家太餓來不及拍照。晚上因為下雨所以沒去看螢火蟲，但在更晚沒燈光的情況下居然在帳篷內看見外面一閃一閃的螢火蟲，很幸運。而在下過雨的早晨空氣很好（大概六點）有些冷，但如果很夏天的時候來大概8點就會非常的熱，一定要帶電風扇。,4,1,1,2,1111,2021/05/07
土豪營主大哥。營區在石門水庫帶狀營區庫的前緣，以整條羅馬公路來看位置算是比較近的。佔地很大屬於中大型營區，有別於小天地型，五葉松更開闊，踢足球也沒問題。營主大哥很熱情，不停騎車巡視到處提供服務，以管理經驗上，是相當負責且細心的總經理，推一個沒毛病。,5,1,1,2,1870,2022/04/19
最高的營區4月初去有點冷，大約12度，下午先洗澡隔壁區外國小朋友們穿著短褲短袖在玩 …,5,1,1,2,3205,2023/05/07
晚上看到滿片星星，孩子們都很開心！。有幾個營位車子只能停在停車場，帳篷用具都得自己搬，如果營區能提供推車給露友們使用會更加方便！,5,1,1,2,2722,2021/03/06
小而美的營區活動很多 營主人很好營區也乾淨舒服,5,1,1,2,4659,2023/05/07
營區很美，老闆人很好，絕對是露營的好去處！,5,1,1,2,6793,2023/05/08
營主很熱情，陪聊陪喝還請吃搗麻糬和山羊肉。洗澡熱水夠熱，只可惜12/31-1/1下雨。,5,1,1,2,1478,2022/01/16
希望營區能管制小孩放炮和夜間十點後的音量。,3,0,1,1,3285,2019/05/08
絕美景色 雖然路途遙遠但值得再次回露的好營區,5,1,1,2,3319,2021/02/17
老闆，營地不要超收喔，這次露營A區就像停車場，至少20台,2,-1,1,0,3302,2023/05/07
營主非常棒廁所很乾淨很值得一直來一直來的營地228露營還沒結束，馬上又跟營主預定7月跟跨年的 …,5,1,1,2,6029,2023/05/07
"小型露營區,冬天在迎風面有些營位風超大,雖然營主有提供帆布等設施風還是會灌進來,較無兒童遊樂設施,但距離商區近採購方便迎風面所以也可以瞭望整個山坡 營主很客氣",4,1,1,2,1890,2020/05/07
還會再訪的營區。一早起來被遠處的高山雲海治癒，傍晚的粉色夕陽抬頭就能看見，營主用心的維護環境，水槽、垃圾收集處、浴室廁所相當乾淨，是一個值得再訪的營區。,5,1,1,2,5418,2022/04/06
老闆很親切！草皮照顧的很乾淨、蓬鬆，浴室超級大很舒服，溪邊也很清澈。雖然沒有大風景，但環境清幽，也沒什麼人，值得回訪。可以跟老闆訂土雞蛋，超好吃 …,5,1,1,2,4502,2024/04/08
分區都有衛浴且乾淨還有飲水機很加分，營主自種芭蕉給我們吃吃，還點一大把香茅幫驅蚊蟲，非常客氣和藹的老夫妻營主，進營區最後一段路比較窄難會車但都有柏油路，有機會再來露！️ …,5,1,1,2,298,2023/05/06
稀有河岸大景（蘭陽溪）、盪鞦韆沙坑；長條狀帳帳相連、洗澡間僅兩間,3,0,1,1,3263,2018/05/06
寵物友善營區，營主夫妻友善又熱情！營地乾淨舒適。營主親切，是個寵物友善營地；適合不愛跟陌生人同露的人。,5,1,1,2,3204,2018/10/25
1.大雨棚真的很大，舒適，下雨天絕對方便，但插座有點少且此區沒有草皮車子也就停在雨棚外，若滿帳視覺感覺擁擠。2.淋浴間感覺偏少，但乾淨，熱水有時候有點不穩。3.魚池很大，熱愛釣魚的朋友可以考慮唷！4.進入營區之後，園區小路很陡，請小心駕駛。,4,1,1,2,1236,2021/05/06
園區內環境維護的很好，衛浴也很棒。車輛停放較不方便，上下裝備如果有車輛檔住進出道路，就會十分不便。,4,1,1,2,7028,2020/04/04
少帳包區好地方。感覺的出來營主有用心整理營區，因當天去遇到下雨，有些少掃興，但營主也不定時的還巡視營區，問問看我們有沒有任何需求！靠近營本部的浴廁真的很讚，超級乾淨的！,5,1,1,2,6912,2019/07/29
