content,rating,status,type,label,sequence_num,publishedDate
營地在最上面山頭的迎風面，去時正逢下雨風大低溫時；遍地泥濘，草地積水排水性不佳，也許是還在建設，營主很珍愛草皮；營本部後方的衛浴設備沒有獨立排水孔，不太衛生且每區的衛浴數量少；洗澡時水溫與水量很剛好，不會忽大忽小。有幾隻黑色羊咩咩會吃草，很可愛但也是遍地羊咩咩黃金；遠方美景很漂亮，期待未來營地會建設的越來越好,2,-1,1,0,3976,2023/05/07
浴室水龍頭忽冷忽熱。寵物建議都禁止，不然就是可以帶不要收錢,2,-1,1,0,4985,2022/04/18
風景優美 營主親切。離小烏來風景很近 路況不錯很好開 營區風景很美 營主很親切 有機會會想再去,5,1,1,2,4741,2022/11/16
服務很好，海拔不高小黑蚊偏多，請做好防蚊工作。。車不停帳邊建議可提供推車。,5,1,1,2,3947,2017/07/24
舒適的露營區，能自然而然的放鬆在這片環境裡使人與人的相處更加緊密營主們也貼心分享秋天螢火蟲,3,0,1,1,2084,2021/05/08
環境還不錯，但下雨時草地容易積水，排水要再加強,4,1,1,2,1646,2017/11/20
老闆娘很親切，浴室水壓很夠，床單乾淨，有用心，很滿意。,5,1,1,2,3519,2022/05/09
營主人超好，提供很多童玩給孩子們玩。還貼心分享附近景點。每一區都很獨立不干擾，三帳包區居然有2套衛浴，使用上很舒服，衛浴很乾淨，每天早上營主都會來清潔。且提供免費洗髮精沐浴乳、吹風機，很佛心。這次228連假來三天兩夜露營，很放鬆的營區，會想再訪，推薦給大家。,5,1,1,2,3233,2023/05/06
場地偏原始老舊 簡陋少整理 有水電冰箱齊全 營地架高有雨棚 需求高標者不合適,3,0,1,1,5399,2023/05/07
蒼蠅、小黑蚊爆炸多！ 吹風機只有一隻風量極小！ 廁所衛生紙在外面，不是每一間都有，廁所跟浴室是一起的！ 草皮草很長….,1,-1,1,0,2092,2023/07/06
第一次帶自己家人來 遇到邱爸 非常親切服務五月末段還看到螢火蟲真的很不錯的環境,5,1,1,2,6897,2023/05/09
被咬的不要不要的，地超硬，還淹水,3,0,1,1,2967,2021/05/06
這禮拜去露，都遇到年輕人，晚上幾乎都不睡覺的（我們大約晚上11點進帳篷睡覺）。過了十點之後還在開著麥克風大聲唱歌、高聲玩遊戲，也沒見營主來巡視，最後撐到半夜一點朋友受不了才起來跟他們說可否放低音量才好些。更誇張的是唱歌的年輕人唱了整天的歌，聲音開超大，營主也不會去約束他們，而且喝酒又高聲唱歌，歌聲實在有夠難聽，聲音開那麼大聲還要別人接受他難聽的破嗓。,1,-1,1,0,1962,2022/05/07
營區竟然沒停車位，叫我們自己去找，水槽水管漏水，跟營主反應，叫我們跟別人共用，露那麼多營區，這真的讓我很傻眼！,1,-1,1,0,6886,2023/05/08
綠地很棒營主很親切營區乾淨附近沒有其他露營區所以很安靜,5,1,1,2,6989,2023/07/07
營區草皮維護的非常棒，營區雖小但很乾淨，也很漂亮,5,1,1,2,4825,2019/05/07
營主非常用心經營營地，對營客也熱情；洗手間跟浴室維持得非常乾淨，每一區規畫的都很用心,4,1,1,2,1354,2018/05/08
滿天的星空～超級美。原訂Top區但遇到消毒只能在E區，真的有些可惜。上山的路很難開，露友們要注意安全。廁所蜘蛛蠻多的有點小可怕，首露遇到熱心的老闆真的感動！下次有機會會再造訪唷,4,1,1,2,4345,2020/09/28
什麼都要收錢 冰箱開開關關 要收30元這是我看過收錢 最勤勞的營地小朋友去冰箱拿飲料被告知要收取$30，因為冰箱開開關關，結果小朋友跑回營地告知大人,1,-1,1,0,4117,2023/05/06
服務態度良好，空氣清新，設施場地規劃合理。,4,1,1,2,3983,2021/05/08
好棒的露營場所，熱水超舒服，衛浴設備新穎又乾淨，值得前去享受悠閒時光的好所在,5,1,1,2,3404,2018/05/08
第六露來到這邊，主打的是有魚池可以釣魚，而且可以幫忙處理，就可以拿來烤肉草皮情況：️️️️還算整潔，樹木不多，海拔不到300所以夏天應該會蠻熱的，且旁邊有魚池不知道蚊子會不會很多廁所衛浴：️️️空間規劃：密集因為整個營區的帳數可以收到50，非常的多，排列也很緊密，所以不太能好好放鬆，加上離馬路很近，晚上飆車、卡車非常多，回音會很大，露營的時候遇到很多帳到了半夜兩三點都還在嬉鬧，小孩還在玩，也因爲人很多，整個營區似乎只有四間廁所跟淋浴間，人多的時候冷水會斷斷續續的，蓮蓬頭也都已經分岔，廁所也就容易傳出臭味。如果很喜歡釣魚的話還可以，但若想享受放鬆露營享受美景可以再考慮,3,0,1,1,844,2023/05/06
超級推薦的秘境露營區適合全家大小一起來 營區的設備都很齊全～還有小朋友最愛的溜滑梯、盪鞦韆可以看得出營主的用心天氣好的話 還有機會看得到滿天的星星,5,1,1,2,1323,2022/05/07
非常棒的營區，老闆很熱心好客！夜景很棒！這次忘了帶地墊幸好有老板借了ㄧ片藍白帆布！,5,1,1,2,1700,2017/04/04
有橘子摘，有沙坑玩，附近景點多。很適合帶小孩來露營,5,1,1,2,3096,2018/01/02
很大的露營場地，原本想附上晚上深山濃霧的浪漫畫面，但是我手機只能拍出一片黑所以只能分享白天的部分。,5,1,1,2,6118,2019/05/07
"環境優美的露營地,。1.這次4/4~4/5 兩天一夜的露營,選擇有雨遮的,同天只有5帳,所以空間非常大.2 如果19 帳全滿 (7帳有雨遮/12帳草皮), 小孩就沒有草皮可以玩了.3.天氣不錯, 旁邊有小溪可以抓蝦.4.有魚池可以釣魚,場地2小時100百,租魚竿100百,釣起的魚,吳郭魚100/斤,烏鰡80/斤,前一天有個露友釣到3條烏鰡,8條吳郭魚.很容易釣.(我女兒也釣到一條吳郭魚,逃走一隻烏鰡)5.回家前買了個放山雞,800百,不錯吃.6.夏天有游泳池開放.7. 整體來說, 是一個不錯的小營區.8. 缺點, 洗澡水壓不穩定..",5,1,1,2,391,2018/04/09
H區的停車位 超級爛 跟營住反應無效 還說要退錢 請我們下山,1,-1,1,0,5314,2020/05/06
草地柔軟舒服，兩棵落雨松的中間就是營位，帳篷搭在變色的落雨松下別有感覺，車帳分離，如果遇到滿帳還是會感覺擁擠，乾濕分離的衛浴洗澡很舒服，路況算好走，進入營區的田間小路比較窄，周邊是果園農園，上午的時候有出現零星蒼蠅，下午的時候看到有農民戴著口罩噴灑霧狀液體，希望不是農藥啊！ …,3,0,1,1,460,2020/05/07
有些石頭很滑，應該要固定去刷,3,0,1,1,5404,2023/05/08
一帳包區，星星挺多的，還能看到螢火蟲！昨天晚上，溪水冰冷，好玩，有冰箱，洗澡熱水讚！有點蚊子跟蜜蜂！但營主有提供蚊香！！安寧，無光害！除了小遠外！整個營區cp值不錯！,5,1,1,2,109,2021/05/07
不推，易積水，且服務不好,1,-1,1,0,2513,2017/05/07
營主非常好客，原住民很nice。因為包場，帶我們去砍竹，削成尖柱，還準備每帳一塊厚豬肉塊，讓大家體驗火烤山豬肉，還有竹製射箭體驗，很棒的感受！,5,1,1,2,573,2021/09/23
營主很親切熱情，風景優美，山上天然的冷氣，非常舒服，令人想再次造訪～,5,1,1,2,3267,2021/05/07
谢谢老板  上週六本抱著忐忑不安心情還是  深呼吸的在F区  拚了一晚  很棒的地方  缩時攝影也很美放不上來  雨后的次日更美  這晚的伙伴們也很棒,5,1,1,2,1828,2021/05/07
營區離居住在台北市區的我們來說，其實有點遙遠！這裡算是蠻新的一個營區，腹地不大，營主將營地設計成「階梯式」，共有四層，我們這次使用的是最底層（靠近衛浴區），原設計可容納八帳，但是因為大家都是大型或巨型帳篷，再加上客廳帳，所以我們最後只搭了六個帳篷。而營區設有「營棧」，若有不足的飲品可在此採購。這裏還有瞭望台、兒童戲水池、射箭區，對小朋友來說，是個很適合打發時間的營區喔！,3,0,1,1,1543,2019/05/07
一個小而美的露營區!!廁所和衛浴十分乾淨!!營主也很用心經營~雨遮超級大!!完全不怕下雨和太陽!!而且很貼心在每帳後面設計水龍頭給小朋友洗手洗腳!!溪邊玩水也很近很安全~是我露營過最優質的營區!!推薦給大家!!,5,1,1,2,5976,2021/05/07
營區小而美，營主很客氣。雨棚是6×7大雨棚呀！還有室內廣場，這有小溜滑梯，繪本小角落。營主也會在這帶孩子們簡單玩手作，也有讓孩子們體驗棉花糖diy……特殊假日還有不同活動呢！營區內，有不少園藝擺設，也設置了盪鞦韆，有棚沙坑，戲水道等。衛浴水溫穩定，水壓足，水溫也很好調整，相當乾淨，不時看到營主在整理呢！ 營區除了基本冷藏冰箱，還有大型冷凍櫃，脫水機。整體來說，是一個很舒服的營區，很適合放空 …,5,1,1,2,4325,2023/05/07
風景優美  環境清潔 服務親切 尤其是高高的那位營主 大人小孩都嗨翻了  下次還會帶更多人來,5,1,1,2,4190,2021/05/06
營地排水超差，也沒有戶草墊，下雨內帳床墊全濕又積水，根本沒辦法睡，直接收帳回家，超雷營區,1,-1,1,0,6957,2022/05/07
超級乾淨的營區！很有規劃。一到露營區就可以感覺營主的用心經營！過程中營主遇到一些吵鬧難搞的露客真的辛苦他了！維持一個營區不容易謝謝營主一家提供那麼棒的營區,5,1,1,2,3545,2024/03/17
"在露營區餐廳旁的小平台可以看到不錯的雲海,,老闆人也很好,,可是,,浴廁設備簡陋,且洗手台漏水廁所地上都濕濕的,且衞生紙沒了也不一定會去補,沒有想像中的好",3,0,1,1,3497,2019/05/08
乾淨整潔的營地，長程的車程，但是給初次露營有不錯的體驗，夜晚也有螢火蟲現身,5,1,1,2,6685,2021/05/07
老闆人很好，雖然安排營地時有出點狀況，但大家還是玩得很開心。A區設備齊全，很多東西都可以不用帶桌椅卡拉OK...等設備都有!,5,1,1,2,877,2019/03/04
"無限美好。要去的人不要猶豫了，真的是一個非常乾淨的營地！ 當天入住遽然包全營地！！ 超級爽的， 好安靜 也沒有人打擾， 9月的季節平地一樣好熱,上來1300米後 整個涼快到爆炸， 真心推薦b區， 遮雨棚真的好涼  草坪也好美 超級好下釘， 以上是我9/5-9/6實際感受",5,1,1,2,3023,2020/09/11
收了200元清潔費結果什麼都沒有有些人只是想和在露營的親朋好友聊聊天打打屁就要被收200！！！ 營主啊~有點貴喔！,1,-1,1,0,6654,2021/05/07
鐵棚超大 老闆夫妻熱情  環境設施雖然簡單 但這就是我們要的生活,5,1,1,2,4582,2020/05/07
很不錯的露營區！很森林～臨時預約…雖然到營區已經天黑了，現場接待的小姐很有耐心的告知目前所剩的位置，並且供我選擇，非常的感謝！浴廁及營區環境非常的乾淨。 …,5,1,1,2,429,2023/05/07
有機會還會在光臨。要來的客人記得營釘帶30公分的晚上風很大營地主人都很親切離海很近，過年營地也沒超收，沒有人擠人，很棒,5,1,1,2,5724,2019/02/15
露營營地主人有刀是正常的但是主人拿刀對著客人 就不太正常了484在這露營區的客人都要先享受被主人拿刀對著的饗宴呢……額……嚇死我的毛了給一星我覺得還太多,1,-1,1,0,3158,2022/05/08
風景好。營主夫妻熱情 還可採有機草莓 值得再去的好營區,5,1,1,2,1155,2019/06/11
"不優的露營經驗。1.疫情微解封,政府開放戶外活動,確認此營地有管制人數及營位後訂位,但到現場後,整個營區營位超收,所有露友帳篷距離完全無法保持安全距離,管理亂七八糟.(營主還叫大家別Po FB or IG)2.營位內,一看就知道沒整理,有鐵條,束帶..營位內還有螞蟻窩,一看就知道沒整理除蟲,晚上睡覺,小朋友還被螞蟻咬.3.請營主好好管理營區,別推責任給露營樂系統.",3,0,1,1,1759,2021/07/20
古色古香，環境自然隨時都有小小的動物出現營主有種菜可以採適合帶小朋友前往露營️,5,1,1,2,2700,2021/05/07
營主超收，導致冰箱空間完全不夠用，整個營地宛如停車場，非常不愉快的露營經驗,1,-1,1,0,2711,2023/05/07
環境乾淨營主很客氣，有小沙灘 盪鞦韆 游泳池 旁邊還有很乾淨的溪水 夏天很適合來玩， 如果營主還有辦小活動的話更好,4,1,1,2,4517,2020/05/07
老闆很親切！場地乾淨又漂亮，是新的露營區，浴室很大間，洗起來很舒服，熱水是老闆親手燒的喔！,5,1,1,2,4018,2023/05/07
有兒童戲水池，可以讓孩子玩上一整個下午了也適合愛釣魚的爸爸偷閒，戲水池旁邊就是釣魚池囉，唯一缺點就是小黑紋有點多,4,1,1,2,7161,2023/07/08
自然的環境 蓬勃的生態這才是享受大自然而不是參與國土破壞,4,1,1,2,1650,2018/05/06
草地區在營區門口外，雜草叢生未整理且蚊子多，離廁所又很遠，本來要硬著頭皮搭，但一旁露友勸搭棧板水泥地營地較好，老闆也同意更換營地，但老闆隨和，客家人非常好客，隨意就將果園的柑橘摘給我們，並且告知想吃都可以隨意採，營地費用也便宜，浴室廁所乾淨，算是不錯的營區。,4,1,1,2,4900,2023-11-14T19:43:28+08:00
設備不佳，出現露客素質不佳的情況。1. 營主晚上多去現場關心一下露客，半夜2.3點還在嗨，嚴重影響睡眠品質.....2. 廁所浴室蚊蟲多，落葉阻塞導致排水不佳....3. 交通便利，風景佳,4,1,1,2,4266,2023/02/12
熱情的主人，冬季兒童設施可以增加就更棒了。,5,1,1,2,4539,2018/12/19
雖然起大霧沒看到景色 但還是很棒 下次想再去,5,1,1,2,492,2020/08/16
B區木棧板拿來放客廳帳，真的是不錯的選擇...,4,1,1,2,479,2018/09/28
老闆為了賺錢超賣營位也不出面協調非常不負責任,1,-1,1,0,1423,2023/05/07
聽海很美~~天氣好更美。營主人很好、營位都有依照帳篷尺寸安置!!,5,1,1,2,3098,2021/05/28
今年中秋節在這邊露營，老闆娘說這幾天都幫我們祈禱不要下雨，真是太感謝了。果然前2天都沒有下雨，最後一天收帳才開始下雨。營區景觀漂亮，浴室廁所分離乾淨。有提供衛生紙。臨近小烏來風景區，羅浮泰雅溫泉公園，及義興吊橋。,5,1,1,2,767,2020/05/06
這個營區，適合喜歡熱鬧的大群組，也適合喜歡辟靜的人。,5,1,1,2,6046,2018/05/06
"海拔1700m很深山路有幾處有高低差但我們低底盤一個人下去指揮還是能順利通過休旅或吉普車應該能輕鬆駕馭低底盤開得戰戰兢兢，但到達後非常值得山景、雲海、星空、秋紅、冬櫻、竹林熱水夠熱、衛浴乾淨（營主常巡）、營主熱心好聊洗手槽、插座共用,有幾區動力線20米以上比較保險、廁浴同間,人多可能會塞車、洗手槽沒燈屬半原始營區網路一些評論設施不完善，但這次去並不覺得，希望露友們能理解高海拔一切不易也許原始營區較不便，但更能顯出大自然非人造的美，不如自身做好少帶高功率產品好營區，不推嗎？",5,1,1,2,2596,2022/05/07
上去的路線一定要遵照營主的指示！有非常美麗的景觀，夕陽也一覽無遺，衛浴設備都保持的乾乾淨淨，冰箱飲水機一應俱全，還有烤肉爐可以借，有草皮空間給孩子們遊玩，非常值得再來的營區，而且...好便宜。唯一缺點是剛好遇到風有點大。營主非常熱情！推薦,5,1,1,2,951,2020/05/07
空地平整，腹地廣大，環境清幽，營主友善，是個值得再去的好營地，沒有過多的人工設施，草地樹木間隔寬廣，營位設計寬廣，辦活動的好地方。,5,1,1,2,4406,2019/05/06
"到營區前的四公里路面很不平整, 極為顛簸也無法會車，開了20分鐘左右 , 營本部的冰箱感覺年代古老, 冰了飲料卻一點都不冰, 廁所也不見有人打掃, 洗澡的地方勉強還算乾淨。營區沒有收訊, 這點則是要看個人觀感。隔天與友人皆被疑似小黑蚊或是跳蚤的蟲叮咬(本身已經噴了防蚊液), 查看評論之前網友也有相同經驗。總之不推~~ 唯一優點是高海拔在夏天來說相對涼爽, 但畢竟也路途遙遠",2,-1,1,0,331,2022/05/08
夜景佳，蚊蟲少，設施稍遜,3,0,1,1,3169,2017/05/08
親切有心的老闆，準備了泳池、沙坑、籃球，讓小朋友玩的不亦樂乎，謝謝老闆的用心,5,1,1,2,2465,2017/08/21
營主人很奈斯。在這裡露營很舒適，享受悠閒的愜意,5,1,1,2,3495,2023/04/04
營主提供搗麻糬的活動（好吃），還設有戲水池（好玩），最最重要的是廁所跟浴室都超乾淨的（好露），是個小而美的營地～,5,1,1,2,6658,2020/05/07
營位不算大，所以車子不方便停很近，衛浴廁所都很基本但很乾淨，冰箱真的很遠在雨棚區的右上方，沒有飲水機所以記得水要帶，不然就是開車下山大約10分鐘有便利商店。整體而言是不錯的營區，收費也便宜，如果一些小細節再加強一下就會很棒了。,4,1,1,2,3726,2023/05/07
地點離日月潭很近 方便 營地小而美 也有沙池遛滑梯和盪鞦韆供小朋友玩樂 後來要回家發現戒指放在浴室老闆幫我找到 還幫我寄回來 真的很謝謝 老闆一家人很親切 也有提供熱水和冰箱  …,5,1,1,2,290,2020/05/07
營主很有趣，是老師ㄟ營區乾淨，便利性高10帳即可以包區,5,1,1,2,3500,2020/05/08
太過擁擠，彼此會互相干擾。減帳、廁所不脫鞋,4,1,1,2,3487,2020/03/10
環境優美 空間舒適 營區設備齊全 衛浴非常乾淨(感謝營主用心維護)  大家趕快來喔,5,1,1,2,6217,2023/05/08
因為我懶得開遠路，就臨時找個離台北車程一小時的露營區，還能抽空去逛一下附近的老街！更出乎意料之外的，是在附近的露營區都幾乎客滿的狀況下，我們還能一帳包場，營主說接下來的耶誕節和元旦都是滿帳的，所以我們撿到了VIP的享受，不但自選營位還可以搭超大的雙峰帳，整區的果園、菜園、魚池、遊樂場都能寓教於樂，有種菜DIY，還有現採的水果可吃，熟在樹上的水果真的不是採下來放熟可比擬的甜美！結果似乎回程的食物比我們帶去露營的更多了……唯一要注意的就是小黑蚊，營主也會提供蚊香來驅蟲喲！,5,1,1,2,1477,2022/05/08
值得一去 老闆老闆娘人熱情服務好 親子露營區,5,1,1,2,3867,2018/10/14
"營區適合親子共遊,草皮維護的很好,戲水池會噴水,推薦!。有廣播服務提醒相關營區消息,真的用心,大力推薦 .. !!",5,1,1,2,4089,2023/07/03
廁所超級乾淨，真的很加分營地空間也給得很大方我們只是小帳小天幕，一整個周圍好空，營繩高興怎麼拉就怎麼拉前方有矮樹，以為沒景可看，沒想到看到雲瀑，傍晚還住在雲裡面，超級浪漫,5,1,1,2,5946,2023/05/07
景緻優美，備有乾淨舒適水壓優秀的淋浴及廁間，老闆親切。,5,1,1,2,2643,2018/05/07
"還OK。遊戲區離營位太近,有點擾人,浴室數量不足",4,1,1,2,1765,2020/02/10
這周去露營租露營區的帳篷與客廳帳，客廳帳一頂已不防水，滴水嚴重，下午四點請老闆來看，工作人員七點雨停才到，先把裡布擦一遍認真檢查有無破洞，說沒破洞就要走了，我們強調這是防水塗層失效了，因為另一頂不會，請求更換，老闆來了一直強調這是正常的，客廳帳裡面就是會滴水，態度強勢輕蔑，完全不理顧客的反應，堅持己見，搖頭嫌錢難賺。查看過往評論遇到問題的處置的確很像我們這次的經驗，不小心就慣老闆了，露營區美但遇到問題心會累。,1,-1,1,0,257,2022/05/06
可以眺望淡水海的一個露營區，草皮整理得很好， 夜晚的燈光照明有點不足,4,1,1,2,2977,2023/09/07
第五露營主非常熱情準備小玩具給小朋友玩環境乾淨舒適路也很好走小狗狗小不點很可愛喲,5,1,1,2,5255,2023/05/07
E區很優。車停帳邊，各區獨立衛浴，冰箱冷凍櫃在E區，草地不錯，營主親切另外夜衝時要小心開，入營地前最後一小段路沒有路燈,5,1,1,2,6096,2023/05/07
營區很小  雨棚3*3  公路旁  無景觀。營區很小  無人照看  有事自己去旁邊的餐廳去問  晚上就找不到人了,2,-1,1,0,4208,2021/04/26
車露營位泥土地，下雨地上泥濘！,3,0,1,1,6075,2021/05/07
小而美的露營區，有冰箱離水域也很近，環境優美，也有大棚內的位置可以選擇喔！,5,1,1,2,2882,2023/05/07
令人放鬆的環境雖然是新開幕的營地但場地與設備都算齊全老闆很Nice~ 有機會再訪,5,1,1,2,1040,2023/05/08
這個週末到雲端紅土露營區，感覺真的超棒的，第十八露的我們，第一次有捨不得離開的感覺！營區真的太美了，整體規劃超有質感的，衛浴部分簡直是六星級！,5,1,1,2,5447,2023/11/08
"露營就是要享受戶外,建議卡啦OK設備封存或限制使用.。親切的營主,雖小但營主提供豐富的生活導覽並可順遊新溪口吊橋.還有竹弓及存錢筒供小孩,還有營主的烤魚香又好吃. 第一次露到的營地在晚上10點後只能聽到大自然的聲音. 營主也適時關心露客們, 可惜廁所較髒, 而營主也提供卡啦OK供朋友使用, 但一下午的魔音實在惱人.",5,1,1,2,2893,2019/03/04
還不錯的露營區說大也不大屬精緻型，停車較為緊迫，沒有風景，圖個青山悠閒，廁所與浴室皆乾淨，老闆與老闆娘待人親切，價格不貴，營區電力充足，缺點是冰箱有2部2部冰箱不夠大也不夠冷，冷藏庫東西一多會化冰，夏天來建議自己帶行動冰箱來。,3,0,1,1,5026,2020/05/07
"聯繫上不夠主動!。因連日大雨, 於出發當天一早就主動聯繫營主, 是否有勸退露客的動作. 到晚上七點半才回覆說不用過去, 但大家早已出發...小黑蚊非常的多, 多到我懷疑人生. 草地積水非常嚴重, 雖有提供護草墊卻還是泥濘不堪! 整場設備, 大概只有浴室算很不錯, 再改善一下排水速度會更好!",3,0,1,1,73,2019/06/10
小黑蚊多，營區腹地不大，雨棚區的寬度比較窄。廁所只有一間是坐式，其他都是蹲式+洗澡淋浴，感覺一不小心會掉進去。一般沒連假夜衝半價，但連續假日只有八折，這邏輯有點微妙營主不愛接電話，偶有遇見算是人滿好的，不過這個營區超級⋯不推，列入自己的黑名單。,1,-1,1,0,2888,2023/05/08
好山好水，很生態的露營區，只是路很小，不好走；此次露營意外變成一帳包場，營區老闆人很好。,5,1,1,2,2326,2021/04/29
在最高點•眺望雲海高山•人間仙境•美不勝收,5,1,1,2,5430,2017/05/08
第三露：營地大，衛浴乾淨。碎石地，營釘要好一點才容意打釘。,4,1,1,2,2472,2018/05/06
三天沒清理垃圾～廁所的衛生紙也堆了三天沒清，廁所就多了一股味兒～,1,-1,1,0,6330,2023/05/08
只給五顆星，是因為只有五顆星！！！太親切舒服的好地方了！處處可以感受到老闆娘的用心跟好意，廁所非常的乾淨！適合露營新手，之後有人問我推薦，我一定第一個推薦這裡,5,1,1,2,367,2023/06/08
"浴廁空間大，其中一間還有分格,不會讓衣服濕掉而且有冷凍.冷藏冰箱及飲水機附近有好幾個景點可以去走走真的很不錯",5,1,1,2,4873,2023/05/07
營地乾淨、廁所衛浴設備很棒。營地老闆很貼心、還弄了水煎包給我們吃,5,1,1,2,184,2017/03/20
露營的好地方，下去有個很陡的陡坡，上來時候有個緩坡。不要走錯了。 要不然無法會車，車子可能也爬不上來。 前方有個河水可以戲水，最好帶個浮具下水，比較安全。,5,1,1,2,5639,2020/05/07
給妳們建議：1.我是不知道D區雨棚區原來可以這麼多帳⋯也覺得收費標準很怪⋯⋯明明聽到對方根本不知道車貼這種東西她們最後卻每帳只要$1100&$900？！2.D區車位實在太少⋯超收嗎？導致車要停在很遠⋯⋯搬東西很遠3.有推車可以搬裝備很好⋯但似乎承載力不夠，拉到一半東西也掉的差不多輪胎不夠力不好推4.請問每天有人負責清廁所嗎？才星期六的下午廁所馬桶旁都是尿⋯⋯知道是露友照成的，但其實希望能常常注意廁所清潔以上建議,2,-1,1,0,1894,2019/05/06
一個值得推薦給大家的好營地。。草皮厚，視野開闊無遮蔽，據說秋季還可以看到雲海。營區面南，無光害適合上山觀星。近上巴陵觀景台，臨時補給方便。老闆態度親切，還供冰箱可以使用。,4,1,1,2,484,2017/04/20
女廁還可以，水質不優 哈哈,3,0,1,1,1340,2019/05/08
三月中去過，第三次機露。沒有另外收取機車費用，僅收原本的帳位費不錯老闆親切，當天風大還幫忙轉移帳位廁所比我們的帳篷空間還豪華，都想睡在廁所了。離淡水景點都很近，機能也方便（怕吵的露友要考量）但還是有幾個可以更好的地方啦～草地可以多維護，廁所可以更常維持清潔（當然使用者也要一起啦）.p.s 營區大樹下真的超好拍,4,1,1,2,5502,2023/05/07
