content,rating,status,type,label,sequence_num,publishedDate
感謝營主救援讓我們一家有瓦斯爐煮飯，草地很棒，兒童遊樂設施很多又好玩，還有可愛的兔兔可以摸。草地限定時間開放車輛上下裝備很貼心，這樣就不用時時擔心車子進出會撞到小孩。,5,1,1,2,2789,2021/04/26
它的淋浴間是我露營過最好的 大又乾淨連小行李箱拉進去也沒問題 不用怕會溼掉喔 可惜男女沒分開，老闆&老闆娘人很親切,4,1,1,2,5035,2019/05/07
有小黑蚊 廁所異味重 戲水池髒原預定包區 一到現場傻眼已被其他露友佔據 心情超差的,2,-1,1,0,3231,2023/11/06
跨年去了結果好像超收帳篷一樣，一個約莫6*9的營地要我們塞兩帳，前面停車根本無法停下兩台車，鞭炮到了隔天6點還在放,1,-1,1,0,3928,2022/05/07
個人主觀體驗僅供參考因為預知會下雨所以訂了C區碎石區減少泥濘的機會C區除了石桌那裏相對低窪一點會積水，其他地方有發揮碎石區的優勢排水迅速C區可容量兩帳 但若是大型隧道帳兩帳就會比較擠了有提供該區專用冰箱，這非常方便。有不少蚊子，要注意防蚊。因為下雨車陷在泥巴裡，營主熱心幫忙救援，感謝。營區外的道路可以看到螢火蟲。衛浴乾淨。美中不足的就是停車的問題了，,5,1,1,2,5286,2023/06/06
暨南大學腹地的友善營地。#道路不會不好走，但需經過暨南大學校內，路標不是那麼清楚。#衛浴設備乾淨，水壓強！#雖然營地沒有特別的景色，但因鄰近暨南大學，讓小孩消耗精力絕無問題。#營主大仁哥挺熱情的，還會做鬆餅給大家品嚐，給過讚！,4,1,1,2,5030,2019/04/07
營區不大，可以一眼望盡！景色只能遠眺一瞇瞇的景色（照片是放大好幾倍的效果）營區最後10分鐘的路真的不太好走，晚上夜衝要非常小心，營區設備一般般，沒有小孩遊樂設施，浴室全部共用5間，廁所3間（稍微少），容易跳電不要用高瓦數電器～以上！,3,0,1,1,2173,2022/05/07
老闆非常熱情，巡視頻率高，有問題隨時協助解決，讚讚,5,1,1,2,2009,2021/11/13
海拔800營主夫婦就住在這邊的三合院這次是單飛，搭獨立c區，夜衝抵達之後打電話給營主，他會出來迎接獨立c區有一盞燈，搭帳不會暗暝矇下裝備完之後要集中停車在三合院前面這邊每一區都有段差，一層一層，D區最高草皮照顧的很好有護草墊廁所有三間蹲，三間坐，兩個小便斗，六間浴室，三個洗手台，兩隻吹風機有冰箱冷藏冷凍，飲水機，脫水機，營主家那邊也有冰箱記得洗澡前要先看有沒有熱水，水壓很穩，不會忽冷忽熱這裡是我15露以來第一次露營沒有被蚊子叮連小黑蚊也沒有，蒼蠅也很少，真的不誇張..我也很驚訝！但其他區域我就不知道了晚上營主會帶大家去看夜景，要坐營主的車小朋友可以玩水，玩沙坑，牆上可以畫畫因為我們蠻喜歡這裡的，所以就直接訂了三個月後的營位，打算再來一次,5,1,1,2,4935,2021/05/08
大雨棚區蟲實在有夠多。大雨棚區蟲實在太多了，雖然在溪旁～但是實在只適合玩、不適合搭帳～蟲比一般營區位置多了兩倍～這是用殺蟲劑也殺不完的。大雨棚旁就是廁所～隱約都會有廁所味飄出。所以實在不會再去了。,3,0,1,1,5967,2020/10/03
很久沒有露營洗澡洗到抓狂的，只能說幸好不是寒流來的時候到這營區，小黑蚊個人覺得還能接受，但這熱水真的讓人無法接受。,2,-1,1,0,6480,2020/05/08
路況好開，沒什麼難度！營區整理得非常用心，營主也很熱情~值得再去也很期待櫻花季,5,1,1,2,3449,2024/01/08
很棒的景觀。廁所乾濕分離很乾淨，熱水都有也很熱，到營區前有一段路較陡，要注意安全,4,1,1,2,3566,2018/07/23
在這裡發現「人」才是最美的風景。真的很喜歡營主的熱情和善，營主說很快會有釣魚池（苦花、溪哥）、梅花鹿、羊咩咩，期待下次來就看得到哦！,5,1,1,2,4523,2020/08/11
雖然路不太好開，最後一段的產業道路很狹小且顛簸。但營地不錯，提供租帳及收搭帳的服務，在入住之前，也會放置除濕機。營主熱心的教我們如何點營火。同區的露客也都很有品質，很棒的一次露營經驗。,5,1,1,2,2054,2023/05/08
"浴廁乾淨，但現場才說租帳要多付搭帳費觀感不佳。優點：浴廁乾淨，服務人員態度良好缺點：帳與帳之間距離近易，地面不平整，          租帳到了現場才說要加300元搭帳費,還不能選自己搭，          問為何不先講得到的回覆是網站不能寫，觀感不佳。",3,0,1,1,5489,2023/02/13
優點：園區很乾淨，園主很認真在維護。缺點：地很硬，不好下營釘。 每一區的帳位多多少少都有被砍伐掉的樹幹，高低不一，有的高度不到三十公分，沒有警示燈，夜衝一定要注意，隨時會撞到。 樹木有蜜蜂跟虎頭蜂，務必要注意安全。,3,0,1,1,2920,2023/11/06
"設備很新,營地主人維護很好,有給小朋友玩的水池.沙坑..,就小黑蚊有點多.",4,1,1,2,6256,2020/05/08
營區小而美，草皮漂亮、衛浴乾淨、熱水穩定供應，營主超親切！下次會再來,5,1,1,2,955,2023/05/08
營區算還可以~有魚池供露友釣魚,3,0,1,1,624,2019/05/06
自在舒適，營主夫婦人很nice。原本訂C區雨棚，抵達時營主引導搭在A區雨棚，高度比較高，視野更好，升級驚喜，小朋友在營位瘋狂奔跑放電！超舒服營區自產的雞蛋品質很好瓦斯帶不夠，謝謝營主夫婦幫忙提供，省了開車下山的麻煩，每個營位都有烤火桶跟木材能使用，暖暖暖,5,1,1,2,5185,2023/03/04
"非常凹凸不平的地面，雨後入口非常泥濘，重點是這裡是可以唱""卡拉ok""的營地，從早唱到晚。晚上10點後持續吵鬧，反應給營主也沒處理，一直吵鬧到一兩點，反正營主不住這，吵不到他的概念，超雷...",1,-1,1,0,5322,2021/05/07
口袋名單裡的露營區，這一次訂了雨棚區， 營區環境很好，常常有大景，感覺就在雲海旁邊一樣，雨棚區特別大，搭完後有一個活動的空間，營區也配置了桌子，椅子，省得帶裝備，洗碗槽一樣是有熱水，這一點非常貼心，包區內有自己的廁所跟冰箱，還有24小時的熱水，營主也常常出來巡視，需要什麼服務跟打掃環境，晚上的時候營主還會幫忙拉下布幕擋風。,5,1,1,2,6990,2024/02/07
營主態度不佳 廁所沒衛生紙還很臭 草皮完全沒處理 燈光不足 總之不推薦大家來露營,1,-1,1,0,1183,2021/05/07
海拔1590公尺白天7-8度，晚上2-3度A區草皮完整，碎石少提供設施冷凍/冷藏飲水機廁所無提供洗發精/沐浴乳，衛浴設備偏老舊狹小，使用電熱水器，晚上10點後不供熱水聽說是風景很厲害的營地，但第一天抵達搭帳時小雨，後來就開始下大雨下了一整夜，一片霧茫茫也看不到景色優點是高山0蚊蟲ps露營超過10次，這個老闆娘應該是最不熱情的,2,-1,1,0,472,2022/05/08
"親切健談的原住民同袍。場地規劃建議明確劃分,可避免爭議,浴廁及流理台地面積水處太多待改善,服務不錯~!",3,0,1,1,5546,2020/10/07
老闆娘很親切，並且會主動關心是否需幫忙，衛浴都保持得很乾淨，每間都有提供酒精消毒。。建議自由奔放的雞群，不要跑進營地比較安全。,4,1,1,2,1116,2021/12/27
營主親切熱心，可惜當天天氣不好，期待的夜景沒看到,5,1,1,2,2769,2016/12/02
路況確實是很好走～營主真的也很熱情！但是環境衛生狀況非常的差營本部門口停車場滿地煙蒂廁所式流動式的組合廁所浴室的地板排水真的不優泄水方向沒往排水孔傾斜草地狀況與照片落差很大想用護草板墊高也沒幾片唯一的標準男廁異味很重營主的家人還有台改裝摩托車超吵每次出門都發車在那熱車熱很久包場收費規則也是模糊不清很有爭議嚴格來說只能算私人院子稱不上營地,1,-1,1,0,896,2021/05/08
來露營放鬆不是來受限制的露營區～,1,-1,1,0,962,2023/05/06
老闆很熱情，給了我們很棒的位置，晚上還過來參一咖喝酒聊天，很推薦其他旅客選擇這裡露營喔，風景優美，洗澡熱水供應也是很穩定。唯一要注意的是上山的路崎嶇，記得準備暈車藥或保持車內通風，還有記得多帶一點水避免中暑。,5,1,1,2,1497,2022/05/07
營區不大但很整潔，老闆熱心廁所也很乾淨很重要！下次會想再去的露營區 …,5,1,1,2,1785,2022/05/09
營地與廁所都很乾淨，營主人很和善熱心，只是可惜現在不能抓蝦了。,4,1,1,2,5795,2022/05/07
營主熱情，熱水充足，場地乾淨，在五葉松樹下露營真的有在森林的感覺。附近還有一座高遶吊橋可以走。,4,1,1,2,6188,2022/05/08
這是一處很用心經營的營地有露天草地也有雨棚位除了白天有遼闊的景色晚上還有精彩的夜景營區不論場地或設施都感覺得出營主夫婦的用心老闆夫妻有年輕的心不時穿梭在各個營位熱情招呼剛結束這次美好露營就期待下一次的再造訪,5,1,1,2,1735,2022/05/07
因爲二個女子臨時決定衝南橫，但時間很晚了南橫也進不去，又想找個地方洗澡休息一晚，無奈住宿都找不到，在google map 找到了「荖濃有機農業露營區」，撥了電話想詢問能否車宿但電話沒人接，心想完了要趕緊再找下一家，後來營主很快的回電話給我，詢問後說可以夜衝，當下真的與同伴終於開心也安心了。老闆好客氣又很親切還等我們到達營區，即使當晚已近晚間9點仍笑咪咪的介紹營區設備，營地很大，洗澡的水量很大很熱，不會因爲多人同時使用而忽冷忽熱的，推薦給大家。,5,1,1,2,5900,2023/05/08
衛浴沒幾間要排隊，冰箱只有一台（爆櫃），注意小黑蚊,2,-1,1,0,2644,2022/05/08
營位給的很大、營區有WIFI，浴室水壓穩定而且水量很大、小朋友有足夠的空間活動,5,1,1,2,743,2022/11/29
感謝胡營主的幫忙，第一次車宿，忘東忘西的！ 營主都能協助，晚上還熱情邀約喝酒聊天，雖然只有一天的行程，但下次宜蘭車宿一定是我的第一首選！謝謝您的小禮物！  還有無敵夜景！,5,1,1,2,6404,2023/05/07
老闆與老闆娘人都很熱情…想必日後衛浴設備規劃完善後會更加的棒喔,5,1,1,2,433,2017/03/18
營主親切客氣，少了親子浴室,3,0,1,1,4068,2020/05/07
"熱水問題忽冷忽熱，不然就是冷的，所以熱水穩定的只有兩間，沒滿帳就要排隊等洗澡，滿帳還得了，可能建議大家夏天來比較好，反正沒熱水洗冷水也ok,另外停車要停很遠，而且他提供停車的地方好像是公有地，停車是違法的，大概覺得不會有人檢舉才敢這樣使用吧！",1,-1,1,0,6202,2023/05/07
高雄開車過來大概2小時左右，走省道29號經過南沙魯部落後，看到左手邊營區標示右轉上去，部落有飲料店跟小商店。最近的超商在甲仙，甲仙過來大概半個小時。營區路很好開，沒什麼急轉彎。最近局部路面刨除翻修，營主有提前打電話告知，路過時高低差要減速慢行。入營區的路有兩條，建議不要按google 導航走，會帶你走另一條比較繞到路，重點是快到營區前的路變的非常窄，車身會被兩邊的樹一直刮。 營區從上到下分A到E、5個區。有冷凍冷藏，熱水機。衛浴整理乾淨，提供衛生紙沐浴乳。d區收4帳，景觀開闊，離浴室廁所冰箱都近。c區也不錯，收3帳，有落雨松。E區景觀被樹林擋住，不過離冰箱跟營主家旁的衛浴近。營區隨時都有人整理。乾淨沒什麼蚊蟲。這次搭d區，景色不錯。使用方便。比較可惜是路面不夠平整。有提供護草墊。整體滿意，會再找機會回露。,4,1,1,2,1540,2024/01/08
無敵夜景，經營夫妻和善，唯一缺點 出入小路會車困難,4,1,1,2,5651,2021/05/08
營區寬敞舒適蠻適合親子的營區下面有溜滑梯跟盪鞦韆還有沙坑釋放小朋友的體力營位也算寬敞浴廁也都算整潔,4,1,1,2,5954,2023/05/06
好玩值得回訪的營地！。不得不推這次露營場地…四帳就可以包區了獨立衛浴設備水量超大很舒服草皮養護的很好沒有蚊蟲天氣好還有星空午後雷陣大雨雖然會積水但是水退的很快唯一可惜的是…營區主打的A~F區都有戲水池沒開放！原本每區旁邊都有水池可以玩才下訂但是不知道是不是因為午後大雷雨怕淹水所以沒有開放！這是我唯一覺得可惜的地方..,5,1,1,2,1441,2022/06/27
很棒的營區 親切的營長 乾淨的環境 值得從台北殺來放鬆的露營場地^^推推～,5,1,1,2,2812,2022/05/08
本次在Top處夜衝二天二夜先講缺點排水普通，近山坡處爛泥多優點浴室水壓穩定熱水充足環境整潔營主隨call隨到且親切是會再造訪的營地下回應該會體驗A區看看,5,1,1,2,318,2023/10/07
老闆親切，營區乾淨舒適。宜蘭之旅必來的營區。雨棚區超大超舒服。當天還下著大雨，到了營區老闆說趕快去洗澡。感動餒讚值得在訪。,5,1,1,2,6546,2024/04/29
2露，草皮維護得非常不錯，老闆娘人好親切，午夜雖然15度但因為濕度高，冬季注意保暖喔!,5,1,1,2,4104,2021/02/16
訂金是全額，遇大豪雨希望延期卻只能延平日，退訂只能退3分之2，無法全額退款，原本談好提供餐點，最後才說無法提供，早就預訂，卻在最後才告知，營區蒼蠅很多。,1,-1,1,0,6582,2021/05/06
老闆服務親切！場地規劃不錯！大自然維護不遺餘力！,5,1,1,2,1270,2018/05/19
不錯~。交通方便~晚上有星星~營主不錯~ 浴廁好棒^^~冬天入住沒蚊蟲~^^~,5,1,1,2,7042,2022/12/26
非常棒！孩子玩得超開心，大人也可以很輕鬆。超大草皮，聽著溪水聲，超靜心。孩子們玩水也不擔心。。隨意找的地點。真的非常的舒心。最喜歡，沒什麼人，露營最喜歡的就是遠離人群。孩子們可以盡情的在草地奔跑，離溪水又很近。想玩水，就直接去。大人可以在上面邊看著邊發呆，無敵棒下次想要遠離人群的時候一定還會再去！！,5,1,1,2,1916,2022/11/28
露營區有ABCDF區，每區都不大，營區內道路窄小且很陡，要轉進B區內因轉角小超驚險，非常考驗開車技術。廁所只有一個，AB區都要爬樓梯才能到達。營區有種一些櫻花樹，春天時較美。,2,-1,1,0,2704,2023/05/07
路線算好走，但冬天夜衝霧大到快看不到路。景觀、營地都一級棒，雲海吃到飽。but就是這個but，連兩晚男浴室的熱水超級小，站起來洗水就沒了，只能蹲著洗，在6度氣溫下沒熱水真的慘。看過往評論好像就有此問題，營主加油啊⋯⋯希望再訪時已改善。 …,4,1,1,2,3035,2024/02/07
有户外營區也有遮雨區白天视野寬廣 環境算可野外昆蟲超多毛毛蟲顏色鮮艷晚上看星星大又亮衛浴標示不清（男 女）算還不錯的營區,3,0,1,1,5241,2023/05/07
謝謝營地主的用心，服務及設備都非常好，尤其還準備了冰箱讓大家使用。。這次我們選擇露了三天兩夜發現了二個問題，第一晚因為跨年的關係所以大家比較high都會倒數完才睡，但是，我的後方有一群年輕的露友一直到凌晨兩點多還在嘻鬧；第二天來了新的露友，他們5～6個小朋友竟然把營地提供的板車拿來當滑板車玩，從斜坡快速衝下來，對他們自己危險也對別人危險。希望營地主可以定期加強安全巡邏,5,1,1,2,1457,2017/01/03
營區雖小，但已足夠。大棧板很不錯，大人放鬆，小孩也玩得很開心。,5,1,1,2,6932,2021/12/15
元旦崩潰露！鄰區包區撕吼唱卡拉、重低音高分貝放音樂、喧鬧玩團康～～～到凌晨三點。抗議無效、反而更刻意。一群近20男男女女年輕人恣意喝鬧，誰都不敢惹。,3,0,1,1,6962,2022/05/06
整體來說：是我們願意再來的露營區清單之一！營區主人算是服務很不錯，態度很親切友善的主人。還會主動來問你會不會冷，需不需要柴火。細部設施，我就沒有逐一拍攝，以我自己還沒有50露的新手來說，這種環境是我很可接受的了。分配空間算是大，我這次是在 D區，就算一頂四人帳、一頂客廳帳，再停一台車，空間都還是夠，所以真的算CP不錯的營地。海拔也不會太高，約莫800，所以也不至於太冷，唯獨山嵐飄過來的話，濕氣會稍微高一些。感覺會是夏天蠻適合來的營地。草皮並沒有很好下釘，估計是之前整地的時候，有先鋪過一層石頭，接著才上土和草，所以營釘在打到剩下1/4長度的時候，會不太好打到最後，但我覺得不影響我對這個營地的評價。所以，還是推薦的喔！,5,1,1,2,2430,2022/05/07
老闆娘很親切，老闆人也很好。在營區自己不小心頭撞到車門流血，老闆很熱心的開車載我到下巴陵的醫療站治療，大感謝！衛浴都很乾淨，水溫夠熱。營區風景真的是很好。上山的路比較狹窄崎嶇，不過我們是大露營車還是進的去,5,1,1,2,2574,2024/03/08
營主熱情，天氣熱一回來還幫忙架好了電風扇和艾草防蚊棒，真的貼心，狗勾海草那一整天都在帳篷外陪著我,5,1,1,2,1562,2023-02-21T23:53:27+08:00
營地超讚、超棒的！露營區名稱不大眾的原因是因為營主是以3個兒子各取一字做為命名，是個充滿愛的營區，營主一家熱情又友善，營地環境依山傍水、乾淨清幽，臨近的溪流走幾步就到了，最重要又非常安全，絕對是熱愛大自然露友的首選之處，烹煮方面附有冰箱、飲水機，還有自養的放山雞、吳郭魚、烏鰡可購買，遊樂方面有3D魔幻輪、哈雷電動車，還有溪流可抓溪蝦和苦花魚(販賣部可買蝦網，不需自帶)，沐浴方面水壓很穩，不會忽大忽小、忽冷忽熱，整體而言可圈可點，是不喜吵雜的我超推的私房景點。,5,1,1,2,5885,2018/05/08
A區雨棚滿+對面A區草地滿帳 共12帳，真的稍嫌擁擠~沒什麼活動空間~可惜了這個營地~,1,-1,1,0,5134,2023/05/06
環境非常好，衛浴空間也很滿意營主也很熱情在這和朋友們度過了美好的三天假期～非常推薦,5,1,1,2,4040,2023/05/07
老闆跟老闆娘人很好相處這次包場體驗非常棒是很喜歡的營地之一推薦給大家,5,1,1,2,1807,2023/05/06
讓人不舒服的露營經驗，跟之前露友講的有出入第一：蚊子多到爆，像敢死隊一樣不要命的狂叮，後悔沒有落跑，大人小孩都被咬到不要不要的，去之前問營主，回覆讓你感覺蚊子數量只有一些，落差很大第二：借東西要看臉色，還要聽人家碎碎唸，連一滴洗碗精也是，其他東西也是，很不舒服，這點跟之前露友講的出入很大。營主當然有不借的權利，但是連一滴洗碗精也碎碎念，請問是把露友當什麼？第三：沒注意到小孩把營區洗手台弄有點髒(有些沙土)，要聽人家碎碎念第四：玩具是收起來的，不一定會借，不過這點不能批評，因為營主有自己的考量第五：營區其實場地不大，也沒什麼設施，小孩沒什麼地方跑，會覺得無聊，營區也沒什麼景色優點：浴廁常打掃，但可能只開一間。草皮很綠，但草太長了一點。有窯烤爐，但...有些事不想直接講出來 。插座數量很足。,1,-1,1,0,3733,2020/05/08
360度處處都是可以遠眺路況好開  放鬆舒適的好地方但也因為沒遮蔽物 晚上很冷 白天很曬,4,1,1,2,3889,2022/05/09
海拔不高，但面景廣闊，可以選擇包區或單帳前往！是個值得再訪的營區！山路為單線，有柏油路面，部份彎道較陡，總體都算好開容易到達。若滿帳車子需要停在下面停車場。除了B區外，其他以包區為主，B區則是先到先贏，有面景的也有後排無景的。個別的流理台非常方便！地面為石礫與草地綜合，下釘容易，部份區塊為軟土，釘子可能不受力可避開。衛浴廁所與淋浴分開，不分男女，乾淨、熱水充足，寬敞且置物空間方便，附吹風機可以吹頭髮。,5,1,1,2,6372,2019/05/07
營區還可以，第一天沒什麼蒼蠅，第二天好多蒼蠅，營主很客氣，除了沒水準的露友，說話大聲，放音樂大聲，放煙火一堆煙飛過來，打呼大聲，，隔壁小孩23：00-00：00還在嬉鬧說話，一堆咳嗽的人不戴口罩，大人小孩都有，重點是營區似乎沒有禁煙，打開帳篷，洗澡，廁所，全部都聞得到，讓不抽菸的人會崩潰，尤其是在上風處還抽菸的沒水準人。,4,1,1,2,4088,2023/05/08
老闆很親切，廁所經常打掃維護乾淨，有用心經營~,5,1,1,2,4682,2022/05/08
夜景無敵遠眺蘭陽平原，環境乾淨舒適，營主也很和善，有機會再次造訪,5,1,1,2,6896,2023/12/07
環境整潔，浴室乾淨，老板人超好，清涼消暑的小溪,5,1,1,2,1721,2020/05/07
環境好，衛浴空間乾淨，營主超熱心！會想再去！,5,1,1,2,5167,2019/05/08
風景美麗 空氣清新 營主熱情 小孩的樂活天地,5,1,1,2,3332,2018/05/07
第27露10/29、30、31這次選擇來到了尖石-怡然自德一路平順的道路，直到要有一個90度的轉彎後，開始精神振奮了起來來個不踩煞車，直線往上衝的概念，衝啊！朋友們，千萬不要懷疑，油門就是給他踩到底，直到營區的營位F區。階梯式的營位，有雨篷有水池有沙坑還有熱水洗手台（還真是第一次碰到呢！），更有一營區有2間衛浴2個廁所的單獨使用，有24小時穩定熱水這個我更滿足了。2天一夜加夜衝的時間裡，每天都在仙境濃霧中，涼爽的天氣、清新的空氣、厚實的草地，就是一個舒服放鬆的地方雖然下了一點雨，這就是讓我今年冬天第一大景-超厚雲海出現了…說真的這次的旅程，讓我超滿意又滿足的。這次來天氣早晚溫差大，所以沒有蒼蠅蚊子昆蟲蜜蜂，又是一個讚還有別忘了，這時候有老闆自種的柿子超甜，一定要來嚐嚐喔！,5,1,1,2,626,2022/05/07
營主很細心的關心我們是否有其他需求，也介紹很棒的草莓園“尚好農場”，老闆也很熱心的請我們吃很甜的橘子和喝草莓醋，可以去看看喔,5,1,1,2,610,2018/05/07
營區範圍很大，但是這次前往，還是有一點美中不足，還是希望各位露友們，晚上深夜時分，能夠還給環境一份幽靜。雖然很想一同分享喜悅，但畢竟夜深露重。營主很熱心，很健談。但是鄰近水庫的部分，都被竹林遮掩了。稍嫌美中不足。但環境很好。超過五顆星，期待下次再訪。,5,1,1,2,3723,2024/02/08
這是個無敵棒的營區！環境優美、廁所衛浴空間大且非常乾淨唷！愛玉、風味餐都令人很enjoy呢！我們能在這麼棒的營區享受大自然的美好，無限感恩營主的用心和營主家的小孩勤勞的維護，衷心感謝！吊橋下面是清澈流水，更有豐富的生態。吊橋過去可以走一圈到特富野部落，真是個可以好好休閒放鬆的人間仙境！,5,1,1,2,1896,2023/11/08
️優點：1.老闆老闆娘都很親切好客2.車床天地特約棧點 可車泊 搭帳3.在下方公區看得到山巒綿延的景色4.晚上星星很多5.營區下方好像可體驗採果及吃羊肉爐️實際情況：1.廁所衛浴都是男女各一2.環境還有很多待整理的地方（我表達得很含蓄）3.紮營地基本上就是一大塊停車場，看不到景色，且要用水用電洗澡上廁所都不方便。4.如果有用餐的客人來，他的車會停在你的帳篷旁邊。5.離三義市區車程15分鐘山路雖然整體而言不是一個會回訪的地方，不過入駐期間確實可以感受到老闆老闆娘濃濃的人情味。在公區下層有看到怪手在整地，應該是有擴建計劃，期待能看到更好設施更完善的溫馨農場,3,0,1,1,5577,2022/05/07
廁所很髒，每次上都要舖一層衛生紙才敢上。浴室的層架也很髒牆壁都是黃黃的垢，洗手台和飲水機都是水垢好像都沒擦過沒在清理……其他地方就普通，只是不知為何評價還蠻高的。,1,-1,1,0,5627,2022/05/07
景色美 環境清幽 整個營區安全自在 適合有小朋友的家庭...尤其是男女營主好客親切，常招待自家果園種植的蔬果...整體來說，會讓人常想回訪走走的營地！！,5,1,1,2,1937,2020/05/08
當你走出帳篷，你可以看到美麗的山景，呼吸到城市裡感受不到的新鮮空氣。晚上的時候你可以看到天空中成千上萬的星星閃閃發光，這也是孩子們玩耍的好地方，例如小游泳池、沙坑等。工作人員真的很樂意幫助你。,5,1,1,2,3663,2019/05/08
環境營地都很讚，Ｂ區的浴廁需再加強清掃，廁所味很重。,5,1,1,2,5227,2023/05/08
空氣好，位於河流旁的營區。,3,0,1,1,3268,2019/05/07
環境還算可以，地形分三層，最上層只有一間衛浴，略顯不足，二層不大但有4間衛浴，與三層共用，如果人多時，厠所的垃圾希望能頻繁點清理會更好。,3,0,1,1,3905,2019/05/08
