content,rating,type,status,sequence_num,tokenization,text,publishedDate,origin
參與活動人數介於50至60人，可能會對露營品質造成影響，但安全性方面應仍可接受。然而，教練的人數是否符合標準，以確保緊急事故時的適切處理，尚待確認。如若發生意外，在場教練的能力將至關重要，以防止情況惡化。部分教練的不耐煩可能影響整體體驗，建議反應此問題以獲得改善。,3,2,0,4189,,參與活動人數5060品質影響安全性應接受教練人數符合標準確保緊急事故時適切尚待確認發生意外在場教練能力至關重要情況惡化教練不耐煩影響整體體驗建議改善,2023/8/8,0
海拔僅 80 公尺，因此相當炎熱，早晨容易被熱醒。水上漂漂河活動非常有趣。帳篷能事先搭好，十分方便。建議攜帶有效防蚊液，以防小黑蚊叮咬。雖提供蚊香，但仍被叮得滿手疤，癢了近兩個禮拜。,3,2,0,4202,,海拔80公尺炎熱早晨熱醒水上漂漂河活動有趣帳篷事先搭建議攜帶防蚊液以防小黑蚊叮咬提供蚊香叮得滿手疤癢兩個禮拜,2023/7/8,0
設備齊全且風景迷人，讓您感受到舒適的露營體驗。衛浴設施提供洗髮精、沐浴乳、吹風機、冷凍冷藏冰箱，使生活便利。然而，小黑蚊數量多，建議攜帶充足防蚊用品。營主熱心提供蚊香，但仍需注意。凌晨喧嘩影響睡眠，建議攜帶耳塞以確保休息。,3,2,0,4216,,設備齊全風景迷人感受舒適體驗衛浴設施提供洗髮精沐浴乳吹風機冷凍冷藏冰箱生活便利小黑蚊數量建議攜帶充足防蚊用品營主熱心提供蚊香需注意凌晨喧嘩影響睡眠建議攜帶耳塞確保休息,2023/6/8,0
此次入住的露營車提供薄墊而非舒適床墊，若對睡眠品質敏感者應自行攜帶寢具。車內多組電源插座為方便之處，但空調溫度控制不精準，導致睡眠品質下降。壓縮機運轉產生的震動亦影響睡眠舒適度。營區環境整潔，草皮維持良好，且露營車旁設有洗手台，方便清潔。沙灘車行程安排妥適，但活動可再豐富化。若單純追求戶外體驗，可考慮入住；然若追求舒適睡眠和無備餐壓力，飯店可能更合適。,3,2,0,4251,,入住露營車提供薄墊非舒適床墊睡眠品質敏感應自行攜帶寢具車多組電源插座為處空調溫度控制精準導致睡眠品質下降壓縮機運轉震動影響睡眠舒適度營區環境整潔草皮露營車旁設有洗手台清潔沙灘車行程安排妥適活動豐富化追求戶外體驗入住然若追求舒適睡眠無備餐壓力飯店合適,2023/5/8,0
環境清幽，沙灘車穿梭帶來樂趣，營地保持整潔，但洗手間稍遠，夜晚則遭遇短暫跳電。,3,2,0,4255,,環境清幽沙灘車穿梭帶來樂趣營地整潔洗手間稍遠夜晚遭遇短暫跳電,2023/5/8,0
這次選擇了懶人露營，滿心期待地抵達現場，卻令人相當失望。雖然費用不算太貴，但設備卻十分不足！不僅需要自備枕頭、棉被，帳篷內甚至連基本照明設備都沒有，只有外面提供燈條。此外，營地附近的廁所、冰箱等設施稍遠，有些不方便。如果期待豪華露營體驗的朋友，這裡與期望完全不符。但如果想嘗試露營，這裡仍可能是接受程度不錯的場地。,3,2,0,4312,,選擇懶人滿心期待抵達現場令人失望費用不算太貴設備自備枕頭棉被帳篷照明設備外面提供燈條營地廁所冰箱設施稍遠期待豪華體驗朋友期望不符想嘗試接受程度不錯場地,2023/5/8,0
環境清幽，充滿愜意氛圍，活動體驗也相當有趣，但一泊二食中的晚餐卻令人失望。菜餚多缺乏風味，或過鹹或過淡，令人食之不盡愉快。幸賴自備烤肉解飢，否則不得不跋山涉水尋訪便利商店。建議業者可將泊食分開販售，使顧客能專注享受環境，而非飽受難吃的食物所苦。,3,2,0,4314,,環境清幽充滿愜意氛圍活動體驗有趣一泊二食中晚餐令人失望菜餚缺乏風味或過鹹過淡令人食愉快幸賴自備烤肉解飢跋山涉水尋訪便利商店建議業者可將泊食分開販售顧客專注享受環境非飽受難吃食物所苦,2023/5/8,0
參加漂漂河親子活動，整體而言具有樂趣，惟淋浴間數量不足，導致排隊等候時，休息區聚集一群吸煙人士，現場工作人員未加以勸阻或提供吸煙區資訊。此情景令人不禁質疑業者對兒童及成人感受的重視，希望業主能重視此問題，以提升整體遊憩體驗。,3,2,0,4319,,參加漂漂河親子活動整體而言樂趣惟淋浴間數量導致排隊等候時休息區聚集一群吸煙人士現場工作人員未勸阻提供吸煙區資訊情景令人不禁質疑業者兒童成人感受重視希望業主重視提升整體遊憩體驗,2023/5/8,0
水龍頭出水量小，騎乘自行車時容易吸入灰塵，且常遇到螞蟻和昆蟲。,3,2,0,4325,,水龍頭出水量騎乘自行車時吸入灰塵且常螞蟻昆蟲,2023/5/8,0
環境雖優美並保持整潔，但設備方面確有一些不足。儘管有吸引人的漂漂河活動和較少的蚊子，插座數量實在過少，導致不便。最初分配的魚池草地位置完全沒有電，只能向對面營地借，但位置亦十分擁擠。後換到B區，雖然有電，但盥洗、冰箱和飲水機卻都相當遙遠，且冰箱的冷凍效果不佳，難以保存冰棒。為避免困擾，建議攜帶行動冰箱。,3,2,0,4368,,環境優美整潔設備確有吸引漂漂河活動少蚊子插座數量實在過少導致不便最初分配魚池草地位置電只能對面營地位置擁擠換到B區有電盥洗冰箱飲水機遙遠冰箱冷凍效果不佳難以保存冰棒為困擾建議攜帶冰箱,2023/5/8,0
我們周末早上參加漂流河活動，可能因假日人潮眾多，導致行程變得緩慢，活動也不十分刺激。在瀑布拍照時，需稍作等待，補給礦泉水以一大罐提供給全體，衛生上稍嫌不足，看到照片後感到失望，工作人員的相機鏡頭佈滿霧氣，導致畫質不佳，此點成為最大遺憾和缺點。,3,2,0,4394,,周末早上參加漂流河活動假日人潮眾多導致行程變得緩慢活動刺激瀑布拍照時需稍作等待補給礦泉水一大罐提供衛生稍嫌照片感到失望工作人員相機鏡頭佈滿霧氣導致畫質不佳此點成為遺憾缺點,2023/5/8,0
漂流體驗較預期縮短，9點集合，10時30分左右便結束行程。旅途中還發生意外插曲，因急流導致我被水沖走，一名疑似國中生助理教練努力拉住我和泳圈，但最終也一起被沖走約50公尺。當下我以為將要登上社會版面，所幸及時獲得成年教練救援，避免受傷加劇。溪水湍急，原以為會有教練協助渡溪，但沒有，只能自行克服困難渡溪。回到集合地點，才獲得一位教練關切，詢問是否需要冰塊冰敷。儘管傷勢不嚴重，但希望教練能更關注受傷者，提供更暖心的關懷。所幸孩子未遭遇危險，否則情緒可能更加激動。,3,2,0,4455,,漂流體驗預期縮短點集合10時30分結束行程旅途中還發生意外插曲急流導致水沖走一名疑似國中生助理教練努力拉住泳圈最終沖走約50公尺為登上社會版面教練救援受傷加劇溪水湍急原以為教練協助渡溪只能自行克服困難渡溪回到集合地點一位教練關切詢問冰塊冰敷傷勢希望教練關注受傷者提供更暖心關懷孩子未遭遇危險情緒激動,2023/5/8,0
營區雖然提供了舒適的住宿環境，但衛浴和廁所位置稍遠，導致使用上較為不便；此外，小黑蚊肆虐令露營者們飽受蚊蟲叮咬之苦，彷彿全身都是紅豆冰。,3,2,0,4465,,營區提供舒適住宿環境衛浴廁所位置稍遠導致為不便小黑蚊肆虐令飽受蚊蟲叮咬之苦彷彿全身紅豆冰,2023/5/8,0
區域環境應屬原住民族保留地，讓年輕人能留在家鄉打拚、創業，十分值得鼓勵。進入區域範圍時，請妥善塗抹防蚊液或做好防蚊措施。活動部分，沙灘車或全地形車的聲響較大，可能使部落充滿噪音和廢氣。建議後續經營方向須審慎思考，以維持自然寧靜與環境品質。,3,2,0,4467,,區域環境應屬原住民族保留地年輕人留在家鄉拚創業值得鼓勵區域時請妥善塗抹防蚊液做好防蚊措施活動沙灘車或全地形車的聲響較大部落充滿噪音廢氣建議後續經營方向須審慎思考自然寧靜環境品質,2023/5/8,0
環境尚可，但溪邊已受到破壞，沙灘車橫行，造成危險。此營區為熱門選擇，吸引眾多露營客，導致吵雜且充滿烤肉味。營區對面民宅的卡拉OK，音量過大，影響睡眠。警察多次造訪，但服務態度不佳。建議有興趣者親自體驗，但不強烈推薦。,3,2,0,4478,,環境尚可溪邊受到破壞沙灘車橫行危險營區為熱門選擇吸引眾多客導致吵雜充滿烤肉味營區對面民宅卡拉OK音量過大影響睡眠警察造訪服務態度不佳建議興趣體驗強烈推薦,2022/5/8,0
浴室與洗手台距離稍遠，但環境山巒環繞，美不勝收。,3,2,0,4488,,浴室洗手台距離稍遠環境山巒環繞美不勝收,2022/5/8,0
在快5000元的露營車中，僅提供床墊，卻沒有被子和枕頭，著實令人覺得十分昂貴。,3,2,0,4525,,5000元露營車中提供床墊被子枕頭著實令人昂貴,2022/5/8,0
"優點：營地附近的廁所和浴室非常乾淨，且空間寬敞，令人感到舒適。草地面積廣闊，提供孩子們充足的空間奔跑和玩樂。

缺點：廁所和洗手台的位置較遠，需要走一段路才能抵達，較為不便。遇到下雨，營地的排水性不佳，導致積水形成泥濘，影響體驗。",3,2,0,4571,,"優點營地廁所浴室乾淨空間寬敞令人感到舒適草地面積廣闊提供孩子充足空間奔跑玩樂

缺點廁所洗手台位置較遠走一段路抵達為不便下雨營地排水性不佳導致積水泥濘影響體驗",2022/5/8,0
門口接待員的服務需加強，接待員建議在停車場等待，隨後又有其他人員要求移車，最終才告知訂位資訊。帶往營區後，工作人員對營區名稱似乎不熟悉。此外，車子無法停在帳篷旁，卸貨十分不便。提供的廁所使用茶籽堂沐浴用品。,3,2,0,4592,,門口接待員服務需接待員建議停車場等待人員移車最終告知訂位資訊營區工作人員營區名稱熟悉車子停帳篷旁卸貨不便提供廁所茶籽堂沐浴用品,2022/5/8,0
在炎熱的夏天，蚊蟲容易猖獗，經常爆滿需要事先預約。,3,2,0,4608,,炎熱夏天蚊蟲猖獗爆滿事先預約,2022/5/8,0
對追求刺激活動的露營客而言，此處的漂流或沙灘車僅屬初級體驗，難以滿足其需求；然而，對於一家大小前來度假，共享大自然之美，共同創造難忘回憶的家庭而言，這裡無疑是理想的選擇。,3,2,0,4631,,追求刺激活動客漂流沙灘車僅屬初級體驗難以需求一家大小前來度假共享大自然之美創造難忘回憶家庭無疑理想選擇,2021/5/8,0
夜間逾10時，員工仍在交談喧嘩，A區營位鄰近馬路，車聲陣陣，沙灘車穿梭往來，導致睡眠受干擾；然而草皮養護得宜，令人印象深刻。,3,2,0,4680,,夜間逾10時員工交談喧嘩區營位鄰近馬路車聲陣陣沙灘車穿梭往來導致睡眠受干擾草皮養護得宜令人印象深刻,2021/5/8,0
溯溪體驗稍顯一般，儘管幾個深潭可讓您全身溼透，但整體規劃並沒有令人難以忘懷的亮點，不足以使之成為必遊的首選。,3,2,0,4712,,溯溪體驗稍顯幾個深潭全身溼透整體規劃令人難以忘懷亮點不足以使之成為必遊首選,2021/5/8,0
我們住宿的是諾美帝露營車，內裡十分乾淨，舒適度極佳。然而，露營車周圍環境欠佳，遊覽車直駛於露營車前，高溫之夏引擎更加炙熱，此外，解說漂流與溯溪的擴音器也影響住宿品質。真心建議，此二露營車應避免擺放此處，而置於其他露營車或營地附近。整體服務卓越，體驗到原住民的純樸與熱心助人。風景優美，舒適度高，漂流活動刺激。露營車位置扣減兩顆星。,3,2,0,4718,,住宿諾美帝露營車內裡乾淨舒適度極佳露營車周圍環境欠佳遊覽車直駛露營車前高溫之夏引擎炙熱解說漂流溯溪擴音器影響住宿品質真心建議此二露營車應擺放置於露營車營地整體服務卓越體驗原住民純樸熱心助人風景優美舒適度高漂流活動刺激露營車位置扣減兩顆星,2021/5/8,0
沉浸於自然的氣息中，感受輕風拂面，身心獲得放鬆。兩處小激流增添了冒險的樂趣，讓旅程更加多元豐富。,3,2,0,4726,,沉浸於自然氣息中感受輕風拂面身心放鬆兩處激流增添冒險樂趣旅程多元,2021/5/8,0
停車場充滿塵土，停放一整個下午，車輛也沾滿一層灰土。建議鋪設碎石，不僅可減少塵土飛揚，雨天時也不易變成泥濘。,3,2,0,4732,,停車場充滿塵土停放下午車輛沾滿一層灰土建議鋪設碎石減少塵土飛揚雨天時不易泥濘,2021/5/8,0
周遭環境清幽，充滿綠意，但早晨容易因帳篷內舒適而欲罷不能。溪流水質清澈，然而鄰近山徑的四驅車噪音，加上孩童參與其樂，令人感到不安。營地夜晚喧嘩，大銀幕電影、卡拉OK聲不絕於耳，導致不少都市人帶來不自然的度假氛圍。所幸，設施保持整潔，稍解煩憂。,3,2,0,4773,,周遭環境清幽充滿綠意早晨帳篷舒適欲罷不能溪流水質清澈鄰近山徑四驅車噪音孩童參與其樂令人感到不安營地夜晚喧嘩銀幕電影卡拉OK聲不絕於耳導致都市人帶來自然度假氛圍設施整潔稍解煩憂,2021/5/8,0
場地乾淨明亮，但衛浴間數量未跟帳數相匹配。冰箱位置過遠，空間明顯不足。建議至少在兩個區間間設置直立式冰箱。,3,2,0,4780,,場地乾淨明亮衛浴間數量未帳數相匹配冰箱位置過遠空間建議至少兩個區間間設置直立式冰箱,2020/5/8,0
漂漂河提供了另類的露營體驗，令人感到十分驚艷，令人激賞！,3,2,0,4818,,漂漂河提供另類體驗令人感到驚艷令人激賞,2020/5/8,0
山谷景色壯麗，溪水清涼舒適，營地空間寬敞，然而由於面積遼闊，僅在入口營本部和最尾端（C 及森林區）設置廁所與淋浴間，使得整個營區相當不便，且數量也不足。此外，營本部需處理僅來玩水的遊客，增添困擾。另一方面，冰箱空間有限，僅有一個雙門冷藏與冷凍冰箱供全區使用，導致在炎熱天氣下，食材保存成重大挑戰，尤其是較後方區域的遊客，來回營本部需花 5 至 8 分鐘，增加不便。因此，建議攜帶冰桶或自行準備冰箱，以防食材變質。,3,2,0,4819,,山谷景色壯麗溪水清涼舒適營地空間寬敞面積遼闊僅在入口營本部尾端C森林區設置廁所淋浴間營區不便數量營本部需僅來玩水遊客增添困擾冰箱空間有限僅有雙門冷藏冷凍冰箱供全區導致炎熱天氣食材保存成挑戰後方區域遊客來回營本部需花分鐘增加不便建議攜帶冰桶自行冰箱以防食材變質,2020/5/8,0
衛浴設施與營地稍遠，建議增設方便性，熱水供應則偶有不穩定，盼能進行改善。,3,2,0,4902,,衛浴設施與營地稍遠建議增設方便性熱水供應則偶穩定盼能改善,2019/5/8,0
環境整潔，景點豐富，設備完善，但場地寬廣、人氣旺，稍嫌吵雜。,3,2,0,4903,,環境整潔景點設備完善場地寬廣人氣旺稍嫌吵雜,2019/5/8,0
草皮保持得不錯，僅有廁所位置較為遙遠，需在夜晚摸黑前往。不過，廁間乾淨且寬敞，設有乾濕分離設計，加上水壓充足，提供舒適的沐浴體驗。為使體驗更完美，若增加流動廁所，將更便利。,3,2,0,4911,,草皮不錯僅有廁所位置為遙遠需在夜晚摸黑前往廁間乾淨寬敞設有乾濕分離設計水壓充足提供舒適沐浴體驗為體驗完美增加流動廁所將更便利,2019/5/8,0
漂漂河體驗最初令您憂心刺激程度，但抵達現場後，發現眾多孩童一同歡笑，更顯溫馨。雖當日臨時無法下水，但保留制提供了彈性，使下次造訪更加期待。,3,2,0,4935,,漂漂河體驗最初令憂心刺激程度抵達現場發現眾多孩童一同歡笑更顯溫馨當日臨時下水保留制提供彈性下次造訪期待,2019/5/8,0
在馬路邊，貨車頻繁經過造成些許干擾，但鳥啼蟲鳴交織成另一樂章，讓人陶醉於大自然的美妙樂音。,3,2,0,4983,,馬路邊貨車頻繁些許干擾鳥啼蟲鳴交織成樂章陶醉大自然美妙樂音,2018/5/8,0
美景環繞，帳距稍嫌擁擠，似乎接近超收帳的狀況。,3,2,0,5002,,美景環繞帳距稍嫌擁擠接近超收帳的狀況,2018/5/8,0
南部少見的懶人露營區，交通便利、場地寬敞，衛浴清潔度佳且數量充足。多數設施尚可，但兩帳共用一個流理台較不方便。此外，浴室洗澡水外流導致泥濘，較為不便。,3,2,0,5046,,南部少見懶人區交通便利場地寬敞衛浴清潔度佳且數量充足設施尚可兩帳共用流理台浴室洗澡水外流導致泥濘為不便,2024/3/8,0
衛浴設備齊全，保持整潔，每間帳篷旁皆設有洗手台，每房配備冷氣，但冬季到訪仍可能感到寒冷且室內易潮濕。提供鍋子和方便瓦斯爐，請注意攜帶瓦斯罐及打火機。,3,2,0,5047,,衛浴設備齊全整潔每間帳篷旁皆設有洗手台每房配備冷氣冬季到訪感到寒冷室內易潮濕提供鍋子瓦斯爐請攜帶瓦斯罐及打火機,2024/3/8,0
設施大多已出現陳舊感，以豪華露營的價位而言，其CP值在臺灣的露營區中較為偏低。,3,2,0,5048,,設施陳舊感豪華價位CP值臺灣區中為偏低,2024/3/8,0
帳篷表面佈滿霉斑，椅子明顯破損，廁所數量不足，帳篷內未提供衛生紙和垃圾桶。冷氣設備較冷，洗手台則保持乾淨。,3,2,0,5073,,帳篷表面佈滿霉斑椅子破損廁所數量帳篷內未提供衛生紙垃圾桶冷氣設備冷洗手台乾淨,2023/10/8,0
如同其他遊客所言，帳篷內出現許多黴菌斑塊，令人失望。園區內設施也需要改善，尤其是已荒廢的泳池滑水道。儘管工作人員數量多且親切，但園區的清潔和維護有待加強。,3,2,0,5089,,遊客言帳篷黴菌斑塊令人失望園區設施改善荒廢泳池滑水道工作人員數量多且親切園區清潔維護有待,2023/6/8,0
第一次造訪免搭帳營地，我發現自己更偏好自行搭設帳篷的環境。儘管帳篷在原地承受日曬雨淋，但回到蓬內仍感覺舒適自在。然而，進入帳篷後，空氣品質稍差，甚至帶有些許異味。所幸在炎熱的夏天，營地提供了冷氣設備，增添了些許便利性。,3,2,0,5105,,第一次造訪免搭帳營地發現自己偏好自行搭設帳篷環境帳篷原地承受日曬雨淋回到蓬內感覺舒適帳篷空氣品質稍差帶有些許異味炎熱夏天營地提供冷氣設備增添些許便利性,2023/5/8,0
環境與設施相當優質，但需注意到可能遇到缺乏公德心的同遊者。凌晨零時後，附近營地仍瀰漫狂歡氣氛，反映兩次營本部，但問題仍持續至午夜。,3,2,0,5165,,環境設施優質需注意缺乏公德心遊者凌晨零時營地瀰漫狂歡氣氛兩次營本部持續午夜,2023/5/8,0
在黃昏時刻，夏日蚊子數量略多，空間略感擁擠，障礙物標示不清，需待改善，相較於過去的舊場地，此處明顯較小，故不太考慮再次到訪，但仍會前往二號店旗津。,3,2,0,5176,,黃昏時刻夏日蚊子數量空間略感擁擠障礙物標示不清需待改善相較舊場地故不太到訪仍會前往二號店旗津,2023/5/8,0
2.5顆星的露營地，帳篷拉鍊損壞後直接修補，留下縫似是期望旅客自行進出。工作人員於凌晨10時持續巡查，使夜晚較安靜。惟此營地照明不足，自晚上廁所、冰箱距離帳篷遙遠，建議攜帶手電筒。冰箱冷度不佳，可能因開關頻繁或故障，導致早上上廁所如同桑拿，需重新清洗。設備老舊，但未更新或維修，令人感到無謂浪費。,3,2,0,5177,,2.5顆星露營地帳篷拉鍊損壞修補留下縫似期望旅客自行進出工作人員凌晨10時持續巡查夜晚安靜惟此營地照明晚上廁所冰箱距離帳篷遙遠建議攜帶手電筒冰箱冷度不佳開關頻繁故障導致早上廁所桑拿需清洗設備老舊未更新維修令人感到無謂浪費,2023/5/8,0
狩獵帳篷提供了良好的休憩環境，但小黑蚊數量眾多，建議穿著長褲並採取防蚊措施，以免被叮咬。此外，附近的紅豆樹使大家都能享受美味的自製紅豆冰。,3,2,0,5180,,狩獵帳篷提供休憩環境小黑蚊數量眾多建議穿著長褲防蚊措施叮咬紅豆樹使享受美味製紅豆冰,2023/5/8,0
"園區規模龐大！若帳篷位於入口，前往營本部或遊樂設施至少需步行10分鐘。建議提供定點高爾夫接駁車，戲水區吸引小孩放電，但兩天都捨不得起來。然則，以下為缺點：

1.小黑蚊非常多，需借用蚊香，但需押金500元，還須遠至營本部歸還，此地廣大，蚊蟲難免，應每帳提供蚊香盤，成本不低。
2.狩獵帳內外黴菌充斥，外觀清潔不佳，內帳潮濕，地毯氣味濃厚，檯燈布破損未更新。
3.防疫期間，廁所未提供酒精供消毒，較其他同價位免搭帳的設施差。",3,2,0,5203,,"園區規模龐大帳篷位於入口前往營本部遊樂設施至少需步行10分鐘建議提供定點高爾夫接駁車戲水區吸引小孩放電兩天捨不得為缺點

小黑蚊需借用蚊香需押金500元還須遠至營本部歸還蚊蟲難免應每帳提供蚊香盤成本不低
狩獵帳內外黴菌充斥外觀清潔不佳內帳潮濕地毯氣味濃厚檯燈布破損未更新
防疫期間廁所未提供酒精供消毒同價位免搭帳設施差",2022/5/8,0
住在椰林狩獵帳，當日入住率接近滿房，帳篷內瀰漫霉味，令女友皮膚過敏。僅提供3間盥洗室，太晚洗澡就沒熱水。公廁僅有2間、2個便斗和1個洗手台，建議加快更新以符合需求。營地廣闊，建議重新規劃以提高舒適度和美觀。報到流程不流暢，入口缺乏指引，誤闖販賣部才發現報到處。總體而言，住宿經驗尚可，但假日價格稍高，考慮重新造訪高雄的露營樂2號店。,3,2,0,5213,,住椰林狩獵帳當日入住率接近滿房帳篷瀰漫霉味令女友皮膚過敏提供間盥洗室太晚洗澡熱水公廁僅有間斗洗手台建議加快更新符合需求營地廣闊建議規劃提高舒適度美觀報到流程流暢入口缺乏指引誤闖販賣部發現報總體而言住宿經驗尚可假日價格稍高造訪高雄樂號店,2022/5/8,0
小黑蚊數量稍多，可能因個人體質影響，而帳篷稍顯老舊且發霉，導致過敏疑慮。營地人滿為患，儘管事前提醒，但夜晚仍受噪音干擾。盥洗室水壓充足，惟可增加衣物晾乾架子。假日人潮眾多，幾乎滿帳；火鍋和特色餐風味不錯，但小食部商品偏少，建議增售零食或飲料。由於位置偏僻，自行駕車或騎車前往較為方便，並可於10分鐘車程外的水上花園博物館消磨時間。,3,2,0,5214,,小黑蚊數量稍體質影響帳篷稍顯舊且發霉導致過敏疑慮營地人滿為患事前提醒夜晚仍受噪音干擾盥洗室水壓充足惟可增加衣物晾乾架子假日人潮眾多滿帳火鍋特色餐風味不錯小食部商品偏少建議增售零食飲料位置偏僻自行駕車騎車前往為可於10分鐘車程外水上花園博物館消磨時間,2022/5/8,0
"懶惰露營，首次嘗試配備彈簧床、冷氣和免裝備，雖帶來便利，但價格稍高，四人房假日要價4,800元；浴室數量建議增加，以符合5-8帳的需求，以免太晚洗熱水沒得用。幸好當天未冷，勉強以冷水洗澡；吹風機需投幣，建議自備充電器。若價格更實惠，懶人露仍大推！",3,2,0,5219,,懶惰首次嘗試配備彈簧床冷氣和免裝備帶來便利價格稍高四人房假日要價800元浴室數量建議增加符合帳的需求太晚洗熱水沒得用幸好當天未冷勉強冷水洗澡吹風機需投幣建議自備充電器價格實惠懶人露推,2022/5/8,0
晚上有不快的爭吵聲，吵鬧聲響徹雲霄，靠路邊的車輛也傳來刺耳引擎聲，睡眠品質堪慮。,3,2,0,5237,,晚上不快爭吵聲吵鬧聲響徹雲霄路邊車輛傳來刺耳引擎聲睡眠品質堪慮,2022/5/8,0
衛浴設施需加強清潔，因價位接近飯店，但清潔度未符基本期望。,3,2,0,5254,,衛浴設施需清潔價位接近飯店清潔度未符期望,2021/5/8,0
非常失望，雖然營地的規則和規劃很完善，但抽菸的人非常多，且營規無法有效執行。如今已接近凌晨1時，營帳外仍充滿喧鬧聲，令人難以忍受，這營區似乎只是虛有其表。,3,2,0,5256,,失望營地規則規劃完善抽菸營規執行接近凌晨時營帳外充滿喧鬧聲令人難以忍受營區虛有其表,2021/5/8,0
