content,rating,type,status,sequence_num,tokenization,text,publishedDate,origin
設備表現良好，惟服務人員僅在入住期間出現，未留下深刻印象。,3,2,0,4,,設備表現惟服務人員僅在入住期間未留下深刻印象,2024/3/7,0
入營前之800公尺需駕駛技術良好者，因路面爲碎石、蜿蜒、崎嶇、不平，無法會車，雨天不建議。蓮蓬頭水溫不穩，需以水桶取水沐浴，景觀為樹林環繞，無特別景致。帳篷美觀、營地整潔，提供瓦斯罐（需自備）、烤盤、餐盤。,3,2,0,25,,入營前800公尺需駕駛技術路面碎石蜿蜒崎嶇不平車雨天建議蓮蓬頭水溫穩需以水桶取水沐浴景觀為樹林環繞特別景致帳篷美觀營地整潔提供瓦斯罐需自備烤盤餐盤,2023/5/7,0
環境清幽，設備也相當完善，但女性員工或老闆娘似乎態度較為嚴厲。,3,2,0,47,,環境清幽設備完善女性員工老闆娘態度為嚴厲,2022/5/7,0
山路雖陡峭，但不難駕馭，除了帳篷外觀，其餘地方缺乏特色，無深刻印象。三角鐵皮屋頂的星星帳更勝太陽帳，而地球帳則美不勝收。建議自行烹煮食物，避免食用原民餐。,3,2,0,48,,山路陡峭難駕馭帳篷外觀地方缺乏特色深刻印象三角鐵皮屋頂星星帳更勝太陽帳地球帳則美不勝收建議自行烹煮食物食用原民餐,2022/5/7,0
幽靜、空氣清新，服務親切，但帳篷內的床墊偏硬，可能不適合追求柔軟睡眠者；抵達途中的最後路段路況不佳，路面及路旁佈滿落石，建議天候不佳時避免前往。,3,2,0,51,,幽靜空氣清新服務親切帳篷床墊偏硬適合追求柔軟睡眠抵達途中路段路況不佳路面路旁佈滿落石建議天候不佳時前往,2022/5/7,0
我們選擇了寬敞的空地，使用自帶帳篷，費用以人頭計算，非常便宜。營主待人和善，且對寵物也十分友好。然而，營主的兩隻狗和其他狗之間的互動，導致我們的狗遭到咬傷，半夜甚至在帳篷附近尿尿打卡。三頂帳篷、瀝水籃和餐盤都受到影響。此外，營地的螞蟻數量相當多，導致我們在收帳時花費時間清除。沒想到，螞蟻還跟著我們回家，讓我們家也成了螞蟻窩，真是令人沮喪。,3,2,0,65,,選擇寬敞空地自帶帳篷費用人頭計算便宜營主待人和善寵物友好營主兩隻狗狗之間互動導致狗咬傷半夜帳篷尿尿打卡三頂帳篷瀝水籃餐盤影響營地螞蟻數量導致收帳時花費時間清除沒想到螞蟻還跟著回家家成螞蟻窩令人沮喪,2021/5/7,0
還算滿意，但淋浴間熱水供應不穩定，時冷時熱，影響了泡澡的舒適度。,3,2,0,154,,算滿意淋浴間熱水供應穩定時冷時熱影響泡澡舒適度,2017/5/7,0
營區位置雖不便利，考驗駕駛技巧，但帳篷環境優美，擺設吸睛，床墊舒適且周邊寧靜。熱水供應不穩，偶有跳電，使用營區電器時。餐廳由外包廠商營運，聯繫需謹慎。業主快速回應抵達前的問題，後續聯繫則較慢。適合放鬆身心的懶人露營，而非熱鬧活動的場所。,3,2,0,183,,營區位置便利考驗駕駛技巧帳篷環境優美擺設吸睛床墊舒適周邊寧靜熱水供應穩偶有跳電營區電器時餐廳外包廠商營運需謹慎業主快速回應抵達前後續較慢適合放鬆身心懶人非熱鬧活動場所,2023-12-27T14:05:23+08:00,0
客房照片與現場環境相同地美輪美奐，加上獨享獨立露營區，提供了寧靜的休憩環境。訂購的晚餐令人回味無窮，然而，仍有幾點建議：1. 由於Google地標與實際位置有出入，建議店家提供更詳細的路線指引。2. 營區內野狗、野貓眾多，帳篷密封性不足，建議自備石頭擋住帳篷外。,3,2,0,261,,客房照片現場環境美輪美奐獨享獨立區提供寧靜休憩環境訂購晚餐令人回味無窮幾點建議Google地標位置出入建議店家提供詳細路線指引營區野狗野貓眾多帳篷密封性建議自備石頭擋住帳篷外,2022-11-14T14:15:10+08:00,0
住宿舒適度高，服務人員熱心盡責，下午茶風味鮮美，床舖柔軟舒適。然而，活動安排較為怪異，下午茶的窯烤比薩 DIY 和晚餐的火烤兩吃在午後 4 點到晚間 8 點半之間，可能造成過飽的問題，甚至導致食材浪費。建議調整活動時間或調整食量。此外，園內活動較少，容易受天氣影響，使體驗降低。希望園方能多思考顧客需求，因價格不斐，顧客回訪率將取決於老闆的智慧。,3,2,0,589,,住宿舒適度高服務人員熱心盡責下午茶風味鮮美床舖柔軟舒適活動安排為怪異下午茶窯烤比薩DIY晚餐火烤兩吃午後點到晚間點半之間過飽導致食材浪費建議調整活動時間調整食量園內活動少受天氣影響體驗降低希望園方能思考顧客需求價格不斐顧客回訪率將取決於老闆智慧,2023/8/7,0
價格雖偏高，使CP值略為下降，但舒適的床墊確保睡眠品質。潮濕環境導致棉被散發霉味，降低整體舒適度。冷氣部分可能需要定期清潔濾網，以避免發霉氣味。食物豐盛，適合大食量的露營者，但潮濕天氣可能影響風味。衛浴空間乾淨，但蚊香片因潮濕無法使用。服務人員親切，園區生態豐富，提供夜晚的自然饗宴。,3,2,0,604,,價格雖偏高CP值略為下降舒適床墊確保睡眠品質潮濕環境導致棉被散發霉味降低整體舒適度冷氣定期清潔濾網發霉氣味食物豐盛適合食量但潮濕天氣影響風味衛浴空間乾淨蚊香片因潮濕服務人員親切園區生態提供夜晚自然饗宴,2023/8/7,0
整體感受是多元的，營地雖小但充滿業主巧思，充滿驚喜。手作體驗與服務人員表現卓越。晚餐提供的BBQ食材雖不多，但足以充飢。然而，早餐令人失望，座位安排擁擠，鄰桌距離過近，且大部分菜餚已失溫，口感大打折扣。花費一萬多元的住宿費用，期望更高，若餐廳員工訓練及餐點品質提升，將更值得。,3,2,0,679,,整體感受多元營地雖小充滿業主巧思充滿驚喜手作體驗服務人員表現卓越晚餐提供BBQ食材雖不多足以充飢早餐令人失望座位安排擁擠鄰桌距離過近大部分菜餚失溫口感大打折扣花費一萬多元住宿費期望更高餐廳員工訓練餐點品質提升將更值得,2023/6/7,0
餐點令人非常失望，下午茶的果汁似合成品，麵包又乾又硬，只有野餐盒可選。晚餐的BBQ擺盤雖美，但食材不新鮮，連餐廳經理到場也無濟於事。旅程中留下滿滿遺憾。,3,2,0,762,,餐點令人失望下午茶果汁似合成品麵包乾硬野餐盒選晚餐BBQ擺盤雖美食材新鮮餐廳經理到場無濟於事旅程中留下滿滿遺憾,2023/5/7,0
此次好友精心安排的旅行，首度享受峇嵐杉丘的親子露營體驗，在BBQ火烤餐食方面，選擇豐富多樣，服務人員更以熱情親切的態度，讓整個旅程充滿放鬆氛圍。這處野奢露營勝地，無疑是一家人共享天倫之樂的理想選擇。,3,2,0,808,,好友精心安排旅行首度享受峇嵐杉丘親子體驗BBQ火烤餐食選擇多樣服務人員熱情親切態度旅程充滿放鬆氛圍這處野奢勝地無疑一家人共享天倫之樂理想選擇,2023/5/7,0
設備老舊，食材品質欠佳，環境吵雜，導致睡眠不佳，然而，晨昏美景迷人，周邊景點方便前往。,3,2,0,945,,設備老舊食材品質欠佳環境吵雜導致睡眠不佳晨昏美景迷人周邊景點前往,2023/5/7,0
入住體驗尚可，但整體感受不佳，員工素質不均衡導致困惑。電話詢問時答覆不一，入住時協助搬運行李、提供手作課程令人愉快。然而，晚餐匆忙，食材豐富但未保持新鮮度，桌面空間不足，隱私性低。房外拉簾多餘，免治馬桶實用，但淋浴間無抽風，香氣濃郁但影響睡眠。冷氣溫度顯示LED燈刺眼，早餐等候時間長，服務人員處理態度不佳。09:30導覽亦無法參與，整體而言，雖有正面點，但負面點較多，讓人失望。,3,2,0,968,,入住體驗尚可整體感受不佳員工素質均衡導致困惑電話詢問時答覆入住時協助搬運行李提供手作課程令人愉快晚餐匆忙食材未新鮮度桌面空間隱私性低房外拉簾多餘免治馬桶實用淋浴間抽風香氣濃郁影響睡眠冷氣溫度顯示LED燈刺眼早餐等候時間長服務人員態度不佳0930導覽參與整體而言正面點負面點較失望,2023/5/7,0
自停車場抬行李至半山腰櫃檯已覺不便，且期望有人員引導。房內及衛浴設備雖乾淨，但室內空間狹小，床單散發潮濕味，隔音不佳，整夜受狗吠聲所擾，可能因工作人員未住在營區，未能體會擾眠之苦。晚餐巴比Q尚可，但無醬料供搭配，官網未提醒，影響食用體驗。冰塊售300元，雖非鉅款，但無必要因小失大。大園區應置檯製冰機。早餐擺盤用心，但食材口味不佳，偏鹹且食材內夾雜菜梗。唯一讚賞處為服務人員態度佳，未使硬體不足破壞渡假心情。,3,2,0,992,,停車場抬行李半山腰櫃檯已覺不便期望人員引導房內衛浴設備乾淨室內空間狹小床單散發潮濕味隔音不佳整夜受狗吠聲所擾工作人員未住營區未能體會擾眠之苦晚餐巴比Q尚可醬料供搭配官網未提醒影響食用體驗冰塊售300元雖非鉅款因小失大園區應置檯製冰機早餐擺盤用心食材口味不佳偏鹹食材夾雜菜梗唯一讚賞處為服務人員態度佳未使硬體破壞渡假心情,2023/5/7,0
此次露營旅程的感受並不卓越，營地尚未妥善整理，地面多處泥濘尚未鋪平，晚餐的烤肉安排有限，於傍晚五、六時便全數送來，導致有被強迫用餐之感，用餐時間僅約一小時，自八時起便開始收餐，造成用餐困擾；公廁氣味不佳，散發陣陣水溝味，然而帳篷舒適度高，食材亦新鮮可口，令其令人滿意。然而，整體而言，營地尚未完全準備就緒，員工服務應對及接待有待加強。值夜保全人員熱心盡責，熱心解說如何觀賞星空，但以近五千元的價格而言，服務品質應更加提升。,3,2,0,1010,,旅程感受卓越營地尚未妥善整理地面多處泥濘尚未鋪平晚餐烤肉安排有限傍晚六時全數送來導致強迫用餐之感用餐時間僅約小時八時收餐用餐困擾公廁氣味不佳散發陣陣水溝味帳篷舒適度高食材新鮮可口令其令人滿意整體而言營地尚未準備就緒員工服務應對接待有待值夜保全人員熱心盡責熱心解說觀賞星空以近五千元價格服務品質應提升,2023/5/7,0
烤肉食材雖多元，但無法當日全數清理，表示衛生方面仍有改善空間。園區內尚有部分設施未完成，令遊客感到些許失望。,3,2,0,1043,,烤肉食材多元當日全數清理衛生改善空間園區尚有設施未令遊客感到些許失望,2022-08-15T11:51:51+08:00,0
園區雖尚未全面建設完成，然期待規劃完畢後之風貌。惟帳外清潔尚待加強，以免遮蔽外景，致美感大打折扣。,3,2,0,1055,,園區尚未建設期待規劃完畢風貌惟帳外清潔尚待遮蔽外景美感大打折扣,2022-07-26T04:07:37+08:00,0
食材新鮮，烤肉美味，但中餐品質待加強。廁所有異味，跳電問題須改善。小黑蚊多，房內未提供防蚊液。飲水充足，但施工中影響舒適度。,3,2,0,1057,,食材新鮮烤肉美味中餐品質廁所異味跳電須改善小黑蚊多房內未提供防蚊液飲水充足施工中影響舒適度,2022-07-12T04:07:35+08:00,0
硬體設施齊全且貼心，然而早餐晚餐的品質若如此，不如避免提供，既無法滿足口腹之欲，也形成浪費。,3,2,0,1129,,硬體設施齊全貼心早餐晚餐品質提供口腹之欲浪費,2024/4/7,0
烤肉食材稍顯平凡，若男性成員較多，可能會不敷使用，建議自備火鍋會更加合適。營區提供的酒選擇豐富，對酒鬼來說是一大優點。暖氣設備稍嫌不足，四人帳略感擁擠，且需要定期檢修帳篷的燈泡燈條和小布條，以免發生危險。洗澡水的溫度調節不穩定，欲達舒適溫度較困難。早餐提供米粉湯，口感不佳且需長時間等待。帳間規劃尚可，但鄰近景點多，方便遊玩。綜合而言，體驗普通。,3,2,0,1135,,烤肉食材稍顯平凡男性成員敷建議自備火鍋合適營區提供酒選擇酒鬼一大優點暖氣設備稍嫌四人帳略感擁擠定期檢修帳篷燈泡燈條布條發生危險洗澡水溫度調節穩定欲達舒適溫度困難早餐提供米粉湯口感不佳且需長時間等待帳間規劃尚可鄰近景點遊玩綜合體驗,2024/4/7,0
服務優質且親切，自由佈置帳篷令您感到愉快，環境整潔且簡單。然而，針對方案內含的食材與早餐，您略有不滿，建議自行準備食物，以獲得更滿足的用餐體驗。,3,2,0,1167,,服務優質親切自由佈置帳篷令感到愉快環境整潔簡單方案內含食材早餐略有建議自行食物用餐體驗,2023/11/7,0
五星級營地提供梅酒招待，服務人員的態度親切，衛浴設備保持乾淨，但晚餐食材份量稍嫌不足，調味較重。同行孕婦以1200元租用冷氣，需每3小時倒一次水，感覺稍嫌不值，建議提前告知此狀況，以便自行評估。,3,2,0,1183,,五星級營地提供梅酒招待服務人員態度親切衛浴設備乾淨晚餐食材份量稍嫌調味重同行孕婦1200元租用冷氣需小時倒水感覺稍嫌不值建議提前告知狀況自行評估,2023/9/7,0
露營體驗尚可，氣墊床軟硬度稍嫌不足，且被套易脫落，導致睡起來不舒適。帳內溫度高似烤爐，但勉強可接受。最令遊客不滿的是被要求將車停放樹下，導致車輛遭蟻群入侵，使心情大受影響。,3,2,0,1254,,體驗尚可氣墊床軟硬度稍嫌被套易脫落導致睡舒適帳內溫度高似烤爐勉強接受最令遊客將車停放樹導致車輛遭蟻群入侵心情大受影響,2023/7/7,0
餐點風味雖佳，低脂烤牛肉品質待改善，過鹹醃製里肌限制了味蕾享受，蔬菜種類少，期待更多元的佳餚。週末假期湧入多人，帳蓬間距略近，導致睡眠品質受影響。洗澡水溫不足，奢華露營體驗稍嫌不足，似為便利露營，而非奢華享受。,3,2,0,1315,,餐點風味雖佳低脂烤牛肉品質改善鹹醃製里肌味蕾享受蔬菜種類少期待多元佳餚週末假期湧入帳蓬間距略近導致睡眠品質受影響洗澡水溫奢華體驗稍嫌似為便利非奢華享受,2023/5/7,0
重點先寫：床墊為充氣床墊，服務周全，食材、器具及環境皆不錯，但標榜豪華露營的價格，卻對床墊感到失望，缺乏誠意。,3,2,0,1317,,重點先寫床墊為充氣床墊服務周全食材器具環境皆不錯標榜豪華價格床墊感到失望缺乏誠意,2023/5/7,0
服務人員態度和善，拍照效果極佳。然而，令人失望的是，廁所鄰近，且附近有煙蒂筒，禁煙告示似為裝飾。規定晚上10點後勿喧嘩，但附近仍有吵雜聲響，影響睡眠品質。雖然營區優美，食材充足，但與「野奢」之名相比，價格實惠程度稍嫌不足。,3,2,0,1322,,服務人員態度和善拍照效果極佳令人失望廁所鄰近煙蒂筒禁煙告示似為裝飾晚上10點後勿喧嘩吵雜聲響影響睡眠品質營區優美食材充足野奢之名相比價格實惠程度稍嫌,2023/5/7,0
"「十分建議」租了一台要價1,200元的冷氣，但實際上充其量只是個抽風機，與同價位露營區的冷氣相比完全遜色，早上六點帳篷就宛如烤爐，強烈建議夏天前來的遊客務必慎重考慮！",3,2,0,1416,,建議租一台要價200元冷氣實際上抽風機同價位區的冷氣相比遜色早上六點帳篷宛如烤爐強烈建議夏天前來遊客務必慎重考慮,2023/5/7,0
營區夜晚的景致美不勝收，且離斷橋也頗為近，可惜的是，晚餐的部分令人失望，食材新鮮度不足，吐司更因過熟而酸掉。,3,2,0,1498,,營區夜晚景致美不勝收斷橋為可惜晚餐令人失望食材新鮮度吐司因過熟酸掉,2022-05-28T04:05:00+08:00,0
環境優美，服務人員和善，提供多樣化帳篷裝飾道具，稍感遺憾的是當晚下雨導致帳篷易進水，稍為影響住宿品質。,3,2,0,1578,,環境優美服務人員和善提供多樣化帳篷裝飾道具稍感遺憾當晚下雨導致帳篷易進水稍為影響住宿品質,2022/3/21 21:24,0
體驗一般，收費較高且需自行處理多件事，自公共區域回帳篷需穿越草地，導致清洗後雙腳仍沾染汙垢；建議可多花些錢至附近露營區享受更舒適的豪華露營，但工作人員態度良好，特別是在雨天辛勞付出。,3,2,0,1580,,體驗收費高且需自行處理多件事公共區域回帳篷需穿越草地導致清洗雙腳沾染汙垢建議可多花些錢區享受舒適豪華工作人員態度特別是在雨天辛勞付出,2022/8/31 01:13,0
如果是懶人露營，天氣炎熱可能使帳內較不舒適，儘管設有冷氣，仍容易被曬醒。冰箱方面，營主應調整配置，雖然有大冰箱，但來回搬運較為不便。然而，風景優美及營區規劃良好，整體而言仍屬可接受。,3,2,0,1638,,懶人天氣炎熱使帳舒適設有冷氣曬醒冰箱營主應調整配置有大冰箱來回搬運為不便風景優美營區規劃整體而言仍屬接受,2023/8/7,0
露營區的夜晚景致令人驚豔，老闆人很親切，早餐豐富美味，廚房設備齊全，非常適合初學者。帳篷內冷氣運作聲響較大，加上與別處帳篷的靠近，導致半夜仍可聽到隔壁的喧嘩聲。,3,2,0,1691,,區的夜晚景致令人驚豔老闆親切早餐美味廚房設備齊全非常適合初學者帳篷冷氣運作聲響較大帳篷靠近導致半夜聽到隔壁喧嘩聲,2022/5/7,0
風景優美，拍照吸睛，烤肉食材豐富，設有獨立衛浴廚房和點心供應，可惜價位略高，當晚睡眠受低溫影響，暖氣功能似乎不彰，所幸被褥足夠保暖，使期望稍受影響，整體而言CP值尚可。,3,2,0,1692,,風景優美拍照吸睛烤肉食材設有獨立衛浴廚房點心供應可惜價位高當晚睡眠受低溫影響暖氣功能不彰被褥足夠保暖期望稍受影響整體而言CP值尚可,2022/5/7,0
群族人整體住佇去，價錢算唔便宜，整體入住CP值算中上。優點：1.整個園區的佈置真嘅美，活動空間算大，要拍照真嘅不錯2.老闆同老闆娘人蠻好親切，剛到園區及離開時會在門口招呼3.給予的餐點真嘅量蠻多的，大致上6人份都蠻夠吃的4.衛浴設備還算可以，水量夠大。缺點：1.入住時，給予的餐具都濕的未擦乾，就潮濕收進抽屜裡。2.開放空間廚房還算大，但感覺周遭環境都沒整理，會看到小蟲子，且餐具或配件都摸起來像沒洗乾淨。3.調味補品當時我們那組有點受潮了，也只剩一點，其實有點倒不出來。4.提供給予備品不足，如:有提供烤肉食品，但卻沒給予烤肉刷具，去櫃檯詢問後，才補給我們(且是使用過的)，我自己覺通常應該要給予新的給客人使用。(畢竟也不知道前組是怎使用那隻烤肉刷具)建議：1.建議可在網上公告住宿會提供大概食材及每個補品固定給予數量。(若不足可能會須收費)2.建議餐具可以再擦乾並清潔。3.建議可以提供業者方便聯絡方式，因為當有入住時有緊急事情想諮詢時，都只能透過臉書聊天室溝通(也不是馬上回覆)。4.房間內有提供冷暖氣機，建議可以提供操作說明方式。,3,2,0,1695,,群族人整體住佇去價錢算唔便宜整體入住CP值算中上優點園區佈置真嘅美活動空間算大拍照真嘅不錯老闆老闆娘人蠻親切剛到園區離開時會門口招呼給予餐點真嘅量人份夠吃衛浴設備算水量夠大缺點入住時給予餐具濕未擦乾潮濕收進抽屜裡開放空間廚房還算大感覺周遭環境整理小蟲子餐具配件摸起來沒洗乾淨調味補品那組受潮剩一點倒提供給予備品提供烤肉食品給予烤肉刷具櫃檯詢問補給過的覺給予新的給客人前組隻烤肉刷具建議建議網上公告住宿提供食材補品固定給予數量會須收費建議餐具擦乾清潔建議提供業者聯絡方式因為當有入住時有緊急事情想諮詢時只能透過臉書聊天室溝通回覆房間內提供冷暖氣機建議提供操作方式,2022/5/7,0
飲水機未提供自由飲用水的便利，讓人感到不合理，甚至在深山的露營區都能找到，令人失望。蚊蟲在深夜橫行，令人困擾，希望管理單位能採取有效的生態防治措施，以提升露營品質。黑色鐵皮屋的廁所及浴室，在炎熱的夏天，經太陽曝曬後溫度高漲，令遊客感到不適，建議改善通風及降溫措施。,3,2,0,1776,,飲水機未提供自由飲用水便利感到不合理深山區都找到令人失望蚊蟲深夜橫行令人困擾希望管理單位採取有效生態防治措施提升品質黑色鐵皮屋廁所浴室炎熱夏天太陽曝曬溫度高漲令遊客感到不適建議改善通風降溫措施,2023/9/7 11:28,0
夜晚的美景令人陶醉，提供了絕佳的拍照場景，但冰箱的冷度稍嫌不足，使得保存食物稍顯不便。,3,2,0,1777,,夜晚美景令人陶醉提供絕佳拍照場景冰箱冷度稍嫌保存食物稍顯不便,2023/6/13 16:46,0
初次造訪高美濕地的懶人露營之旅，周遭景色確是令人心曠神怡。（有時候網路上介紹的內容，只能當作參考。）優點：1.住宿地點鄰近著名的高美濕地，景色迷人。2.工作人員熱情有禮，服務周到。3.帳篷內保持整潔，讓您享有舒適的住宿體驗。4.櫃檯提供防蚊液、桌遊等娛樂設施，供房客借用。5.夜晚在露營椅下，欣賞明月，格外悠閒。缺點：1.園區內主要賣點仍為高美濕地美景。2.一泊三食的下午茶、晚餐、早餐，價位雖低，但餐點普通。3.園區廁所與高美遊客服務中心共用，露營區的廁所稍遠。4.帳篷區與廁所間有一定距離。5.晚上沒有任何活動安排。6.帳篷外觀有些發霉。7.價位稍高，但設施和服務與之相比，未完全匹配。此次體驗，難推薦朋友再次光臨。,3,2,0,1803,,初次造訪高美濕懶人之旅周遭景色確是令人心曠神怡有時候網路上介紹內容只能當作參考優點住宿地點鄰近著名高美濕景色迷人工作人員熱情有禮服務周到帳篷整潔享有舒適住宿體驗櫃檯提供防蚊液桌遊娛樂設施供房客借用夜晚椅下欣賞明月悠閒缺點園區賣點仍為高美濕美景一泊三食下午茶晚餐早餐價位雖低餐點園區廁所高美遊客服務中心共用區的廁所稍遠帳篷區與廁所間距離晚上活動安排帳篷外觀發霉價位稍高設施服務相比未匹配體驗難推薦朋友光臨,2024/4/24,0
"1、廁所使用不便，須持卡至遊客中心公廁，刷卡進出門卡卡住，廁所空間狹窄。
2、帳篷內風噪擾人，若遇雨，雨聲如同在鐵皮屋，影響睡眠品質。
3、晚上無夜遊，用餐後無活動，僅能休息，缺乏娛樂選項。
4、晚餐菜色普通，早餐則尚可。
5、冰箱須至遊客中心使用公用冰箱，使用上不便。
6、停車場無坡道供拉行李，樓梯陡峻，初體驗帳篷露營，感受欠佳。",3,2,0,1859,,"廁所不便須持卡遊客中心公廁刷卡進出門卡卡住廁所空間狹窄
帳篷內風噪擾人遇雨雨聲鐵皮屋影響睡眠品質
晚上夜遊用餐活動僅能休息缺乏娛樂選項
晚餐菜色早餐尚可
冰箱須至遊客中心公用冰箱不便
停車場坡道供拉行李樓梯陡峻初體驗帳篷感受欠佳",2024/2/8,0
雖然客房提供冷氣，仍感悶熱，衛浴設施與一般遊客區隔，須刷卡方能使用。注意淋浴間附設220V吹風機，警告標示不明顯，使用個人電器應謹慎小心。,3,2,0,1881,,客房提供冷氣仍感悶熱衛浴設施與遊客區隔須刷卡淋浴間附設220V吹風機警告標示電器應謹慎小心,2024/1/8,0
3.5/5 優點：1. 入住時，帳篷內的冷氣已開啟，提供舒適的氣溫。2. 帳篷內提供耳塞，以符合淺眠旅客的需求。3. 衛浴空間乾淨，並使用茶籽堂洗手乳/洗髮乳。4. 附近有高美濕地的美景。缺點：1. B/C區帳篷距離衛浴有一小段距離，對年長者和兒童較不方便。2. 晚餐品質不佳，食物偏辣或鹹，海鮮新鮮度待改善，白飯過硬。3. 早餐口味尚可，但較依賴營友互動。4. 夕陽體驗與用餐時間衝突。5. 適合不想準備太多東西的露營新手嘗試，但部分體驗感到可惜。,3,2,0,1930,,3.5優點入住時帳篷冷氣開啟提供舒適氣溫帳篷提供耳塞符合淺眠旅客需求衛浴空間乾淨茶籽堂洗手乳洗髮乳高美濕美景缺點BC區帳篷距離衛浴一小段距離年長者兒童晚餐品質不佳食物偏辣鹹海鮮新鮮度改善白飯過硬早餐口味尚可依賴營友互動夕陽體驗用餐時間衝突適合不想太東西新手嘗試體驗感到可惜,2023/10/8,0
