content,rating,type,status,sequence_num,tokenization,text,publishedDate,origin
帳篷的空間優勢讓人有開闊感，但豪華露營的評價令遊客期待更高。雖然床墊硬度因人而異，但以此價位而言，確實有舒適度上的期待落差。此外，熱水供暖的溫度調節不穩定，影響了舒適度。因此，整體CP值取決於個人感受，尤其是遠道而來的遊客，更期盼在較高價位下能享受到舒適的睡眠體驗。,3,2,0,4029,,帳篷空間優勢開闊感豪華評價令遊客期待更高床墊硬度因人而異以此價位確實舒適度期待落差熱水供暖溫度調節穩定影響舒適度整體CP值取決於感受遠道而來遊客期盼高價位下能享受舒適睡眠體驗,2024/3/8,0
於2024年1月27日入住山峰小徑露營區，雖事先知悉淋浴需等候較長時間，但熱水供應仍然令人失望。寒流後的低溫，更凸顯熱水問題的重要性，需等約三分鐘熱水，洗澡途中卻突然變冷水，令人受寒。此價格與熱水器品質不成比例，建議改善。廁所數量與淋浴間數不相符，建議各帳篷應配有對應廁所。為防寒冷，建議露營友可租借煤爐。迎賓小點心及服務人員態度良好，晚餐提供自助式火鍋，補餐迅速。服務人員亦主動詢問加點需求。風景優美，雲海迷人，整體而言，洗澡水問題影響體驗，其餘皆滿意。,3,2,0,4036,,2024年月27日入住山峰小徑區事先知悉淋浴需等候較長時間熱水供應令人失望寒流低溫凸顯熱水重要性需等約三分鐘熱水洗澡途中變冷水令人受寒價格熱水器品質不成比例建議改善廁所數量淋浴間數相符建議帳篷應配有廁所為防寒冷建議友可租借煤爐迎賓小點心服務人員態度晚餐提供自助式火鍋補餐服務人員主動詢問加點需求風景優美雲海迷人整體而言洗澡水影響體驗皆滿意,2024/2/8,0
園區規模有限，視野受阻礙，主要用於放鬆心情。,3,2,0,4112,,園區規模有限視野受阻礙用於放鬆心情,2023/7/8,0
車位位置難尋，且價格偏高，令下次造訪的意願降低。,3,2,0,4139,,車位位置難尋價格偏高令下次造訪意願降低,2023-10-19T04:23:21+08:00,0
服務品質良好且工作人員親切，營區空間寬敞舒適。不過小黑蚊數量眾多，建議使用防蚊用品。若追求寧靜的悠閒露營體驗，建議選在人較少的平日秋冬季節造訪。,3,2,0,4148,,服務品質工作人員親切營區空間寬敞舒適小黑蚊數量眾多建議防蚊用品追求寧靜悠閒體驗建議選在少平日秋冬季節造訪,2024/4/8,0
此次預訂A區電力供應不足，距離遠且電壓不穩定；帳棚旁無洗手台，需要到大門處使用，相當不便。然而，風景仍頗為優美。不過，周邊有公司團露，深夜仍大聲喧嘩，多次聯繫營主未得到妥善處理，處理能力令人擔憂，且缺乏現場巡場人員。,3,2,0,4165,,預訂區電力供應距離遠電壓穩定帳棚旁洗手台大門處不便風景為優美周邊公司團露深夜大聲喧嘩營主未妥善處理能力令人擔憂缺乏現場巡場人員,2024/1/8,0
參加活動人數眾多，約50-60人，可能會影響露營品質。安全性方面，建議主辦單位密切注意，以確保每位參與者的福祉。教練的人數應符合標準，以維持適當的安全與品質。若發生事故，在場教練應具備緊急處理能力。部分教練的不耐煩可能影響整體體驗，但請記住，這僅是少數案例，多數教練仍致力於提供良好的露營活動。,3,2,0,4189,,參加活動人數眾多約5060影響品質安全性建議主辦單位密切注意確保每位參與者福祉教練人數應符合標準品質發生事故在場教練應具備緊急能力教練不耐煩影響整體體驗請記住這僅案例教練致力於提供活動,2023/8/8,0
海拔僅80米，使氣溫較高，早晨常因炎熱而驚醒。戲水漂漂河樂趣無窮，但防蚊措施需謹慎。帳篷提前搭設，服務貼心。建議攜帶有效防蚊液，雖提供蚊香，但仍遭叮咬，留下疤痕數週。,3,2,0,4202,,海拔80米氣溫高早晨炎熱驚醒戲水漂漂河樂趣無窮但防蚊措施需謹慎帳篷提前搭設服務貼心建議攜帶防蚊液提供蚊香遭叮咬留下疤痕數週,2023/7/8,0
營地設備完善，景色宜人，盥洗用品一應俱全。蚊蟲多，建議攜帶防蚊用品。營主熱心提供蚊香，但深夜喧嘩影響睡眠，耳塞仍無法解決。,3,2,0,4216,,營地設備完善景色宜人盥洗用品一應俱全蚊蟲建議攜帶防蚊用品營主熱心提供蚊香深夜喧嘩影響睡眠耳塞解決,2023/6/8,0
此次入住露營車，車內提供薄墊，但舒適度有限，建議自行攜帶睡眠用品。車內多組電源插座方便，提升了便利性。惟空調溫度調節不精確，導致睡眠品質下降，並伴隨壓縮機運轉帶來的震動。營區環境保持乾淨，草皮整齊修剪，且每台露營車旁設有洗手台，避免衛生問題。沙灘車行程合適，但活動多樣化更受歡迎。若單純追求戶外氛圍，可考慮入住；但若追求舒適住宿與便利餐飲，飯店可能更合適。,3,2,0,4251,,入住露營車車提供薄墊舒適度有限建議自行攜帶睡眠用品車多組電源插座提升便利性惟空調溫度調節精確導致睡眠品質下降伴隨壓縮機運轉帶來震動營區環境乾淨草皮整齊修剪每台露營車旁設有洗手台衛生沙灘車行程合適活動多樣化受歡迎追求戶外氛圍入住追求舒適住宿便利餐飲飯店合適,2023/5/8,0
環境清幽，充滿自然魅力，更擁有沙灘車及多元體驗活動，營地保持整潔，但洗手間稍遠一些，夜晚則遭遇短暫跳電。,3,2,0,4255,,環境清幽充滿自然魅力擁有沙灘車多元體驗活動營地整潔洗手間稍遠夜晚遭遇短暫跳電,2023/5/8,0
造訪了一個懶人露營，充滿期待，然而抵達現場後，卻感到相當失望。雖然費用不算太貴，但提供的設備卻非常不足。不僅需要自備枕頭、棉被和帳篷，連基本照明設備也缺乏，僅有外露的燈條勉強照得進帳篷。此外，營地位置距離廁所、冰箱等設施稍遠，有些不便。如果期望豪華露營體驗，這裡絕對無法滿足你的需求；然而，如果想嘗試露營，這裡仍可能是一個可接受的場地。,3,2,0,4312,,造訪懶人充滿期待抵達現場感到失望費用不算太貴提供設備自備枕頭棉被帳篷照明設備缺乏僅有外露燈條勉強照得進帳篷營地位置距離廁所冰箱設施稍遠不便期望豪華體驗需求想嘗試接受場地,2023/5/8,0
環境清幽，氣氛宜人，活動多元有趣，但一泊二食中的晚餐令人失望，食材風味不足或過鹹，令賓客難以下嚥，幸賴自備烤肉解饞。建議業主分途加購食宿，使賓客能充分享受自然體驗。,3,2,0,4314,,環境清幽氣氛宜人活動多元有趣一泊二食中晚餐令人失望食材風味或過鹹令賓客難以下嚥幸賴自備烤肉解饞建議業主分途加購食宿賓客享受自然體驗,2023/5/8,0
參加漂漂河親子活動，整體而言是愉快的，惟淋浴間稍嫌不足，導致等待沖澡時在休息區的一群成人長時間吸煙，現場工作人員未予制止或提示是否設有吸煙區。煙塵繚繞，令人無法放鬆，特別是陪伴的孩子和其他家長，當下心急如焚，期盼業主能重視此問題，以維護家庭出遊的愉快體驗，避免再遇到此類令人困擾的吸煙者。,3,2,0,4319,,參加漂漂河親子活動整體而言愉快惟淋浴間稍嫌導致等待沖澡時休息區一群成人長時間吸煙現場工作人員未予制止提示設有吸煙區煙塵繚繞令人放鬆特別陪伴孩子家長心急如焚期盼業主重視維護家庭出遊愉快體驗此類令人困擾吸煙者,2023/5/8,0
水量不足，騎乘單車時產生大量塵土，且飲食選擇多以泥土為主。,3,2,0,4325,,水量騎乘單車時塵土飲食選擇多以泥土為主,2023/5/8,0
環境雖優美，但設施明顯不足。雖然營地維持得不錯，且有漂漂河可供娛樂，蚊蟲卻不多，但插座數量嚴重不足，導致露營者飽受困擾。被分配至魚池草地的露營者，更需遠赴對面營地借用電，十分不便。即使換至B區，距離洗澡間、冰箱和飲水機也相當遙遠，而冰箱功能不彰，冷凍效果不佳，建議攜帶行動冰箱以提升舒適度。,3,2,0,4368,,環境優美設施營地不錯漂漂河可供娛樂蚊蟲插座數量嚴重不足導致飽受困擾分配魚池草地需遠赴對面營地用電不便換至B區距離洗澡間冰箱飲水機遙遠冰箱功能不彰冷凍效果不佳建議攜帶冰箱提升舒適度,2023/5/8,0
我們假日上午參加漂漂河活動，可能因假日人潮眾多，導致行程延遲且缺乏刺激感。在瀑布拍照時，排隊等候時間較長。補給礦泉水提供給團體，共同分享，衛生方面稍嫌不足。工作人員相機鏡頭有霧氣，導致照片品質不佳，成為最大的遺憾與缺點。,3,2,0,4394,,假日上午參加漂漂河活動假日人潮眾多導致行程延遲缺乏刺激感瀑布拍照時排隊等候時間較長補給礦泉水提供團體分享衛生稍嫌工作人員相機鏡頭霧氣導致照片品質不佳成為遺憾缺點,2023/5/8,0
漂流體驗較預期短，9點集合，10時30分左右即結束行程，遭遇意外插曲因激流導致被水沖走，一名未成年助理教練緊跟泳圈，最終也遭沖走約50公尺，差點登上社會版面。幸好，及時獲得救援，避免受傷更加嚴重。溪中湍急，原以為有教練協助渡溪，卻需自行克服困難。渡溪後，傷勢未獲得妥善處理，感到冷漠。期望教練們能更加關懷受傷者，以提升整體觀感。,3,2,0,4455,,漂流體驗預期短點集合10時30分結束行程遭遇意外插曲激流導致水沖走一名未成年助理教練緊跟泳圈最終遭沖走約50公尺差點登上社會版面幸好救援受傷溪中湍急原以為教練協助渡溪需自行克服困難渡溪傷勢未妥善處理感到冷漠期望教練關懷受傷者提升整體觀感,2023/5/8,0
營區雖提供舒適的休憩環境，惟衛浴及廁所距離過遠，造成不便；此外，小黑蚊肆虐，令露營者飽受蚊蟲叮咬之苦，猶如紅豆冰滿手滿腳。,3,2,0,4465,,營區提供舒適休憩環境惟衛浴廁所距離過遠不便小黑蚊肆虐令飽受蚊蟲叮咬之苦猶如紅豆冰滿手滿腳,2023/5/8,0
區域環境為原住民保留地，提供年輕人返鄉發展機會，值得肯定。建議進入地區前使用防蚊液，以避免蚊蟲叮咬。活動部分，沙灘車或全地形車可能產生較大聲響，影響環境安寧。建議檢討經營方向，避免污染及噪音影響部落生活。,3,2,0,4467,,區域環境為原住民保留地提供年輕人返鄉發展機會值得肯定建議地區前防蚊液蚊蟲叮咬活動沙灘車或全地形車較大聲響影響環境安寧建議檢討經營方向污染噪音影響部落生活,2023/5/8,0
環境尚可，惟溪邊已受破壞，沙灘車橫行，造成危險。本區為熱門露營地，湧入眾多露營客，造成吵雜氣氛。營區周邊瀰漫烤肉煙味，影響環境。營區對面民宅於夜間播放卡拉OK，音量過大，影響睡眠。警方已多次到訪，但噪音問題仍存。雖人潮保證生意，但服務態度普通。欲試者可嘗試，惟不特別推薦。,3,2,0,4478,,環境尚可惟溪邊已受破壞沙灘車橫行危險本區為熱門露營地湧入眾多客吵雜氣氛營區周邊瀰漫烤肉煙味影響環境營區對面民宅夜間播放卡拉OK音量過大影響睡眠警方到訪噪音仍存人潮保證生意服務態度欲試者嘗試惟特別推薦,2022/5/8,0
浴室與洗手台距離較遠，導致使用上稍嫌不便，但山中美景仍令人心曠神怡。,3,2,0,4488,,浴室洗手台距離較遠導致稍嫌不便山中美景令人心曠神怡,2022/5/8,0
"在近5,000元的露營車中，僅提供床墊而未附被子和枕頭，著實感到相當昂貴。",3,2,0,4525,,000元露營車中提供床墊未附被子枕頭著實感到昂貴,2022/5/8,0
"優點：營地附近的廁所及浴室保持整潔，且面積寬闊，提供良好的休憩環境，讓小孩有足夠的空間活動。

缺點：廁所和洗手台位置較遠，在使用上較為不便；遇到降雨，草地排水性不佳，導致積水形成泥濘。",3,2,0,4571,,"優點營地廁所浴室整潔面積寬闊提供休憩環境小孩足夠空間活動

缺點廁所洗手台位置較遠為不便降雨草地排水性不佳導致積水泥濘",2022/5/8,0
入口處接待人員的服務需要加強，工作人員告知需在停車場等候，隨後又多次要求將車輛移走。當接待人員到來，詢問訂位資訊時，卻一臉陌生，需自行告知營區。露營地無法停車於帳篷旁，卸貨相當不便。廁所提供茶籽堂沐浴用品，但整體體驗較為普通。,3,2,0,4592,,入口處接待人員服務工作人員告知需在停車場等候車輛移走接待人員到來詢問訂位資訊時一臉陌生需自行告知營區露營地停車帳篷旁卸貨不便廁所提供茶籽堂沐浴用品整體體驗為,2022/5/8,0
炎炎夏日蚊子肆虐，常造成爆滿情況，需事先預約以確保有營地。,3,2,0,4608,,炎炎夏日蚊子肆虐爆滿情況需事先預約確保營地,2022/5/8,0
對於追求刺激活動的露營客，此處提供的漂流或沙灘車體驗可能不足以滿足其需求；然而，對全家出遊、喜愛大自然的家庭而言，共享美好回憶和共同探索戶外樂趣，則顯得格外值得。,3,2,0,4631,,追求刺激活動客提供漂流沙灘車體驗不足以需求全家出遊喜愛大自然家庭共享美好回憶探索戶外樂趣顯得值得,2021/5/8,0
晚上10點過後，員工仍在現場聊天嘻鬧，音量過大影響休息品質，且A區營位鄰近馬路，車聲吵雜，加上沙灘車頻繁進出。不過，草皮維護得相當良好，使環境保持整潔。,3,2,0,4680,,晚上10點過員工現場聊天鬧音量過大影響休息品質區營位鄰近馬路車聲吵雜沙灘車頻繁進出草皮維護環境整潔,2021/5/8,0
溯溪體驗雖普通，主要僅靠幾個深潭提供全身浸濕的樂趣，其餘活動規劃並無太突出之處，令到訪者未感非前往不可。,3,2,0,4712,,溯溪體驗僅靠幾個深潭提供全身浸濕樂趣活動規劃並無太處令到訪未感非前往,2021/5/8,0
我們入住了諾美帝露營車，內裝乾淨舒適，提供了愉快的住宿體驗。然而，外部環境欠佳，遊覽車停在露營車前，引擎高溫加劇炎熱天氣，加上解說漂流和溯溪的擴音機，影響了住宿品質。真心建議，這二輛露營車應與營地其他露營車或營地一起放置。服務品質優異，感受到原住民的純樸和熱心助人。風景優美、舒適，活動刺激，惟露營車位置扣分。,3,2,0,4718,,入住諾美帝露營車裝乾淨舒適提供愉快住宿體驗外部環境欠佳遊覽車停露營車前引擎高溫加劇炎熱天氣解說漂流溯溪擴音機影響住宿品質真心建議二輛露營車應營地露營車營地放置服務品質優異感受原住民純樸熱心助人風景優美舒適活動刺激惟露營車位置扣分,2021/5/8,0
沉浸在自然的靜謐中，放鬆身心靈，享受兩段輕柔的小激流，帶來暢快淋漓的體驗。,3,2,0,4726,,沉浸自然靜謐中放鬆身心靈享受兩段輕柔激流帶來暢快淋漓體驗,2021/5/8,0
停車場滿布塵土，停在這裡一整天，整輛車都被一層灰土覆蓋。建議鋪設碎石，不僅能防止塵土飛揚，在雨天也能避免變成爛泥漿。,3,2,0,4732,,停車場滿布塵土停一整天整輛車都一層灰土覆蓋建議鋪設碎石塵土飛揚雨天爛泥漿,2021/5/8,0
環境清幽，植被茂密，讓人心曠神怡。然而，當地居民騎乘ATV在河水上，影響了自然寧靜，尤其是在年幼孩童參與其中，更令人擔憂。營區夜晚喧囂四起，大螢幕電影和卡拉OK歌喉競賽，為自然環境增添了一絲都市喧囂。儘管如此，設施保持整潔，反映了管理者的用心。,3,2,0,4773,,環境清幽植被茂密心曠神怡居民騎乘ATV河水影響自然寧靜年幼孩童參與令人擔憂營區夜晚喧囂四起螢幕電影卡拉OK歌喉競賽為自然環境增添一絲都市喧囂設施整潔管理者用心,2021/5/8,0
場地寬敞且乾淨，但廁所數量未符合帳數。冰箱距離過遠，空間明顯不足。建議至少在一、兩區間設置直立式冰箱。,3,2,0,4780,,場地寬敞乾淨廁所數量未符合帳數冰箱距離過遠空間建議至少兩區間設置直立式冰箱,2020/5/8,0
漂漂河之旅提供了另類的露營樂趣，令人大開眼界，真是太棒啦！,3,2,0,4818,,漂漂河旅提供另類樂趣令人大開眼界太棒,2020/5/8,0
山谷的自然美景令人心曠神怡，溪水的清涼感令人舒心，營地的空間十分寬廣。然而，由於範圍廣大，廁所與淋浴間僅設置在入口營本部和最尾端的C及森林區，導致營區的便利性降低，且數量也不足。此外，營本部需要處理未露營僅戲水的遊客，增加了工作負擔。此外，冰箱容量不足，僅有一個雙門冷藏和冷凍冰箱供全區使用，在炎熱天氣和人潮眾多的情況下，難以滿足需求。建議攜帶冰桶或冰箱等設備，以防食材腐敗。由於後半部區域到營本部的距離需步行5~8分鐘，來回增加了不便。,3,2,0,4819,,山谷自然美景令人心曠神怡溪水清涼感令人舒心營地空間寬廣廁所淋浴間設置入口營本部尾端C森林區導致營區便利性降低數量營本部未戲水遊客增加工作負擔冰箱容量僅有雙門冷藏冷凍冰箱供全區炎熱天氣人潮眾多情況難以需求建議攜帶冰桶冰箱設備以防食材腐敗後半部區域到營本部距離需步行分鐘來回增加不便,2020/5/8,0
衛浴設施與營地稍遠，建議增設方便性，熱水供應也需改善，以提升整體住宿品質。,3,2,0,4902,,衛浴設施與營地稍遠建議增設方便性熱水供應需改善提升整體住宿品質,2019/5/8,0
環境整潔，景點豐富，設備完善，但場地廣闊、人氣高，稍嫌吵雜。,3,2,0,4903,,環境整潔景點設備完善場地廣闊人氣高稍嫌吵雜,2019/5/8,0
草皮維持得不錯，廁所位置稍遠，需在夜晚摸黑前往，不方便；但廁所乾淨、寬敞，且採乾濕分離，盥洗水壓充足，洗澡舒適。若增設流動廁所，體驗將更完美。,3,2,0,4911,,草皮不錯廁所位置稍遠需在夜晚摸黑前往廁所乾淨寬敞採乾濕分離盥洗水壓充足洗澡舒適增設流動廁所體驗將更完美,2019/5/8,0
漂漂河體驗令您原先擔心過於刺激，但抵達現場後，發現更多小朋友一起享受樂趣，使得您的孩子更加雀躍。即便當天無法即時下水，還能保留票券，以便日後再次造訪。,3,2,0,4935,,漂漂河體驗令原先擔心刺激抵達現場發現小朋友享受樂趣孩子雀躍當天即時下水還能保留票券日後造訪,2019/5/8,0
在馬路邊露營，貨車來往頻繁，偶有小吵，但鳥啼蟲鳴交織成另一種自然樂章。,3,2,0,4983,,馬路邊貨車來往頻繁偶有小吵鳥啼蟲鳴交織成一種自然樂章,2018/5/8,0
景色宜人，每座帳篷間距略為狹窄，似有超收帳之慮。,3,2,0,5002,,景色宜人每座帳篷間距為狹窄似有超收帳之慮,2018/5/8,0
南部露營區罕見提供懶人露營服務，交通便利且場地廣闊，衛浴設備乾淨且充足。大部分地方皆良好，唯露營食材多，兩帳共用一個流理台過於不便。浴室洗澡水外溢，導致泥濘產生，實為不妥。,3,2,0,5046,,南部區罕見提供懶人服務交通便利場地廣闊衛浴設備乾淨充足大部分地方皆唯食材兩帳共用流理台不便浴室洗澡水外溢導致泥濘實為不妥,2024/3/8,0
衛浴設施多且維持整潔，每帳旁配置洗手台，每間帳篷配置冷氣，但冬季來訪仍感寒冷且潮濕，房內提供鍋子與瓦斯爐，請自備瓦斯罐及打火機。,3,2,0,5047,,衛浴設施多且整潔每帳旁配置洗手台每間帳篷配置冷氣冬季來訪仍感寒冷潮濕房內提供鍋子瓦斯爐請自備瓦斯罐及打火機,2024/3/8,0
帳篷的發霉問題嚴重，椅子也損壞，且廁所數量不足，帳篷內未提供衛生紙和垃圾桶，感到失望。不過，冷氣相當冷，洗手台保持乾淨，仍有些許優點。,3,2,0,5073,,帳篷發霉椅子損壞廁所數量帳篷內未提供衛生紙垃圾桶感到失望冷氣冷洗手台乾淨些許優點,2023/10/8,0
如同其他遊客所言，帳篷內充斥著霉斑，且園區內的設施明顯需改善。泳池滑水道的外觀更令人擔憂，看起來已許久未清潔。然而，工作人員雖眾多，但也十分親切。,3,2,0,5089,,遊客言帳篷充斥著霉斑園區設施需改善泳池滑水道外觀令人擔憂許久未清潔工作人員雖眾親切,2023/6/8,0
初次造訪免搭帳營地，仍偏好自行搭設帳篷的體驗，因帳篷長期受日曬雨淋，蓬內空氣感覺欠佳且帶有異味。然而，夏季期間提供冷氣設備，仍為較舒適的選擇。,3,2,0,5105,,初次造訪免搭帳營地偏好自行搭設帳篷體驗帳篷長期受日曬雨淋蓬內空氣感覺欠佳帶有異味夏季期間提供冷氣設備仍為舒適選擇,2023/5/8,0
環境與設施相當好，但須注意可能遇到缺乏公德心的其他露營客。深夜時段10點後仍有喧嘩狂歡聲音，向營地管理反映2次，但仍未改善，持續至凌晨12點，影響睡眠品質。,3,2,0,5165,,環境設施但須缺乏公德心客深夜時段10點後仍喧嘩狂歡聲音營地管理次未改善持續凌晨12點影響睡眠品質,2023/5/8,0
在日落時分，蚊蟲增多，使得活動稍感不便；營地空間稍顯狹窄，易造成擁擠感；障礙物標示不明確，亟需改善；相較於舊營地，此處明顯縮小，使再次到訪的意願降低；然而，仍期待前往二號店旗津營地。,3,2,0,5176,,日落時分蚊蟲增多活動稍感不便營地空間稍顯狹窄易擁擠感障礙物標示亟需改善相較舊營地縮小到訪意願降低期待前往二號店旗津營地,2023/5/8,0
2.5顆星的露營體驗，帳篷拉鍊損壞後僅以縫線修補，導致進出不便，令人困惑。工作人員於10點後主動尋覓製造噪音者，使得夜晚較為寧靜。然而，從帳篷至廁所、冰箱的路段缺乏充足照明，建議攜帶手電筒以便移動。冰箱效能不佳，可能因頻繁開關或其他因素，導致冷卻效果不佳。部分設備已接近損壞狀態，卻未更換或維修，令人感到失望。整體而言，住宿品質有待提升。,3,2,0,5177,,2.5顆星體驗帳篷拉鍊損壞僅以縫線修補導致進出不便令人困惑工作人員10點後主動尋覓製造噪音夜晚為寧靜帳篷廁所冰箱路段缺乏充足照明建議攜帶手電筒冰箱效能不佳頻繁開關因素導致冷卻效果不佳設備接近損壞狀態未更換維修令人感到失望整體而言住宿品質有待提升,2023/5/8,0
狩獵帳篷提供了舒適的休憩環境，但小黑蚊數量可真不少。建議穿著長褲及做好防蚊措施，以免每名參與者都成了小黑蚊的美味紅豆冰。,3,2,0,5180,,狩獵帳篷提供舒適休憩環境小黑蚊數量真不少建議穿著長褲做好防蚊措施每名參與者成小黑蚊美味紅豆冰,2023/5/8,0
設施需要稍作清潔，住宿方面尚可。,3,2,0,5189,,設施稍作清潔住宿尚可,2023/5/8,0
"園區規模甚大，自入口處至營本部或遊樂設施，步行至少需10分鐘。建議提供定點高爾夫接駁車，以方便旅客。戲水區為孩子們放電的最佳場所，讓他們兩天都捨不得起來。然而，以下是一些缺點：

1.小黑蚊數量眾多，需借蚊香且支付押金500元，再至營本部歸還。由於園區廣大，蚊蟲難免，每帳提供蚊香盤應為合理措施，費用也不高。
2.狩獵帳內外佈滿黴菌，且未進行保養或清洗，帳篷內瀰漫潮濕味，地毯氣味亦濃厚，檯燈布已破損未更換。
3.在防疫期間，為確保衛生，廁所內提供酒精供遊客消毒，應是基本要求。然而，此營區在相同價位下，免搭帳的經驗較優，細節方面仍有許多改進空間。",3,2,0,5203,,"園區規模甚大入口處至營本部遊樂設施步行至少需10分鐘建議提供定點高爾夫接駁車旅客戲水區為孩子放電最佳場所兩天捨不得缺點

小黑蚊數量眾多需借蚊香支付押金500元至營本部歸還園區蚊蟲難免每帳提供蚊香盤應為措施費用高
狩獵帳內外佈滿黴菌未保養清洗帳篷瀰漫潮濕味地毯氣味濃厚檯燈布已破損未更換
防疫期間為確保衛生廁所提供酒精供遊客消毒應是營區價位免搭帳經驗較優細節改進空間",2022/5/8,0
