content,rating,type,status,sequence_num,tokenization,text,publishedDate,origin
3.5/5優點：1. 入住時，帳篷已開啟冷氣，帳篷內涼爽舒適；2. 提供耳塞供淺眠旅客使用，衛浴空間保持乾淨；3. 使用茶籽堂洗手乳/洗髮乳，氣味宜人；4. 附近有高美濕地美景，景色優美；缺點：1. B/C區帳篷與衛浴距離較遠，對長者及孩童較不便利；2. 晚餐選擇以辣、鹹口味為主，海鮮新鮮度不足，白飯過硬；3. 早餐味道普通，但與周邊露營客互動很重要；4. 夕陽觀賞時間與晚餐時間重疊，可能影響體驗；5. 適合不想準備太多東西的露營初學者，但部分細節稍嫌可惜。,3,2,0,1930,,3.5優點入住時帳篷開啟冷氣帳篷涼爽舒適提供耳塞供淺眠旅客衛浴空間乾淨茶籽堂洗手乳洗髮乳氣味宜人高美濕美景景色優美缺點BC區帳篷衛浴距離較遠長者孩童便利晚餐選擇以辣鹹口味為主海鮮新鮮度白飯過硬早餐味道周邊客互動夕陽觀賞時間晚餐時間重疊影響體驗適合不想太東西初學者細節稍嫌可惜,2023/10/8,0
偶爾放棄舒適的飯店生活，走進大自然的懷抱也是一種體驗。儘管會遇到蟲鳴鳥叫、貓狗打架和飆車噪音，但營地提供了耳塞，還算可以接受。公廁位置稍遠，半夜需要上廁所可能只能在帳篷內解決，且安全性也令人擔憂。門禁卡制度雖存在，但還是讓人感到不安全，因有人可能會不斷感應您的門。廁所門禁卡使用後還需要上鎖，以免被偷窺。飲食方面，建議以保溫方式處理，因食物通常會冷卻。如果您注重睡眠品質或飲食，偶爾體驗即可，以免覺得花大錢受罪。,3,2,0,1931,,放棄舒適飯店生活走進大自然懷抱一種體驗蟲鳴鳥叫貓狗打架飆車噪音營地提供耳塞算接受公廁位置稍遠半夜廁所只能帳篷解決安全性令人擔憂門禁卡制度感到有人感應的門廁所門禁卡後還上鎖偷窺飲食建議保溫方式食物冷卻注重睡眠品質飲食體驗即可花大錢受罪,2023/10/8,0
希望能更加區分房客與遊客的使用空間，淋浴間與公共廁所相連，令人感到不舒服，且內部還存在一些怪異之處，如部分淋浴間入口加裝黑色大理石防水條，夜晚容易被忽略，差點跌倒。住宿時請多加注意。此外，餐廳、大廳、冰淇淋店的冷氣不冷，但氣溫相當高。,3,2,0,1951,,希望區分房客遊客空間淋浴間公共廁所相連令人感到舒服內部怪異處淋浴間入口加裝黑色大理石防水條夜晚忽略差點跌倒住宿時請多加餐廳大廳冰淇淋店冷氣不冷氣溫高,2023/9/8,0
晚餐於日落時分6:00抵達，可惜未能欣賞高美濕地的絕美景色，實在相當可惜。,3,2,0,1953,,晚餐日落時分00抵達可惜未能欣賞高美濕絕美景色實在可惜,2023/9/8,0
服務人員的熱忱與專業程度令人印象深刻，生態導覽老師更增添了豐富的旅遊體驗。然而，客房的清潔度和舒適度仍有改善空間，因昆蟲經常在床上出沒，令人困擾。此外，鄰近馬路導致半夜車輛噪音干擾，影響了睡眠品質。兒童額外收費方面，在暑假期間的高計價令人感到有些不便。值得一提的是，餐廳的餐點美味，但開放式吃到飽取餐方式需要加強宣導，以維持用餐品質。,3,2,0,1983,,服務人員熱忱專業程度令人印象深刻生態導覽老師增添旅遊體驗客房清潔度舒適度改善空間昆蟲床上出沒令人困擾鄰近馬路導致半夜車輛噪音干擾影響睡眠品質兒童額外收費暑假期間高計價令人感到不便值得一提的是餐廳餐點美味開放式吃取餐方式宣導用餐品質,2023/8/8,0
食材品質令人失望，不僅單調，更常出現不足的狀況，令人飢腸轆轆等候。服務人員態度雖然可圈可點，卻似常陷入忙碌的困境。,3,2,0,1995,,食材品質令人失望單調更常狀況令人飢腸轆轆等候服務人員態度可圈可點似常陷入忙碌困境,2023/8/8,0
於7月炎熱的時節到訪，帳棚內冷氣提供了舒適的降溫，令人感到驚喜。夜晚比預期更寧靜，在貝殼區的住宿體驗令人滿意。,3,2,0,2000,,月炎熱時節到訪帳棚冷氣提供舒適降溫令人感到驚喜夜晚預期寧靜貝殼區的住宿體驗令人滿意,2023/8/8,0
生態導覽團分享了許多有趣的生物，讓人不禁讚嘆大自然的奧妙。,3,2,0,2014,,生態導覽團分享有趣生物不禁讚嘆大自然奧妙,2023/8/8,0
自然美景環抱，夜晚星斗相伴，但午時陽熱，帳篷內難獲涼意，影響午間休憩品質。,3,2,0,2035,,自然美景環抱夜晚星斗相伴午時陽熱帳篷內難獲涼意影響午間休憩品質,2023/7/8,0
食物美味，衛浴整潔，但受到網路影片誇大的吸引而來，可能會失望。地點位於高美濕地旁，獨特之處像極了高級懶人露營，卻又不像。用餐地點在服務區樓上，猶如回憶畢業旅行。雖然食物美味，但價格昂貴，CP值不足，因此不建議再次造訪。,3,2,0,2073,,食物美味衛浴整潔網路影片誇大吸引而來失望地點位於高美濕地旁獨特之處高級懶人用餐地點服務區樓上猶如回憶畢業旅行食物美味價格昂貴CP值建議造訪,2023/7/8,0
對於敏感入睡者或不喜歡噪音的人，本營地可能不適合您。尤其是帳蓬隔音不佳，可能會被其他遊客的喧鬧影響。另外，廁所距離營地中心較遠，可能導致不便。如果您希望獲得更舒適的露營體驗，您可能需要考慮其他營地。,3,2,0,2083,,敏感入睡喜歡噪音營地適合帳蓬隔音不佳遊客喧鬧影響廁所距離營地中心較遠導致不便希望舒適體驗營地,2023/6/8,0
海風強勁的季節應避免造訪，因帳篷易遭強風吹襲，中柱甚至可能倒塌。主要適合晴天造訪，因盥洗室距離營地較遠，於寒冷或下雨天候造訪，將造成極大不便。,3,2,0,2091,,海風強勁季節應造訪帳篷易遭強風吹襲中柱倒塌適合晴天造訪盥洗室距離營地較遠寒冷下雨天候造訪不便,2023/6/8,0
廁所只有一間，距離營位較遠，使用上不方便，且整潔度不佳，味道過重。下午茶餐點空虛，晚餐的海鮮中卷未熟，導致多人腹瀉，幸好未讓孩童食用。照明設備也有問題，帳篷外的燈泡串故障多，帳篷內照明也偏弱，影響夜晚活動。桌遊、球、手電筒、防蚊液可供借用，但選擇有限。業者回應表示會努力改善，希望日後能提供更好的露營體驗。,3,2,0,2095,,廁所一間距離營位較遠整潔度不佳味道過重下午茶餐點空虛晚餐海鮮中卷未熟導致多人腹瀉幸好未孩童食用照明設備帳篷外燈泡串故障帳篷照明偏弱影響夜晚活動桌遊球手電筒防蚊液可供借用選擇有限業者回應努力改善希望日後提供更好體驗,2023/6/8,0
露營地點鄰近高美濕地，徒步即達，可飽覽自然風光；營地規模有限，僅包含帳篷區及遊客中心，餐廳位於二樓。衛浴設施與遊客共用，但分開管制，位置稍遠，清潔度尚可。帳棚內溼氣重，除濕機使用後仍感潮濕，影響舒適度。床鋪舒適、空間寬敞，但戶外休憩空間有限，需坐臥於帳棚內或櫃檯附近。附設桌椅方便使用，餐點選擇有限且口味一般。夜晚可欣賞露營區的迷人夜景。,3,2,0,2114,,地點鄰近高美濕徒步即達飽覽自然風光營地規模有限包含帳篷區及遊客中心餐廳位於二樓衛浴設施與遊客共用分開管制位置稍遠清潔度尚可帳棚溼氣重除濕機感潮濕影響舒適度床鋪舒適空間寬敞戶外休憩空間有限需坐臥帳棚櫃檯附設桌椅方便使用餐點選擇有限口味夜晚欣賞區的迷人夜景,2023/5/8,0
整體還算滿意，但遇到一些問題，如冬天海邊風太大、低溫時很冷，以及下午茶補餐速度緩慢，導致過度取餐。男性淋浴間也有熱水問題，但更換一間即可解決。以這個價位而言，可能期望更高，但整體體驗尚可。,3,2,0,2195,,整體算滿意冬天海邊風太大低溫時冷下午茶補餐速度緩慢導致過度取餐男性淋浴間熱水更換一間即可解決價位期望更高整體體驗尚可,2023/5/8,0
客服人員相當熱心，為旅客解決了許多問題。但廚師的廚藝有待加強，濕地餐的味道和口感都不佳，令人失望。以五千元的花費來說，有更多的活動和裝飾可增加樂趣。,3,2,0,2214,,客服人員熱心為旅客解決廚師廚藝有待濕地餐味道口感不佳令人失望五千元花費活動裝飾增加樂趣,2023/5/8,0
服務卓越，帳篷舒適，餐飲方面尚可，但口味稍差，整體CP值稍低，價格略高。,3,2,0,2218,,服務卓越帳篷舒適餐飲尚可口味稍差整體CP值稍低價格高,2023/5/8,0
服務人員態度和善，令人感到親切，但淋浴間熱水供應量不足，令沐浴體驗大打折扣；此外，環境衛生有待改善，建議在颱風過後避免造訪。,3,2,0,2313,,服務人員態度和善令人感到親切淋浴間熱水供應量令沐浴體驗大打折扣環境衛生有待改善建議颱風過後造訪,2023-10-11T09:04:57+08:00,0
鄰近高美濕地，位置便利，但晚餐和早餐的選擇種類有限。盥洗間地面常可見頭髮，且缺乏定期清潔人員維護。,3,2,0,2327,,鄰近高美濕位置便利晚餐早餐選擇種類有限盥洗間地面頭髮缺乏定期清潔人員維護,2023-04-06T10:58:59+08:00,0
環境保持尚可，餐飲品質尚可，惟份量稍嫌不足，多位小朋友期待之水果亦未如願品嚐。,3,2,0,2463,,環境尚可餐飲品質尚可惟份量稍嫌多位小朋友期待水果未如願品嚐,2024/4/8,0
營地位處深山，環境清幽，但交通安全須留意。營區雖小，卻提供良好空氣品質和壯麗星空。一舶二食體驗令人滿足，但期望不宜過高。浴室盥洗設施尚可，但排水及衛浴設計需改善。廁所則保持乾淨。入住下層帳蓬區，距其他帳蓬過近，可能影響隱私。營主的供電規則，在低溫季節可能影響舒適度，建議檢討。,3,2,0,2567,,營地位處深山環境清幽交通安全須留意營區雖小提供空氣品質壯麗星空一舶二食體驗令人期望不宜過高浴室盥洗設施尚可排水衛浴設計需改善廁所乾淨入住下層帳蓬區帳蓬過近影響隱私營主供電規則低溫季節影響舒適度建議檢討,2024/3/8,0
蟲鳴聲不絕於耳，夜晚蟬聲不間斷，影響了您的睡眠品質。營區的停車空間寬敞，有兩隻受捕獸夾傷害的小狗，請遊客不要使用捕獸夾。下午造訪白蘭溪古道，享受了清涼的冷泉，舒緩了雙腳的疲勞。晚餐和早餐以溫暖的原住民特色料理滿足了旅人的胃，雖然菜色相較飯店較為單純，但更具有在地風味。此次入住好冬小屋，室內雖乾淨但內部設備需加強，空調僅提供電風扇，導致房間過熱，而彈簧床太軟、枕頭太硬，影響睡眠品質。營區服務人員熱忱有禮，提供封路後的路況說明，餐點依然美味，但小木屋的床品質令其考慮再次入住的決定。,3,2,0,3090,,蟲鳴聲不絕於耳夜晚蟬聲不間斷影響睡眠品質營區停車空間寬敞兩隻受捕獸夾傷害小狗請遊客捕獸夾下午造訪蘭溪古道享受清涼冷泉舒緩雙腳疲勞晚餐早餐溫暖原住民特色料理旅人胃菜色相飯店為風味入住好冬小屋室內乾淨內部設備需空調提供電風扇導致房間過熱彈簧床太軟枕頭太硬影響睡眠品質營區服務人員熱忱有禮提供封路路況餐點依然美味小木屋床品質令其入住,2023/9/8,0
"1. 期待特色餐點，但口味偏淡，有些失望。不同地區的料理看起來很美，但味道稍嫌清淡。先前的朋友曾表示沒味道，此次實際體驗也認同這個評論。
2. 山谷小鹿區的帳篷間距過近，面對面設置令人感奇怪。雖然帳數多可以接待更多客人，但居住品質大受影響。原本期待悠閒、清淨的露營體驗，但擁擠感十足。
3. 山谷小鹿區的餐廳未開放，晚餐、早餐需至接待中心。路程遙遠，行動不便，住宿體驗中造成不便。
4. 廁所有異味，整體環境優美，自然聲響美妙，起霧、雲海美景難忘。茶水間、浴室設備齊全，備品優質。服務人員親切、耐心，解決問題有方。
5. 因擁擠人群、漫長路程，寧靜、放鬆氛圍未得滿足。下次可能不會再選擇此營地，期望更靜謐的露營體驗。",3,2,0,3519,,"期待特色餐點口味偏淡失望地區料理美味道稍嫌清淡先前朋友味道體驗認同評論
山谷小鹿區的帳篷間距過近面對面設置令人感奇怪帳數多接待客人居住品質大受影響原本期待悠閒清淨體驗擁擠感十足
山谷小鹿區的餐廳未開放晚餐早餐需至接待中心路程遙遠行動不便住宿體驗中不便
廁所異味整體環境優美自然聲響美妙起霧雲海美景難忘茶水間浴室設備齊全備品優質服務人員親切耐心解決問題有方
擁擠人群漫長路程寧靜放鬆氛圍未得下次選擇營地期望靜謐體驗",2023/5/8,0
我們於2/14前來此賞櫻，當天氣候驟變，起大霧且能見度僅5-10米。周邊服務及用餐環境還算可接受，但當天氣溫過低，入房即感受到濕氣，全身感到寒冷。房內提供的用品有限，僅有電風扇、除濕機、掛衣架、床上的電毯，卻沒有室內拖鞋和暖氣。入住四人房的我們十分寒冷，導致不願意下床。整體而言，性價比普通。,3,2,0,3538,,14前來此賞櫻當天氣候驟變大霧能見度10米周邊服務用餐環境還算接受當天氣溫過低入房感受濕氣全身感到寒冷房內提供用品有限僅有電風扇除濕機掛衣架床上電毯室內拖鞋暖氣入住四人房寒冷導致床整體而言性價比,2023/5/8,0
環境清幽，工作人員服務熱忱十足，解說內容清楚易懂。餐點個人感覺一般，但喜好因人而異。為避免寒冷，建議近期造訪時攜帶保暖衣物。夜晚較涼，且濕度較高，此乃氣候因素，個人感受。,3,2,0,3539,,環境清幽工作人員服務熱忱十足解說內容易懂餐點個人感覺喜好因人而異為寒冷建議近期造訪時攜帶保暖衣物夜晚較涼濕度高氣候因素感受,2023/5/8,0
"四人房帳篷住宿費用為9,900元，包含晚餐和早餐。帳篷環境乾淨、整潔，但缺乏冷氣機。由於當天有下雨和強風，溫度並不高，因此冷氣問題並未造成困擾。然而，若天氣炎熱，可能成為問題。帳篷間距離很近，鄰居過份喧嘩可能影響休息品質。建議保留適當距離或提供包場選擇。晚餐菜色及份量尚可，服務人員主動詢問是否需要加點。餐桌間距離若稍遠，用餐體驗將更加舒適。早餐方面，菜色令人失望，充斥蒼蠅。喝完咖啡後，服務人員迅速處理蒼蠅。",3,2,0,3572,,四人房帳篷住宿費用為900元包含晚餐早餐帳篷環境乾淨整潔缺乏冷氣機當天下雨強風溫度並不高冷氣並未困擾天氣炎熱成為帳篷間距離很近鄰居過份喧嘩影響休息品質建議保留距離提供包場選擇晚餐菜色份量尚可服務人員主動詢問加點餐桌間距離稍遠用餐體驗舒適早餐菜色令人失望充斥蒼蠅喝完咖啡服務人員蒼蠅,2023/5/8,0
硬體設備和服務人員的熱忱獲得4-5顆星評價，可惜缺乏壯觀的風景，但樹林提供了寧靜的氛圍。然而，附近的旅客使用個人音響和飲酒喧嘩破壞了氛圍，而工作人員卻沒有制止。更適合網美打卡的地點。,3,2,0,3601,,硬體設備服務人員熱忱顆星評價可惜缺乏壯觀風景樹林提供寧靜氛圍旅客音響飲酒喧嘩破壞氛圍工作人員制止適合網美打卡地點,2023/5/8,0
景觀方面較不足，連餐廳區也無美景，與山中靜靜相比有些差距，感到小失望。但工作人員的服務態度非常良好。,3,2,0,3645,,景觀餐廳區也美景山中靜靜相比差距感到失望工作人員服務態度,2023/5/8,0
帳篷設施表現佳，惟晚餐料理尚待提升，早餐尚可，熱水供應不穩，亟待改善；甫開業三個月，服務品質仍有成長空間。,3,2,0,3682,,帳篷設施表現佳惟晚餐料理尚待提升早餐尚可熱水供應穩亟待改善開業三個月服務品質成長空間,2023/5/8,0
千萬別遵循Google Maps導航選擇最快路線，因該路路面顛簸，車輛底盤會不斷磨擦地面，建議改走122道路。可惜店家未提供相關提示。,3,2,0,3998,,千萬別GoogleMaps導航選擇最快路線因該路路面顛簸車輛底盤磨擦地面建議改走122道路可惜店家未提供相關提示,2024/4/8,0
帳篷提供寬敞的空間，使您免於壓迫感，但令人失望的是，以這個價位來說，床墊過於堅硬。此外，熱水溫度不穩定，有時過燙，欲稍作調整卻瞬間變冷。整體而言，CP值取決於個人觀點，尤其是遠道而來的旅客，期望在高價位中能享受舒適睡眠體驗。,3,2,0,4029,,帳篷提供寬敞空間免於壓迫感令人失望價位床墊堅硬熱水溫度穩定過燙欲稍作調整瞬間變冷整體而言CP值取決於個人觀點遠道而來旅客期望高價位中能享受舒適睡眠體驗,2024/3/8,0
於20240127入住山徑仙境帳篷區，入住前服務人員已提醒熱水需稍候，但熱水器性能確實有待改善。因寒流來襲，氣溫低，洗澡水的穩定性至關重要。寒流後山上溫度低，洗澡熱水品質不佳，需等約3分鐘，水溫卻可能驟降，令人困擾。以該價格而言，熱水器表現令人失望。此外，6帳篷僅配置4間衛浴，建議增加至6間，以符合需求。面對低溫，建議攜帶煤爐，或商家提供提前入住服務。迎賓點心尚可，晚餐為自助式，有火鍋可供選擇，補餐速度快，服務人員亦熱心。唯一不足之處為洗澡熱水，其他皆美不勝收，雲海景色美不勝收。,3,2,0,4036,,20240127入住山徑仙境帳篷區入住前服務人員提醒熱水需稍候熱水器性能確實有待改善因寒流來襲氣溫低洗澡水穩定性至關重要寒流山上溫度低洗澡熱水品質不佳需等約分鐘水溫驟降令人困擾以該價格熱水器表現令人失望帳篷配置間衛浴建議增加間符合需求面對低溫建議攜帶煤爐商家提供提前入住服務迎賓點心尚可晚餐為自助式火鍋供選擇補餐速度快服務人員熱心唯一不足之處為洗澡熱水皆美不勝收雲海景色美不勝收,2024/2/8,0
園區面積雖有限，但鄰近山巒環繞，提供良好視野。主要用於放鬆身心，仍符合期待。,3,2,0,4112,,園區面積有限鄰近山巒環繞提供視野用於放鬆身心符合期待,2023/7/8,0
位置難以找到，價格也較昂貴，下次不再考慮前往。,3,2,0,4139,,位置難以找到價格昂貴下次前往,2023-10-19T04:23:21+08:00,0
服務人員親切且營地寬敞，令人滿意，但小黑蚊數量過多，令體驗受到影響。建議吸蚊器少來，以免使用大量防蚊用品。對於追求寧靜悠閒的露營者，建議選擇人較少的秋冬季節。平日造訪將提供較好的露營體驗。,3,2,0,4148,,服務人員親切營地寬敞令人滿意小黑蚊數量過多令體驗影響建議吸蚊器少來防蚊用品追求寧靜悠閒建議選擇人較少秋冬季節平日造訪提供體驗,2024/4/8,0
這次在A區預訂，發現供電不足且距離遠，電壓也不太穩定，帳棚旁沒有洗手台，需至大門處使用洗澡設備；好在景觀尚可。然而，附近有公司團露，深夜仍大聲喧嘩，多次聯繫營主未獲妥善處理，處理能力令人擔憂，希望有工作人員能定期巡場。,3,2,0,4165,,區預訂發現供電距離遠電壓太穩定帳棚旁洗手台需至大門處洗澡設備景觀尚可公司團露深夜大聲喧嘩營主未獲妥善處理能力令人擔憂希望工作人員定期巡場,2024/1/8,0
參與活動人數介於50-60人，可能會影響露營品質，但安全性仍應符合標準。然而，請確認教練人數是否充分，以確保每個人獲得適當指導。發生事故時，教練應具備緊急處理能力。如有不耐煩情況，建議溝通以改善體驗。,3,2,0,4189,,參與活動人數5060影響品質安全性仍應符合標準請確認教練人數確保指導發生事故時教練應具備緊急能力不耐煩情況建議溝通改善體驗,2023/8/8,0
海拔僅80米，因此較為炎熱，常於清晨因高溫而驚醒。戲水漂漂河活動有趣，但容易被蚊蟲叮咬。營地貼心提供帳篷預先搭設，且備有防蚊蚊香。然使用防蚊液為佳，因被叮咬仍造成癢痛且留疤。,3,2,0,4202,,海拔80米為炎熱清晨高溫驚醒戲水漂漂河活動有趣蚊蟲叮咬營地貼心提供帳篷預先搭設備有防蚊蚊香防蚊液為佳叮咬癢痛且留疤,2023/7/8,0
設施齊全且風景優美，讓您享受舒適的露營體驗。衛浴用品一應俱全，冰箱亦提供冷凍冷藏功能。然而，小黑蚊數量眾多，建議攜帶充足的防蚊用品。此外，凌晨喧嘩影響睡眠品質，使用耳塞仍無法解決，建議未來露營者留意睡眠品質需求。,3,2,0,4216,,設施齊全風景優美享受舒適體驗衛浴用品一應俱全冰箱提供冷凍冷藏功能小黑蚊數量眾多建議攜帶充足防蚊用品凌晨喧嘩影響睡眠品質耳塞解決建議未來留意睡眠品質需求,2023/6/8,0
露營車內裝備有限，床墊偏薄，睡眠品質可能受影響；車內多插座方便，但空調設定不準且產生震動，影響睡眠；營區清潔與草皮修剪良好，衛浴方便；沙灘車行程佳，活動多樣化可增色；若追求舒適住宿與全方位服務，飯店可能更適合。,3,2,0,4251,,露營車裝備有限床墊偏薄睡眠品質受影響車內插座空調設定不準震動影響睡眠營區清潔草皮修剪衛浴沙灘車行程佳活動多樣化增色追求舒適住宿全方位服務飯店適合,2023/5/8,0
環境清幽且富於自然風情，提供沙灘車騎乘和多元體驗，營地保持整潔，惟廁所位置稍遠，夜晚更遭遇短暫跳電。,3,2,0,4255,,環境清幽富於自然風情提供沙灘車騎乘多元體驗營地整潔惟廁所位置稍遠夜晚遭遇短暫跳電,2023/5/8,0
到訪時充滿期待，但實際體驗後感到些許失望。雖然價格不斐，但提供的設備卻相當有限。不僅需自備寢具，帳篷內連基本照明設備也沒有，僅提供帳篷外的燈條。此外，營地位置稍遠，離廁所、冰箱等設施有些距離，稍嫌不便。若期待豪華露營體驗，此處可能無法滿足您的需求；然而，如果想嘗試露營初體驗，此處仍可能是一個可以接受的場所。,3,2,0,4312,,到訪時充滿期待體驗感到些許失望價格不斐提供設備有限需自備寢具帳篷內連照明設備提供帳篷外燈條營地位置稍遠廁所冰箱設施距離稍嫌不便期待豪華體驗需求想嘗試初體驗接受場所,2023/5/8,0
環境清幽，悠閒自在，但戶外活動相當有趣。惟餐食方面，一泊二食中的晚餐令人大失所望，口味過於平淡或怪異，導致大家僅品嚐幾口便放棄，若沒有自備烤肉用具，可能還得下山購買食物解饞。建議業主可分開泊食，以加購方式提供，追求環境體驗而非受食難吃的困擾。,3,2,0,4314,,環境清幽悠閒自在戶外活動有趣惟餐食一泊二食中晚餐令人大失所望口味平淡怪異導致品嚐幾口放棄自備烤肉用具還得下山購買食物解饞建議業主分開泊食以加購方式提供追求環境體驗非受食難吃困擾,2023/5/8,0
參加漂漂河親子活動，整體而言為正向體驗，但淋浴間數量不足，導致等候時間過長。休息區有人群吸煙，工作人員未進行勸導，令人失望。請業主重視兒童及家長感受，加強管理以提升娛樂品質。,3,2,0,4319,,參加漂漂河親子活動整體而言為正向體驗淋浴間數量導致等候時間過長休息區人群吸煙工作人員未勸導令人失望請業主重視兒童家長感受管理提升娛樂品質,2023/5/8,0
水量不足，騎車產生大量灰塵，且環境相當髒亂，有太多塵土飛揚。,3,2,0,4325,,水量騎車灰塵環境髒亂有太多塵土飛揚,2023/5/8,0
環境雖然優美，且確實有維護，但蚊子較少，漂漂河提供了娛樂。然而，插座數量不足是一個重大的缺點，導致您被迫向其他露營區借電。被分配到的魚池草地位置缺乏電，迫使您更換至B區，然而，洗澡、冰箱和飲水機依然距離過遠。冰箱的冷凍功能不彰，導致冰棒無法維持固體狀態，因此建議攜帶行動冰箱以獲得較佳的露營體驗。,3,2,0,4368,,環境優美確實維護蚊子少漂漂河提供娛樂插座數量缺點導致被迫區借電分配魚池草地位置缺乏電迫使更換B區洗澡冰箱飲水機依然距離過遠冰箱冷凍功能不彰導致冰棒固體狀態建議攜帶冰箱較佳體驗,2023/5/8,0
我們假日上午參加漂漂河活動，可能因人潮眾多，行程相對變慢。活動欠缺刺激感，連瀑布拍照也須稍等。補給礦泉水方式為團體提供一大罐，共同飲用衛生度欠佳。照片品質不佳，相機鏡頭霧濛濛，導致影像不淸楚，成為最大缺憾與缺點。,3,2,0,4394,,假日上午參加漂漂河活動人潮眾多行程變慢活動欠缺刺激感瀑布拍照也須稍補給礦泉水方式為團體提供一大罐飲用衛生度欠佳照片品質不佳相機鏡頭霧濛濛導致影像淸楚成為缺憾缺點,2023/5/8,0
