content,rating,type,status,sequence_num,tokenization,text,publishedDate,origin
"這次的露營體驗還算不錯,不過台灣大哥大在這裡的網路訊號實在是太差了,完全沒有訊號可用,讓人感到很無助,這點真的需要加強改善。",3,1,0,72,,體驗算不錯台灣大哥大網路訊號實在太差訊號可用感到無助真的改善,2023/05/06,0
這次的露營體驗讓人覺得規劃上有待加強，經常會遇到跳電的問題，衛浴打掃的品質也不是很理想。不過，場地的規模相當寬敞，提供了不錯的露營體驗。,3,1,0,117,,體驗規劃有待跳電衛浴打掃品質理想場地規模寬敞提供不錯體驗,2022/05/06,0
"這次的露營經驗讓我感到有些失望。熱水的溫度忽冷忽熱，讓人難以適應，尤其是在夏天，水溫忽然降低，真是令人不適。想想如果是在冬天，這樣的溫度可能會讓大家冷到發抖。希望老闆能夠好好處理這個問題，讓熱水的溫度更加穩定。

另外，廁所的清潔度也值得改善。垃圾未經妥善處理，讓廁所內散發著強烈的尿騷味，影響了整體的衛生環境。建議老闆能夠派人定期清洗和收拾垃圾，保持廁所的整潔。

最後，跳電的情況也相當嚴重，希望老闆能夠加強電力系統的穩定性，避免這樣的情況再次發生。畢竟花費了這麼多錢來享受露營的樂趣，卻遇到這些問題，實在是有些讓人感到遺憾。",3,1,0,138,,"經驗感到失望熱水溫度忽冷忽熱難以夏天水溫降低令人不適想想冬天溫度冷到發抖希望老闆好好熱水溫度穩定

廁所清潔度值得改善垃圾未經妥善處理廁所散發著尿騷味影響整體衛生環境建議老闆派定期清洗收拾垃圾廁所整潔

跳電情況相當嚴重希望老闆電力系統穩定性情況再次發生花費多錢享受樂趣實在感到遺憾",2022/05/06,0
營地的營位雖然寬敞，但衛浴設施明顯不足，洗澡時水溫時大時小，時熱時冷，讓人難以適應。,3,1,0,146,,營地營位寬敞衛浴設施洗澡時水溫時大時時熱時冷難以,2021/05/06,0
這個露營地的場地還算不錯，但缺少飲水機，還得自己準備水，稍嫌不便。,3,1,0,150,,露營地場地算不錯缺少飲水機還得水稍嫌不便,2021/05/06,0
路況不錯，衛生環境有待加強。廁所清潔程度不理想，垃圾桶經常滿溢未清理。,3,1,0,169,,路況不錯衛生環境有待廁所清潔程度理想垃圾桶滿溢未清理,2021/05/06,0
浴室廁所有點遠，沒有飲水機，環境還不賴。,3,1,0,201,,浴室廁所遠飲水機環境不賴,2020/05/06,0
這個露營區的場地寬敞，草地和樹木都整理的很好，前往營區的道路也很好開車，非常適合露營。,3,1,0,218,,區的場地寬敞草地樹木整理前往營區道路開車非常適合,2019/05/06,0
營位落葉很多，洗澡水壓不穩，寧靜區部份位置落葉很多，雨後很潮濕，洗澡水壓不穩。,3,1,0,243,,營位落葉洗澡水壓不穩寧靜區部份位置落葉雨很潮濕洗澡水壓不穩,2022/03/01,0
營地的管理稍嫌不妥，晚上7點多還沒8點，鄰近帳篷要求我太吵，營主來提醒我降低音量，晚上10點前就離開，實在令人感到沮喪。,3,1,0,303,,營地管理稍嫌不妥晚上點多還點鄰近帳篷我太吵營主來提醒降低音量晚上10點前離開實在令人感到沮喪,2023/05/06,0
營區的環境整潔，沒有過多的光源，且時分安靜，除了昆蟲與動物的鳴叫外，是露營的好地方。,3,1,0,335,,營區環境整潔過多光源時分安靜昆蟲動物鳴叫外地方,2023/05/06,0
"營區位於馬路旁,如果不喜歡車聲,訂位時可以選擇靠近釣魚池的區域,會比較遠離馬路。營本部與雨棚區相連,如果不喜歡在別人家門口睡覺,就不要訂雨棚區。營本部有兩台冰箱,在雨棚區露營時,夜晚會聽到冰箱壓縮機運轉的聲音,非常吵。營區路況良好,導航設備可以順利導航到定點。五星級衛浴設備非常寬敞,一家四口一起洗澡也不會感到擁擠,有提供洗髮精和沐浴乳。釣魚池的開放時間取決於老闆,因此無法隨時都可以釣魚。",3,1,0,378,,營區位於馬路旁喜歡車聲訂位時選擇靠近釣魚池區域遠離馬路營本部雨棚區相連喜歡家門口睡覺訂雨棚區營本部兩台冰箱雨棚區時夜晚聽到冰箱壓縮機運轉聲音吵營區路況導航設備順利導航定點五星級衛浴設備寬敞一家四口洗澡感到擁擠提供洗髮精沐浴乳釣魚池開放時間取決於老闆釣魚,2020/05/06,0
露營場地寬敞，營位大且營主用心維護，適合親子同遊，風景也很優美。不過，露營地的野貓非常多，甚至會偷吃食物，讓人防不勝防。因此，攜帶食物時要格外小心，避免被貓咪偷吃。此外，清晨時分會有猴群出沒，覓食時要注意食材的安全。,3,1,0,470,,場地寬敞營位大且營主用心維護適合親子同遊風景優美露營地野貓偷吃食物防不勝防攜帶食物時要小心貓咪偷吃清晨時分猴群出沒覓食時要食材,2024/01/06,0
優點：營地整理得很整齊，管理員用心維護環境。缺點：地面堅硬，難以紮營釘。每個區域的帳位都有些被砍伐的樹幹，高低不平，有的高度不到三十公分，沒有警示標誌，夜間露營時須小心，避免撞到。園區內有蜜蜂和虎頭蜂出沒，出入時務必注意安全。,3,1,0,473,,優點營地整理整齊管理員用心維護環境缺點地面堅硬難以紮營釘區域帳位砍伐樹幹高低不平高度不到十公分警示標誌夜間時須小心撞園區內有蜜蜂虎頭蜂出沒出入時務注意安全,2023/11/06,0
這個營地整理得很好，設備齊全，尤其是石頭地特別硬。遠遠就能看到大帳篷，顯得非常熱鬧。,3,1,0,497,,營地整理設備齊全石頭特別硬遠遠大帳篷顯得熱鬧,2023/05/06,0
"這個營區營位很大約有120帳，最後一段路上山不好會車，注意google導航會要你提前左轉，但營主有立牌要再開150公尺再左轉，才是正確上山道路。水電方面，冰箱兩帳共用洗碗台，晚上較容易有電壓不穩現象，大約在洗澡時段。4到5區共用一個營業用冰箱，跟一個冷凍櫃，所以先放先贏。垃圾桶只有在廁所外面才有，除非帳在廁所旁邊的區，不然都要走去丟垃圾，非常不方便。浴廁方面，4到5區共用4到5間廁所,浴室，尖峰時段需排隊，人多洗澡時，地板排水會溢出來，優點是水壓穩定，24小時供應熱水。營地方面，缺點是不好下釘，如果釘子不夠粗，容易歪掉，優點是營地算大又好停車。營區在群山環繞下不錯，屬於梯田式，但晚上洗澡時間，不曉得為什麼會有一陣一陣尿騷味過了這時段就沒了(當然也要看風向)。活動區的設施基本上人多就要排隊，畢竟是大營區，還好營地夠大，所以建議自備一些玩物給小朋友玩。",3,1,0,510,,營區營位120帳一段路上山不好車google導航會要提前左轉營主有立牌開150公尺左轉正確上山道路水電冰箱兩帳共用洗碗台晚上電壓穩現象洗澡時段區共用營業冰箱冷凍櫃先放先贏垃圾桶廁所外面帳在廁所旁邊的區走丟垃圾浴廁區共用間廁所浴室尖峰時段需排隊人多洗澡時地板排水會溢優點水壓穩定24小時供應熱水營地缺點不好釘釘子歪掉優點營地算大停車營區群山環繞不錯梯田式晚上洗澡時間曉得為一陣一陣尿騷味過段風向活動區設施人多排隊營區還好營地夠大建議自備玩物小朋友玩,2023/05/06,0
"1.洗澡水溫不穩，時熱時冷，露營者要注意水溫的變化。
2.營地的碎石區石頭鋒利，容易造成割傷，下營釘時要特別小心，地面硬且不好敲。
3.廁所整潔是這個營地的一大優點。",3,1,0,522,,"洗澡水溫穩時熱時冷水溫變化
營地碎石區石頭鋒利割傷下營釘時要特別小心地面硬且不好敲
廁所整潔營地一大優點",2022/05/06,0
營區雖然寬敞，環境也算不錯，但地面上的石子卻成了個大問題，營釘難以打入，還容易鬆脫。晚上強風陣陣，許多露客的天幕和帳篷都被吹倒，驚慌的叫聲此起彼落。來此露營得挑個好天氣，而且不太適合新手，建議三思而行。幸好這裡也能看到車宿的，算是個小小的亮點。,3,1,0,526,,營區寬敞環境算不錯地面石子卻成營釘難以打入鬆脫晚上強風陣陣露客天幕帳篷吹倒驚慌叫聲此起彼落來此挑個天氣不太適合新手建議三思而行幸好車宿算是小小的亮點,2022/05/06,0
營區環境普通，景色不算吸引人，但整體維護還算可以。唯一的缺點是洗澡時水溫不穩，難以舒適地洗澡，其他方面的表現尚可。,3,1,0,527,,營區環境景色不算吸引整體維護算唯一缺點洗澡時水溫穩難以舒適洗澡表現尚可,2022/05/06,0
營地風超大，碎石和草皮難以搭帳篷！廁所數量有限，如果能分割衛浴區會更好。不過，兒童遊戲設施很受小朋友歡迎。,3,1,0,545,,營地風超大碎石草皮難以搭帳篷廁所數量有限分割衛浴區會更好兒童遊戲設施很受小朋友,2022/05/06,0
營區環境清幽，唯獨露客太多，小孩也多，製造不少噪音，尤其是沒有時間觀念，晚上11點多了還在喧嘩製造噪音，營主卻沒有管制，讓人感到相當困擾。,3,1,0,547,,營區環境清幽唯獨露客太多小孩製造噪音時間觀念晚上11點多還在喧嘩製造噪音營主管制感到困擾,2022/05/06,0
環境不錯，但碎石子多於草皮，走起路來像健行步道。衛浴廁所雖然間數多，但距離有點遠。不過，每小時都有人來清潔和整理廁所環境，打掃的算乾淨。,3,1,0,550,,環境不錯碎石子多於草皮走起路來健行步道衛浴廁所間數多距離遠小時有人清潔整理廁所環境打掃算乾淨,2022/05/06,0
前往營地的路途平坦好走，兩線道可會車，十分便利。然而，營地地面鋪滿了尖銳的碎石塊，建議攜帶不銹鋼營釘或額外的營釘來防止腳被割傷。營地的景色十分優美，令人心曠神怡。遊戲區位於營地的最下方，需要走一小段下坡路才能到達。露營當晚，營地不斷跳電，至少發生了5次以上的斷電情況，不知道是什麼原因造成的，建議可以攜帶非插電的燈具作為備用照明。營地的廁所熱水供應不穩定，時而熱水時而冷水，水溫忽冷忽熱。營地內也沒有飲水機，露營者需要自備飲用水。,3,1,0,560,,前往營地路途平坦走兩線道可會車便利營地地面鋪滿尖銳碎石塊建議攜帶不銹鋼營釘額外營釘來腳割傷營地景色優美令人心曠神怡遊戲區位於營地下方走一小段下坡路到達當晚營地跳電至少發生次斷電情況原因建議攜帶非插電燈具作為備用照明營地廁所熱水供應穩定時而熱水時而冷水水溫忽冷忽熱營地飲水機自備飲用水,2021/05/06,0
"這個營區佔地廣闊，非常適合小朋友放電，營主也很貼心，在戲水區提供了遮陽傘，讓家長在陪伴孩子時不會過於曬。整體來說，還有幾點可以改進的地方，讓這裡的露營體驗更完善：

1. 垃圾桶的位置偏遠，不太方便。
2. 廁所的照明不足，夜晚使用時稍嫌危險。
3. 熱水器的溫度控制不穩，忽冷忽熱。
4. 營區的地釘不夠牢固，碎石太多，容易打到石頭。",3,1,0,573,,"營區佔地廣闊非常適合小朋友放電營主貼心戲水區提供遮陽傘家長陪伴孩子時曬整體幾點改進地方體驗完善

垃圾桶位置偏遠不太
廁所照明夜晚時稍嫌危險
熱水器溫度控制穩忽冷忽熱
營區釘牢固碎石太石頭",2021/05/06,0
這次的露營經驗真是讓人難忘，地面硬得像鋼板一樣，腳一踩就會傳出清脆的聲響。更別說下大雨時，營地就像一個小湖泊，水淹得我們無法安睡。,3,1,0,575,,經驗難忘地面硬得鋼板腳一踩傳出清脆聲響大雨時營地湖泊水淹安睡,2021/05/06,0
路況差，導航帶路經過熱鬧的老街，假日車輛擁擠，回程時飽受塞車之苦。營地地面堅硬，滿是大大小小的石頭，使用普通營釘多次敲打仍無法紮營。衛浴設施還算乾淨，但使用上略顯不足。,3,1,0,592,,路況差導航帶路熱鬧老街假日車輛擁擠回程時飽受塞車之苦營地地面堅硬滿是大大小小石頭營釘敲打紮營衛浴設施算乾淨略顯,2020/05/06,0
這次的露營地碎石地太硬，根本難以紮營，天氣又超級不配合，強勁的東北季風一陣陣吹來，整個帳篷幾乎被吹垮，讓大家都有了非常糟糕的經歷，有一半的露友甚至在半夜決定放棄紮營，直接撤離，實在是太可惜了。,3,1,0,613,,露營地碎石地太硬難以紮營天氣超級配合強勁東北季風一陣陣吹來帳篷吹垮糟糕經歷一半露友半夜放棄紮營撤離實在太可惜,2019/05/06,0
這個露營地的環境清幽，很適合喜歡安靜的露營者，但缺乏宣傳和投資，讓這個露營地的潛力未被完全發揮。,3,1,0,625,,露營地環境清幽適合喜歡安靜缺乏宣傳投資露營地潛力未發揮,2019/05/06,0
露營地的整理很不錯，但是碎石地的營釘不好釘，需要多加注意。,3,1,0,634,,露營地整理不錯碎石營釘不好釘多加,2019/05/06,0
泥土和石頭太多，營釘難以扎入地面，露營環境不太理想。,3,1,0,658,,泥土石頭太營釘難以扎入地面環境不太理想,2018/05/06,0
整體來說還不錯。營位很寬敞，5*8帳篷搭設空間足夠，但是打釘實在困難，風大時恐有釘子鬆脫的危險。,3,1,0,722,,整體不錯營位寬敞帳篷搭設空間足夠打釘實在困難風大時恐有釘子鬆脫危險,2019/03/14,0
很抱歉，浴室的隔熱效果不太好，晚上使用時容易感到冷。,3,1,0,820,,抱歉浴室隔熱效果不太好晚上時感到冷,2017/05/02,0
整體環境不錯，視野遼闊，附近也有超市方便採買，但山路稍陡，會車時要特別注意。最讓人詬病的是老闆的誠信問題，讓整體感受大打折扣。,3,1,0,859,,整體環境不錯視野遼闊超市採買山路稍陡會車時要特別注意最讓人詬病老闆誠信整體感受大打折扣,2023/05/07,0
D區女生廁所僅有一間蹲式廁所與一間淋浴間，使用上實在不足。媽媽們帶小孩洗澡時，常常得等很久，建議增設座式廁所或裝設安全扶手，對老年人或不習慣蹲廁所的人來說會更加方便。DE區共用冷凍庫，若能增設冷藏功能，相信會更受大家歡迎。幸好有大雨棚，方便大家遮風避雨，營地的整體規劃還算不錯。,3,1,0,925,,D區女生廁所僅有一間蹲式廁所一間淋浴間實在媽媽小孩洗澡時久建議增設座式廁所裝設扶手老年人習慣蹲廁所DE區共用冷凍庫若能增設冷藏功能受幸好有大雨棚遮風避雨營地整體規劃算不錯,2019/05/07,0
這裡的環境和衛生條件都很優秀，營地的地理位置和視野也很棒，空氣品質也相當不錯。,3,1,0,926,,環境衛生條件優秀營地地理位置視野很棒空氣品質不錯,2019/05/07,0
這個露營地點地理位置相當不錯，距離三星鄉的味珍香跟全家開車約10-15分鐘的路程，附近還有許多景點可以參觀，像是松蘿跟九寮溪步道等。不過，來這裡露營時，秋冬季節容易刮大風，半夜睡覺時會有點不安穩。,3,1,0,940,,地點地理位置不錯距離三星鄉味珍香全家開車約1015分鐘路程景點參觀像是松蘿寮溪步道時秋冬季節刮大風半夜睡覺時會安穩,2018/05/07,0
這個露營地點離市區較近，夜景也很美。但天氣較熱，需要準備好防曬用品。過路露營適合想短暫休息的旅人。,3,1,0,944,,地點市區較近夜景美天氣較熱防曬用品過路適合想短暫休息旅人,2018/05/07,0
營地的碎石地比較硬，下營時要特別小心，避免受傷。,3,1,0,982,,營地碎石硬下營時要特別小心受傷,2021/12/14,0
在C區的草地上鋪滿了護草墊，排水不良導致小朋友們在草地上玩耍時，經常被絆倒，腳底破皮流血，實際能遊玩的區域僅限於靠近沙坑的一小塊區域。雖然設施上有熱水水槽和獨立衛浴區，但衛浴的清潔程度一般般，還有待改善。,3,1,0,1042,,C區的草地上鋪滿了護草墊排水不良導致小朋友草地上玩耍時絆倒腳底破皮流血遊玩區域僅限於靠近沙坑一小塊區域設施熱水水槽獨立衛浴區衛浴清潔程度一般般改善,2024/02/07,0
前往這個露營地需要從內灣那邊上山。雖然路上車輛較多，但相對來說路程較短，比較不會讓人感到太過疲憊。,3,1,0,1062,,前往露營地內灣上山路上車輛相對來說路程短感到太過疲憊,2023/05/07,0
中規中矩的露營地，爬坡小路雜草樹枝需要修剪，整體來說給予3.5顆星的評價。,3,1,0,1080,,中規中矩露營地爬坡小路雜草樹枝修剪整體給予3.5顆星評價,2023/05/07,0
很抱歉，飄飄河的設施在其他區域並沒有開放，讓您感到失望。雖然如此，水廁的防蟲紗網設置相當貼心，提供了舒適的使用體驗。整體而言，這次露營並沒有達到您的期待。,3,1,0,1273,,抱歉飄飄河設施區域開放感到失望水廁防蟲紗網設置貼心提供舒適體驗整體而言期待,2023/10/07,0
晚上蚊蟲多，環境清幽，設施尚可，適合親子遊憩。,3,1,0,1287,,晚上蚊蟲環境清幽設施尚可適合親子遊憩,2023/06/07,0
很抱歉，營位區的劃分沒有很明確，導致先來先搭的情況發生，影響了其他露營者的體驗。,3,1,0,1377,,抱歉營位區劃分導致先來先搭情況發生影響體驗,2022/05/07,0
"整體來說還算可以,但營區評價似乎沒有很高,我們兩帳選擇C區,如果4帳可能會稍微擁擠。冬天去時,沒有蚊蟲,只看到一隻小蟑螂,衛浴設備還不錯,但需要自己維持乾淨,因為營主似乎沒有定期清潔。旁邊就是大馬路,有時重機車隊經過會很吵。可能也是因為馬路旁有一隻大野狗,突然闖入我的帳篷。",3,1,0,1382,,整體算營區評價高兩帳選擇C區帳稍微擁擠冬天時蚊蟲一隻蟑螂衛浴設備不錯乾淨因為營主定期清潔旁邊大馬路重機車隊吵因為馬路旁一隻野狗闖入帳篷,2022/05/07,0
這個營地感覺以前應該是很用心經營的，但現在似乎已經荒廢了。可能是因為大家最近都在補班補課，所以我們包場的時候，營區沒有大門，讓人覺得沒什麼安全感。突然會有過路客直接把車開進來，遊蕩在營區裡，甚至還使用廁所。營主只有在收錢的時候才會出現。浴室的水溫也有些不穩定，會忽冷忽熱。整體來說，這個營地的維護狀況還有待加強。,3,1,0,1388,,營地感覺用心經營荒廢因為補班補課包場營區大門沒什麼安全感過路客車開遊蕩營區裡廁所營主收錢浴室水溫穩定忽冷忽熱整體營地維護狀況,2021/05/07,0
"建議要去之前先確認有沒有開放漂漂河,頂區整潔度和維護狀況,這樣花1000元的價格稍嫌昂貴,下雨天排水不佳,還得跟隔壁借草墊。",3,1,0,1410,,建議先確認有沒有開放漂漂河頂區整潔度維護狀況花1000元價格稍嫌昂貴下雨天排水不佳還得隔壁草墊,2020/05/07,0
露營地腹地狹小，帳篷搭好後幾乎沒有活動空間，環境整潔度還算可以。,3,1,0,1412,,露營地腹地狹小帳篷搭好活動空間環境整潔度還算,2020/05/07,0
營地蹲式廁所的清潔度還有待加強，一打開門就能看到一些汙漬，實在不太衛生。,3,1,0,1413,,營地蹲式廁所清潔度打開門汙漬實在不太衛生,2020/05/07,0
D區的營位較小，停車位不太寬敞，我們一行四人都得費一番功夫才能將車停妥，否則就得停到路邊。營區位於道路旁，得多加留意孩子們是否跑到馬路上。若想體驗更寬敞的露營環境，建議可考慮包區的選擇。,3,1,0,1453,,D區的營位停車位不太寬敞一行四人得費功夫將車停妥停到路邊營區位於道路旁得多加留意孩子跑馬路上若想體驗寬敞環境建議包區選擇,2022/10/12,0
C區的排水系統和水壓稍嫌不足，雖然營主熱情友善，衛浴設施也維持乾淨，但水壓不足、排水不良，影響露營體驗。建議營主改善相關設施，提供更舒適的露營環境。,3,1,0,1457,,C區的排水系統水壓稍嫌營主熱情友善衛浴設施乾淨水壓排水不良影響體驗建議營主改善相關設施提供舒適環境,2022/06/27,0
這次的露營體驗雖然還算不錯，但與預期有一些落差，讓人感到有些可惜。,3,1,0,1472,,體驗算不錯預期落差感到可惜,2021/03/03,0
C區的衛浴設備髒亂不堪，到處都是蟑螂爬行，讓人不敢恭維。最令人困擾的是，營主似乎沒有住在營地，導致我們這次的露營體驗被隔壁區的噪音干擾，整夜無法入眠。一群年輕人從晚上10點開始唱卡啦OK，一路唱到半夜12點，實在是令人無法忍受。當我們向營主反映此事時，他卻束手無策，毫無改善的誠意，讓我們對此次露營留下了深深的失望。,3,1,0,1475,,C區的衛浴設備髒亂不堪蟑螂爬行不敢恭維令人困擾營主住營地導致體驗隔壁區的噪音干擾整夜入眠一群年輕人晚上10點唱卡OK一路唱半夜12點實在令人無法忍受營主此事時束手無策改善誠意留下深深失望,2020/08/21,0
整體來說還是值得推薦。雖說在路邊大致來說還不會太吵。,3,1,0,1478,,整體值得推薦路邊太吵,2020/03/04,0
這個營區位於山谷中，夏天的氣溫較為悶熱。廁所的清潔度不佳，顯示沒有得到充分的打掃。整體而言，這個營區的設施與環境並不符合我的期望，因此我不會考慮再次前往。,3,1,0,1479,,營區位於山谷中夏天氣溫為悶熱廁所清潔度不佳顯示打掃整體而言營區設施與環境符合期望前往,2019/12/23,0
B區營位，週六一晚的心得，優點是環境清幽，距離北埔市區近，非常方便補給，不想開伙都沒問題，適合短暫偷閒的輕裝露營。要注意的是，營區照片沒有更新，原本A區旁的鞦韆、水池（球池）、沙坑不知何故消失了，剩下草皮區域，記得自己帶遊具。洗澡時洗到一半沒有熱水，可能是尖峰時段的關係，而且沐浴、洗髮精的按壓試了兩間都有故障出不來。標示2200後安靜，但第一晚隔壁區的喝酒喧鬧到深夜，第二晚有小孩比賽奔跑喧嘩到2230，都未見營主實際出來規勸。,3,1,0,1524,,B區營位週六一晚心得優點環境清幽距離北埔市區補給不想開伙適合短暫偷閒輕裝營區照片更新原本區旁鞦韆水池球池沙坑不知何故消失剩下草皮區域記得帶遊具洗澡時洗一半熱水尖峰時段關係沐浴洗髮精按壓試兩間故障出不來標示2200安靜第一晚隔壁區的喝酒喧鬧深夜晚有小孩比賽奔跑喧嘩2230未見營主規勸,2023/12/07,0
雨天來這裡真的不太合適，整個營區都變成泥濘，尤其是碎石區更是泥巴滿地，整個像水鄉澤國一樣。衛浴沒有乾濕分離，雖然希望至少可以有加蓋的垃圾桶，減少氣味和影響美觀。從衛浴到營地的排水系統應該都需要加強改善。碎石區的大斜坡在雨天非常危險，小孩大人都跌倒好幾次，務必要處理這個問題。,3,1,0,1526,,雨天真的不太合適營區泥濘碎石區更是泥巴滿地水鄉澤國衛浴乾濕分離希望至少加蓋垃圾桶減少氣味影響美觀衛浴營地排水系統改善碎石區的斜坡雨天危險小孩大人跌倒幾次務必,2023/11/07,0
營主人很好，態度親切，但可惜缺少親子浴室的設施。,3,1,0,1574,,營主人態度親切可惜缺少親子浴室設施,2020/05/07,0
這個營區雖然車停入後空間稍嫌不足，但設有良好的遊戲區，深受小朋友喜愛。然而，小黑蚊的問題相當嚴重，整個家庭幾乎都被叮咬，讓人不堪其擾。儘管如此，營區的方便性還是不錯的。,3,1,0,1578,,營區車停入空間稍嫌設有遊戲區深受小朋友喜愛小黑蚊相當嚴重家庭叮咬不堪其擾營區方便性不錯,2020/05/07,0
位於北埔市集附近的這個露營區，規模雖然不大，但路標清晰，交通也相當便利。唯一要注意的是，小黑蚊的數量較多，露營時要做好防護措施。,3,1,0,1581,,位於北埔市集區規模路標清晰交通便利唯一小黑蚊數量時要做好防護措施,2019/05/07,0
這個營地的道路規劃和營位佈局都還不錯，適合中小型的露營團體。設施方面也維持的還蠻乾淨的。,3,1,0,1592,,營地道路規劃營位佈局都還不錯適合中小型團體設施還蠻乾淨,2019/05/07,0
路標不夠明確，導致在叉路口處容易迷路，建議管理單位可以加設清楚的指標，方便遊客導航。,3,1,0,1711,,路標導致叉路口處迷路建議管理單位加設指標遊客導航,2018/03/20,0
這個營區擁擠不說，隔壁區更是吵到不行，讓人難以入眠。營區內的道路狹窄，車子經過時都會刮傷底盤，真是令人頭疼。,3,1,0,1753,,營區擁擠不說隔壁區更是吵到不行難以入眠營區道路狹窄車子時刮傷底盤令人頭疼,2023/11/07,0
