content,rating,type,status,sequence_num,tokenization,text,publishedDate,origin
這個營區位於山谷中，夏天氣溫較高，空氣也比較悶熱。另外，廁所的清潔度不佳，顯示管理上有待加強。不過，整體來說，這裡的露營體驗並不如預期，讓人覺得可惜，之後不會再次造訪。,3,1,0,1479,,營區位於山谷中夏天氣溫高空氣悶熱廁所清潔度不佳顯示管理有待整體體驗預期可惜造訪,2019/12/23,0
B區營位的週六一晚心得，優點包括環境乾淨、靠近北埔市區，方便補給。不開伙也沒問題，適合輕裝露營。要注意的是，營區照片沒有更新，原本的鞦韆、水池、沙坑消失了，只剩下草皮區。洗澡時沒有熱水，可能是尖峰時段的關係。洗髮精的按壓也有故障。標示2200後安靜，但隔壁區的喝酒喧鬧、孩子奔跑到深夜，營主未出面規勸。,3,1,0,1524,,B區營位週六晚心得優點包括環境乾淨靠近北埔市區補給開伙適合輕裝營區照片更新原本鞦韆水池沙坑消失剩下草皮區洗澡時熱水尖峰時段關係洗髮精按壓故障標示2200安靜隔壁區的喝酒喧鬧孩子奔跑深夜營主未出面規勸,2023/12/07,0
雨天來露營真的不太適合，到處都是泥巴，特別是碎石區。衛浴沒有乾濕分離，希望至少能加蓋一個垃圾桶，避免影響環境衛生。從衛浴到營地的排水也需要加強改善。碎石區的大斜坡下雨天非常滑，容易讓大人小孩跌倒，請務必處理這個問題。,3,1,0,1526,,雨天真的不太適合泥巴特別碎石區衛浴乾濕分離希望至少加蓋垃圾桶影響環境衛生衛浴營地排水改善碎石區的斜坡下雨天滑大人小孩跌倒請務必,2023/11/07,0
營主很親切，但缺少親子浴室，實在可惜。,3,1,0,1574,,營主親切缺少親子浴室實在可惜,2020/05/07,0
這個營區雖然空間不大，但車子停進去後就顯得狹窄。裡面有一個遊戲區，很受小朋友歡迎，讓他們玩到不願意離開。可惜的是，小黑蚊實在太多了，讓全家都無一倖免，每個人至少被咬了200包。因為小孩被叮得太慘，只好強拉他們回家，否則他們還不願意離開。總的來說，這個營區方便，但蚊蟲問題比較嚴重。,3,1,0,1578,,營區空間車子停進去顯得狹窄遊戲區很受小朋友玩到離開可惜小黑蚊實在太全家無一倖免至少咬200包因為小孩叮得太慘只好強拉回家還不離開營區蚊蟲比較嚴重,2020/05/07,0
位於北埔市集附近的這個露營區，規模雖然不大，但路標清楚，路況也相當不錯。不過，需要特別留意的是，小黑蚊在這裡頗為猖獗，到時候一定要做好防蚊措施，避免被叮咬。,3,1,0,1581,,位於北埔市集區規模路標路況不錯特別留意小黑蚊為猖獗到時候做好防蚊措施叮咬,2019/05/07,0
車道和場地的規劃還不錯，適合中小型團體露營。設備維護得還算乾淨整潔。,3,1,0,1592,,車道場地規劃不錯適合中小型團體設備維護還算乾淨整潔,2019/05/07,0
路標指示不夠清晰，很容易讓人在進入營地前迷路，影響露營體驗。,3,1,0,1711,,路標指示清晰營地前迷路影響體驗,2018/03/20,0
規劃帳篷太擁擠，感覺像是分租套房。帳篷搭得太密集，幾乎沒有活動空間。浴廁方面還算乾淨，但數量上與比例有些不平衡。,3,1,0,1767,,規劃帳篷太擁擠感覺像是分租套房帳篷搭得太密集活動空間浴廁算乾淨數量比例平衡,2023/05/07,0
營地環境還算不錯，但5帳共用2處電箱和洗菜枱，使用上略顯不足。另外，廁所和浴室雖然乾淨，但屋頂是透光罩，在夏天使用時，裡面就像烤箱一樣，非常熱。廁所前的洗手枱只有一個小小的，不方便使用，也不夠用。,3,1,0,1780,,營地環境算不錯帳共用處電箱洗菜枱略顯廁所浴室乾淨屋頂透光罩夏天時烤箱熱廁所前洗手枱小小的方便使用,2023/05/07,0
"營地腹地雖然不大,但平日只有少量車輛,所以不會覺得擁擠。夕陽風景雖然會被樹木遮擋,但最高營位緊鄰馬路,會有些噪音。環境整理算是乾淨。入住時,營主說車泊不折扣,依露營原價收費,我同意。但隔天要離開時,營主又說露營車不能用電,插電要另外加錢。付一樣的費用,露營車可以用電,但車泊就不能用電?營主對車宿車泊似乎不太友善。車泊車宿的朋友,如果需要入園住宿,請三思而後行……",3,1,0,1787,,營地腹地平日少量車輛擁擠夕陽風景樹木遮擋營位緊鄰馬路噪音環境整理算是乾淨入住時營主說車泊折扣原價收費同意隔天要離開時營主說露營車用電插電要加錢付費用露營車用電車泊用電營主對車宿車泊不太友善車泊車宿朋友入園住宿請三思而後行,2022/05/07,0
風景優美，但浴室的熱水溫度不穩定，時冷時熱，影響使用體驗。,3,1,0,1830,,風景優美浴室熱水溫度穩定時冷時熱影響體驗,2020/05/07,0
霧氣和濕氣重，影響了視野，晾帳篷需要花費不少時間。,3,1,0,1831,,霧氣濕氣重影響視野晾帳篷花費時間,2020/05/07,0
草地不錯，營主人也很好，但晚上的蟲蟲大軍讓人不敢領教。衛浴數量也明顯不足。,3,1,0,1858,,草地不錯營主人晚上蟲蟲大軍領教衛浴數量,2019/05/07,0
老闆對於夏日消暑茶品的提供相當熱心，同時也用心在園區內種植樹木，營造出一個優質的露營環境。,3,1,0,1859,,老闆夏日消暑茶品提供熱心用心園區種植樹木營造優質環境,2019/05/07,0
五月天的露營地，白天中午過後很熱，晚上則涼爽宜人，露水較重，草地和草皮都維護得很好。不過，蚊蟲較多，衛浴間數量偏少，洗澡時經常有人在排隊。建議中午前搭營，隔天早點收拾，避免烈日當頭的煩躁。,3,1,0,1864,,五月天露營地白天中午過後很熱晚上涼爽宜人露水重草地草皮維護蚊蟲衛浴間數量偏少洗澡時有人排隊建議中午前搭營隔天早點收拾烈日煩躁,2019/05/07,0
這裡環境狹窄，水槽共用，衛浴設備不足，雖然整潔，但不太方便。插座位置偏遠，需要拉長線材，活動空間也較為侷限。營本部才有冰箱，露營體驗略顯不足。,3,1,0,1907,,環境狹窄水槽共用衛浴設備整潔太插座位置偏遠拉長線材活動空間為侷限營本部冰箱體驗略顯,2022/04/13,0
營區的空間感覺有點擁擠，附近還有狗狗會來搶奪鞋子。,3,1,0,1942,,營區空間感覺擁擠狗狗會來搶奪鞋子,2020/08/12,0
這次我們訂的是七號草地區，場地狹長且狹小，根本無法容納七頂帳篷。我們向營主反映此問題，卻得到令人無法苟同的回應。,3,1,0,1956,,訂七號草地區場地狹長狹小根本無法容納七頂帳篷營主令人苟同回應,2019/08/03,0
營位略顯狹窄，洗手間數量不足，稍嫌不便。然而，整體環境尚可接受，營主態度和藹可親。,3,1,0,2035,,營位略顯狹窄洗手間數量稍嫌不便整體環境尚可接受營主態度和藹可親,2018/05/01,0
2018年1月1日，我們一家人預訂了A區10帳的露營，但營主卻因訂位系統出錯，擠了3帳給我們。儘管營主態度和善，但拒絕確認訂位訊息，要求我們自行解決。這讓我們感到很不爽，因為我們早在5個月前就預訂了。儘管我們也享受了3天的露營，但希望營主能堅強面對問題，不要再推卸責任了。,3,1,0,2060,,2018年月日一家人預訂區10帳的營主訂位系統出錯擠帳給營主態度和善拒絕確認訂位訊息自行解決這讓感到不爽因為早月前預訂享受天希望營主能堅強面對推卸責任,2018/01/08,0
我們到達營區後，發現營位的位置和網站上標示的不同，且營位的大小也不符合我們所需要的。當我們準備搭設方形天幕時，才發現營位實在太小，根本無法搭設。天幕的尺寸是440*550，然而營區網站上標示的營位尺寸卻是5*5。這讓我們感到相當失望和不滿意。希望營區能夠改善這些問題，給予旅客更好的露營體驗。,3,1,0,2116,,到達營區發現營位位置網站標示營位大小符合搭設方形天幕時發現營位實在太小根本無法搭設天幕尺寸440550營區網站標示營位尺寸卻是這讓感到失望滿意希望營區改善給予旅客更好體驗,2017/07/14,0
蟲子很多，洗澡時浴室水壓不穩，常常身上冒出小水泡。沒有飲用水供應，得自備。上山的路又陡又彎，開車上去相當費力。進入營區後還要再走二十分鐘才到達指定營位。G區只有G1區有美景，但夜景不是宜蘭市的景緻。考慮到價格一千塊，應該可以找到更好的露營地。,3,1,0,2175,,蟲子洗澡時浴室水壓穩身上冒出水泡飲用水供應自備上山路陡彎開車費力營區走二十分鐘到達指定營位G區G1區有美景夜景宜蘭市景緻價格一千塊找到更好露營地,2023/05/07,0
20220429-0501這次住草地第G區，下了整個周末的雨，到達時因為下雨起霧，整個營區只有廁所和浴室前的一盞小燈，非常黑暗，再加上營區的排水不佳，到處都是大大小小的水坑，搭帳的難度大幅提升。由於下雨和起霧，也沒看到任何風景。總結：以後不會再來宜蘭露營了。,3,1,0,2176,,202204290501住草地G區周末雨到達時因為下雨起霧營區廁所浴室前一盞小燈黑暗營區排水不佳大大小小水坑搭帳難度大幅提升下雨起霧風景再來宜蘭,2023/05/07,0
廁所數量不足，使用時經常需要排隊，影響了旅遊體驗。,3,1,0,2222,,廁所數量時排隊影響旅遊體驗,2020/05/07,0
這次的露營體驗還算不錯，景色優美，尤其是未開放的G區，可以欣賞到龜山島和蘭陽平原的夜景，晚上若關燈，還可以看到滿天星空，甚至有機會看到銀河。滑草區讓小朋友玩得超開心，中間的草皮非常適合遊戲，玩沙的地方也有遮陽區，玩水也在旁邊，相當方便。不過水池邊緣較高，沒有可以上下處，需要注意安全。天氣較涼爽，管理員人很好，熱心幫助。廁所和衛浴都打掃得很乾淨，但若營區帳數多，衛浴可能會不夠用，冷熱水控制也不是很好，但有提供水桶。這次沒有遇到小黑蚊，但蒼蠅很多，需要多加留意。,3,1,0,2225,,體驗算不錯景色優美未開放G區欣賞龜山島蘭陽平原夜景晚上關燈滿天星空機會銀河滑草區小朋友玩得超開心草皮非常適合遊戲玩沙地方遮陽區玩水旁邊水池邊緣高處注意安全天氣涼爽管理員熱心廁所衛浴打掃乾淨營區帳數多衛浴冷熱水控制提供水桶小黑蚊蒼蠅多加留意,2020/05/07,0
很抱歉聽到您在這個營區的不愉快經驗。營區內宿客素質參差不齊，影響到其他人的休息時間，浴廁清潔維護不佳，熱水供應不穩定，讓人覺得無法放鬆。來此露營可能需要一些運氣，才能有個愉快的體驗。,3,1,0,2229,,抱歉聽到營區愉快經驗營區內宿客素質參差不齊影響其他人休息時間浴廁清潔維護不佳熱水供應穩定放鬆來此運氣有個愉快體驗,2020/05/07,0
營地雖然不大，但海拔夠高，夜晚天氣好時可以欣賞星空美景。然而，在炎熱的天氣下，大白天上山露營並不理想，因為沒有遮蔽物可以避暑。幸運的是，水電設施完善，提供了基本的生活需求。,3,1,0,2236,,營地海拔夠高夜晚天氣好時欣賞星空美景炎熱天氣大白天上山理想因為遮蔽物避暑幸運水電設施完善提供生活需求,2019/05/07,0
G區夜景美不勝收，但衛浴設施略顯老舊，需要加強清潔和維護，希望管理單位能夠改善環境衛生。,3,1,0,2244,,G區夜景美不勝收衛浴設施略顯老舊清潔維護希望管理單位改善環境衛生,2019/05/07,0
生日去那裡露營，從台七甲上山的路段完全沒路燈，夜衝的朋友要注意行車安全。營區的蚊蟲真的很多，沒有飲水機，入住的朋友要自備水源。露營樂上面的照片可能已經是很久以前的了，一帳1000元的價格，還有許多其他更好的露營選擇。,3,1,0,2278,,生日台七甲上山路段路燈夜衝朋友行車營區蚊蟲真的飲水機入住朋友自備水源樂照片很久以前一帳1000元價格更好選擇,2022/12/08,0
G區營位白天和晚上的風景真的很美，帶給人完全不同的感受。然而，G區的草皮營位草長到膝蓋了，環境顯得有些久未整理的樣子。時不時會有虎頭蜂飛來飛去，讓人有些擔憂。儘管如此，營位提供了衛浴設備、冰箱和冷凍櫃，使用起來相當方便。洗澡間和廁所分開，衛浴清潔度較差。總體而言，G區的風景是最大的賣點，可以欣賞到夜景和龜山島的美景。,3,1,0,2281,,G區營位白天晚上風景真的美帶給感受G區的草皮營位草長膝蓋環境顯得久未整理樣子時不時虎頭蜂飛來飛去擔憂營位提供衛浴設備冰箱冷凍櫃洗澡間廁所分開衛浴清潔度較差總體而言G區的風景賣點欣賞夜景龜山島美景,2022/08/01,0
下雨天，營地雖然不如預期乾淨，但孩子們還是玩得很開心，雨天的露營體驗給他們留下了難忘的回憶。,3,1,0,2285,,下雨天營地預期乾淨孩子玩得開心雨天體驗留下難忘回憶,2022/04/08,0
環境沒有整理乾淨，設施也不太好。,3,1,0,2288,,環境整理乾淨設施不太好,2021/11/22,0
第二次來到G區露營，帳位空間狹小，營地規劃不佳。G區的營位上停滿車輛，公共區域受限，帳篷前方停著其他人的車。儘管營地收費高達18帳，但衛浴只有2間，廁所僅4間，洗澡水溫忽冷忽熱。提供的冰箱不冷，食材容易腐敗，洗食物須在廁所區域進行，非常不方便。當天晚上跳電多達5、6次，早上5:30也跳電！夏天若沒有電扇，直接起床收帳。唯一的優點是風景優美，夜晚睡覺時很涼爽。強烈建議不要訂G區！,3,1,0,2303,,第二次來到G區帳位空間狹小營地規劃不佳G區的營位停滿車輛公共區域受限帳篷前方停著其他人的車營地收費高達18帳衛浴間廁所間洗澡水溫忽冷忽熱提供冰箱不冷食材腐敗洗食物須在廁所區域當天晚上跳電多達次早上30跳電夏天電扇起床收帳唯一優點風景優美夜晚睡覺時涼爽強烈建議訂G區,2020/06/29,0
護草墊的數量明顯不足，導致許多地方裸露，影響整體的露營體驗。營區間的階梯也顯得破損不堪，行走時容易絆倒，安全性堪憂。衛浴空間內的蚊蟲問題也相當嚴重，使用衛浴時總是被叮咬不已，實在令人無法忍受。,3,1,0,2311,,護草墊數量導致地方裸露影響整體體驗營區間階梯顯得破損不堪行走時絆倒安全性堪憂衛浴空間蚊蟲相當嚴重衛浴時叮咬實在令人無法忍受,2020/02/22,0
還有一些進步空間。雖然連假期間人潮眾多，但營地的設備明顯不足以應付滿帳的需求。冰箱髒污的問題也讓人感到不太理想。建議可以增設冷藏式分離冰箱，以改善用餐環境。,3,1,0,2315,,空間連假期間人潮眾多營地設備不足以應付滿帳需求冰箱髒污感到不太理想建議增設冷藏式分離冰箱改善用餐環境,2019/07/17,0
"1.營位距離車道太近（D和F區），對小孩來說不安全。
2.浴室熱水會忽冷忽熱。
3.不知是冷藏還是冷凍庫？冷度不夠冷。
4.此次露營不巧遇到有夫妻（喝醉）在吵架，半夜長時間的大聲爭吵吵醒了不少露友，希望營區夜間還是可以有管理員或是營主在場，有任何問題發生時才能即時處理。",3,1,0,2368,,"營位距離車道太近DF區小孩
浴室熱水忽冷忽熱
不知冷藏冷凍庫冷度冷
夫妻喝醉吵架半夜長時間大聲爭吵吵醒露友希望營區夜間管理員營主在場發生時即時",2018/04/09,0
元旦連假下雨，讓整體露營體驗大打折扣。營地上層區域的規劃顯然有待加強，衛浴設施也僅能算是普通。與去年相比，整體感受明顯下滑。,3,1,0,2377,,元旦連假下雨整體體驗大打折扣營地上層區域規劃有待衛浴設施僅能算是去年相比整體感受下滑,2018/02/12,0
天氣不佳，美景無緣一睹，期待下次再訪。沙坑區的遮雨棚破損，影響孩童遊玩，建議盡速維修。營位的洗手檯髒汙，卡有黑垢，令人不悅。,3,1,0,2379,,天氣不佳美景無緣一睹期待下次再訪沙坑區的遮雨棚破損影響孩童遊玩建議盡速維修營位洗手檯髒汙卡有黑垢令人不悅,2018/01/05,0
營主熱情且待人親切，營地環境不錯，整體氛圍不錯。,3,1,0,2452,,營主熱情待人親切營地環境不錯整體氛圍不錯,2016/12/30,0
這個營地的環境整潔度很高，草地的維護也做得很好，營地的整體環境給人一種舒適愜意的感覺。,3,1,0,2528,,營地環境整潔度高草地維護做營地整體環境給人一種舒適愜意感覺,2021/05/07,0
週五夜衝的露營經驗不太理想。營主晚歸，冰箱也要等到他們回家才能使用，導致我們的主食雞肉不幸腐壞。但值得一提的是，衛浴設施非常乾淨，營主也經常維護公共區域的清潔。,3,1,0,2542,,週五夜衝經驗不太理想營主晚歸冰箱回家導致主食雞肉不幸腐壞值得一提的是衛浴設施乾淨營主維護公共區域清潔,2021/05/07,0
營地平整乾淨，衛浴設施維持清潔，景觀俯瞰美麗山景。距離瀑布約40分鐘車程，相當便利。,3,1,0,2549,,營地平整乾淨衛浴設施清潔景觀俯瞰美麗山景距離瀑布約40分鐘車程便利,2020/05/07,0
這個露營地離瀑布很近，溪水清澈見底，還有平坦的小池塘，非常適合小朋友玩水。整體環境優美，蟲鳴鳥叫不斷，讓人感受到與大自然的親密接觸。唯一的缺點是營區內的螞蟻比較多，但這並不影響我對這個露營地的整體評價。,3,1,0,2550,,露營地瀑布很近溪水清澈見底平坦池塘非常適合小朋友玩水整體環境優美蟲鳴鳥叫感受大自然親密接觸唯一缺點營區螞蟻這並影響露營地整體評價,2020/05/07,0
這個露營地雖然名為天然，但卻是蟲兒滿天飛，夜晚更是各種昆蟲齊出，害怕蟲子的人最好三思。空氣清新，但卻少了山景的美。幸好營主非常辛勤，還會收垃圾並清潔浴室。,3,1,0,2582,,露營地名為天然卻是蟲兒滿天飛夜晚更是昆蟲害怕蟲子三思空氣清新少山景美幸好營主辛勤還會收垃圾清潔浴室,2022/12/08,0
環境不錯，營主用心維護品質，但出入口道路狀況差，造成底盤刮傷，泳池磁磚也需要改善，小朋友被劃傷，營主提供保險，算盡責了。,3,1,0,2746,,環境不錯營主用心維護品質出入口道路狀況差底盤刮傷泳池磁磚改善小朋友劃傷營主提供算盡責,2023/05/07,0
沒有飲水機、沐浴用品，必須自備，景色普通，附近有農地，蒼蠅多，上山道路小且路況差，底盤低不推薦前往，會車困難，個人不推薦。,3,1,0,2787,,飲水機沐浴用品自備景色農地蒼蠅上山道路小且路況差底盤低推薦前往車困難推薦,2021/05/07,0
"這個露營地的營區時間是早上10點才開門,提早到會打擾到營主,真不好意思。",3,1,0,2793,,露營地營區時間早上10點才開門提早到打擾到營主真不好意思,2021/05/07,0
這裡到洗澡堂的距離有點遠，需要多花點時間走路。,3,1,0,2797,,洗澡堂距離遠花點時間走路,2021/05/07,0
這個露營地非常新，環境清幽，空氣清新，適合來這裡度過愉快的時光。,3,1,0,2801,,露營地新環境清幽空氣清新適合度過愉快時光,2021/05/07,0
基本設施尚可，但傍晚到隔天不斷傳來陣陣蜜蜂的臭味，相當令人困擾。蜜蜂不斷圍繞在周遭，讓人感到相當不舒服。這是我在各個營地中，第一次遇到蜜蜂如此密集且黏著人的情況，實在是令人困擾。,3,1,0,2812,,設施尚可傍晚隔天傳來陣陣蜜蜂臭味令人困擾蜜蜂圍繞周遭感到舒服這是營地中第一次蜜蜂密集黏著情況實在令人困擾,2020/05/07,0
營地規定明確禁止使用卡啦OK，但不論如何，同時有兩組人在營地大聲播放音樂，真是破壞了在山上露營時享受大自然的寧靜。雖然營地的廁所和環境都維持得很乾淨整潔，但這樣的噪音確實扣了一星的評價。,3,1,0,2834,,營地禁止卡OK不論如何兩組營地大聲播放音樂破壞山上時享受大自然寧靜營地廁所環境乾淨整潔噪音確實扣一星評價,2019/05/07,0
"這個露營地點環境還算不錯,周邊開發得比較多,但視野還是相當開闊,值得一去。",3,1,0,2842,,地點環境算不錯周邊開發視野開闊值得一去,2018/05/07,0
營地的設施很完善，尤其是地下噴水池，讓孩子們玩得不亦樂乎。營主也很熱情，樂於提供幫助，讓我們度過了一個愉快的露營體驗。,3,1,0,2855,,營地設施完善地下噴水池孩子玩營主熱情樂於提供度過愉快體驗,2023/02/16,0
第一區營地的景色確實很美麗，但兩隻雞不停地叫了24小時，實在是太吵了。更令人不滿的是，10月二露六區雞消失了，取而代之的是貓。結果浴室的熱水器異常，洗澡一半時還會有瓦斯味，最後連水溫都變冷了。整體體驗只能給三星。,3,1,0,3000,,第一區營地景色確實美麗兩隻雞不停24小時實在太吵令人10月二露六區雞消失取而代之是貓浴室熱水器異常洗澡半時還會瓦斯味水溫變冷整體體驗只能三星,2022/05/07,0
個人比較無法接受廁所和浴室是合在一起的。感覺有點老舊，蟲子也很多，還有點味道。其他地方的風景和草地都很不錯。,3,1,0,3008,,接受廁所浴室合在一起感覺老舊蟲子味道地方風景草地不錯,2021/05/07,0
露營遇到吵鬧的鄰居，雖然是運氣的一面，但營主應該適時制止，尤其是半夜兩點才終於停止，影響到其他人的休息。雖然營主很熱心、和藹可親，但整體露營體驗還是略顯不足。廁所和浴室的設施算是可以接受。,3,1,0,3011,,吵鬧鄰居運氣營主適時制止半夜兩點終於停止影響其他人休息營主熱心和藹可親整體體驗略顯廁所浴室設施算是接受,2021/05/07,0
櫻花盛開時美不勝收，微風吹過更是浪漫無比。不過，廁所數量不足，多人同時使用時容易忽冷忽熱，電力供應也略嫌不足，兩台吹風機使用就可能跳電。,3,1,0,3014,,櫻花盛開時美不勝收微風吹過更是浪漫無比廁所數量多人時忽冷忽熱電力供應略嫌兩台吹風機跳電,2021/05/07,0
天湖露營區的場地雖然不大，但環境清幽，適合想要遠離塵囂的露營者。設施雖然簡單，但提供基本的需求。推薦給想要體驗慢活的朋友。,3,1,0,3018,,天湖區的場地環境清幽適合想要遠離塵囂設施簡單提供需求推薦想要體驗慢活朋友,2021/05/07,0
營地的營位劃分還算寬敞，然而廁所沒有封頂，晚上廁所裡的昆蟲飛來飛去，小朋友在使用廁所或洗澡時會感到害怕。此外，冰箱設置在營本部內，營主不在或休息時間就會上鎖，這對攜帶食材露營的朋友來說略顯不便。,3,1,0,3036,,營地營位劃分算寬敞廁所封頂晚上廁所裡的昆蟲飛來飛去小朋友廁所洗澡時感到害怕冰箱設置在營本部營主不在休息時間上鎖這對攜帶食材朋友略顯不便,2021/05/07,0
這個時間點4區樹少太陽下很熱，山景還不錯，但設施略嫌不足，尤其是沒有花季的話會有些無聊，收錢才看到營主。,3,1,0,3052,,時間點區樹少太陽很熱山景不錯設施略嫌花季無聊收錢營主,2020/05/07,0
2區包區的設施不太理想，頻繁跳電且超過8次，顯示電力供應不穩定。全區供電30安培，卻仍然發生跳電，可能與電力負荷有關。廁所衛生條件需要改善，建議管理單位加強維護與清潔工作。,3,1,0,3064,,區包區設施不太理想頻繁跳電且超過次顯示電力供應穩定全區供電30安培發生跳電電力負荷廁所衛生條件改善建議管理單位維護清潔工作,2019/05/07,0
2015年和朋友一起去的這個營區，算是比較貼近大自然的那種營地。那時候的衛浴設施是共用熱水器，所以水溫會看隔壁是否有人在使用而定。晚上還有提供搗麻糬，現場吃的非常美味。,3,1,0,3077,,2015年朋友營區算是貼近大自然那種營地衛浴設施共用熱水器水溫隔壁有人而定晚上提供搗麻糬現場吃美味,2019/05/07,0
夜景美麗，但衛浴設備略顯陽春,3,1,0,3096,,夜景美麗衛浴設備略顯陽春,2018/05/07,0
櫻花盛開時，營區應該會很美。帳篷前被樹木遮蔽，無法直接欣賞到山景，稍嫌可惜。廁所狀況尚可，水溫有些不穩定。不過，幸運的是，這次遇到好露友，與我兒子玩得很開心，希望沒有給他們帶來太多困擾。,3,1,0,3111,,櫻花盛開時營區美帳篷前樹木遮蔽欣賞山景稍嫌可惜廁所狀況尚可水溫穩定幸運好露友兒子玩得開心希望帶來太困擾,2022/01/23,0
在第8區搭帳篷，離營區有段距離，到廁所得走一段稍微陡峭的小路，比較不方便。廁所的天花板沒有封起來，蚊蟲很多。,3,1,0,3125,,區搭帳篷營區段距離廁所走一段稍微陡峭小路廁所天花板封蚊蟲,2020/12/14,0
這個營地的衛浴設施不多，且簡陋不起眼。,3,1,0,3141,,營地衛浴設施簡陋不起眼,2019/09/20,0
