content,rating,type,status,sequence_num,tokenization,text,publishedDate,origin
營位稍嫌狹窄，洗手間數量不足，使用上較為不便。衛浴設備明顯不足，影響到整體的體驗。幸好營主態度親切，服務周到。,3,1,0,2035,,營位稍嫌狹窄洗手間數量為不便衛浴設備影響整體體驗幸好營主態度親切服務周到,2018/05/01,0
"2018-2/24-25包A區10帳, 營主說是app訂位系統出錯, 多擠三帳, 但不願確認對方app訂位訊息, 雖然只有一夜, 但我們五個多月前的預訂是算什麼？ 其實很不爽雖然我們也自得其樂了三天（不然要我們怎麼想）希望下次營主要有主見, 不要再說是誰的問題了, 該解決問題就要堅強解決",3,1,0,2060,,20182425包區10帳營主說app訂位系統出錯多擠三帳不願確認app訂位訊息一夜五個多月前預訂算不爽自得其樂三天想希望下次營主見解決問題堅強解決,2018/01/08,0
蟲蟲很多，洗澡時容易身上出現紅色斑點。沒有水源，沒有提供飲用水。上山的路不好開，標誌指示轉進去還要二十五分鐘。G區只有g1有景觀，但夜景不是宜蘭市區的夜景。覺得不值得再造訪了，花一千塊錢可以去的地方很多。,3,1,0,2175,,蟲蟲洗澡時身上紅色斑點水源提供飲用水上山路不好開標誌指示轉進二十五分鐘G區g1景觀夜景宜蘭市區夜景值得造訪花一千塊錢地方,2023/05/07,0
20220429-0501這次住草地第G區，天氣不佳，整個周末都下雨，到達時因為雨勢過大，起了濃霧，整個營區只有廁所和浴室前方的一盞小燈，非常黑暗，再加上營地的排水系統不良，到處都是大小不一的水坑，搭建帳篷的難度大幅增加。由於濃霧的關係，無法欣賞到美麗的風景。總結來說，這次的露營體驗非常糟糕，未來不會再來宜蘭露營了。,3,1,0,2176,,202204290501住草地G區天氣不佳周末下雨到達時因為雨勢過大濃霧營區廁所浴室前方一盞小燈黑暗營地排水系統不良大小不一水坑搭建帳篷難度大幅增加濃霧關係欣賞美麗風景體驗糟糕未來再來宜蘭,2023/05/07,0
廁所數量不足，需要排隊使用相當不便。,3,1,0,2222,,廁所數量排隊不便,2020/05/07,0
景色宜人，未開放的G區可欣賞龜山島和蘭陽平原的夜景，晚上關燈後滿天星斗，若運氣好還能看到銀河。滑草區讓小朋友玩得不亦樂乎，中間的草皮適合遊戲，玩沙也有遮陽區，玩水也在旁邊。然而，水池邊緣較高，沒有可以上下處，需注意天氣涼爽。管理員人很好，熱心服務。廁所和衛浴打掃得很乾淨，但若營區帳數多，浴廁可能不夠用。冷熱水控制不易，有提供水桶。雖然沒有小黑蚊，但這次遇到很多蒼蠅。,3,1,0,2225,,景色宜人未開放G區可欣賞龜山島蘭陽平原夜景晚上關燈滿天星斗運氣還能銀河滑草區小朋友玩得草皮適合遊戲玩沙遮陽區玩水旁邊水池邊緣高處需注意天氣涼爽管理員熱心服務廁所衛浴打掃乾淨營區帳數多浴廁冷熱水控制不易提供水桶小黑蚊蒼蠅,2020/05/07,0
這次的露營經驗並不理想，營區內的遊客素質普遍較差，學生群聚開趴到半夜，影響到其他人的休息，同時老人們也在清晨五點開始聊天，使用浴廁時也發現清潔維護情況不佳。另外，熱水的供應也不穩定，來此露營可能需要一點運氣。,3,1,0,2229,,經驗理想營區遊客素質較差學生群聚開趴到半夜影響其他人休息清晨五點聊天浴廁時發現清潔維護情況不佳熱水供應穩定來此一點運氣,2020/05/07,0
這個營地雖然不大，但海拔卻相當高，在夜晚的時候，天氣好的時候可以欣賞到美麗的星空，天氣炎熱時不建議在中午前後上山露營，因為沒有遮蔽物可以擋住太陽，水電設施還算完善。,3,1,0,2236,,營地海拔高夜晚天氣欣賞美麗星空天氣炎熱時建議中午上山因為遮蔽物擋住太陽水電設施算完善,2019/05/07,0
G區的夜景美不勝收，但衛浴設施有待改善，希望管理單位能夠加強環境衛生，提供更好的露營體驗。,3,1,0,2244,,G區的夜景美不勝收衛浴設施有待改善希望管理單位環境衛生提供更好體驗,2019/05/07,0
"生日去那裡露營,從台七甲轉進去的路段很暗,沒有路燈,開車上山要特別小心。營區裡的蚊蟲非常多,也沒有飲水機,住宿的朋友要注意。露營樂網站上放的照片應該是很久以前的了,一帳的價錢1000元,有更好的選擇。",3,1,0,2278,,生日台七甲轉進路段很暗路燈開車上山特別小心營區裡的蚊蟲飲水機住宿朋友樂網站上放照片很久以前一帳價錢1000元更好選擇,2022/12/08,0
G區營位的景色在白天和晚上都非常美麗，帶給人不同的感受。然而，G區的草皮營位草長得非常高，環境顯得有些久未整理。時不時還會有虎頭蜂飛來飛去。雖然營位設有衛浴設備、冰箱和冷凍櫃，位置相當方便，但洗澡間和廁所分開，衛生狀況較不理想。儘管如此，風景是這個營地最大的特色，尤其是G區，可以欣賞到夜景和龜山島的美景。,3,1,0,2281,,G區營位景色白天晚上美麗帶給感受G區的草皮營位草長高環境顯得久未整理時不時還會虎頭蜂飛來飛去營位設有衛浴設備冰箱冷凍櫃位置洗澡間廁所分開衛生狀況理想風景營地特色G區欣賞夜景龜山島美景,2022/08/01,0
下雨天，地面雖然濕滑，但孩子們仍舊玩得不亦樂乎，開心地笑著，讓人看了也感到十分欣慰。,3,1,0,2285,,下雨天地面濕滑孩子玩得開心地笑著感到欣慰,2022/04/08,0
這個露營地的環境維護不佳，雜亂無章，設備也比較老舊，使用起來並不太舒適。,3,1,0,2288,,露營地環境維護不佳雜亂無章設備老舊並不太舒適,2021/11/22,0
我第一次來這個露營區，訂的帳位很小，營地規劃也很糟糕。G區的營地車子亂停，公共空間受限，帳蓬前面還停著別人的車。營地只收18帳位，但只有2間衛浴和4間廁所，洗澡水的溫度忽冷忽熱。提供的兩台冰箱都很不冷，食材很容易酸掉，洗食材的地方也在廁所區，非常不方便。晚上電力跳電好幾次，甚至早上5點30分也跳電。夏天沒電扇吹，直接起床收帳。唯一的優點是風景真的很不錯，晚上睡覺很涼！千萬不要訂G區！,3,1,0,2303,,第一次區訂帳位很小營地規劃糟糕G區的營地車子亂停公共空間受限帳蓬還停著的車營地只收18帳位間衛浴間廁所洗澡水溫度忽冷忽熱提供兩台冰箱冷食材酸掉洗食材地方廁所區晚上電力跳電好幾次早上點30分跳電夏天電扇吹起床收帳唯一優點風景真的不錯晚上睡覺很涼訂G區,2020/06/29,0
很抱歉，這次的評論內容並不符合生成相似內容的條件。由於評論中提及的問題涉及露營地的設施維護和管理，因此需要具體的評論內容才能生成相似的句子。請您提供更多細節或具體的露營評論，我會盡力生成類似的露營評論。,3,1,0,2311,,抱歉評論內容符合生成內容條件評論中提及涉及露營地設施維護管理評論內容生成句子請提供細節評論我會盡力生成類似評論,2020/02/22,0
連假前往即使下著雨，營地依然一位難求，顯示出設備或許不足以應付滿帳的情況。此外，冰箱的清潔度有些問題，希望能增加冷藏式與冷凍式分離的冰箱。,3,1,0,2315,,連假前往下著雨營地依然一位難求顯示設備不足以應付滿帳情況冰箱清潔度希望增加冷藏式冷凍式分離冰箱,2019/07/17,0
抱歉，元旦下雨讓我很不舒服。上層區域的規劃不如預期，浴廁的品質普通，跟去年來相比，感受明顯不同。,3,1,0,2377,,抱歉元旦下雨舒服上層區域規劃預期浴廁品質年來相比感受,2018/02/12,0
這個營地的營主很熱情，待人接物親切，讓人感到賓至如歸。營地環境整潔，設施完善，適合露營。,3,1,0,2452,,營地營主熱情待人接物親切感到賓至如歸營地環境整潔設施完善適合,2016/12/30,0
這裡的環境維護得相當乾淨，草地也經常修剪，給人一種整潔舒適的感覺。,3,1,0,2528,,環境維護乾淨草地修剪給人一種整潔舒適感覺,2021/05/07,0
週五的夜衝不太推薦，因為營主大半夜才會到家，冰箱也要等到營主回來才能使用，導致我們的主食雞肉隔天就壞了。雖然衛浴設備很乾淨，營主也很勤於維護公共區域的清潔，但這次的經驗並不理想。,3,1,0,2542,,週五夜衝太推薦因為營主大半夜家冰箱營主回來導致主食雞肉隔天壞衛浴設備乾淨營主勤於維護公共區域清潔經驗理想,2021/05/07,0
整潔的營地，衛浴設施維持清潔，景色尚可。前往瀑布需時約40分鐘。,3,1,0,2549,,整潔營地衛浴設施清潔景色尚可前往瀑布需時約40分鐘,2020/05/07,0
這個露營地非常適合喜愛大自然的人，蟲鳴鳥叫讓人身心放鬆，瀑布和溪水就在附近，清涼的溪水和平坦的小池讓小朋友玩水時很安心。整體來說，這個營區環境很棒，只是螞蟻稍微多了一點。,3,1,0,2550,,露營地非常適合喜愛大自然蟲鳴鳥叫身心放鬆瀑布溪水清涼溪水平坦小池小朋友玩水時安心整體營區環境很棒螞蟻稍微一點,2020/05/07,0
這個露營地非常自然，周圍環境原始。如同網路上所說的，毛蟲非常多，夜間可能會有昆蟲出沒，對怕蟲的人來說要三思。空氣清新，但周圍景色並不美麗。營主非常辛勤，會定期收取垃圾並清潔浴室。,3,1,0,2582,,露營地自然周圍環境原始網路上所說毛蟲夜間昆蟲出沒對怕蟲三思空氣清新景色美麗營主辛勤定期收取垃圾清潔浴室,2022/12/08,0
很抱歉，根據您提供的評論內容，我無法生成相似的露營評論。,3,1,0,2622,,抱歉提供評論內容生成評論,2019/08/20,0
環境不錯，營主有用心在顧品質，可惜出入口道路狀況不佳，底盤被刮了好幾條，泳池磁磚需要改善，小朋友被磁磚劃傷，營主有提供保險，算是盡責了。,3,1,0,2746,,環境不錯營主有用心顧品質可惜出入口道路狀況不佳底盤刮好幾條泳池磁磚改善小朋友磁磚劃傷營主有提供算是盡責,2023/05/07,0
上山的路窄又崎嶇，車子底盤低的話不太適合，會車也很困難。周圍的農地蚊蟲多，景色也普通。沒有飲水機和沐浴用品，得自己準備。整體來說，個人不太推薦。,3,1,0,2787,,上山路窄崎嶇車子底盤低不太適合會車困難農地蚊蟲景色飲水機沐浴用品整體不太推薦,2021/05/07,0
提醒大家，營區的開門時間是早上10點，不需要太早到達，以免打擾到營主的作息，造成不必要的困擾。,3,1,0,2793,,提醒營區開門時間早上10點太早到達打擾到營主作息不必要困擾,2021/05/07,0
草地區到洗澡堂的距離有點遠，需要多花些時間和體力才能抵達。,3,1,0,2797,,草地區洗澡堂距離遠多花些時間體力抵達,2021/05/07,0
這個露營區的環境非常清新，空氣也十分清新，適合來這裡野營。,3,1,0,2801,,區的環境清新空氣清新適合野營,2021/05/07,0
"基本設施還算可以,但傍晚到隔天早上卻一直飄著陣陣蜜蜂排泄物的惡臭,實在是有些令人受不了。更令人困擾的是,這些蜜蜂會不斷地在你周圍徘徊,讓人感到相當不舒服。雖然之前也遇過一些蟲很多的營地,但這些蜜蜂的騷擾程度卻是前所未有的,讓人感到相當困擾。",3,1,0,2812,,設施算傍晚隔天早上飄著陣陣蜜蜂排泄物惡臭實在令人受不了令人困擾蜜蜂徘徊感到舒服遇過蟲營地蜜蜂騷擾程度卻是前所未有感到困擾,2020/05/07,0
營地明文規定禁止使用卡啦OK，但現在卻有兩組人同時使用，讓整個營地充斥著噪音，與期待在山上享受寧靜的藍天白雲和清新的空氣相去甚遠，實在令人失望，扣一星。然而，廁所整潔，營地維持良好，仍然是個不錯的露營地。,3,1,0,2834,,營地明文規定禁止卡OK兩組營地充斥著噪音期待山上享受寧靜藍天白雲清新空氣相去甚遠實在令人失望扣一星廁所整潔營地不錯露營地,2019/05/07,0
這個營地環境還不錯，只是周邊已經開發得差不多了，景觀雖然還算開闊，但感覺有點被住宅區和商業區包圍，還是有些可惜。,3,1,0,2842,,營地環境不錯周邊開發景觀算開闊感覺住宅區商業區包圍可惜,2018/05/07,0
營主熱情好客，特別準備了地下噴水池，讓孩子們盡情玩樂，度過了一個愉快的露營時光。,3,1,0,2855,,營主熱情好客特別地下噴水池孩子盡情玩樂度過愉快時光,2023/02/16,0
路程：前往白蘭部落的路都還算好開，但營區內的路比較陡峭，需要小心駕駛。冰箱：冰箱只有冷藏區，沒有冷凍區，而且冰箱只有在營本部，取用東西要走一段路。浴廁區：四區、六區兩區的浴室和廁所在同一間，沒有乾濕分離，水泥地板因長期潮濕有些微青苔。以分區這麼多帳來說，如果大家都在熱門時段使用，廁所和浴室可能不夠用。浴室使用瓦斯，同行友人沖水時熱水突然中斷，還要換間使用，幸好隔壁間沒有人。熱水的控制非常有問題，一不小心就會著涼，而且浴室沒有加裝紗窗，隔間內常有蟲子。最後必須說，唯一的小便斗漏水，使用上感受不佳。營位：營位很大，使用空間充足，土質也很好。然而，營地有些地方有些傾斜，桌子或床位可能使用上都會受到影響。供電：這次使用時突然跳電，其他區也都無法用電，營主來維修後才恢復供電，我們因為用電少不太受影響，但其他區的使用者就不知道了。,3,1,0,2964,,路程前往白蘭部落路還算開營區路陡峭小心駕駛冰箱冰箱冷藏區冷凍區冰箱在營本部取用東西走一段路浴廁區四區六區兩區浴室廁所間乾濕分離水泥地板長期潮濕微青苔分區多帳熱門時段廁所浴室浴室瓦斯同行友人沖水時熱水中斷換間幸好隔壁間熱水控制一不小心就會著涼浴室加裝紗窗隔間常有蟲子說唯一小便斗漏水感受不佳營位營位很大空間充足土質營地地方傾斜桌子床位影響供電時跳電區也用電營主來維修恢復供電因為用電少不太受影響區的使用者,2024/01/07,0
第一區營地的景色確實很美麗，但兩隻雞不斷輪流叫了24小時，實在是太吵了。更令人不滿的是，浴室的熱水器異常，洗了一半的澡突然變冷水，還有瓦斯味。這次的露營體驗只能給三星。,3,1,0,3000,,第一區營地景色確實美麗兩隻雞輪流24小時實在太吵令人浴室熱水器異常洗一半澡變冷水瓦斯味體驗只能三星,2022/05/07,0
這次的露營經驗雖然還算平常，但營區內的噪音問題讓人難以放鬆。儘管營主態度友善，仍無法有效制止吵鬧的聲音持續到半夜，影響了整體的露營體驗。廁所和浴室的設施也只能算是勉強足夠。總體來說，這次的露營感受偏向普通。,3,1,0,3011,,經驗算平常營區噪音難以放鬆營主態度友善制止吵鬧聲音持續半夜影響整體體驗廁所浴室設施只能算是勉強足夠總體感受偏向,2021/05/07,0
櫻花盛開時的景色美不勝收，微風吹過時，更是浪漫至極。不過，露營區的衛浴設施稍嫌不足，當多人同時使用時，水溫忽冷忽熱，令人難以忍受。此外，電力供應也有些不足，兩台吹風機就可能造成跳電，希望管理單位能夠改善這些問題。,3,1,0,3014,,櫻花盛開時景色美不勝收微風吹過時更是浪漫至極區的衛浴設施稍嫌當多人時水溫忽冷忽熱令人難以忍受電力供應兩台吹風機跳電希望管理單位改善,2021/05/07,0
天湖露營區的場地雖然不是很大，但環境優美，適合喜歡寧靜氛圍的露營者。推薦給想要放鬆身心的朋友。,3,1,0,3018,,天湖區的場地很大環境優美適合喜歡寧靜氛圍推薦想要放鬆身心朋友,2021/05/07,0
營區的營位雖然有寬敞的安排，但廁所缺乏封頂設計，晚上昆蟲在裡面亂飛，容易讓小朋友感到害怕。另外，冰箱設置在營本部內，營主不在或休息時間就會上鎖，對於攜帶食材露營的露友來說有些不便利。,3,1,0,3036,,營區營位寬敞安排廁所缺乏封頂設計晚上昆蟲亂飛小朋友感到害怕冰箱設置在營本部營主不在休息時間上鎖攜帶食材露友便利,2021/05/07,0
這個營地在下午時分，4號區的樹木較少，導致太陽直射，讓人感到相當炎熱。周圍的山景還算不錯，但設施較為缺乏，沒有太多的娛樂選擇，尤其是現在不是花季的時候，顯得有些無聊。更令人失望的是，當我們詢問費用時，營主才突然出現。,3,1,0,3052,,營地下午時分號區樹木少導致太陽直射感到炎熱山景算不錯設施為缺乏太多娛樂選擇花季顯得無聊令人失望詢問費用時營主才,2020/05/07,0
很抱歉聽到您在這個露營區的經驗不盡理想。包區全區供電的問題似乎有所欠缺，因為跳電次數過多，顯示電力供應不穩定。這可能會影響您的露營體驗，使您感到不舒適。另外，廁所衛生的改善也值得注意。整體而言，這個露營區還有進步的空間，以提供更好的服務和環境。,3,1,0,3064,,抱歉聽到區的經驗理想包區全區供電欠缺因為跳電次數過多顯示電力供應穩定影響體驗感到舒適廁所衛生改善值得注意整體而言區空間提供更好服務環境,2019/05/07,0
風景秀麗，令人心曠神怡，但住宿設施略顯陳舊，需要改善。,3,1,0,3072,,風景秀麗令人心曠神怡住宿設施略顯陳舊改善,2019/05/07,0
2015年和朋友們一起去的這個營區，算是比較接近大自然的營區。當時的衛浴設施是共用的熱水器，所以水溫會受到隔壁是否有人使用而有所變化。晚上還有提供搗麻糬體驗，現場品嚐非常美味。,3,1,0,3077,,2015年朋友營區算是接近大自然營區衛浴設施共用熱水器水溫隔壁有人變化晚上提供搗麻糬體驗現場品嚐美味,2019/05/07,0
夜景美麗，但衛浴設備稍嫌簡陋。,3,1,0,3096,,夜景美麗衛浴設備稍嫌簡陋,2018/05/07,0
櫻花盛開的時候，營區應該很美。帳篷前被樹木遮擋，無法直接欣賞山景，有點可惜。廁所還算乾淨，水溫雖然不太穩定，但幸運的是，這次遇到好露友，和我的兒子一起玩得很開心，希望沒有造成他們的困擾。,3,1,0,3111,,櫻花盛開營區美帳篷前樹木遮擋欣賞山景可惜廁所算乾淨水溫不太穩定幸運好露友兒子玩得開心希望困擾,2022/01/23,0
很抱歉，第8區的營地距離營本部較遠，且到浴廁需經過一條稍陡的樓梯。廁所的封頂沒有做好，導致蚊蟲容易進入。,3,1,0,3125,,抱歉區的營地距離營本部較遠浴廁需一條稍陡樓梯廁所封頂做好導致蚊蟲,2020/12/14,0
這個營地的衛浴設備不太理想，廁所間數量少，且設施簡陋。,3,1,0,3141,,營地衛浴設備不太理想廁所間數量少設施簡陋,2019/09/20,0
廁所沒有提供衛生紙，稍嫌不便，建議現場備妥衛生紙。營區內草地上有乾掉的狗大便，清潔度有待加強。垃圾桶沒有準備垃圾袋，容易引來野狗野貓翻找，影響環境衛生。垃圾桶也沒有壓磚塊固定，半夜可能會被野狗野貓翻動垃圾，整體而言，需要改善。,3,1,0,3156,,廁所提供衛生紙稍嫌不便建議現場備妥衛生紙營區草地上乾掉狗大便清潔度有待垃圾桶垃圾袋引來野狗野貓翻找影響環境衛生垃圾桶壓磚塊固定半夜野狗野貓翻動垃圾整體而言改善,2018/11/26,0
營區裡到處都是蒼蠅，讓人無法放鬆享受露營的樂趣。,3,1,0,3184,,營區裡蒼蠅放鬆享受樂趣,2023/05/07,0
這個營區整潔舒適，但價格上漲得有點離譜，未來不會再來了。,3,1,0,3189,,營區整潔舒適價格上漲離譜未來再來,2022/05/07,0
這個露營區的特色是共用大草地，廁所和浴室都很乾淨整齊，營本部也有販賣冷飲，方便遊客補給水分。,3,1,0,3217,,區的特色共用草地廁所浴室乾淨整齊營本部販賣冷飲遊客補給水分,2021/05/07,0
營區的草地非常柔軟舒適，兩棵落雨松之間就有營位，帳篷搭在變色的落雨松下別有一番風味，車帳分離，營區的乾濕分離衛浴也很方便，洗澡時不用擔心濕滑。路況還算好走，進入營區的田間小路比較窄，周邊是果園和農園，早上有零星的蒼蠅出現，下午看到農民戴著口罩噴灑霧狀液體，希望不是農藥。,3,1,0,3237,,營區草地柔軟舒適兩棵落雨松之間營位帳篷搭變色落雨松下別有風味車帳分離營區乾濕分離衛浴洗澡時不用擔心濕滑路況還算走營區田間小路窄周邊果園農園早上零星蒼蠅下午農民戴著口罩噴灑霧狀液體希望農藥,2020/05/07,0
水龍頭的水是溫的，非常適合冬天露營。然而，包區的營位營主並沒有提供完整的草地使用權，原因是中央的走道需要給營主開高爾夫球車通過行銷產品，這算是非常特別的商業手法。,3,1,0,3238,,水龍頭水溫非常適合冬天包區營位營主並提供完整草地使用權原因中央走道給營主開高爾夫球車行銷產品算是特別商業手法,2020/05/07,0
這個營地的環境還不錯，但四周都是水果園，所以到處都是蒼蠅，稍微影響了露營的體驗。,3,1,0,3243,,營地環境不錯四周水果園蒼蠅稍微影響體驗,2020/05/07,0
這個地方適合想要遠離城市塵囂的人，來這裡可以露營或住宿，享受大自然的寧靜。,3,1,0,3258,,地方適合想要遠離城市塵囂住宿享受大自然寧靜,2019/05/07,0
草地寬敞舒適，廁所整潔明亮，還有專人定期打掃，衛浴設備更設有乾濕分離。不過，退帳時人潮較多，稍嫌擁擠。,3,1,0,3263,,草地寬敞舒適廁所整潔明亮專人定期打掃衛浴設備設有乾濕分離退帳時人潮較稍嫌擁擠,2019/05/07,0
園區維護得不錯，衛浴設備很乾淨，但活動空間稍嫌不足。,3,1,0,3279,,園區維護不錯衛浴設備乾淨活動空間稍嫌,2018/05/07,0
很抱歉，民宿外面的營地電源不足，讓我們難以使用電器設備，也無法使用電燈，希望能改善這個問題。,3,1,0,3282,,抱歉民宿外面營地電源難以使用電器設備電燈希望改善,2018/05/07,0
優點：寬敞的草地適合野餐和放風箏；缺點：帳篷數量過多，讓孩子們沒有足夠空間盡情遊玩。,3,1,0,3289,,優點寬敞草地適合野餐放風箏缺點帳篷數量過多孩子足夠空間盡情遊玩,2018/05/07,0
優點：衛浴乾淨舒適，環境優美，設施新穎完善。缺點：營地擁擠，蒼蠅多，缺乏兒童遊樂區。,3,1,0,3301,,優點衛浴乾淨舒適環境優美設施新穎完善缺點營地擁擠蒼蠅缺乏兒童遊樂區,2018/05/07,0
這次的露營之旅，雖然天氣不佳，但我們仍然堅持下去，感謝營主的用心經營，免費提供的草莓讓我們都感到窩心。然而，天氣實在太不配合，讓我們只能看著天空發呆，很無奈。儘管如此，這次難忘的經歷將永遠留在我們心中，雖然我們睡在車上，但這也是另類的體驗。,3,1,0,3305,,之旅天氣不佳堅持下去感謝營主用心經營免費提供草莓感到窩心天氣實在太配合只能看著天空發呆無奈難忘經歷永遠留在心中睡車上這也另類體驗,2017/05/07,0
"這個露營地的場地雖然廣大,但卻缺乏美景,周圍只有一片果園,實在有些可惜。雖然有分A、B兩區,但下車後就得把車集中在停車場,不太方便。民宿建築有設計感,但不知道住起來是否舒適。營地平坦安全,適合小朋友奔跑,但美景卻付之闕如,讓人有些失望。",3,1,0,3315,,露營地場地缺乏美景果園實在可惜有分B兩區下車把車停車場不太民宿建築設計感住舒適營地平坦適合小朋友奔跑美景卻付闕如失望,2017/05/07,0
草地雖然不錯，但整體來說還是有些可惜。,3,1,0,3323,,草地不錯整體可惜,2017/05/07,0
環境看似乾淨整潔，但不知怎麼的，身上開始癢了起來，仔細一看，原來是跳蚤惹的禍，讓這趟露營之旅蒙上了一層陰影。,3,1,0,3327,,環境看似乾淨整潔不知身上癢仔細一看跳蚤惹禍這趟旅蒙上一層陰影,2022-04-28T17:04:37+08:00,0
前往這個露營地的道路有些顛簸，尤其是接近目的地時，路況變得非常陡峭，開車不太方便。,3,1,0,3471,,前往露營地道路顛簸接近目的地時路況變得陡峭開車不太,2023/10/23,0
路途頗為崎嶇，尤其是接近營區的那段路，開車時需要格外小心謹慎。,3,1,0,3472,,路途為崎嶇接近營區那段路開車時小心謹慎,2023/10/23,0
這個營地的噪音太大了，隔壁的狗叫聲、羊叫聲、凌晨4點的公雞叫聲都讓人無法入眠，真的是個不適合休息的營地。,3,1,0,3568,,營地噪音太大隔壁狗叫聲羊叫聲凌晨點的公雞叫聲入眠真的適合休息營地,2023/12/07,0
