content,rating,type,status,sequence_num,tokenization,text,publishedDate,origin
"這個營地的路況不錯,設施也算齊全,像是有溜滑梯、腳踏車、籃球、沙坑、泳池等,草地活動空間也很大,整體氛圍還不錯,營主人的態度也很好。不過還是有一些小缺點,像是洗澡時間有限制,晚上12點半後就沒熱水,白天也沒有熱水可用。另外,裝備只能放在草地旁的柏油路下,可是柏油路只有不到3米寬,下裝備的時候,勢必會擋到後面的車。騎腳踏車的空間只有柏油路,可是柏油路很窄。收假當天的撤帳時間比較硬,很多營地都會有比較大的彈性時間。海拔低,可以看到星星,但是最大光害就是門口那盞路燈,如果可以手動開關就好了。A區如果有3帳,距離護草墊放置區雖然不遠,但會很累。整體來說,還是會把這個營地放在口袋名單中,但是下裝備不能在草地下,真的是個很大的缺點,希望營主可以想辦法解決。",3,1,0,5231,,營地路況不錯設施算齊全像是溜滑梯腳踏車籃球沙坑泳池草地活動空間很大整體氛圍不錯營主人態度缺點像是洗澡時間晚上12點半熱水白天熱水可用裝備只能放在草地旁柏油路柏油路不到米寬裝備勢必會擋的車騎腳踏車空間柏油路柏油路很窄收假當天撤帳時間硬營地彈性時間海拔低星星光害門口那盞路燈手動開關區帳距離護草墊放置區不遠但會累整體營地放在口袋名單中裝備草地真的很大缺點希望營主想辦法解決,2023/12/08,0
"評論中提到營地的優點，包括有足夠的冰箱和冷凍空間，草皮、籃球場、腳踏車區、玩沙區和戲水區等設施。營主一家人勤勞打掃，收垃圾和分類，廁所和浴室雖然間數少，但經常巡視清理環境。營主也會指導車位，注意孩子安全，並在廁所門上放置櫃子，讓人感受到用心經營。

評論中提到需要改善的硬體設施，包括女廁浴室的冷水流太小，水溫不穩定，僅有5間淋浴間，可能無法滿足大量使用者的需求。營主回應表示是因為太多人使用水，但評論者認為應該增加淋浴間數量以改善這個問題。

此外，評論者提到天氣因素，建議選擇合適的季節來營地，因為風大且容易遇到小黑蚊。幸運的是，評論者在此次露營中並未遇到太多小黑蚊。",3,1,0,5253,,"評論中提到營地優點包括足夠冰箱冷凍空間草皮籃球場腳踏車區玩沙區戲水區等設施營主一家人勤勞打掃收垃圾分類廁所浴室間數少巡視清理環境營主指導車位孩子並在廁所門上放置櫃子感受用心經營

評論中提到改善硬體設施包括女廁浴室冷水流太小水溫穩定僅有間淋浴間使用者需求營主回應因為太多人水評論者認為增加淋浴間數量改善

評論者提到天氣因素建議選擇合適季節營地因為風大且小黑蚊幸運評論者中並未太小黑蚊",2023/05/08,0
優點：營區海拔適中，開車可輕鬆抵達，設有豐富兒童遊樂設施，草坪適合小朋友嬉戲。缺點：小黑蚊和大型斑蚊問題嚴重，儘管噴了防蚊液仍被叮咬，令人痛苦不堪。建議下次可考慮冬季時節前往。,3,1,0,5259,,優點營區海拔適中開車輕鬆抵達設有兒童遊樂設施草坪適合小朋友嬉戲缺點小黑蚊大型斑蚊噴了防蚊液叮咬令人痛苦不堪建議下次冬季時節前往,2022/05/08,0
"這個營區適合喜歡熱鬧、大聲音樂的人,但相鄰帳篷都很近,晚上10點後要安靜。營位擁擠,帳篷位置要小心,否則會被糾正。廁所和浴室在週六尖峰時段難以應付,熱水只提供有限時間,水壓不穩定。冰箱擁擠,食材亂七八糟,有遺失物品。插座電壓不穩,夏天可能跳電。夜衝要早到,晚上10點後大門上鎖。營區打掃乾淨,但規定嚴格,違規會被糾正。建議看營地須知再來。",3,1,0,5283,,營區適合喜歡熱鬧大聲音樂相鄰帳篷晚上10點後要安靜營位擁擠帳篷位置小心糾正廁所浴室週六尖峰時段難以應付熱水提供有限時間水壓穩定冰箱擁擠食材亂七八糟遺失物品插座電壓穩夏天跳電夜衝要早到晚上10點後大門上鎖營區打掃乾淨違規糾正建議營地須知再來,2021/05/08,0
冬天用電不穩定，需要改善才能提供露友更好的露營體驗。,3,1,0,5284,,冬天用電穩定改善提供露友更好體驗,2021/05/08,0
這個露營區A區和CD區的位置不同，A區的車子要停在停車場，CD區的車子可以停在帳篷前面。兩區都共用廁所和浴室，如果帳篷收得滿滿的，洗澡可能要等很長時間，而且洗澡時上面會冷。廁所很乾淨，有拉門，也有準備衛生紙。如果搭在CD區比較靠近尾巴的位置，要注意除了離廁所要走一段路以外，12月去還有一點點蒼蠅，甚至嚴重會侵襲到帳篷及愛車。建議要去要選前面一點的營位，不過營主分配的位置不太會有帳篷相連到天邊的問題。小孩應該會喜歡的地方有沙坑、籃球場、腳踏車、溜滑梯，喜歡放生小孩的適合去。又附冰箱及飲水機。建議食物飲品都要準備好再去開車要下山10幾分鐘至20分鐘左右才會有711。,3,1,0,5288,,區區和CD區的位置區的車子停停車場CD區的車子停帳篷兩區共用廁所浴室帳篷收滿滿的洗澡長時間洗澡時冷廁所乾淨拉門衛生紙搭CD區靠近尾巴位置廁所走一段路12月一點點蒼蠅侵襲到帳篷愛車建議選一點營位營主分配位置不太會帳篷相連天邊小孩喜歡地方沙坑籃球場腳踏車溜滑梯喜歡放生小孩適合附冰箱飲水機建議食物飲品開車下山10幾分鐘20分鐘711,2021/05/08,0
這個營區的熱水供應時間不佳，導致孩子們在戲水後無法立即沖洗，造成不便。,3,1,0,5331,,營區熱水供應時間不佳導致孩子戲水沖洗不便,2023/12/28,0
這個露營地的草皮長得很茂盛，需要定期修剪，否則會影響營位的整潔。A區的營位設計不太合理，若有三組朋友同時到達，搭帳和收帳的過程可能會很混亂，營位狹小，幾乎沒有空間可以活動。由於車輛無法會車，若要離開營地，需要先收好帳篷，這會增加不少困難度。此外，停車位和營位之間有段距離，無法使用推車，完全依靠人力來搬運物品，這可能會導致家庭成員之間的摩擦。幸運的是，浴室和廁所還算乾淨整潔。垃圾桶僅設置在入口處，若有多組人同時到訪，垃圾桶可能會很快滿。最後，如果下大雨，草皮的排水系統可能無法應付，會出現積水的情況。,3,1,0,5426,,露營地草皮長茂盛定期修剪影響營位整潔區的營位設計不太若有三組朋友到達搭帳收帳過程混亂營位狹小空間活動車輛車離開營地先收帳篷這會增加困難度停車位營位之間段距離推車人力搬運物品導致家庭成員之間摩擦幸運浴室廁所算乾淨整潔垃圾桶設置入口處若有多組到訪垃圾桶很快大雨草皮排水系統應付積水情況,2024/05/05,0
"11月18日至19日在那裡露營的環境還算可以,但早上洗澡洗到一半變成冷水,差點感冒,打了三四次電話都沒人接。",3,1,0,5434,,11月18日至19日環境算早上洗澡洗一半冷水差點感冒三四次電話沒人接,2023/12/08,0
非常抱歉，棧板的品質不盡理想，影響了露營體驗。,3,1,0,5435,,抱歉棧板品質理想影響體驗,2023/11/08,0
"廁所規劃不錯,但只有營本部有冰箱,我們在C區要走很遠不方便。B區的大草皮讓孩子遊戲玩水很棒,也有衛浴,但沒有冰箱很不方便。A區的營位比較狹長形,如果是大帳篷可能會有點擠,草地不是很平整,有的地方有窟窿,所以搭帳篷的時候還要注意位子。營位洗手台不足,訂位網站寫3帳,也只有3個洗手台,但營主把我們4帳安排在同一區。這個季節附近有很多螢火蟲,但也有很多小黑蚊和螞蟻,蜘蛛都很不小隻。白天會有一些蒼蠅,最可怕的是還有大蟑螂,生態非常豐富。",3,1,0,5440,,廁所規劃不錯營本部冰箱C區要走很遠B區的草皮孩子遊戲玩水很棒衛浴冰箱區的營位狹長形大帳篷擠草地平整地方窟窿搭帳篷位子營位洗手台訂位網站寫帳洗手台營主帳安排區季節螢火蟲小黑蚊螞蟻蜘蛛不小隻白天蒼蠅可怕蟑螂生態非常豐富,2023/05/08,0
香港回來的小哥很親切且熱情，但每帳的間隔很近，晚上過10點後其他帳很吵且屢勸不聽，業者沒有善盡有效的勸導，玩桌遊的大聲嚷嚷、喝酒團的邊放音樂及大聲講話...幾乎到12點多才漸漸安靜下來，得以入眠。,3,1,0,5450,,香港回來小哥親切熱情每帳間隔很近晚上10點後帳很吵且屢勸不聽業者善盡勸導玩桌遊大聲嚷嚷喝酒團的邊放音樂大聲講話12點多漸漸安靜下來得以入眠,2023/05/08,0
這次的露營經驗還算不錯，雖然小黑蚊還蠻多的，但廁所還蠻乾淨的。,3,1,0,5519,,經驗算不錯小黑蚊還蠻廁所還蠻乾淨,2020/05/08,0
營地地面不平整，帳篷之間距離過近，與照片所呈現不符，需要謹慎評估。,3,1,0,5524,,營地地面平整帳篷之間距離過近照片呈現不符謹慎評估,2019/05/08,0
這裡的環境算是不錯，但帳篷數量實在太多，導致空間有些擁擠。廁所間的數量顯得有些不足，尤其是D區附近的廢水飄散出一股令人不敢領教的惡臭味。更令人感到無奈的是，早上有幾隻狗在帳篷邊打鬧，起床後發現帳篷邊有狗來過留下的排泄物，讓人心情大受影響。,3,1,0,5527,,環境算是不錯帳篷數量實在太導致空間擁擠廁所間數量顯得D區廢水飄散一股令人領教惡臭味令人感到無奈早上幾隻狗帳篷打鬧起床發現帳篷邊有狗來過留下排泄物心情大受影響,2019/05/08,0
小沙坑和小水池非常適合孩子們玩樂，讓他們度過一個愉快的露營時光。,3,1,0,5540,,沙坑水池非常適合孩子玩樂度過愉快時光,2018/05/08,0
營地的草坪保養得非常好，綠意盎然，但營地主人在收帳時收得太快，導致入住和退房的時間比較擁擠。,3,1,0,5541,,營地草坪保養綠意盎然營地主人收帳時收太快導致入住退房時間擁擠,2018/05/08,0
浴廁維護得不錯，但現場才說租帳要額外付搭帳費，讓人覺得不舒服。優點：浴廁維護乾淨，服務人員態度和善。缺點：帳篷之間距離較近，地面鋪設不平整，租帳到了現場才說要加300元搭帳費，而且不能選擇自己搭建，回覆說網站上不能寫清楚，讓人覺得觀感不佳。,3,1,0,5562,,浴廁維護不錯現場說租帳要額外付搭帳費舒服優點浴廁維護乾淨服務人員態度和善缺點帳篷之間距離較近地面鋪設平整租帳現場說要加300元搭帳費選擇搭建回覆說網站寫觀感不佳,2023/02/13,0
營區在人多時，應該加強垃圾處理，避免造成環境髒亂。,3,1,0,5610,,營區人多時垃圾處理環境髒亂,2019/03/02,0
營地空間有限，帳篷擺放過於密集，導致夜晚吵雜不堪，附近的狗叫聲與人聲交織在一起，讓人難以入眠。更令人困擾的是，儘管已經是深夜，仍有其他露營者大聲聊天，小孩的尖叫聲不絕於耳，營主卻未能及時介入管理，讓噪音持續不斷。蚊蟲的騷擾也與日俱增，實在是令人難以忍受的經驗。,3,1,0,5663,,營地空間有限帳篷擺放密集導致夜晚吵雜不堪狗叫聲人聲交織難以入眠令人困擾深夜大聲聊天小孩尖叫聲不絕於耳營主未能介入管理噪音持續蚊蟲騷擾與日俱增實在令人難以忍受經驗,2018/04/06,0
老闆熱心，但話不多，無法繼續回訪，整體來說沒有太多亮點，兔子也沒有特別的表現。,3,1,0,5719,,老闆熱心話回訪整體太亮點兔子特別表現,2024/04/08,0
湖畔區的景色相當優美，能在這裡露營真的很舒適。大樹下的這兩個位置更是理想，能感受到大自然的寧靜氛圍。,3,1,0,5786,,湖畔區的景色優美真的舒適大樹下兩個位置更是理想感受大自然寧靜氛圍,2019/05/08,0
景色優美，但營位狹窄且價格過高，一晚收費1500元。,3,1,0,5791,,景色優美營位狹窄價格過高晚收費1500元,2019/05/08,0
這個露營區的環境還算不錯，但衛浴設施略顯不足。最上層只有一間衛浴，可能需要共用，如果人多的話，希望能夠加強清潔，避免產生太多垃圾。二層有四間衛浴，相對來說比較方便，但與三層共用，如果人數多的話，可能也需要注意垃圾清理的問題。總體來說，這個露營區的環境還不錯，但衛浴設施的管理需要加強。,3,1,0,5793,,區的環境算不錯衛浴設施略顯最上層一間衛浴共用人多希望清潔太垃圾二層四間衛浴相對來說三層共用人數垃圾清理總體區的環境不錯衛浴設施管理,2019/05/08,0
"這個營區的棧板設施很完善,讓我們一夜好眠。早上起來看到美麗的風景,感覺非常愜意。不過,營區面積較小,有些可惜。好在營區內有販賣部,可以購買到飲品和生活必需品,相當方便。",3,1,0,5844,,營區棧板設施完善一夜好眠早上美麗風景感覺愜意營區面積可惜營區內有販賣部購買飲品生活必需品,2018/05/08,0
設備不太完善，景色還算不錯，但收費稍高了一些。,3,1,0,5845,,設備不太完善景色算不錯收費稍高,2017/05/08,0
在這個寧靜的地方，呼吸著清新的空氣，享受著大自然的簡單之美，讓身心獲得放鬆與慰藉。,3,1,0,5955,,寧靜地方呼吸著清新空氣享受著大自然簡單之美身心放鬆慰藉,2021/05/08,0
離開喧囂的城市，前往山上欣賞美景，暫時遠離塵世，讓心靈獲得寧靜，為下一次的出發做好準備。,3,1,0,5968,,離開喧囂城市前往山上欣賞美景暫時遠離塵世心靈寧靜為出發做好,2020/05/08,0
前往營地的道路有些崎嶇，需要小心駕駛。營地的景色優美，地勢陡峭，讓人有置身山林的感受。,3,1,0,6031,,前往營地道路崎嶇小心駕駛營地景色優美地勢陡峭置身山林感受,2021/04/26,0
七月時包了五帳的櫻花區，雖然廁所和洗手台數量有限，對於五帳的露營來說略顯不足，但整體環境還算不錯。小黑蚊確實很多，但營主會提供大片的蚊香片，幫助驅蚊。櫻花區的冰箱需要使用對面營本部的冰箱，但裡面存放了營主的私人物品，聞起來有阿嬤冰箱的味道，建議自備冰箱。適逢營主的朋友上山喝酒，除了冰箱被塞爆兩箱啤酒外，還整天的唱歌直至晚上十點，熱鬧非常。營區有親人的貓咪和狗狗，個性穩定不怕小孩，走路4分鐘左右有冰涼的溪水可以玩，營主夫人也會善意提醒可以把蚊香帶至岸邊。總結來說，場地偏小，設備也建議加強，但天然環境不錯。,3,1,0,6092,,七月時包五帳櫻花區廁所洗手台數量有限五帳略顯整體環境算不錯小黑蚊確實營主會提供大片蚊香片驅蚊櫻花區的冰箱對面營本部冰箱但裡面存放營主私人物品聞起來嬤冰箱味道建議自備冰箱適逢營主朋友上山喝酒冰箱塞爆兩箱啤酒外整天唱歌直至晚上十點熱鬧營區親人貓咪狗狗個性穩定小孩走路分鐘冰涼溪水玩營主夫人善意提醒蚊香岸邊場地偏小設備建議天然環境不錯,2023/05/08,0
這次的露營經驗令人感到相當掃興。小黑蚊、蒼蠅和大雨的聯手襲擊，讓整個營地變成了泥濘不堪。碎石頭舖的不夠，導致地面上到處都是爛泥巴，讓人難以舒適地活動。洗澡和上廁所的空間嚴重不足，五個營位僅有一間衛浴設備，實在不夠用。電源供應線也拉得太長，存在安全隱患。整體而言，這次的露營體驗相當不愉快。,3,1,0,6093,,經驗令人感到掃興小黑蚊蒼蠅大雨聯手襲擊營地泥濘不堪碎石頭舖導致地面爛泥巴難以舒適活動洗澡廁所空間嚴重不足五個營位僅有一間衛浴設備實在電源供應線拉太長安全隱患整體而言體驗愉快,2023/05/08,0
營地的環境不錯，離老街很近，步行就可以到，老闆娘很熱情，很樂意幫忙。然而，浴室和廁所共用，經常要排隊等候。還有幾隻貓在營地裡遊蕩，會跳到餐桌上，還會咬帳篷的拉鍊，半夜還聽到有人尖叫。另外，半夜沒有路燈，很多露營者在那裡走動、探險、聊天，會建議可以開啟部分路燈，做好管制。水槽也比較少，洗碗洗菜要排隊，遇到大家一起煮飯的時候會很難等。,3,1,0,6105,,營地環境不錯老街很近步行老闆娘熱情樂意幫忙浴室廁所共用排隊等候幾隻貓在營地裡遊蕩跳餐桌上還會咬帳篷拉鍊半夜聽到有人尖叫半夜路燈走動探險聊天建議開啟路燈做好管制水槽少洗碗洗菜排隊煮飯難,2022/05/08,0
雨棚區場地狹小，缺乏照明，洗澡時水壓不穩，容易把衣服噴濕。浴室和廁所都是用鐵皮搭建的，洗澡時還會聞到隔壁間大便的味道，非常令人作噁。5帳共用2個洗手台，價格$1200太貴了，同價位在其他地方有更好的景觀和設施的營區多得是。,3,1,0,6114,,雨棚區場地狹小缺乏照明洗澡時水壓穩衣服噴濕浴室廁所鐵皮搭建洗澡時還會聞到隔壁間大便味道令人作噁帳共用洗手台價格1200太貴同價位地方更好景觀設施營區多得是,2021/05/08,0
營區空間有些擁擠，營地規模較小，難以盡情體驗露營樂趣。,3,1,0,6133,,營區空間擁擠營地規模較難以盡情體驗樂趣,2019/05/08,0
第一眼看到這個營區時，覺得坡度有點陡峭，對我家的車子有些擔心。老闆娘很熱情地介紹環境，還提到晚上有機會看到螢火蟲。果不其然，晚上把燈關掉後，營區周圍的螢火蟲真的很多可惜沒有拍照。營區的場地採梯田式設計，每個區域都比較小，廁所和衛浴各只有一間。插座的數量也比較少。另外，營區裡的蒼蠅比較多，風景也普通。唯一比較好的地方是，營區下方有一條溪流，水質非常乾淨，適合小孩子玩水，而且有大人在旁邊看護，相當安全。在這裡，小孩子可以玩得很開心，度過半天的時間。總體來說，這個營區還好，沒有很推薦。,3,1,0,6143,,第一眼營區時坡度陡峭我家車子擔心老闆娘熱情介紹環境提到晚上機會螢火蟲果不其然晚上燈關掉營區螢火蟲真的可惜拍照營區場地採梯田式設計區域廁所衛浴一間插座數量少營區裡的蒼蠅風景唯一地方營區下方一條溪流水質乾淨適合小孩子玩水大人旁邊看護小孩子玩得開心度過半天時間總體營區還好推薦,2018/05/08,0
浴室和廁所共用一間，晚上洗澡時，上廁所的人必須等候。,3,1,0,6146,,浴室廁所共用一間晚上洗澡時廁所等候,2018/05/08,0
很抱歉，露營地的帳篷出租未附鋁箔墊，使用起來有些不便。,3,1,0,6148,,抱歉露營地帳篷出租未附鋁箔墊不便,2018/05/08,0
雅房並不適合帶著小孩的家庭露營，讓人感到有些失望。,3,1,0,6214,,雅房適合帶著小孩家庭感到失望,2019/10/21,0
這個露營地場地還可以，草地維護得不錯，道路也好開。可惜的是，營主的互動不太熱絡。最讓人在意的是，營地裡有狗會追人。,3,1,0,6217,,露營地場地草地維護不錯道路開可惜營主互動不太熱絡最讓人在意營地裡有狗會追人,2019/09/17,0
謝謝老闆。場地維護得很好，草地維護得很美。老闆也會主動提供蚊香和關心露營者。這裡是小包區為主，所以沒有太多的景色。衛浴設施普通。半夜會有狗來翻垃圾，整個晚上都聽到狗叫聲。,3,1,0,6245,,謝謝老闆場地維護草地維護美老闆主動提供蚊香關心小包區為主太多景色衛浴設施半夜狗翻垃圾晚上聽到狗叫聲,2018/11/26,0
這個小區獨露的環境相當放鬆，能夠好好享受大自然的寧靜。,3,1,0,6266,,小區獨露環境放鬆好好享受大自然寧靜,2017/08/21,0
我們這次入住柚子區包區，發現浴室的水量不穩定，有時會忽大忽小，水溫也無法維持在一個恆定的溫度，希望管理單位能夠改善這個問題，以提供更好的住宿體驗。,3,1,0,6267,,入住柚子區包區發現浴室水量穩定忽大忽小水溫恆定溫度希望管理單位改善提供更好住宿體驗,2017/07/23,0
這裡的服務態度非常好，老闆娘們都很親切，待客之道也很周到。,3,1,0,6284,,服務態度老闆娘親切待客之道周到,2017/03/12,0
制高點沿路可見雲霧飄移，美景盡收眼底。然而，森林區地形略顯扁平，帳篷只能橫向搭建，無法直接欣賞壯麗風景，反而得窺探隔壁帳篷的生活。石子地面略有傾斜，稍嫌不便。夜景區風景秀麗，可惜超額入住，導致帳篷只能橫向搭建，帳篷彼此相鄰，無法在客廳帳中直視外景。浴室昏暗，燈光不足，熱水供應穩定，水溫適中。若非超額入住，夜景區或許值得考慮，否則下次不會再來。老闆娘態度友善，為整體體驗加分。,3,1,0,6335,,制高點沿路雲霧飄移美景盡收眼底森林區地形略顯扁平帳篷只能橫向搭建欣賞壯麗風景窺探隔壁帳篷生活石子地面略有傾斜稍嫌不便夜景區風景秀麗可惜超額入住導致帳篷只能橫向搭建帳篷相鄰客廳帳中直視外景浴室昏暗燈光熱水供應穩定水溫適中超額入住夜景區值得下次再來老闆娘態度友善為整體體驗加分,2022/05/09,0
森林區的景色不錯，還能遠眺關西夜景。然而，東北季風正強，森林區的風勢較大。這裡沒有浴室，建議前往時攜帶盥洗用具。,3,1,0,6340,,森林區景色不錯還能遠眺關西夜景東北季風正強森林區風勢較大浴室建議前往時攜帶盥洗用具,2022/05/09,0
很抱歉，這個露營地似乎已經無法進入，讓人感到有些失望，希望管理單位能夠改善並重新開放給露營愛好者。,3,1,0,6354,,抱歉露營地感到失望希望管理單位改善開放愛好者,2021/05/09,0
路途有些崎嶇，較適合四輪驅動車輛前往，但沿途的美景和夜晚的星空令人嘆為觀止。,3,1,0,6373,,路途崎嶇適合四輪驅動車輛前往沿途美景夜晚星空令人嘆為觀止,2020/05/09,0
這條路不通，無法開車到達竹林62號的露營區，讓人感到非常失望。,3,1,0,6633,,這條路不通開車到達竹林62號的區感到失望,2021/05/09,0
這個露營區的景色不太吸引人，場地是石子地，沒有提供護草墊。老闆的態度還不錯，但我覺得員工一直碎碎念的聲音很煩人。,3,1,0,6634,,區的景色不太吸引場地石子提供護草墊老闆態度不錯員工碎碎念聲音煩人,2021/05/09,0
這個營區的最大優點就是鄰近溪流，環境清幽。然而，每一區的營位都顯得擁擠，帳篷緊密相連，讓人覺得不舒服。建議每區應減少帳篷數量，以達到更好的空間利用。,3,1,0,6665,,營區優點鄰近溪流環境清幽每一區營位顯得擁擠帳篷緊密相連舒服建議每區應減少帳篷數量更好空間利用,2020/05/09,0
老闆熱情好客、浴室衛生環境良好、營地空間雖然較小但依舊舒適。,3,1,0,6667,,老闆熱情好客浴室衛生環境營地空間依舊舒適,2020/05/09,0
A2區的營地空間雖然不大，且沒有美景可賞，但浴室的格局倒是相當特別。然而，碟型天幕似乎無法在這裡搭設。更糗的是，隔天早上睡醒時，竟然有別的狗在我們帳篷前方大便，差點就要中獎了。,3,1,0,6702,,A2區的營地空間美景可賞浴室格局倒特別碟型天幕搭設糗隔天早上睡醒時狗帳篷前方大便差點中獎,2022/09/12,0
抱歉，半夜狗叫聲很吵，影響到我的睡眠品質，希望管理人員可以加強管制，避免再次發生類似情況。,3,1,0,6715,,抱歉半夜狗叫聲吵影響睡眠品質希望管理人員管制再次發生類似情況,2021/10/17,0
邱先生和邱太太人很好，讓我們度過了一個愉快的露營體驗。,3,1,0,6744,,邱先生邱太太度過愉快體驗,2019/03/05,0
這次我們選擇了景觀A2區的營位，但帳篷之間的空間太過擁擠，讓人感受不到任何的放鬆感。雖然之前就知道營主已經調整過營位的位置，但沒想到會變得這麼狹窄，一個帳位大約只有5*8天幕的大小，建議不要帶太大的帳篷。人多的時候，廁所就會變得髒亂不堪，營主也沒有積極打掃垃圾，讓人感到有些失望。唯一可以欣賞的就是美麗的景色，除此之外，這次的露營經驗真的讓人有些失望。,3,1,0,6754,,選擇景觀A2區的營位帳篷之間空間太過擁擠感受不到放鬆感營主調整過營位位置沒想到變得狹窄帳位天幕大小建議帶太大帳篷人多廁所變得髒亂不堪營主打掃垃圾感到失望唯一欣賞美麗景色經驗真的失望,2024/04/09,0
很抱歉，根據您提供的評論內容，我無法生成相似的露營評論。,3,1,0,6772,,抱歉提供評論內容生成評論,2024/01/09,0
第一次到這個營地，路標指示還算清楚，但是營地的浴室設施稍嫌不足，只有衣物置放架，卻沒有沐浴乳的置物架，洗澡時很不方便！此外，電壓也不足，2023/11/18晚上就跳電兩次，真的很令人困擾！,3,1,0,6778,,第一次營地路標指示算清楚營地浴室設施稍嫌衣物置放架沐浴乳置物架洗澡時電壓20231118晚上跳電兩次真的令人困擾,2023/12/09,0
